year,release_date,category,genre,title,creator,title_image,introduction,country_category,country_name,video,production,distribution,grade,runtime,remake,cast,staff,series,trilogy,soundtrack,ref_video,read_count,scrape_count
2010,2010.12.29,애니메이션,"코미디, 학원, 하렘",레이디 X 버틀러,감독-오오츠키 아츠시,http://data5.onnada.com/anime/201303/thumb300x400_2077629024_a64ffe28_1.jpg,"초등학생이던 무렵 돌아가신 부모님을 대신해 작은아버지의 집에서 머무르던 히노 아키하루는, 어느 날 텔레비전을 통해 봤던 초 명문 여학교인 하쿠레이료 학원에 신설된 시종육성과 과정에 편입하기로 결의하고, 입학 시험에 합격한다.@ 그러나 험악한 외모로 의도하지 않게 학생들이 그를 무서워하게 만들어버린 무렵, 초등학생 시절 같은 반 친구로 그에게 수많은 트라우마를 양산한 사이쿄 토모미와 재회한다.@ 세르니아 이오리 프레임하트에게는 불가항력으로 벌어진 일 때문에 수상한 사람 취급을 받으며 쫓기게 되는 입장에 처하게 되는 등 여러모로 꼬이는데.@.@.@ 그렇지만 아키하루는 조금씩 학교에 익숙해지기 시작하고, 주위의 인간 관계도 서서히 변화해 나가기 시작한다.",해외,일본,WuRRwqQgqXg,제작사-Xebec,-,19,-,원작코우즈키 츠카사, 히노 아키하루 (HINO AKIHARU)|日野秋晴 / 성우 : 오키츠 카즈유키 (OKITSU KAZUYUKI)|興津和幸, 각본-타마이 츠요시 캐릭터 디자인-타카미 아키오 음악-하네오카 케이,-,12,-,JIuRP_HMU0o,0,0
2010,2010.12.22,애니메이션,SF,고스트 메신저,-,http://data5.onnada.com/anime/201105/thumb300x400_A1285_460819560_51c10f3e_K-967.jpg,"한국 애니메이션 계에 새로운 가능성을 제시해 줄 판타지 애니메이션이 등장했다.@ 이는 국내 애니메이션 제작사 '스튜디오 애니멀'이 2010년 12월 22일부터 공개한 고스트 메신저정식 공개 이전부터 이미 인터넷을 통해 2분 분량의 파일럿 영상이 공개되면서 폭발적인 반응과 함께 입소문을 얻어왔던 작품으로, 국내에서는 보기 드문 OVA 형식으로 제작되어 DVD로 발매되기에 이르렀다.@ 는 저승사자들이 디지털화된 귀신들을 휴대폰으로 소환하여 전투를 벌인다는 콘셉트로, 한국 고유의 사후세계관인 저승세계와 SF를 결부시킨 독특한 세계관과 탄탄한 스토리를 자랑한다.@ 그간 대부분의 작품들이 전체연령가의 TV 방영용 작품으로 제작되어 온 국산 애니메이션계의 현실에서는 어린이들이 내용을 이해하기 쉽고 눈에 잘 띄는 작품들이 주류를 이루었으나, 는 OVA 발매를 목표로 한 만큼 보다 높은 연령층의 애니메이션팬들을 공략할 수 있는 화려한 액션과 화면 연출을 선보인다.@@Opening -Connexion- 노래 : 아웃사이더@Ending -track09- 노래 : 이소라",국내,일본,mpJ98q0n3ZQ,-,-,12,-,-, 꼬마강림,-,-,6,-,Z8is3TsQN0I,0,0
2010,2010.12.12 01:23 (일),애니메이션,미스테리,GOSICK,감독-난바 히토시,http://data5.onnada.com/anime/201012/thumb300x400_1026054309_af5dd931_11.jpg,"동양의 모 국에서 유럽의 작은 나라 소뷔르에 있는 성 마르그리트 학원으로@유학을 온 쿠죠 카즈야는 좀처럼 학교 생활에 적응하지 못한 채로 겉돌고만 있었다.@그러던 어느날 도서관에 갔던 카즈야는 신비한 소녀 빅토리카를 만나게 된다.@수업에도 나오지 않고 언제나 도서관 최상층에 있는 식물원에서 책을 읽고 있는 빅토리카는 마치@프랑스 인형과도 같은 아름다운 외모 이외에도 놀랄만큼 명석한 두뇌와 압도적인 지식량을 자랑한다.@카즈야가 보기에는 우선 빅토리카부터가 수수께끼로 가득하지만, 빅토리카는 그저 무료함을@달랠 뿐이라며 주위에서 일어나는 여러가지 기이한 사건들을 하나씩 풀어 보이는데....",해외,일본,QMFLC-SKtFs,제작사-본즈,-,15,-,원작사쿠라바 카즈키, 빅토리카 (VICTORIQUE)|ヴィクトリカ / 성우 : 유우키 아오이 (YUUKI AOI)|悠木碧," 각본-오카다 마리 캐릭터 디자인-토미오카 타카시, 카와모토 토시히로 음악-나카가와 코타로",-,24,-,iOrkj_MFXm8,0,0
2010,2010.12.12,애니메이션,액션,울버린,감독-아오야마 히로시,http://data5.onnada.com/anime/201303/thumb300x400_2077629024_8c43eb6e_1.jpg,줄거리를 등록하여주세요.,해외,일본,NDAJz4rF_1M,제작사-매드하우스,-,15,-,원작Marvel Comics, - , 각본-카지 켄고 캐릭터 디자인-아베 히사시 음악-타카하시 테츠야,-,12,-,-,0,0
2010,2010.12.12,애니메이션,"드라마, 학원",Starry-Sky,감독-타카모토 노부히로,http://data5.onnada.com/anime/201303/thumb300x400_2077629024_68de94e4_1.jpg,"Starry☆Sky는 성월학원을 무대로 유일한 여학생이 주인공이 되어, 12별자리의 특징을 가진 남자 캐릭터들과의 연애를 그린 작품이다.@ 원화 캐릭터 디자인은 카즈아키가 담당하고 있다.@@HONEY BEE가 기획한 드라마CD, 게임등의 여성향 미디어 믹스 작품 시리즈이다.",해외,일본,vZ863inffkE,제작사-스튜디오 딘,-,12,-,원작Honeybee, 토모에 요우 (TOMOE YOH)|土萌 羊 / 성우 : 미도리카와 히카루 (MIDORIKAWA HIKARU)|?川光, 각본-나카무라 마코토 캐릭터 디자인-후지이 마키 음악-키쿠야 토모키,-,26,-,-,0,0
2010,2010.12.12,애니메이션,"능력, 코미디, 학원, 하렘",기어와라 냐루코양-,감독-타니 아즈마,http://data5.onnada.com/anime/201303/thumb300x400_2077629024_16e73683_1.png,줄거리를 등록하여주세요.,해외,일본,iBTDg5O9Bmk,제작사-DLE,-,12,-,원작아이소라 만타, 냐루코|ニャル子 / 성우 : 아스미 카나 (ASUMI KA-)|阿澄佳奈,-,-,11,-,1ZRq-FlmDT4,0,0
2010,2010.12.04,애니메이션,"드라마, 메카닉, 액션, SF, 전쟁",장갑기병 보톰즈 파인더,-,http://data5.onnada.com/anime/201107/thumb300x400_A1552_2042247640_6b60fd6c_Votoms_Finder-OVA-Poster01.jpg,"두번째로 등장한 보톰즈 파인더는 기존의 보톰즈 세계관과는 전혀 다른 세계를 다룬, 이제까지 등장한 보톰즈 시리즈 중 가장 이채로운 색체를 보여주는 작품이라고 할 수 있다.@ 판타지에 가까운 세계에서 벌어지는 이야기로, 이제까지의 보톰즈가 전쟁 드라마였다면 이 작품은 보다 가볍고 상쾌한 액션 어드벤쳐의 형식을 취한 것으로 보인다.@ 이런 밝은(?) 전개는 이제까지의 보톰즈와는 사뭇 이질적인 느낌이겠지만 신선한 시도라는 점에서 긍정적인 평가를 내리고 싶다.@ 감독이자 메카닉 디자인을 맡은 시게타 아츠시가 '오버맨 킹게이너(2002)'의 작화감독으로 참여한 이력 때문인지 새롭게 디자인된 장갑기병의 모습에는 왠지 킹게이너의 흔적이 느껴지기도 한다.@ 기존의 보톰즈 시리즈에 비해 좀더 로봇 아니메의 느낌에 충실한 작품이 될 것으로 기대된다.",해외,일본,4SSHLsl4eqI,-,-,12,-,-, - ,-,-,1,-,-,0,0
2010,2010.11.26,애니메이션,"액션, 능력, SF, 메카닉, 신, 드래곤, 군, 배틀, 전쟁, 전투, 변신, 모험",트랜스포머 프라임,-,http://data5.onnada.com/anime/201507/thumb300x400_3696359636_a731b99d_cNovel.jpg,오토봇과 디셉티콘의 싸움,해외,일본,72QYZZDt6cc,-,-,12,-,-, 옵티머스 프라임 (OPTIMUS PRIME)|オプティマス?プライム / 성우 : 모리카와 토시유키 (MORIKAWA TOSHIYUKI)|森川智之,-,-,65,-,-,0,0
2010,2010.10.15,애니메이션,드라마,해파리 공주,감독-오오모리 타카히로,http://data5.onnada.com/anime/201303/thumb300x400_2077629024_4cdb4c3c_1.jpg,줄거리를 등록하여주세요.,해외,일본,OymflhSbYjQ,제작사-브레인즈 베이스,-,12,-,원작히가시무라 아키코, 쿠라시타 츠키미 |倉下月海 / 성우 : 하나자와 카나 (HA-ZAWA KA-)|花澤香菜 (はなざわかな), 각본-하나다 쥬키 캐릭터 디자인-하야마 켄지 음악-요시모리 마토코,-,11,-,-,0,0
2010,2010.10.08 23:30 (금),애니메이션,"학원, 판타지, SF, 능력, 액션, 배틀",어떤 마술의 금서목록 Ⅱ,감독-니시키오리 히로시,http://data5.onnada.com/anime/201303/thumb300x400_2077629024_27ba8d29_1.jpg,"전설의 마술사가 기록한, 천사를 소환할 수 있다는 경이의 마도서「법의 서」가 해독법을 아는 수녀와 함께 도난당했다.@그것도 학원도시에서 멍-하니 일상을 보내고 있던 카미조 토우마에게는 전혀 상관없는 사건-일 줄 알았는데@'불행'하게도 왠지 그 구출전에 가담하게 되고….@게다가 납치한 범인은 '아마쿠사식 크리스트 처교', 즉 칸자키 카오리가 프리스테스(여교황)으로 있던 종파라고 하는데?!",해외,일본,NLywdDAEXds,제작사-J.C.Staff,-,15,-,원작카마치 카즈마, 카미죠 토우마 (KAMIJOU TOUMA)|上??麻 / 성우 : 아베 아츠시 (ABE ATSUSHI)|阿部敦,-,-,-,-,-,0,0
2010,2010.10.08,애니메이션,드라마,카룰의 이상한 탑,감독-타카기 쥰,http://data5.onnada.com/anime/201010/thumb300x400_2038530348_96e94f98_091001karl_visual.jpg,줄거리를 등록하여주세요.,해외,일본,-,제작사-Nippon Animation,-,-,-,-, - , 음악-와타나베 체루,-,-,-,-,0,0
2010,2010.10.08,애니메이션,"드라마, 코미디, 메이드",그래도 마을은 돌아간다,감독-신보 아키유키,http://data5.onnada.com/anime/201303/thumb300x400_2077629024_3e35efb1_1.jpg,줄거리를 등록하여주세요.,해외,일본,K0IC0QwNnCs,제작사-샤프트,-,12,-,원작이시구로 마사카즈, 아라시야마 호토리 (ARASHIYAMA HOTORI)|嵐山?鳥 (あらしやま ほとり) / 성우 : 오미가와 치아키 (OMIGAWA CHIAKI)|小見川千明, 각본-타카야마 카츠히코 캐릭터 디자인-야마무라 히로키 음악-Round Table,-,12,-,-,0,0
2010,2010.10.07,애니메이션,학원,탐정 오페라 밀키 홈즈,감독-모리와키 마코토,http://data5.onnada.com/anime/201303/thumb300x400_2077629024_c56654b1_2.jpg,줄거리를 등록하여주세요.,해외,일본,JWRCOHxdkoA,제작사-J.C.Staff,-,12,-,"원작부시로드, Chrono Gear Creative", 셜록 셰린포드 (Sherlock Shellingford)|シャ?ロック?シェリンフォ?ド / 성우 : 미모리 스즈코 (MIMORI SUZUKO)|三森すずこ (みもりすずこ), 각본-후데야스 카즈유키 캐릭터 디자인-누마타 세이야 음악-하라다 마츠미치,-,12,-,-,0,0
2010,2010.10.06,애니메이션,"코미디, 학원, 하렘",좀 더 To Love 트러블,감독-오오츠키 아츠시,http://data5.onnada.com/anime/201010/thumb300x400_2038530438_59d909ce_ffffff-thumb-il2.png,의 2기로 기존의 캐릭터가 모두 등장한 상태로 시작하기 때문에 어느정도 캐릭터에 대한 이해도가 필요하다.@ 하지만 애니메이션이 노리고 있는게 속옷과 알몸노출등의 남성들의 보는 즐거움에 무게를 두고 있기 때문에 굳이 스토리를 이해해 가며 볼 필요는 없지 않을까 싶기도 하다.@ 전체적인 스토리가 잡혀있다기 보다는 옴니버스 스타일로 수많은 여성들에게 둘러싸인 주인공의 수난이 중점적으로 부각된다.@ 안전한(?!) 관람을 위해 보기전에 주위에 누가 없는지 확인해 둘 필요가 있다.,해외,일본,65Ba48_ukKo,제작사-Xebec,-,15,-,"원작야부키 켄타로, 하세미 사키", 유우키 리토 (YUUKI RITOU)|結城梨斗 / 성우 : 와타나베 아케노 (WATA-BE AKENO)|渡?明乃, 각본-야마다 야스노리 캐릭터 디자인-오카 유이치 음악-와타나베 타케시,-,12,-,-,0,0
2010,2010.10.05,애니메이션,코미디,침략- 오징어 소녀,감독-미즈시마 츠토무,http://data5.onnada.com/anime/201010/thumb300x400_2038530438_9495415b_14673.jpg,해양 오염을 계속해 온 인류를 정복하기 위해 심해에서 지상에 온 이카무스메,해외,일본,uIUG7stn6w8,제작사-디오미디어,-,12,-,원작안베 마사히로, 오징어 소녀 (IKAMUSUME)|イカ娘 / 성우 : 카네모토 히사코 (KANEMOTO HISAKO)|金元?子, 각본-요코테 미치코 캐릭터 디자인-이시카와 마사카즈 음악-키쿠야 토모키,-,12,-,-,0,0
2010,2010.10.04,애니메이션,"로맨스, 학원, 연애, 드라마",요스가노소라,감독-타카하시 타케오,http://data5.onnada.com/anime/201809/thumb300x400_2070905274_fd886266_-alone.jpg,"교통사고로 양친을 잃은 카스가노 하루카, 카스가노 소라 남매는@경제적 어려움 등을 이유로 인연이 있는 시골 마을에 이주하게 된다.@여기에는 어릴 적 놀러 왔을 때 알게 된 나오, 같이 논 적이 있던 아키라 등 그립고 새로운 만남이 기다리고 있었다.",해외,일본,GWASk2j2CAc,제작사-Feel,-,19,-,-, 카스가노 하루카 (HARUKA KASUGANO)|春日野 悠 / 성우 : 시모노 히로 (SHIMONO HIRO)|下野紘 (しものひろ), 각본-아라카와 나루히사 캐릭터 디자인-카미모토 카네토시 음악-미와 마나부,-,12,-,5Xpsy7ITkVE,0,0
2010,2010.10.04,애니메이션,"시대, 액션",하쿠오우키 벽혈록,감독-야마사키 오사무,http://data5.onnada.com/anime/201303/thumb300x400_2077629024_6ff7e907_1.jpg,줄거리를 등록하여주세요.,해외,일본,T9Ar9XL1Fq8,제작사-스튜디오 딘,-,15,-,원작오토메이트, 유키무라 치즈루|雪村千鶴 / 성우 : 쿠와시마 호우코 (KUWASHIMA HOUKO)|桑島法子, 캐릭터 디자인-나카지마 아츠코 음악-오오타니 코우,-,11,-,0nYZ1f-EDQ,0,0
2010,2010.10.03,애니메이션,미스테리,심령탐정 야쿠모,감독-쿠로카와 토모유키,http://data5.onnada.com/anime/201303/thumb300x400_2077629024_b6ad4ea7_1.jpg,줄거리를 등록하여주세요.,해외,일본,ldZCIMlJQck,제작사-Bee Train,-,15,-,원작카미나가 마나부, 사이토 야쿠모 (SAITO YAKUMO)|?藤 八雲 / 성우 : 오노 다이스케 (ONO DAISUKE)|小野大輔 (おのだいすけ), 각본-카와사키 히로유키 캐릭터 디자인-시바 미나코 음악-론,-,13,-,KTGEuMVxMdk,0,0
2010,2010.10.03,애니메이션,"드라마, 학원",꿈빛깔 파티쉐르 스페셜 프로페셔널,감독-스즈키 이쿠,http://data5.onnada.com/anime/201303/thumb300x400_2077629024_b0871aaf__K-901.jpg,줄거리를 등록하여주세요.,해외,일본,Jk0HClWhpIc,제작사-Studio Hibari,-,-,-,원작마츠모토 나츠미, 아마노 이치고 (AMANO ICHIGO)|天野いちご (あまのいちご) / 성우 : 유우키 아오이 (YUUKI AOI)|悠木碧, 각본-야마다 타카시 캐릭터 디자인-아키야마 유키코 음악-오오하시 메구미,-,13,-,-,0,0
2010,2010.10.03 23:30 (일),애니메이션,"학원, 하렘, 일상, 로맨스, 코미디",내 여동생이 이렇게 귀여울 리가 없어,"감독-니시모토 유키오, 칸베 히로유키",http://data5.onnada.com/anime/201303/thumb300x400_2077629024_b656ba33_1.jpg,평범한 성격을 가진 코우사카 쿄우스케는 여동생이자 중학생인 코우사카 키리노로부터@온갖 무시에 쓰레기 취급을 당하고 산다는 고교 1학년생이다.@이렇다 보니 남매임에도 불구하고 둘 사이에는 다정한 대화도 없이 지낼 정도였다.@그러던 어느 날 쿄우스케는 키리노로부터 '인생 상담'을 의뢰받게 되는데…,해외,일본,1Bz1fgloCsE,제작사-AIC Build,-,15,-,원작후시미 츠카사, 코사카 쿄스케 (KOUSAKA KYOUSUKE)|高坂京介 / 성우 : 나카무라 유이치 (-KAMURA YUICHI)NO)|渡?明乃," 각본-쿠라타 히데유키, 후시미 츠카사 캐릭터 디자인-하라다 타케히토, 모리타 카즈아키, 와타베 케이스케, 이시이 쿠미 음악-코우사키 사토루",-,15,-,1GjgvAktrtI,0,0
2010,2010.10.02,애니메이션,"판타지, 연애, 학원, 드라마",포츈 아테리얼 붉은 약속,감독-나와 무네노리,http://data5.onnada.com/anime/201303/thumb300x400_2077629024_bc122815_2.jpg,"주인공 '하세쿠라 코헤이'는 7년 전 잠시 살았던 시오미시 타마츠섬으로 전학을 오게 된다.@몇년만에 방문한 곳이지만 그곳에는 소꿉친구였던 '하루나'와 '카나데'가 지내고 있었다.@기숙사로 가던 중에 '센도우 에리카'라는 부회장을 만나게 된 코헤이,@기분좋게 인사하고 손을 잡는 순간 에리카가 이상한 반응을 보이는데...@의문을 가진 코헤이지만 다음날, 자신을 막무가내로 약속장소로 부르는 에리카에대한 궁금증을@해결하기 위해 약속장소로 나가던 중 인적이 드문 성당에서 코헤이가 발견한 것은 의문의 소년이@소녀의 목을 물어 뜯어 흡혈을 하고 있는 모습이었다! 과연 이들의 정체와 앞으로의 코헤이의 운명은?!",해외,일본,StCRRIx39EU,"제작사-Feel, Zexcs",-,15,-,원작August, 하세쿠라 코헤이 (HASEKURA KOUHEI)|支倉孝平 / 성우 : 오노 다이스케 (ONO DAISUKE)|小野大輔 (おのだいすけ), 각본-하세가와 카츠미 캐릭터 디자인-이시하라 메구미 음악-안자이 타카아키,-,12,-,geJq2ckJ5Bw,0,0
2010,2010.10.02,애니메이션,드라마,바쿠만,"감독-카사이 켄이치, 아키타야 노리아키",http://data5.onnada.com/anime/201303/thumb300x400_2077629024_84b51562_1.jpg,"전체적인 배경은 일본의 사이타마 현.@이전에 프로 만화가였던 마시로 노부히로(필명:카와구치 타로)를 둔 마시로 모리타카는@같은 학교의 전교 1등인 타카기 아키토에게 만화가가 되자는 제안을 받는다.@이후 자신이 짝사랑하던 아즈키 미호와 ‘만화를 그려서 애니메이션으로 만들어지면 결혼한다’ 라는@약속을 하고 만화를 그리기 시작한다.  마시로와 타카기는 첫 작품으로 '이 세상은 돈과 지혜'를@출품하게 된 것이 실력을 인정받게 되고, 이후 ‘아시로기 무토’란 필명으로 《가짜 탐정 TRAP》을@연재하기 시작하면서 본격적인 만화가의 길에 들어서게 되는데...",해외,일본,DS3gJkdhub4,제작사-J.C.Staff,-,12,-,"원작오바타 타케시, 오오바 츠구미", 마시로 모리타카 (MASHIRO MORITAKA)|?城最高 (ましろもりたか) / 성우 : 아베 아츠시 (ABE ATSUSHI)|阿部敦, 각본-요시다 레이코 캐릭터 디자인-시타야 토모유키 음악-Audio Highs,-,25,-,DS3gJkdhub4,0,0
2010,2010.10.02,애니메이션,"SF, 메카닉",슈퍼 로봇 대전 OG -디 인스펙터-,감독-오바리 마사미,http://data5.onnada.com/anime/201303/thumb300x400_2077629024_cc39ed9f_1.jpg,"반프레스토의 대표 게임이라 할 수 있는 슈퍼로봇대전을 원작으로 하여 제작된 TV 시리즈 애니메이션.@2006년에 이미 '슈퍼로봇대전 ORIGI-L GENERATION(OG)'을 애니화한 작품으로 가 제작, 방영된 바 있는데, '디 인스펙터'라는 부제를 달고 있는 이번 시리즈는 그 속편에 해당하는 '슈퍼로봇대전 OG2'를 토대로 하여 제작된다.",해외,일본,-,제작사-아사히 프로덕션,-,15,-,-, 쿄스케 난부 (KYOUSUKE -NBU)|キョウスケ?ナンブ / 성우 : 모리카와 토시유키 (MORIKAWA TOSHIYUKI)|森川智之," 각본-야츠후사 타츠노스케, 타케다 유이치로 캐릭터 디자인-하마자키 켄이치, 오오고모리 유키히토, 마사히로 야미네, 에바타 리사 음악-테라다 시호, 쿠리야마 요시치카",-,26,-,bWVhRcErUqU,0,0
2010,2010.10.02,애니메이션,코미디,팬티 - 스타킹 with 가터벨트,감독-이마이시 히로유키,http://data5.onnada.com/anime/201103/thumb300x400_2009478845_2e68fde6_ED8FACEBA7B7EBB380ED9998_untitled.jpg,"각각 천국에서 ?겨난 팬티와 스타킹이 가터벨트를 통해 전해지는 천국쪽의 고스트 처리 의뢰를 따라 헤븐 코인이라는 것을 모은다면 천국으로 다시 돌아갈 수 있다는 가상의 도시, 다텐 시티에서 벌어지는 스토리.@ 미국 카툰을 일본풍 그림체로 리메이크한 코미디물.@ 연출은 일본의 리미티드 애니메이션의 특징인 고화질 원화로 눈을 속이는 기법과 카툰의 매우 만화적인 과장이 혼합된 독특한 형태를 취하고 있다.""""",해외,일본,iZbGlVqKXTM,제작사-가이낙스,-,19,-,원작가이낙스, 팬티 (PANTY)|パンティ / 성우 : 오가사와라 아리사 (OGASAWARA ARISA)|小笠原?里沙, 캐릭터 디자인-니시고리 아츠시 음악-타쿠 타카하시,-,13,-,IY8OSXdbvB0,0,0
2010,2010.10.xx,애니메이션,"사무라이, 시대, 액션",박앵귀 벽혈록,감독-야마사키 오사무,http://data5.onnada.com/anime/201310/thumb300x400_32642209_9633f5e0_uki_20.jpg,줄거리를 등록하여주세요.,해외,일본,-,제작사-스튜디오 딘,-,15,-,원작오토메이트, - , 캐릭터 디자인-나카지마 아츠코 음악-나카지마 아츠코,-,10,-,-,0,0
2010,2010.09.26,애니메이션,"코미디, 학원, 하렘",MM-,감독-나가사와 츠요시,http://data5.onnada.com/anime/201303/thumb300x400_2077629024_09baaff3_MM21.5.jpg,고교 1학년인 사도 타로는 이른바 여자에게 맞거나 욕설만 들어도 행복해하고 좋아한다는@일명 'M(마조히스트)' 증상을 가진 영향 때문에 이 증상과 영향에서 벗어나기 위해@친구인 하야마 타츠키치의 권유하에 학교 내(內)에 있는 '제2 볼런티어부(部)' 를 찾아가게 된다.@ 그러나 그곳에는 자칭 신(神)이라 불리며 남을 향해 구타하는 것을 즐겨한다는@일명 'S(사디스트)' 근성을 갖고 있다는 고2의 이스루기 미오와@남성 공포증을 앓고 있어서 접촉하면 바로 주먹질을 날린다는 고1의 유우노 아라시코가 있었다.@이런 제2 볼런티어부에서 타로의 앞날에 파란만장한 나날들과 수난이 기다리고 있는데….,해외,일본,YAIn8wNFJ6Q,제작사-Xebec,-,19,-,원작마츠노 아키나리, 이스루기 미오 (ISURUGI MIO)|石動美? (いするぎ みお) / 성우 : 타케타츠 아야나 (TAKETATSU AYA-)|竹達彩奈 (たけたつあやな),-,-,-,-,-,0,0
2010,2010.09.25,애니메이션,"학원, 하렘, 게임, 판타지, 로맨스, 코미디",신만이 아는 세계,감독-타케야나기 시게히토,http://data5.onnada.com/anime/201909/thumb300x400_2070905244_af224bde_1.jpg,미연시에서 “함락신”으로 불리는 소년 카츠라기 케이마는 지옥에서 온 신출내기 악마 엘시에 의해 지옥과의 계약을 맺어버리게 된다.@케이마는 엘시의 협력자로서 사람의 마음의 틈새에 둥지를 튼 “카케다마” 사냥을 하게 되는데…@게임 세계의 “함락신” 케이마는 현실의 여성도 공략할 수 있을 것인가!?,해외,일본,c3CiE8W8XkE,제작사-만그로브,-,15,-,원작와카키 타미키, 카츠라기 케이마 (KATSURAGI KEIMA)|桂木桂馬 (かつらぎ けいま) / 성우 : 시모노 히로 (SHIMONO HIRO), 각본-쿠라타 히데유키 캐릭터 디자인-와타나베 아키오 음악-마츠오 하야토,-,12,-,-,0,0
2010,2010.09.25,애니메이션,드라마,소녀요괴 자쿠로,감독-콘 치아키,http://data5.onnada.com/anime/201010/thumb300x400_2009083305_1bc0fd73_1.jpg,"때는 요괴와 인간이 공존하는 시대,@아직은 인간들에게 환영받지 못하는 요괴와의 공존을 위해 군부에서는 요인성이라는 기관을 설립한다.@ 종족이 다르지만 서로와 함께하는 시간이 길어지며 처음에는 서로에게 갖고 있던 오해와 선입견도@시간이 흐르며 조금씩 줄어들고 그럴수록 인간 청년과 요인 소녀들의 마음속에도 다른 감정이 점점 싹트게 된다.@@코믹스는 그리 메리트가 없더니 애니메이션화 되면서 그림체, 분위기, 연출이 완전히 달라졌다.@여성 한쪽의 취향을 타는게 아닌 둘다를 노리고 만든 듯한 신묘한 작품, 역시 애니메이션은 이맛에 보는구나 라는 걸 느끼게 한다.",해외,일본,bJuyDhGnfAE,제작사-J.C.Staff,-,12,-,원작호시노 릴리, 자쿠로 (ZAKURO)|西王母桃 (ざくろ) / 성우 : 나카하라 마이 (-KAHARA MAI)|中原麻衣, 각본-오카다 마리 캐릭터 디자인-하세가와 신야 음악-스기모토 마사루,-,13,-,EIznx4QfhDk,0,0
