year,release_date,category,genre,title,creator,title_image,introduction,country_category,country_name,video,production,distribution,grade,runtime,remake,cast,staff,series,trilogy,soundtrack,ref_video,read_count,scrape_count
2013,2013.12.21 01:53 (토),애니메이션,코미디,푸피포-,감독-스즈키 카오루,http://data5.onnada.com/anime/201312/thumb300x400_1988331732_9ea06d31_1-2.jpg,"와카바는 태어날때부터 사람에게는 보이지 않는 것이 보이는 체질.@ 이 때문에 가족, 동급생이나 친구가 없는 날이 계속 되었다.@ 그러던 어느날 길가에 푸피포라고 소리를 지르는 수수께끼의 분홍빛 폭신폭신한 생물을 발생하게 된 날부터 그녀의 일상은 변하기 시작하는데.@.@.",해외,일본,N-iDEp2EPkI,제작사-AIC Plus+,-,전체,-,원작오시키리 렌스케, 히메지 와카바 (HIMEJI WAKABA)|?路若葉 / 성우 : 사사키 시호 (SASAKI SHIHO)|佐?木詩帆, 각본-나카죠 토모후미 캐릭터 디자인-요코타 타쿠미,-,15,-,mPyQhfq3at8,0,0
2013,2013.10.09 00:30 (수),애니메이션,"SF, 미스테리, 판타지, 요괴, 퇴마",도쿄 레이븐즈,감독-카나사키 타카오미,http://data5.onnada.com/anime/201401/thumb300x400_1982298427_a4e8d092_1-4.jpg,"음양사 명가의 자손으로 태어났음에도 영기를 보지 못하는 16세 소년 츠치미카도 하루토라.@그는 음양술에 쓰이는 영력이 없어 지방에 있는 음양 학교의 분교에서 친구들과 평화로운 일상을 보내고 있었다.@어느 날, 하루토라 앞에 본가의 후계자이자 소꿉친구인 츠치미카도 나츠메가 나타났다.@그녀와의 만남은 하루토라의 운명을 크게 바꿔놓는다?!@나츠메를 만나고 한 사건을 겪은 이후로 하루토라는 나츠메와 식신 계약을 맺고 음양사를 육성하는 특수학교에 입학한다!",해외,일본,ZvGjPkMsCq8,제작사-8bit,-,15,-,원작아자노 코헤이, 츠치미카도 하루토라 (TSUCHIMIKADO HARUTORA)|土御門春虎 / 성우 : 이시카와 카이토 (ISHIKAWA KAITO)|石川界人 (いしかわかいと), 각본-쿠라타 히데유키 캐릭터 디자인-와타나베 아츠코 음악-이우치 마이코,-,24,-,g-HcGIino8g,0,0
2013,2013.10.09 01:30 (수),애니메이션,액션,BlazBlue - Alter Memory,감독-타치바나 히데키,http://data5.onnada.com/anime/201310/thumb300x400_2077629048_b5d9a900_1.jpg,인기 격투게임을 원작으로 한 애니메이션,해외,일본,rDqYDsw87n4,"제작사-TeamKG, 훗즈 엔터테인먼트",-,15,-,-, 라그나 더 블러드엣지 (RAGNA THE BLOODEDGE)|ラグナ=ザ=ブラッドエッジ / 성우 : 스기타 토모카즈 (SUGITA TOMOKAZU)|杉田智和," 각본-아카오 데코, 타카하시 타츠야 캐릭터 디자인-시타야 토모유키 음악-Arte Refact",-,12,-,Sw6Fq-p3-KA,0,0
2013,2013.10.08 01:35 (화),애니메이션,"스포츠, 코미디, 부활동",겁쟁이 페달,감독-나베시마 오사무,http://data5.onnada.com/anime/201403/thumb300x400_991326802_0c712fb7_1-4.jpg,도쿄 바로 옆인 치바현에 사는 오노다 사카미치. 초등학생때부터 자전거를 타고@왕복 90km나 되는 아키하바라에 다니던 근성 있는 오타쿠 소년이다.@고등학교에 입학해 애니 연구부를 만들려 하지만 이런저런 이유로 인해 결국 실패하고@우연히 그의 자전거에 대한 소질을 알게 된 전학생 나루코의 추천으로 전혀 생각하지도@않았던 자전거부에 들어가 숨겨졌던 재능을 발휘하기 시작하는데...,해외,일본,JhdLGdVNPss,제작사-TMS 엔터테인먼트,-,12,-,원작와타나베 와타루, 오노다 사카미치 (ONODA SAKAMICHI)|小野田坂道 / 성우 : 야마시타 다이키 (YAMASHITA DAIKI)|山下大輝 이마이즈미 ??스케 (IMAIZUMI SHUNSUKE)|今泉俊輔 / 성우 : 토리우미 코스케 (TORIUMI KOUSUKE), 각본-요시다 레이코 캐릭터 디자인-요시다 타카히코 음악-사와다 칸,-,38,-,4TDg9SYaLDY,0,0
2013,2013.10.08 02:05 (화),애니메이션,"학원, 드라마",논논비요리,감독-카와모 신야,http://data5.onnada.com/anime/201401/thumb300x400_1982298427_885e8dd9_1-6.jpg,부모님의 사정으로 시골로 이사오게 된 이치쇼우 호타루지만 코시가야 자매와 미야우치 자매를 만나게 되면서 즐거운 하루하루를 지내는데.@.@.,해외,일본,skQchJt2V7Y,제작사-실버 링크,-,12,-,원작앗토, 이치죠 호타루 (ICHIJOU HOTARU)|一?? / 성우 : 무라카와 리에 (MURAKAWA RIE)|村川梨衣," 각본-요시다 레이코, 시모 후미히코, 야마다 유카 캐릭터 디자인-오오츠카 마이 음악-미즈타니 히로미",-,12,-,VK31yvvppk8,0,0
2013,2013.10.08 02:55 (화),애니메이션,"액션, 전쟁, 능력",푸른 강철의 아르페지오 -아르스 노바-,감독-키시 세이지,http://data5.onnada.com/anime/201305/thumb300x400_2077629048_259a764c_001.jpg,"2038년, 가속되는 지구온난화로 전 세계가 저지대 및 해안가 수몰에 의한 재앙을 겪게 되었다.@ 그리고 그에 호응하듯 '안개의 함대'라 불리는 정체/소속 일체 불명의 유령함대가 세계각지의 근해에 나타나, 인류의 해군력을 간단히 분쇄하고 바다로부터 축출해 버린다.@ 이 '안개의 함대'의 특징은 구성 함정들이 하나같이 2차 대전시 사용된 구식 함선(특히 구 일본해군함)의 모습을 하고 있으나 에너지 실드, 레이저포, 중력포 등 인류를 아득히 능가하는 기술력으로 무장했다는 점@@이후 인류는 어떻게든 반격을 시도했으나 번번히 참패를 거듭한다.@ 그러던 중 일본 통제군 중령(중좌) '치하야 쇼조'가 '안개'의 잠수항모인 I-401을 나포하는데 성공, 드디어 반격의 실마리가 잡힌다.@ 그리고 쇼조 중령이 401을 운용하여 안개를 공격하는 작전이 입안되었으나, 어찌된 일인지 작전개시 직전 연락이 두절되고 곧 승조원이 모두 사라진 채 표류하던 401이 발견된다.@ 일본정부는 이를 회수하여 봉인해 버리고 치하야 쇼조가 인류를 배신하고 안개 측에 전향했다는 잠정결론을 내린다.@@세월이 지난 후, 쇼조의 아들이자 해양종합학교 생도였던 주인공 '치하야 군조' 앞에 봉인되었던 401이 나타난다.@ 학교의 동기들과 함께 401에 오른 군조는 401이 지닌 초과학의 힘을 이용해 안개의 함대에 맞서 싸우기 시작하는데.@.@.",해외,일본,4I9zfuf3bbQ,제작사-산지겐,-,15,-,원작Ark Performance, 치하야 군조 (CHIHAYA GUNJO)|千早群像 / 성우 : 오키츠 카즈유키 (OKITSU KAZUYUKI)|興津和幸, 각본-우에즈 마코토 캐릭터 디자인-모리타 카즈아키 음악-코우다 마사토,-,12,-,_YC4g3yQOjE,0,0
2013,2013.10.07 18:00 (월),애니메이션,"SF, 메카닉",건담 빌드 파이터즈,감독-나가사키 켄지,http://data5.onnada.com/anime/201310/thumb300x400_32642209_956b484d_28nb29.jpg,"때는 가까운 미래.@애니메이션 작품 『기동전사 건담』 플라스틱 모델――통칭『건프라』가, 1980년대에 일대 붐을 일으킨 후 몇년뒤.@지금, 제 2차 건프라 붐이라 불릴 새로운 흐름이 세계를 석권하고 있다.@그 인기를 견인하고 있는 것이 제작한 건프라 그 자체를 조종하여 싸우는 『건프라 배틀』의 존재다.@ 이 획기적인 배틀 시스템 등장으로, 인기가 확대되어 매년 건프라 배틀 세계대회가 개최되기에 이르렀다.@본편의 주인공, 이오리 세이 도 건프라를 사랑하고, 건프라 배틀 세계대회의 출장을 꿈꾸는 ？은 건프라 빌더(제작자)이다.@모형점의 외아들이라는 점도 있어서, 뛰어난 건프라 제작 능력을 가진 그지만, 배틀 조작에는 문외한이라, 대회에 출전해도 계속해서 첫 시합에서 탈락하였다.@ 그러한 그가, 탁월한 건프라 조작기술을 가진 소년, 레이지와 만나서 콤비를 짜고 세계대회에 도전한다!.@건프라 빌더, 세이 건프라 파이터 레이지.@세이가 만들고 레이지가 싸운다.@그들이 바로 소문이 자자한 빌드 파이터즈목표는, 건프라 배틀 세계대회에 출장 ？ 우승이다",해외,일본,tGA_xKm95zg,제작사-선라이즈,-,12,-,"원작토미노 요시유키, 야타테 하지메", 이오리 세이 (IORI SEI)|イオリセイ / 성우 : 코마츠 미카코 (KOMATSU MIKAKO)|小松未可子 레이지 (REIJI)|レイジ / 성우 : 코쿠류 사치 (GOKURYU SACHI, 각본-쿠로다 요스케 캐릭터 디자인-오오누키 켄이치 음악-하야시 유키,-,25,-,13X8-Scm3Do,0,0
2013,2013.10.07 00:00 (월),애니메이션,학원,메가네부-,감독-야마모토 소비,http://data5.onnada.com/anime/201309/thumb300x400_2077629048_c38c1f28_n_ver2.jpg,"세계 안경테 시장 점유율 20퍼센트 일본내 점유율 96퍼센트를 자랑하는 후쿠이현 사바에시.@ 주민의 여섯 명 중 한 명이 안경에 관련된 일을 하고 있는 이 지방 도시의 공고엔 별난 학생이 한 명 있었는데 안경을 너무나 사랑한 나머지 안경부라는 특별활동부를 만들기로 한 소년 소마 아키라.@ 인도어파인 소꿉친구 미나베 유키야, 왕자님 같은 외견에 단걸 좋아하는 하치미네 타쿠마, 아키라에게 푹 빠진 후배 카마타니 미츠키, 그리고 눈은 좋은데도 알없는 안경을 쓰고 다니는 무드메이커 키마타 하야토와 함께 정체불명의 부활동을 시작하는데.@.@.@.",해외,일본,Hzn27QC_xyE,제작사-스튜디오 딘,-,12,-,-, 소마 아키라 (SOMA AKIRA)|相馬鏡 / 성우 : 아카바네 켄지 (AKABANE KENJI)|赤羽根健治 카마타니 미츠키 (KAMATANI MITSUKI)|鎌谷光希 / 성우 : 미야타 코우키 (MIYATA KOUKI)|宮田幸季 하치미네 타쿠마 (HACHIMINE TAKUMA)|鉢嶺拓磨 / 성우 : 타마루 아츠시 (TAMARU ATSUSHI)|田丸篤志 미나베 유키야 (MINABE YUKIYA)|三鍋友紀也 / 성우 : 스와베 쥰이치 (SUWABE JUNICHI)|諏訪部順一 키마타 하야토 (KIMATA HAYATO)|木全?人 / 성우 : 키무라 료헤이 (KIMURA RYOHEI)|木村良平," 각본-아카오 데코 캐릭터 디자인-나카지마 아츠코 음악-츠츠미 히로아키, 하시모토 쇼타, 오사키 케이코",-,12,-,f6QQuijZ-Ew,0,0
2013,2013.10.07 01:05 (월),애니메이션,능력,은여우,감독-미사와 신,http://data5.onnada.com/anime/201304/thumb300x400_2077629048_50500aa9_1.jpg,에도시절부터 이어져 내려오는 작은 마을의 신사 딸인 고교 2학년 소녀 사에키 마코토.@ 그녀는 신의 전령이라 불리는 은여우 모습의 요수 긴타로가 보이는 신사의 정통 후계자로 비록 입은 거칠지만 미래를 보거나 잃어버린 물건을 찾아내는 등의 신력을 가진 긴타로와 함께 신사 주변에서 일어나는 자잘한 사건들을 해결하는데.@.@.,해외,일본,-,제작사-디오미디어,-,15,-,원작오치아이 사요리, 사에키 마코토 (SAEKI MAKOTO)|?木まこと / 성우 : 카네모토 히사코 (KANEMOTO HISAKO)|金元?子,-,-,-,-,-,0,0
2013,2013.10.07 20:30 (월),애니메이션,"학원, 마법, 하렘, 액션, 판타지",기교소녀는 상처받지 않아,감독-요시모토 킨지,http://data5.onnada.com/anime/201303/thumb300x400_2077629024_e876af40_1.jpg,"기교마술-그것은 마술회로를 탑재한 자동인형, 그리고 인형사에 의해 구사되는 마술.@ 그 최고 학부인 영국 발푸르기스 왕립기교학원에서는, 인형사의 최정상인 ‘마왕’을 가리는 싸움, 통칭 ‘야회’가 개최된다.@ 그리고 지금, 두 개의 그림자가 학원 교문을 들어섰다.",해외,일본,v3EMc5EFUYo,제작사-라르케,-,15,-,원작카이토우 레이지, 아카바네 라이신 (AKABANE RAISHIN)|赤羽雷? / 성우 : 시모노 히로 (SHIMONO HIRO)|下野紘 (しものひろ),-,-,-,-,-,0,0
2013,2013.10.06 01:35 (일),애니메이션,"드라마, 스포츠",더 파이팅 라이징,감독-시시도 쥰,http://data5.onnada.com/anime/201310/thumb300x400_32642209_7f3ec396_ention.jpg,타카무라 마모루와의 만남을 계기로 권투를 시작한 이후왕따에서 일본 페더급 챔피언의 자리까지 오른 청년 마쿠노우치 잇포.@무사히 3차 방어전을 치르고 4차 방어전을 앞두게 된 잇포는 진정한 강함에 대해 차츰 깨닫기 시작하는데.@.@.,해외,일본,V4eLB1iv1SA,"제작사-매드하우스, Mappa",-,12,-,원작모리카와 죠지, 마쿠노우치 잇포 (MAKUNOUCHI IPPO)|幕之?一? / 성우 : 키야스 코헤이 (KOHEI KIYASU)|喜安浩平," 각본-후데야스 카즈유키 캐릭터 디자인-스기우라 코지 음악-히라노 요시히사, 이마호리 츠네오",-,25,-,-,0,0
2013,2013.10.06 22:27 (일),애니메이션,"코미디, 학원",테큐 3,감독-이타가키 신,http://data5.onnada.com/anime/201310/thumb300x400_32642209_51c001e9_tekyu3.jpg,-,해외,일본,0xgZaLB1jsE,제작사-Mappa,-,15,-,"원작Piyo, 루츠", 타카미야 나스노 (TAKAMIYA NASUNO)|高宮なすの (たかみや なすの) / 성우 : 나루미 쿄코 (NARUMI KYOKO)|鳴海杏子 오시모토 유리 (OSHIMOTO YURI)|押本ユリ (おしもとゆり) / 성우 : 와타나베 유이 (WATANABE YUI)|渡部優衣 신죠 카나에 (SHINJOU KANAE)|新庄かなえ (しんじょうかなえ) / 성우 : 미모리 스즈코 (MIMORI SUZUKO)|三森すずこ (みもりすずこ) 반도 마리모 (BANDO MARIMO)|坂東まりも / 성우 : 하나자와 카나 (HANAZAWA KANA)|花澤香菜 (はなざわかな), 각본-이타가키 신 캐릭터 디자인-이타가키 신 음악-닥스 프로덕션,-,12,-,0xgZaLB1jsE,0,0
2013,2013.10.06 02:20 (일),애니메이션,"학원, 부활동",감으로하는- 부활동물,감독-이시다테 코타로,http://data5.onnada.com/anime/201401/thumb300x400_1982298427_f424b823_1-4.jpg,4명의 고교생이 부활동을 찾는 내용의 MMD 애니메이션 ,해외,일본,3ehCH1xmV_c,-,-,12,-,-, 스즈키 유아 (SZKI YUA)|鈴木結愛 / 성우 : 니시 아스카 (NISHI ASUKA)|西明日香 사토 히나 (SATO HINA)|佐藤陽菜 / 성우 : 아케사카 사토미 (AKESAKA SATOMI)|明坂?美 타카하시 아오이 (TAKAHASI AOI)|高橋葵 / 성우 : 오기노 카린 (OGINO KARIN)|荻野可鈴 타나카 코하루 (TANAKA KOHARU)|田中心春 / 성우 : 오오하시 아야카 (OOHASHI AYAKA)|大橋彩香 소노다 모부코 (SONODA MOBUKO)|園田萌舞子 / 성우 : 우에다 레이나 (UEDA REINA)|上田麗奈," 각본-이시다테 코타로, 야마구치 마사타케, 타카하시 토시유키 캐릭터 디자인-케다마 고쵸 음악-이노우에 쥰이치",-,12,-,MksmHosHWHI,0,0
2013,2013.10.06 17:30 (일),애니메이션,"학원, 미스테리",파이 브레인 신의 퍼즐 3기,감독-엔도 히로타카,http://data5.onnada.com/anime/201310/thumb300x400_32642209_bd72027a_1.jpg,오르페우스 오더와의 싸움 후 진급하고 평온한 학교 생활을 보내고 있었던 카이토들 앞에 새로운 적 레이첼이 나타나게 되는데.@.@.@볼때마다 시작되는 목숨을 건 퍼즐 배틀.@ 열쇠를 쥐고 있는것은 신의 퍼즐에 도전한 한 남자 마가타 진!과연 카이토는 진의 진실을 잡을 수 있을 것인지.@.@.@?,해외,일본,WR_sb8PDDHs,"제작사-선라이즈, NHK",-,12,-,원작야타테 하지메, 다이몬 카이토 (KAITO DAIMON)|大門カイト (ダイモンカイト) / 성우 : 아사누마 신타로 (ASANUMA SHINTARO)|?沼晋太? (あさぬましんたろう)," 각본-세키지마 마요리, 사토 쥰이치 캐릭터 디자인-사사키 요헤이 음악-이즈츠 아키오",-,25,-,tpzKJZRQ-Ls,0,0
2013,2013.10.06 01:05 (일),애니메이션,코미디,성우전대보이스톰 7,-,http://data5.onnada.com/anime/201310/thumb300x400_32642209_59875ab1_main.jpg,근처의 회사원 론뽄기 켄이 일하던 사이 휴식시간을 가지고 있는데 갑자기 사람들의 모에를 먹어 치우는 괴물이 출현한다.@이대로라면 사람들(주로 오타쿠)이 살아가는 원동력을 잃게 되어버려는데.@.@.@.@?그런 엄청난 위기(주로 우타쿠에게)에 카페 점원 6인이 맞어 일어나는데.@.@.@무슨 이유인지 록뽄기도 함께 말려들어 카페 마스터의 도운으로 7인의 전사로 대변신.@미성 전사가 된 7인이 지구(주로 아키아바라)의 평화를 지키기 위해 아름다운 목소리를 무기로 악?과 싸우는 오카타 편인 코미디.,해외,일본,UEq8ssu_6Ik,-,-,15,-,-, 이치몬지 료 (ICHIMONJI RYO)|文字遼 / 성우 : 카키하라 테츠야 (KAKIHARA TETSUYA)|?原徹也 (かきはらてつや) 니카이도 진 (NIKAIDO JIN)|二階堂仁 / 성우 : 미야타 코우키 (MIYATA KOUKI)|宮田幸季 미쿠루베 요우 (MIKURUBE YOU)|三廻部洋 / 성우 : 미키 신이치로 (MIKI SHINICHIROU)|三木眞一? 요모타 고우 (YOMOTA GOU)|四方田豪 / 성우 : 사쿠라이 타카히로 (SAKURAI TAKAHIRO)|櫻井孝宏 고탄노 유우 (GOTANNO YOU)|五反野優 / 성우 : 카토 에미리 (KATOU EMIRI)|加藤英美里 록폰기 켄 (ROGPONGI KEN)|六本木健 / 성우 : 하타노 와타루 (HATANO WATARU)|羽多野? (はたのわたる) 나나카 하나 (NANAKA HANA)|七菜香華 / 성우 : 아카사키 치나츠 (AKASAKI CHINATSU)|赤崎千夏 (赤?千夏) 사오토메 장관 (SAOTOME)|早乙女長官 / 성우 : 세키 토시히코 (SEKI TOSHIHIKO)|?俊彦 쿠로이 (KUROI)|?井 / 성우 : 에구치 타쿠야 (EGUCHI TAKUYA)|江口拓也 해설 / 성우 : 치바 시게루 (CHIBA SIGERU)|千葉繁,-,-,11,-,C4tOPle__hs,0,0
2013,2013.10.06 08:30 (일),애니메이션,"학원, 스포츠, 배틀",다이아몬드 에이스,감독-마스하라 미츠유키,http://data5.onnada.com/anime/202001/thumb300x400_2070905244_45320d51_1.jpg,"중학 전국대회를 노리고 있던 사와무라 에이준은 마지막 대회에서 자신의 폭투로 패하고 만다.@동료들과 함께 고교에서의 복수를 다짐하던 중, 명문 세이도 고교 야구부에서 스카우트 제의가 들어오는데….",해외,일본,9RUV98RNnNg,"제작사-매드하우스, 프로덕션 I.G",-,12,-,원작테라지마 유우지, 사와무라 에이쥰 (SAWAMURA EIJUN)|?村?純 / 성우 : 오오사카 료타 (OOSAKA RYOUTA)|逢坂良太," 각본-코누타 켄지 캐릭터 디자인-우에다 미노루 음악-타카쿠와 하지메, 플라잉팬",-,75,-,bMAd7UPOq5E,0,0
2013,2013.10.06 01:30 (일),애니메이션,"드라마, 로맨스",화이트 앨범 2,-,http://data5.onnada.com/anime/201308/thumb300x400_2077629048_280fdcf2_visual.jpg,"학원제까지 앞으로 한달과 다가온 가을 날의 황혼.@@붕괴한 경음악 동호회의 마지막 한 사람, 키타하라 하루키는방과후의 창가에서 학원제의 스테이지를 향해 기타를 연주했다.@@그것은 2년 반 내내 성실하게 지내온 우등생이졸업까지의 반년 간에 이루려고 한 자그마한 모험.@@그러나 그 서투른 기타의 음색에흐르는 듯한 피아노 선율과, 방울이 울리도록 노랫 소리가 겹쳤을 때.@.@.@@한테서 두 사람에게, 둘에서 세명으로 겹쳐 간 신생 경음악 동호회,꿈 같은 꿈이어서 단 반년 간이 시작된",해외,일본,dewVjWJ6r1U,제작사-Satelight,-,15,-,원작Aquaplus, 키타하라 하루키 (KITAHARA HARUKI)|北原春希 (きたはらはるき) / 성우 : 미즈시마 타카히로 (MIZUSHIMA TAKAHIRO)|水島大宙," 각본-마루토 후미아키 음악-코바야시 ??타로, Aquaplus",-,13,-,VarlT1acfSo,0,0
2013,2013.10.06 20:30 (일),애니메이션,스포츠,세계에서 제일 강해지고 싶어,감독-쿠죠 리온,http://data5.onnada.com/anime/201307/thumb300x400_2077629048_df0e7ea5_001.jpg,"국민적 인기를 구가하던 인기 아이돌 그룹 『Sweet Diva』의 부동의 센터 보컬로써 활약하는 하기와라 사쿠라.@아이돌계의 정상에 올라선 그녀가, 새로운 활동의 무대로 선택한 것은 여자 프로레슬링의 무대였다!소중한 동료 미야자와 에레나의 의지와 『Sweet Diva』의 긍지를 지키기 위해 프로레슬링 단체 「베르세르크」의 레슬러로써 링에 설것을 다짐한 사쿠라.@그곳은 화려함과는 거리가 먼 여자들만의 진지한 승부의 장소였다!라이벌과의 투쟁의 결과로써, 진정한 강함을 사쿠라는 그 손에 넣을 수 있을것인가!?",해외,일본,zbxOk2HibtM,제작사-Arms,-,15,-,원작나츠키 키요히토, 하기와라 사쿠라 (HAGIWARA SAKURA)|萩原さくら / 성우 : 타케타츠 아야나 (TAKETATSU AYANA)|竹達彩奈 (たけたつあやな)," 각본-효도 카즈호 캐릭터 디자인-린신 음악-콘도 유키오, 코니시 카요",-,12,-,vK6qs1KtqZc,0,0
2013,2013.10.05 20:30 (토),애니메이션,"학원, 하렘, 연애, 코미디, 일상, 미스테리",리틀 버스터즈- -리프레인-,감독-야마카와 요시키,http://data5.onnada.com/anime/202002/thumb300x400_2070905244_835b8163_2.jpg,나오에 리키는 과거의 사건으로 삶의 이유를 찾지 못한 채 살아가고 있었다.@그러던 중 친구들을 만나게 되면서 점차 즐거움을 되찾게 된다.@하지만 그들의 사는 세계에는 한 가지 비밀이 있는데….,해외,일본,a_12bvGmstc,제작사-J.C.Staff,-,15,-,원작Visual Art`s/Key, 나오에 리키 (NAOE RIKI)|直枝理樹 / 성우 : 호리에 유이 (HORIE YUI)|堀江由衣 (ほりえゆい) 나츠메 린 (NATSUME RIN)|棗鈴 / 성우 : 타미야스 토모에 (TAMIYASU TOMOE)," 각본-시마다 미치루 캐릭터 디자인-이이즈카 하루코 음악-오리토 신지, PMMK, 마에다 쥰, 미와 마나부",-,13,-,uK0PNhGm7Gk,0,0
2013,2013.10.05 01:30 (토),애니메이션,"판타지, 이세계, 하렘, 일상, 로맨스, 코미디",용사가 되지 못한 나는 마지못해 취직을 결심했습니다,감독-요시모토 킨지,http://data5.onnada.com/anime/201310/thumb300x400_2077629048_85d57d9b_2.jpg,"마왕이 쓰러져버리는 바람에 지금까지의 노력이 허사가 되어버린 용사 지망생 라울.@그는 결국 꿈을 포기하고 왕도에 있는 매직 상점에서 근무하는 나날을 보내고 있었다.@그런데 어느 날, 한 아르바이트 지원자가 경악스러운 이력서를 들고 가게에 나타나는데…",해외,일본,CTtxA-xECms,제작사-아스리드,-,19,-,원작사쿄 쥰, 라울 체이서 (RAUL CHASER)|ラウル?チェイサ? / 성우 : 코모토 케이스케 (KOUMOTO KEISUKE)|河本啓佑,-,-,-,-,-,0,0
2013,2013.10.04 02:35 (금),애니메이션,"드라마, 로맨스",골든타임,감독-콘 치아키,http://data5.onnada.com/anime/201310/thumb300x400_2077629048_14da327c_visual.png,경사스럽게도 대학에 합격하여 상경한 타다 반리 대학 데뷔.@ 도쿄 데뷔 자취 데뷔 등 처음 겪어 보는 일들이 가득해서 들뜬 나머지 그는 입학식 당일에 불의의 습격을 당한다.@ 압도적인 레이디 오라! 완벽한 인생의 시나리오! 특기는 폭주하기! 습격자의 이름은 카가 코코.@ 장미 꽃다발을 반리에게 내던진 그녀는 반리의 친구이자 그녀의 소꿉친구인 야나기사와를 쫓아 같은 대학에 입학했다고 한다.@눈부시지만 위태위태한 코코가 걱정되는 나머지 내버려 두지 못하는 반리인데…?!,해외,일본,6TDPT_dhgz8,"제작사-J.C.Staff, Genco",-,15,-,원작타케미야 유우코, 타다 반리 (TADA BANRI)|多田万里 / 성우 : 후루카와 마코토 (HURUKAWA MAKOTO)|古川? (ふるかわ まこと), 각본-시모 후미히코 캐릭터 디자인-하세가와 신야 음악-아케타가와 진,-,24,-,GuPMqo4qPcE,0,0
2013,2013.10.04 01:58 (금),애니메이션,"학원, 메카닉, 하렘",IS 인피니트 스트라토스 2,감독-키쿠치 야스히토,http://data5.onnada.com/anime/201307/thumb300x400_2077629048_1dedae59_1.png,IS를 움직이게 할 수 있는 오리무라 이치카의 이야기,해외,일본,yMroj8K4iCc,제작사-8bit,-,15,-,원작유미즈루 이즈루, 오리무라 이치카 (ORIMURA ICHIKA)|織斑一夏 / 성우 : 우치야마 코우키 (UCHIYAMA KOUKI)|?山?輝,-,-,-,-,-,0,0
2013,2013.10.04 02:05 (금),애니메이션,"시대, 학원",킬라킬,감독-이마이시 히로유키,http://data5.onnada.com/anime/201310/thumb300x400_32642209_9bd34517_Visual.jpg,아버지를 죽인 편태도 가위의 주인을 찾아 혼노지 학원에 전학 온 여고생 마토이 류코가@편태도 가위를 알고 있는 듯한 사츠키에게 대항하며 벌어지는 이야기 ,해외,일본,ClQ7zkHtXY,제작사-Trigger,-,15,-,"원작Trigger, 나카시마 카즈키", 마토이 류코 (MATOI RYUUKO)|纏流子 / 성우 : 코시미즈 아미 (KOSHIMIZU AMI)|小?水?美, 각본-나카시마 카즈키 캐릭터 디자인-스시오 음악-사와노 히로유키,-,24,-,FRivqBxbHRs,0,0
