year,release_date,category,genre,title,creator,title_image,introduction,country_category,country_name,video,production,distribution,grade,runtime,remake,cast,staff,awards,series,soundtrack,amount,ref_video
1995,1995 .04.01 개봉,영화,"드라마, 멜로/로맨스",샤도우랜드,리차드 아텐보로,https://movie-phinf.pstatic.net/20111222_72/1324564540167mcmML_JPEG/movie_image.jpg,1952년 영국. 루이스(C.S. "Jack"" Lewis: 안소니 홉킨스 분)는 옥스포드 대학교의 영어 영문학과 교수이다. 친구들 사이에서 잭이라 불리는 루이스는 여자와는 거의 교우가 없이 독신으로 조용하게 살아간다. 명석하고 이성적인 잭은 감성적인 문제에는 흔들림이 없을만큼 냉철하고 오로지 지적 토론에만 의미를 찾는다. 그런 잭의 삶에 찾아든 여성은 미국인 시인이자 작가인 조이 그래샴(Joy Gresham: 데브라 윙거 분) 감성이 풍부하고 외향적이며 잭 못지않게 지성적이다.@  잭은 스스로가 놀랍게도 조이에게 이끌린다. 조이가 방탕한 남편과 이혼하기 위해 미국으로 돌아가자 잭은 조이에 대한 감정이 얼마나 간절한 것인가 깨닫게 되고 그녀를 그리워 한다. 몇개월 후 조이가 돌아오지만 잭은 로맨틱한 관계를 주저한다. 그토록 오랫동안 가슴에 묻어둔 감정이 쉽게 표현되지 않는다. 그러한 과정에서 잭은 조이의 8세 된 아들 더글라스(Douglas Gresham: 조셉 마젤로 분)와 가까워진다. 조이의 체류 기간이 만료되려 하자 잭은 그녀가 영국에 영구히 머무를 수 있도록 계약 결혼을 한다. 그렇지만 서로간의 편리를 위한 관계는 넘어서지 않는다. 그러나 조이는 사랑이 깊어져 잭이 강박관념처럼 지니고 있는 신중한 도피본능을 깨뜨려 버리려 한다.@  마침내 잭의 감정에 변화가 있게 되지만 조이는 사형 선고와도 같은 악성골수암 진단을 받는다. 그녀를 잃게 될지도 모른다는 두려움에서 잭은 사랑을 고백한다. 잭은 정식으로 조이에게 청혼하고 결혼식을 올린다. 두 사람은 처음으로 잠자리를 같이 하고 잭은 조이에게 그녀로 인해 자신의 인생이 다시 시작되었음을 고백한다. 몇개월이 경과하면서 조이의 병세도 기적적으로 호전된다. 그러나 절망적인 미래를 늘 생각하며 살아간다. 암은 다시 악화되고 잭은 조이가 없는 고통스러운 삶에 직면해야 한다. 처음으로 잭의 믿음이 시험받는 날이다. 두 사람은 꿈처럼 아름다운 골든밸리로 허니문을 떠난다. 조이는 불안해하는 잭에게 ‘우리가 앞으로 겪을 고통도 행복의 일부인 것’을 상기시킨다. 잭은 그녀가 죽어도 더글라스를 돌볼 것이며 친자식으로 키우겠노라 약속한다. 보다 중요한 것은 정녕 사랑이 슬픔을 가져다 준다해도 사랑의 기쁨을 느낄 수 있도록 더글라스를 가르치겠다고 약속한다.",해외,영국,-,-,-,전체 관람가,131분,-,존 우드 조셉 마젤로 데브라 윙거 안소니 홉킨스 ,  윌리엄 니콜슨 William Nicholson (각본) 윌리엄 니콜슨 William Nicholson (원작자) 리차드 아텐보로 Richard Attenborough (제작) 브라이언 이스트만 Brian Eastman (제작) 다이아나 호킨스 Diana Hawkins (공동제작) 테런스 A. 클레그 Terence A. Clegg (기획) 로저 프래트 Roger Pratt (촬영) 조지 펜튼 George Fenton (음악) 스투어트 크레그 Stuart Craig (미술) 페니 로즈 Penny Rose (의상) 레슬리 워커 Lesley Walker (편집),배우/제작진 수상 이력@수상정보 테이블표@1994@제 47회 영국 아카데미 시상식@수상@알렉산더 코다 상 (리차드 아텐보로)@제 66회 미국 아카데미 시상식@후보@각색상 (윌리엄 니콜슨)@후보@여우주연상 (데브라 윙거)@1993@제 19회 LA 비평가 협회상@수상@남우주연상 (안소니 홉킨스),-,-,-,uh2cQukr4cg
1995,-,영화,-,샤도우체이서 2,존 에어스,https://ssl.pstatic.net/static/movie/2012/06/dft_img77x110_1.png,1993년 12월 24일 크리스마스 이브. 미국의 레이콘 핵연구소의 책임자인 로리 웨버(Laurie Webber: 베스 뚜상 분)는 분주한 크리스마스 이브를 맞았다. 연구소 일만해도 복잡하고 정신 없는데 십대 아들 리키(Ricky: 대니 힐 분)는 엉뚱한 사고를 치기 일쑤고 하다못해 연구소 경비원 프랭크(Frank Meade: 브라이언 기네스 분)는 매일 술을 마셔대서 골치다. 이런때 설상가상으로 대통령으로부터 일급비밀 명령이 내려온 것이다. 수년동안 수십억을 들여 연구해서 제작한 일류 최악의 핵무기(암호명: 코브라)를 비밀리에 없애버리라는 것이다. 이때 인조인간 안드로이드(Android: 프랭크 자가리노 분)의 지휘를 받는 일단의 테러리스트들이 코브라의 탈취 계획을 세우고 무자비하게 연구소를 점령하고 정부 당국과 대치한다. 그러나 그들은 건물안에 공격을 피한 로리와 리키 그리고 경비원 프랭크가 있음을 알지 못한다. 인류 최강의 무기를 탈취해 세계를 지배하려는 음모를 가진 악당들을 막을 수 있는 사람은 암호명을 가진 로리와 어리지만 용감한 아들 리키 그리고 술주정뱅이긴 하지만 선량하고 강한 프랭크 뿐인 것이다. 테러리스트들이 이 골치덩이 세 명을 쫓는 동안 안드로이드의 내부에서 컴퓨터 바이러스가 침투해 프로그램이 파괴되어 안드로이드에게는 전보다 더한 파괴성과 잔인성만 남게 된다. 탈주용 비행기를 대기해 놓으라는 요구를 바깥의 군대가 들어주지 않자 민간 비행기에 미사일을 발사해 수백명의 인명을 순간에 살상에 버리는 등 광폭한 살인 기계가 되어버린 것이다. 이로 인해 정부는 이 연구소를 포기하고 폭파시켜버리기로 작정한다. 로리와 프랭크 리키가 건물속에 있음에도 불구하고. 광기만 남아 워싱톤 도시전체에 핵미사일을 떨어뜨리려고 하는 안드로이드를 저지하면서 폭파직전의 연구소를 탈출해야하는 일촉즉발의 사투가 이 세사람에게 남겨진 것이다.,해외,미국,IPXfQ9-Ovc4,-,-,15세 관람가,94분,-,로빈 스미스 개빈 후드 할 오란디니 대니 케오이 토드 젠슨 베스 타우세인트 브라이언 제네스 프랑크 자가리노 ,  닉 데이비스 Nick Davis (각본) 존 에어스 John Eyres (제작) 조프 그리피스 Geoff Griffith (제작) 그레고리 밴거 Gregory Vanger (제작) 대니 레너 Danny Lerner (공동제작) 제프 앨버트 Jeff Albert (협력프로듀서) 대니 딤보트 Danny Dimbort (기획) 에이비 러너 Avi Lerner (기획) 트레버 쇼트 Trevor Short (기획) 앨런 M. 트로우 Alan M. Trow (촬영) 스티븐 에드워즈 Stephen Edwards (음악) 마크 해리스 Mark Harris (미술) 아만다 I. 커폴 Amanda I. Kirpaul (편집),-,-,-,-,1YcaJ1n4gpg
1995,1995 .12.30 개봉,영화,액션,서극의 칼,서극,https://movie-phinf.pstatic.net/20160408_150/1460081199730l8vpY_JPEG/movie_image.jpg,명검을 만들어내는 이름난 칼 제조창 연봉호. 이 지역 당주의 딸인 소령은 어릴 때부터 아버지를 따라다니는 고아 정안과 제조창에 들어온 지 4년 된 철두를 저울질하며 연정을 키워간다. 후계자로 지목된 정안은 뜻밖에 자기 아버지가 온몸이 문신으로 뒤덮인 자객 비룡에게 처참하게 죽임을 당했다는 사실을 알게 되고 아버지가 남긴 반 토막의 ‘칼’을 들고 복수의 여정에 오른다. 그러나 그를 따라온 소령을 마적단으로부터 구하다가 오른팔을 잃게 된다. 흑두라는 고아 소녀의 도움을 받아 구사일생으로 살아나 주막에서 잡일을 하던 정안은 우연히 발견한 비서로 수련하며 검의 고수가 된다. 한편 철두와 함께 정안을 찾아 나선 소령이 마적단에 의해 곤경에 빠지자 정안이 나타나 위험에서 구한다. 이후 정안의 반격으로 처참하게 패한 마적단은 비룡에게 연봉호의 사람들을 몰살시키고 정안을 죽여달라고 의뢰하는데…,해외,홍콩,jfRwRw1nycQ,-,-,15세 관람가,105분,-,레이 창 모제스 찬 혜천사 사흥화 사천화 주가령 주영당 상니 웅흔흔 조문탁 ,  서극 Hark Tsui (각본) 허안 (각본) 소문성 (각본) 서극 Hark Tsui (제작) 강국민 (촬영) 서극 Hark Tsui (편집) 금마 (편집) 원빈 (무술연출),"배우/제작진 수상 이력@수상정보 테이블표@2019@제 41회 낭뜨 3대륙 영화제@후보@서극, 홍콩 영화의 아이콘 (서극)@2011@제 10회 뉴욕 아시아 영화제@후보@홍콩영화 (서극)@1996@제 15회 홍콩금상장영화제@후보@무술감독상 (원빈 외)@후보@의상&메이크업상 (장숙평)",-,-,-,NvBdxpiTM8o
1995,1995 .05.05 개봉,영화,"드라마, 스릴러",서스피션,스티븐 샤크터,https://movie-phinf.pstatic.net/20111222_101/1324558271709yYwnc_JPEG/movie_image.jpg,샌디애고 경찰청의 유능한 형사인 뎀시(Dempsey: 크리스토퍼 리브 분)는 매력적인 아내와 사랑스런 아들이 있는 겉으로는 행복한 가장이다. 하지만 그의 아내 게일(Gail: 킴 케트럴 분)은 몰래 남편이 친동생처럼 생각하는 후배 형사 닉(Nick: 에드워드 커어 분)과 불륜 관계에 있다. 뎀시는 아내 생일에 빨간 차를 선물하고 아이러니하게도 뎀시와 닉 그리고 게일은 그 자동차 앞에서 행복한 포즈를 취한다.@  파티가 무르익고 있는 저녁 긴급출동 명령이 내려지고 뎀시는 동료 레인하트(Rhinehart: 죠 만테나 분)와 급히 현장으로 달려간다. 뎀시는 능숙한 솜씨로 용감하게 범인들을 검거하지만 숨어있던 범인의 총에 쓰러지고 만다. 결국 척추 신경이 마비되어 평생 휠체어 신세를 지게 돼 명예훈장으로 퇴직한다. 외롭고 쓸쓸한 시간을 보내는 남편의 슬픔엔 아롱곳하지 않고 아내 게일은 더욱 더 외도에 열중한다.@  침울한 나날을 보내던 뎀시는 닉과 게일에게 자기를 죽여달라고 제안을 한다. 사고를 가장하면 엄청난 보험금을 가족들에게 남길 수 있고 자신도 치욕스러운 삶을 연장하지 않아도 되는 좋은 방법이라고 그들을 설득한다. 경찰관으로서 가지고 있던 정보를 활용해 그는 완전범죄를 꾸미고 멕시코까지 가서 총과 범죄에 필요한 물품을 사 가지고 멕시코인으로 가장한 닉과 게일은 한밤중에 각본대로 창문을 부수고 뎀시 앞에 선다. 막상 총을 겨눈 닉은 그 손을 떨구고 말자 옆에서 지켜보던 게일이 자신의 총으로 남편을 향해 방아쇠를 당긴다. 그러나 총알은 없었다. 잠시 후 총성 소리. 게일이 바닥에 쓰러지고 휠체어에서 벌떡 일어나는 뎀시는 닉에게 증오에 서린 목소리를 내뱉으며 그에게 총을 난사한다.@  닉과 게일은 뎀시가 파놓은 덫에 걸린 것이다. 사건은 뎀시의 정당방위로 종결지어지려 하지만 뎀시와 경쟁 관계에 있던 동료 레인하트의 집요한 추적이 시작된다. 뎀시에 대한 의혹을 떨쳐버릴 수 없는 레인하트는 주위의 말류에도 불구하고 그를 공직자 윤리위원회에 고발한다. 뎀시와 레인하트는 법정에서 팽팽한 한판 승부를 벌인다. 그러나 뎀시의 함정은 드러나지 않고 마지막 재판에서 그의 무죄가 판결된다. 분노한 레인하트가 뎀시의 다리에 칼을 꽂아버려 결국 직장에서 해고된다.,해외,미국,zFmE8d6M5Dc,-,-,청소년 관람불가,95분,-,나탈리아 노구리치 론 캐나다 윌리암 H. 머시 피놀라 휴즈 제프리 리바스 에드워드 커 킴 캐트럴 조 맨테그나 크리스토퍼 리브 ,  제리 라자러스 Jerry Lazarus (각본) 윌리암 H. 머시 William H. Macy (각본) 스티븐 샤크터 Steven Schachter (각본) 윌리엄 하트 William Hart (제작) 제리 라자러스 Jerry Lazarus (공동제작) 토니 아마툴로 Tony Amatullo (라인프로듀서) 케이스 샘플즈 Keith Samples (기획) 로스 베리맨 Ross Berryman (촬영) 마이클 호닉 Michael Hoenig (음악) 리처드 쉐먼 Richard Sherman (미술) 베티 페카 매든 Betty Pecha Madden (의상) 마틴 헌터 Martin Hunter (편집),-,-,-,-,-
1995,1995 .10.27 개봉,영화,"드라마, 멜로/로맨스",서울 미란다,최창호,https://ssl.pstatic.net/static/movie/2012/06/dft_img77x110_1.png,일류 패션업계의 사장인 길정은 외국에서의 자유분방한 생활이 몸에 익숙해져 패션 모델들과 1회용 섹스를 즐기는 사나이다. 그의 아내 수진은 패션 디자이너로서 남편의 끊임없는 바람기에 지쳐있던 중 우연히 농장에서 사슴을 키우며 조용하게 살아가는 명식이라는 사내를 알게 된다. 그리고 그의 따뜻하고 순수한 마음에서 위로를 받기 위해 수진은 자주 그의 농장을 찾게 된다. 한편 길정의 바람기는 날이 갈수록 심해져서 현재 패션모델 현주와 뜨거운 정사를 나누고 이제 막 영글어서 터질듯한 여체의 소유자 지연을 발견하고 그녀의 육체에 미칠듯이 빠져버린다. 그리고 자신과 정사를 나눈 여인들에게는 패션쇼에서 주연급 자리를 차지하도록 도와준다. 수진은 길정에게 정도가 너무 지나치다고 불평하지만 그는 이미 자유분망한 사고 방식이 몸에 베어 일말의 양심의 가책도 느끼지 못한다. 수진은 결국 일에만 몰두하게 되고 자신이 항상 꿈꾸며 준비했던 대형 패션쇼를 개최하고 성황리에 끝마친다. 성대한 파티가 벌어지던 그날 밤 길정과 지연은 호텔방에서 길고도 격렬한 정사를 벌인다. 그러나 패션모델 지연이 호텔방에서 의문의 살해를 당하게 되는데.,국내,한국,k2atze9gGfA,-,-,청소년 관람불가,85분,-,소비아 김기석 김성수 정미희 ,  설춘환 (각본) 이성세 (제작),-,-,-,-,ELv9_8Bsf5o
1995,"2010 .06.01 재개봉, 1995 .09.16 개봉",영화,"코미디, 액션, 모험, 판타지, 멜로/로맨스",서유기 - 월광보합,유진위,https://movie-phinf.pstatic.net/20111223_181/13246145803593zL6u_JPEG/movie_image.jpg,손오공은 당삼장과 서결을 구하러 가지않고 사부인 담삼장을 먹으면 불로장수한다는 말에 흑해 우마왕과 결탁하여 당삼장을 죽이려한다. 이에 관세음이 소멸시키나 당삼장이 자신의 목숨을 바치면서 손오공의 환생을 간청하자 관세음은 손오공을 인간으로 환생시키기로 약속한다. 그로부터 500년 후 손오공은 오악산의 산적무리들의 우두머리인 지존보로 태어난다.@  그러던 어느날 춘삼십장과 백정정이란 탁월한 무협능력을 갖춘 두 요괴가 나타나서 지존보에게 발바닥에 점이 세개 있는 사람을 찾으라고 협박한다. 이들은 당삼장을 먹으면 불로장수한다는 사실에 당삼장이 다시 환생한다는 소식을 듣고 분명히 손오공과 만날 것이라고 판단하여 이미 환생한 손오공을 찾기 위해 온 것이었다. 그리고 얼마 후엔 우마왕까지 합세하여 요괴인간들간의 결전이 벌어진다.@  이 와중에 지존보는 백정정과 사랑을 나누고 부도목인 이당가와 춘삼십낭 사이에 당삼장이 태어나게 된다. 당삼장을 만나서야 비로소 자신이 손오공이라는 사실을 알게 되는 지존보. 월광보합을 찾은 손오공은 달빛을 향해 주문을 수차례 외친다. 마침내 시간을 거슬러 올라가 500년 전의 세상으로 간 손오공 제일 먼저 반사대사를 만나게 된다.,해외,홍콩,AqZMnG55nPo,-,-,15세 관람가,88분,-,주인 유진위 나가영 막문위 남결영 채소분 오맹달 주성치 ,  기안 (각본) 양국휘 (제작) 반항생 (촬영) 양화생 (미술) 정소동 (무술연출),-,-,-,-,kSTi_Msj_kM
1995,1995 .04.01 개봉,영화,"전쟁, 액션, 드라마",서초패왕,나탁요  세기연,https://ssl.pstatic.net/static/movie/2012/06/dft_img77x110_1.png,1부. 포악한 정치를 하던 진시황이 죽은 후 차자인 호해가 장자 부소를 죽이고 진이세에 등극하자 각지에서 진나라에 대항하는 군웅들의 반란이 일어난다. 항우는 초나라의 장군 집안 출신으로 진나라에 대항하기 위해 과거 진에게 망했던 초나라 왕손을 찾아내 초 회왕으로 등극시킨후 그를 구심점으로 회계에서 반란을 일으킨다. 한편 패현의 유방은 정장(亭長)으로서 죄수들을 동원해 여산릉을 건설하고 있던 중 진나라 장군을 죽이고 죄수들을 규합한 후 함께 반란을 일으키지만 후에 군량과 무기의 부족으로 자청해서 항우의 휘하로 들어간다. 항우는 자신의 숙부인 항량이 진나라 장수 왕리의 손에 죽자 범증을 참모로 삼는데 이 때 초 회왕으로부터 함양을 먼저 차지하는 이에게 관중왕을 봉해 주겠다는 조서를 받는다. 회왕의 조서를 받은 항우는 유방으로부터 먼저 함양에 들어가지 않겠다는 다짐을 받은 후 거록에 침입한 진나라 장수 왕리를 죽여 숙부 항량의 원수를 갚고 승전의 여세를 몰아 극원을 쳐들어가 2만 군사로 장함의 30만 군사와 대결해 승리한 후 자신에게 투항해온 20만 진나라 병사들의 반란이 두려워 그들을 모두 구덩이에 파묻는 잔악한 짓을 행한다. 항우의 만행이 유방에게 전해지자 유방은 항우와의 약속을 어긴채 함양으로 진격해 함양을 차지한 뒤 자영에게서 천자의 옥새까지 받고 백성들에게 선정을 베풀어 민심을 확보하지만 곧이어 함곡관을 공략한 후 홍문에 주둔한 항우의 위협을 받자 참모 장량은 유방에게 패상으로 철수한 다음 항우에게 관중에 먼저 들어가게 된데 대해 사죄하고 진나라의 항복 문서를 바치도록 권유한다.@ 2부. 유방에게서 함양을 인수받은 항우는 아방궁에 불을 지르고 제후들에게 사방의 땅을 나누어준 후 자신은 초나라의 팽성으로 금의환향한다. 한편 유방은 함양에 먼저 진입했으나 관중왕에 봉해지긴 커녕 항우에게서 척박한 파촉땅을 받고 가솔들을 항우에게 인질로 잡힌 채 파촉으로 떠난다. 인질로 잡혀있는 여치는 항우에게 제후 중에 전영의 모반세력이 가장 크니 전영을 제거하라고 사주해 항우는 전영을 공격해 전영을 죽인다. 전영이 죽자 초 회왕은 자신의 친척인 전영을 죽인 항우의 죄를 물어 항우를 잡아들이려고 하다 항우의 친구이며 우희의 오빠인 우자기의 반대에 부딪쳐 우자기와 회왕의 군사들 사이엔 싸움이 벌어지고 그 와중에 회왕이 우자기의 실수로 시해된다. 회왕이 시해되자 범증은 항우에게 우자기 회왕시해 죄를 물어 처형할것을 종용하지만 항우는 그럴수 없다고 버틴다. 그러다 우자기가 자결하자 항우는 오히려 자신이 회왕을 죽였다고 공포한다. 항우가 회왕을 죽였다는 소식을 들은 유방은 전국의 제후들을 규합해서 항우를 공격하게 해놓고 항우가 없는 사이 팽성을 차지하지만 다시 항우가 쳐들어와 유방은 후퇴하고 이로써 초나라와 한나라 사이에는 본격적인 패권 쟁탈전이 시작된다. 그 후 광무산에서 항우와 유방이 서로 대치했는데 유방의 전세가 불리하자 여치는 꾀를 내어 가짜 유방을 내세워 항복하는척 하면서 유방을 빼돌린다. 유방을 빼돌린 죄로 여치는 죽음의 위기에 당면하지만 다시 교활하게 꾀를 부려 항우로 하여금 유방과 화해한 후 휴전협정을 맺게 만든다.,해외,홍콩,kCxFxYEuXb4,-,-,15세 관람가,198분,-,엽전진 유순 진송용 장풍의 오흥국 서금강 관지림 여량위 공리 ,  Yeung-Ping Sze (각본) 류항 Liu Heng (각본) 승기연 Stephen Shin (각본) 정조강 Siu-keung Cheng (촬영) Romeo Diaz (음악) 황점 (음악) Kwan Kit Mok (미술) Kwan Kit Mok (의상),배우/제작진 수상 이력@수상정보 테이블표@1995@제 14회 홍콩금상장영화제@후보@의상&메이크업상 (Kwan Kit Mok),-,-,-,elQCOmas8eQ
1995,1995 .03.04 개봉,영화,-,선인장,장문간  소충한,https://movie-phinf.pstatic.net/20111222_60/1324522315336EARNW_JPEG/movie_image.jpg,CF와 M-TV에서 활동하던 신예 장문간이 연출한 작품. 맥시코 로케이션으로 제작되었다.@ 황량한 멕시코 벌판 낡은 포르쉐에 몸을 실은 홀(여명). 사랑했던 여인 메기와의 이별 후 자신을 찾기위해 멕시코에 와있다. 사막 길목 여기저기 흩어져 거목처럼 자라나 있는 선인장은 그에게 커다란 위안이 된다. 기타를 둘러메고 길이 이어지는 곳으로 발길을 옮기며 새로운 삼의 방향을 찾기위한 방랑생활을 시작하기엔 이곳 멕시코만한 곳이 없다고 그는 생각한다. 하지만 그의 이런 낭만적인 여행도 잠시뿐. 아는 사람 하나 없는 곳에서 '기타 킬러'라는 누명을 쓰고 쫓기게 된다. 기타 킬러란 기타 안에 총을 넣고 다니며 살인을 일삼는 동양계 킬러의 닉네임이었다. 멕시코로 이주해 살고있는 중국인들은 같이 이민해 왔음에도 그의 친구와 함꼐 두목 카를로스에게 정면도전을 했다가 친구를 잃고 그는 수감되는 비운을 맞본자다. 친구를 잃은 제임스(기타 킬러)는 탈옥한 후 카를로스에게 복수를 선언하고 그때부터 기타 안에 총을 넣고 다녔다. 기타를 든 동양인이라는 이유 하나로 카를로스의 부하들에게 위협을 받으며 계속 쫓기기만 하는 홀. 미모의 한 여인이 나타나 그를 구해준다. 하령이라는 이 여인은 자신의 과거 애인을 카를로스에게 잃고난 후부터 술집을 경영하며 복수의 길을 찾아왔었다. 하령은 홀의 낙천성과 순진함에 점차 매료되어 사랑을 느끼게 되고 홀 또한 다소 말이 없긴해도 눈가에 그늘을 담고 있는 하령에게 강한 호기심을 갖는다. 한편 기타 킬러는 두목 카를로스로부터 착복당했던 자신의 돈을 찾고 그를 처치하기 위해 추적하던 중 과거 그의 친구 여동생 하령과 상봉하게 되고 둘은 공동의 목표를 갖고 있음을 알게된다. 결국 그들은 카를로스의 패거리들과 맞닥뜨리게 되고 하령은 위험에 처하게 된다. 이때 이들을 돕기 위해 나타난 홀과 패거리들의 대결전이 시작되는데.,해외,홍콩,XcGl89cQwqI,-,-,청소년 관람불가,-,-,임해봉 갈민휘 모제스 찬 진룡 엽옥경 여명 ,-,-,-,-,-,3sa_Ko9sHvg
1995,1995 .09.08 개봉,영화,액션,성룡의 썬더볼트,진가상,https://movie-phinf.pstatic.net/20160421_202/1461218879089mK5EB_JPEG/movie_image.jpg,일본의 미쯔비시 자동차 공장의 연구실 팀장이자 전문 레이서였던 아화(성룡)는 홍콩으로 돌아와 차 수리센터를 경영하며 경찰 공무원인 아버지와 두 어린 여동생과 함께 평화롭게 살고 있었다. 어느 날 아버지와 함께 심야 불법 레이싱 경주 단속에 나섰다가 모든 일이 꼬여 버린다. 불법 레이싱의 배후에 있는 범죄조직이 아화를 자기 편으로 끌어들이려 하는데…,해외,홍콩,fjt3FwMYVqI,-,-,15세 관람가,110분,-,왕민덕 원영의 성룡 ,  진경가 (각본) 진가상 (각본) 곽위종 (각본) 하관창 (프로듀서) 차이란 (제작) 황영항 Wing-Hung Wong (촬영) 양방언 (음악) 장요종 (편집) 진훈기 (무술연출) 홍금보 Sammo Hung Kam-Bo (무술연출),배우/제작진 수상 이력@수상정보 테이블표@1996@제 15회 홍콩금상장영화제@후보@무술감독상 (홍금보)@1995@제 32회 금마장@수상@액션감독상 (홍금보),-,-,-,-
