year,release_date,category,genre,title,creator,title_image,introduction,country_category,country_name,video,production,distribution,grade,runtime,remake,cast,staff,awards,series,soundtrack,amount,ref_video,,,,,,,,,,,,,,
2002,2002 .09.27 개봉,영화,드라마,낙타들,박기용,https://movie-phinf.pstatic.net/20111221_299/1324469005446JajTS_JPEG/movie_image.jpg,"여기는 월곶에 있는 한 모텔방. 초공항 진입로로 들어선 차 안의 남자, 공황청사 앞에서 크락션을 누른다. 기둥 뒤에 서있어 보이지 않던 여자의 모습이 드러난다. 여자, 조수석에 올라탄다. 고속도로. 차 안에서 남자와 여자가 나란히 앉아 있다. 토요일 오후여서 그런지 고속도로가 많이 밀리고 꼼짝을 하지 않는 차 안에 남자와 여자 사이에는 다소 거북스러운 침묵이 흐른다. 늦은 것을 사과하며 남자는 여자의 이름을 묻는다. 이름조차 몰랐던 남자와 여자를 태운 차가 톨게이트를 빠져나간다.@  서해안의 작은 포구 월곶. 갈매기 소리가 가깝게 들려온다. 오래 전 수원행 기차를 타고 와본 적이 있던 소래 포구 옆 월곶은 모텔, 횟집, 노래방 천국으로 변해버렸다. 변한 것이 어디 이것뿐이랴- 횟집을 찾은 남자와 여자, 구석자리를 차지하고 마주 앉는다. 술잔이 채워지고 비워지면서 어디에서 나고 자랐는지, 부모님은 어떤 분이었는지 등등 소소한 이야기들을 두서없이 나눈다. 약사인 여자는 두통을 없애기 위해선 담배와 술을 줄여야 한다고 충고한다. 고개를 끄덕끄덕하며 남자는 다시 담배를 피워 문다.@  노래방, 나란히 앉아있는 남자와 여자의 모습 위로 반주가 흐른다. 검은 빛 바다 위를 끝없이 흘러가는 밤배를 부르다가 남자와 여자는 입을 마준다. 자동차 와이퍼가 빗방울을 닦아내고 있다. 즐비하게 늘어선 모텔 촌 불빛이 자동차 안으로 흘러 들어온다. 모텔 엘리베이터 안, 남자가 조심스럽게 여자의 손을 잡는다.",국내,한국,https://www.youtube.com/watch?v=Dbx_2hAzIQA,-,-,청소년 관람불가,91분,-,박명신 이대연 ,  박기용 Park Kiyong (각본) 김성수 (제작부) 고충길 (제작) 최현정 (행정) 최찬민 (촬영) 남성일 (조명) 김안훈 (조명) 신수현 (조연출) 장준석 (연출부) 윤희영 (연출부) 정진욱 (동시녹음) 정진욱 (음향) 인상현 (음향) 이종일 (붐오퍼레이터) 박진석 (음악) 김방균 (분장) 박기용 Park Kiyong (편집) 김성수 (편집) 남나영 (네가편집) 홍금옥 (마케팅부문) 메커드 (시각효과부문) 유동렬 (시각효과부문) 문병용 (시각효과부문) 이형승 (시각효과부문) 서성길 (시각효과부문) 최호용 (시각효과부문) 정현수 (시각효과부문) 장강석 (현상부문) 조성준 (현상부문) 이용기 (현상부문) 박주희 (디자인) 김하원 (번역) 달시 파켓 Darcy Paquet (번역),배우/제작진 수상 이력@수상정보 테이블표@2018@제 13회 런던한국영화제@후보@인디 파이어파워 (박기용)@2002@제 3회 전주국제영화제@후보@디지털스펙트럼 (박기용),-,-, ,https://www.youtube.com/watch?v=DuM5jpi925Q,,,,,,,,,,,,,,
2002,2002 .10.11 개봉,영화,"드라마, 코미디",남자 태어나다,박희준,https://movie-phinf.pstatic.net/20111223_146/1324568448779aKYme_JPEG/movie_image.jpg,"지도에 없는 섬 ‘마이도’ 3월1일은 독립운동가의 후손이자 이 마을 최고령이신 장수해 할아버지의 99번째 생일날이다. 할아버지의 마지막 소원을 물어보는 마을사람들은 잠시 말을 잇지 못한다. “사실은-말이다..내가 가슴에 매친게 있다. 우리마을에 대학가는 놈 하나 맹글어서 이 섬을 세상에 알리라.”@  고민에 빠진 마을 사람들. 대학에 갈만한 놈이라고는 마을의 세 청년 대성, 만구, 해삼이 밖에 없는데 이들에게 공부는 먼나라 일이요, 그렇다고 체육특기생으로 대학에 갈 만큼 뛰어난 재능이 있는 것도 아니다. 고민, 고민을 하던 마을 사람들이 내놓은 결론 “그래, 그냥 맞고 때리면 되는 거 권투가 있지 않나? 걸로 대학생 한번 만들어보자!”@  마을 사람들은 수소문 끝에 복싱계를 떠났던 7전 2승 5패의 전적을 가진 읍내의 오락실 주인 왕코치를 초빙하고 본격적인 권투 트레이닝에 들어간다. 대성은 좋아하는 여대생 사랑을 위해, 만구는 대학가요제에 나가 가수로 성공하기 위해, 해삼은 뭍에서 일하며 많은 돈을 벌기 위해 연습은 시작되지만 어째 쯧쯧-@  개개인의 단점을 보완(?)한 필살기를 개발하여 열심히 갈고 닦은 대성, 만구, 해삼. 드디어 아마추어 권투대회가 시작되고 온마을의 기대를 안은 이들이 링에 오른다. 뜨거운 스포트라이트 밑에서 시작된 어설프기 그지없는 한판승부가 시작되고 신기하게도 결승까지 오르는 기적을 이룬 이들, 과연 권투로 대학에 갈 수 있을까?",국내,한국,https://www.youtube.com/watch?v=x-KWFu5fx7M,길벗영화,-,전체 관람가,109분,-,박지일 이재용 박찬영 박은수 김동석 김사랑 이원종 여현수 홍경인 정준 ,  이창렬 (각본) 박희준 (각색) 김수지 (각색) 백경숙 (프로듀서) 김종석 (제작이사) 김민희 (제작이사) 최남진 (제작이사) 강완경 (제작실장) 노성후 (제작실장) 김애경 (제작부장) 이상택 (제작부) 권명중 (제작부) 김동균 (제작부) 이명희 (제작부) 토드 문 Todd Moon (제작) 주니 박 Juny Park (제작) 정수열 (제작관리부문) 조병수 (제작관리부문) 박성혜 (제작관리부문) 손은지 (제작관리부문) 임운영 (촬영부) 최태춘 (촬영부) 홍재식 (촬영부) 황성욱 (촬영부) 홍태화 (촬영부) 박기남 (촬영부) 이석현 (촬영) 고영광 (조명) 김지훈 (조명부) 이재명 (조명부) 김성철 (조명부) 유태종 (조명부) 안겸서 (조명부) 김동범 (조명부) 한정희 (조명부) 박재호 (연출부) 김종석 (연출부) 이윤희 (스크립터) 권혁문 (조감독) 김용수 (조감독) 이해환 (조감독) 남원준 (조감독) 백승일 (조감독) 김한수 (조감독) 김탄영 (동시녹음) 김봉수 (음악) 최순식 (음악) 김정태 (미술) 송화준 (미술) 윤기찬 (세트) 차순하 (소품) 김윤석 (소품) 김민정 (소품) 윤종업 (특수장비) 정훈 (특수장비) 윤여진 (특수효과) 안희준 (분장) 박상희 (분장) 김소희 (분장) 김윤희 (분장) 조미령 (분장) 김성 (의상) 김은정 (의상) 김영호 (현장편집) 경민호 (편집) 임혜정 (편집) 백은자 (네가편집) 성연아 (카피라이터) 임형근 (녹음부) 김도현 (녹음부) 천상민 (녹음부) 정동식 (녹음부) 이순옥 (마케팅부문) 김종근 (마케팅부문) 주승현 (마케팅부문) 최윤정 (마케팅부문) 박지영 (마케팅부문) 홍상석 (무술감독) 배재일 (무술지도) 금종택 (무술지도) 강영주 (무술지도) 안갑용 (무술팀) 김상진 (무술팀) 이재용 (무술팀) 백경찬 (무술팀) 한지빈 (무술팀) 김신용 (무술팀) 박진수 (무술팀) 차재근 (무술팀) 조주현 (무술팀) 황인범 (무술팀) 한정현 (무술팀) 이규환 (무술팀) 전지수 (무술팀) 조현 (무술팀) 이선도 (무술팀) 김원종 (무술팀) 박형식 (무술팀) 권삼옥 (무술팀) 조성민 (발전차) 황학성 (발전차) 여경보 (스테디캠) 제로원 픽처스 (시각효과부문) 신순식 (운송) 정상국 (운송) 문재수 (운송) 김남호 (음향부문) 박보연 (음향부문) 김영호 (음향부문) 박기영 (음향부문) 김재경 (음향부문) 이경환 (음향부문) 양근복 (조명크레인) 신진우 (지미집) 김희승 (지미집) 송은규 (지미집) 박천복 (지미집) 임형진 (지미집) 서동우 (지미집) 백진규 (지미집) 양혜성 (포스터) 윤진호 (메이킹) 홍수환 (자문) 한지빈 (콘티),배우/제작진 수상 이력@수상정보 테이블표@2003@제 4회 전주국제영화제@후보@시네마페스트 야외상영 (박희준),-,-,-,https://www.youtube.com/watch?v=H4-NUwjfsQU,,,,,,,,,,,,,,
2002,2002 .02.22 개봉,영화,"멜로/로맨스, 코미디",내겐 너무 가벼운 그녀,바비 패럴리  피터 패럴리,https://movie-phinf.pstatic.net/20111222_93/1324505720550yDJnW_JPEG/movie_image.jpg,"성격 나쁜 것은 참을 수 있어도, 못생기고 뚱뚱한 것은 도저히 참을 수 없다! 이제까지 '할 라슨(잭 블랙 분)'은 여자친구는 반드시 쭉쭉빵빵 절세미녀여야 한다는 얄팍한(?) 생활신조를 꿋꿋이 지키며 살아왔다. 비록 호응해 주는 여자는 거의 없었지만-@  그러던 어느날, 할은 우연히 유명한 심리 상담사 로빈스 (실제 본인 출연)과 함께 고장난 승강기에 갇히게 된다. 로빈슨은 할의 문제를 단번에 해결하는 특별한 최면요법을 선사하고, 바로 그날 '할' 앞에 세상에서 가장 아름다운 여인 '로즈마리(기네스 팰트로 분)'가 나타난다. 늘씬한 몸매에 환상적인 금발. 게다가 성격까지 천사같은 그녀!! 그녀와의 시간은 완벽 그 자체이다.@  헌데 왜 그녀가 엉덩이만 살짝 걸쳐도 의자들이 다 박살나고, 아름다운 그녀의 속옷은 낙하산만 할까? 하지만 그것이 뭐 대수이랴, 내 눈앞에 그녀는 이렇게 완벽하기만 한데.. 과연 할의 파라다이스는 계속될 것인가?",해외,미국,https://www.youtube.com/watch?v=8LXhHCcJDZg,이십세기폭스코리아(주),이십세기폭스코리아(주),15세 관람가,114분,-,젠 게스너 수잔 워드 토니 로빈스 브루스 맥길 르니 커비 조 비터렐리 제이슨 알렉산더 잭 블랙 기네스 팰트로 ,  숀 모이니핸 Sean Moynihan (각본) 피터 패럴리 Peter Farrelly (각본) 바비 패럴리 Bobby Farrelly (각본) 브래들리 토머스 Bradley Thomas (제작) 찰스 B. 웨슬러 Charles B. Wessler (제작) 바비 패럴리 Bobby Farrelly (제작) 피터 패럴리 Peter Farrelly (제작) 마크 S. 피셔 Marc S. Fischer (공동제작) 마크 카펜티어 Mark Charpentier (공동제작) 크리스 메이어 Kris Meyer (협력프로듀서) 사라 로페즈 Sarah Lopez (협력프로듀서) 러셀 카펜터 Russell Carpenter (촬영) 아이비 Ivy (음악) 톰 울프 Tom Wolfe (음악) 마니쉬 라밸 Manish Raval (음악) 시드니 J. 바소로미우 주니어 Sydney J. Bartholomew Jr. (미술) 파멜라 위더스 Pamela Withers (의상) 크리스토퍼 그린버리 Christopher Greenbury (편집) 릭 몽고메리 Rick Montgomery (배역),-,-,-,-,https://www.youtube.com/watch?v=XdWJAgA1eOc,,,,,,,,,,,,,,
2002,-,영화,한국,냉장고,안영석,https://movie-phinf.pstatic.net/20111222_112/1324497232898bqpVL_JPEG/movie_image.jpg,"영수네 집은 산동네에서 하루하루 어렵사리 살림을 꾸려나가는 도시 서민. 어느날 엄마는 살림에 보탬이 되고자 아버지 몰래 계를 들지만 계주가 달아나는 바람에 오히려 그 동안 모은돈 전부를 날리고 만다. 이 때문에 가족들은 낙담하게 되고 서로간에 서먹해 진다. 철모르는 영수는 떼먹힌 돈 대신에 빚잔치에서 가져온 낡은 냉장고가 마냥 신기하기만 하다. 집안에 처음 생긴 냉장고 덕분에 누나, 엄마, 그리고 아버지는 조금씩 마음이 누그러진다. 영수네 집은 가족안의 따뜻한 정으로 다시금 고된 날들을 견뎌나가기로 한다. (To save money for the family, a woman gets into a mutual finance group without telling her husband. When the organizer of the group runs away, she loses all the money, which deeply frustrates her and her family. She takes an old refrigerator from…)@ 연출의도. 나이를 먹으면서 가장 절실하게 배우는 건 '산다는 게 결코 만만치가 않다'는 것이다. 어쩌면 자신감을 잃어가는 것일 수도 있고 어쩌면 철모르고 품엇던 치기와 자만을 조금은 덜어낸 것일수도 있겟다. 전에는 '산다는 게 다 그렇지 뭐' 라는 말이 무척이나 못난 소리로 들렸는데 이제는 그 한마디를 하기위해 숱한 전투를 치뤄내야함을 조금은 알겠다. 냉장고는 동네 아줌마들이 모처럼 작정을 하고 어느 집 안방에 모여 설탕, 프림을 잔뜩 타서 달짝지근해진 커피와 함께 풀어내는 수다를 어설프게 흉내낸 것이다. 글허지만 어설픈 희망타령으로 오해되지 않았으면 하는 바람이다. 끝으로 고된 날들을 꿋꿋이 버텨나가는 백전 노장들에게 경의를 표한다. (As I grow older I learn that ‘living is not easy’. It may be the case that I’m losing my confidence or my childishness and self-conceit are fading away a little.)@ 어린 시절의 아련한 기억 한 자락을 끌어내서 따뜻한 시선으로 가족을 바라보고 있는 단편 영화. 한국 단편영화로는 처음으로 베니스 영화제 경쟁부문에 진출했다. 한국영화아카데미 14기 졸업 작품. 클레르몽페랑영화제 경쟁부문(2000), 스페인 시네마조브 국제영화제 경쟁부문(2000).",해외,29분,https://www.youtube.com/watch?v=yR9kWoVViBQ,-,-,전체 관람가,-,-,이예원 김용란 민경진 ,  안영석 (각본) 안영석 (프로듀서) 정연경 (촬영) 장효정 (조연출) 박관수 (음향) 송지현 (미술) 서광열 (옵티컬) 안보라 (분장),-,-,-,-,https://www.youtube.com/watch?v=PJIy4xBVrVY,,,,,,,,,,,,,,
2002,-,영화,한국,너 없는 나,남기남,https://ssl.pstatic.net/static/movie/2012/06/dft_img77x110_1.png,뇌종양에 걸린 사랑하는 여인을 살리고자 애쓰는 연인들의 이야기.,해외,98분,https://www.youtube.com/watch?v=WQ3mRnYUHhE,-,-,15세 관람가,-,-,김민석 ,  안진원 (각본),-,-,-,,https://www.youtube.com/watch?v=1VjwlV2EI-I,,,,,,,,,,,,,,
2002,-,영화,드라마,네 멋대로 해라,박성수,https://movie-phinf.pstatic.net/20111222_294/132450916888917eEr_JPEG/movie_image.jpg,"고복수가 출감한다. 첫 수감은 현장체포라 어쩔 수 없었다지만, 이번 구속은 참으로 억울했다. 박 형사가 증거조작을 한 것이다. 복수는 출감하자마자 꼬붕이를 만나서 박 형사의 활동구역을 찾아간다. 중고 레코드점. 전 경이 CD를 고르고 있다. 그 옆에서 한동진도 CD를 고르고 있다. 주인에게 앨범에 대해 이것 저것 질문을 한다. 둘은 안면이 없다. 이 때 선글라스 여인이 강아지를 끌고 들어와 다짜고짜 핸드백으로 동진의 뒷통수를 후려치고 강아지를 안기고 사라진다. 동진이 다른 여인과 바람을 피운 모양이다. 그는 잠시 겸연쩍어 하다가 강아지를 한 쪽 구석에 묶어 두곤 CD 고르던 일을 계속한다. 건망증이 심한 동진은 강아지를 잊고 상점을 나갔고, 상점 주인은 강아지를 무서워하는 탓에, 뜻하지 않게 경이 강아지를 맡게 된다.@ 복수가 출감기념으로 박 형사를 골탕먹이고 귀가를 위해 선 버스 정류장. 복수는 경의 가방에 손을 넣는다. 작업개시다. 그러나 복수와 경의 눈이 마주친다. 복수가 놀라는 것도 잠시, 경이 끌고 온 강아지가 도로로 뛰어드는 바람에 경도 도로로 몸을 기울이고 그녀를 향해 버스가 달려든다. 복수는 그녀를 구하기 위해 손을 뻗지만 겁먹은 복수의 몸이 경을 보호하지 못하고 저만 살겠다고 혼자서 도로를 구른다. 고복수도 전 경도 눈을 질끈 감을 뿐이다. 거친 소음은 버스 타이어 터지는 소리. 그들은 때마침 펑크난 타이어 땜에 살았다. 목석처럼 서 있던 경이 안도의 미소를 짓고 졸도한다.@ 다음날. 꼬붕이가 발목을 삐어 따라간 병원. 병원복도 대기의자에 복수가 앉아있다. CT실 안에 들어간 꼬붕이를 복수가 기다리고 있는데 불현듯 저만치서 여인을 부르는 조그만 여자. 환자복을 입은 경이다. 놀란 복수는 고개를 애써 돌린다. 엊저녁 응급실로 실려 온 그녀가 오늘까지 병원에 있다. 그가 그녀를 피해 가려할 때, 그가 쓰러진다. 그것도 그녀 앞에서. 복수의 불치병이 자각증상을 일으키는 순간이다. 이 후 재생 불량성 빈혈임을 알게된다. 경의 팔에 안겨 쓰러지는 복수. 고복수 앞에 죽음이 가깝다.@ 그는 자꾸만 아득하고 자꾸만 짜증이 난다. 꼬박 24시간을 잠도 안자고 먹지도 않고 TV만 봤다. 프로그램이 끝나 푸른 바탕화면만 들어있는 TV를 차마 끌 수가 없다. “지갑 털다가 길에서 쓰러져 죽으면-” 복수는 그렇게 하루를 꼬박 세우고 그런 생각을 한다. 그리고 하루를 꼬박 잔다. 그는 다음 날부터 꼬붕이한테 당장 일을 구해 오란다. 꼬붕인 그런 재주 없다. 이 세계에서도 이 둘은 인맥이 없다. 일자리가 마련 될 때까지 그는 새벽 운동을 시작한다. 죽기 전까지 건강해져서 아버지한테 뭘 좀 해 드려야겠다. 그러다가 동네 한 구석에 잠바차림의 동네 아저씨들이 몰려 서 있는 것을 본다. 인력시장이다. 복수는 마침 한 사람이 결석한 그 틈에 끼여든다.@ 복수가 간 곳은 드라마 촬영장. 이 패거리는 엑스트라들이다. 참기 힘든 엑스트라를 하다가 그의 눈을 사로잡은 것은 스턴트맨. 성룡같다. 태어나서 이렇게 재미나고 감동스런 장면은 본적이 없다. 고복수 생애 처음으로 목표가 생겼다. 그는 꼬붕이와 함께 스턴트맨 사무실을 찾는다. 복수와 경은 다시 만난다. 그가 훔친 그녀의 신분증, 그리고 강아지가 엮여서 만나게 되고, 복수는 경의 언니가 운영하는 여관에서 하룻밤을 보낸다. 경은 강아지를 돌려주려 만난 한동진과 가까워진다. 그의 예술적 기질이 맘에 든다. 어른스런 그의 태도가 참 좋다. 자유로운 자태가 황홀하기도 했다. 그리고 자신이 만난 사람 중에 제일 똑똑하다. 그러고 보니 그녀 주변엔 지적인 자가 없다. 그와 좋은 음악동료가 되고 싶다. 복수는 경의 동진에 대한 사랑은 가짜라고 여긴다. 그 의도가 불손하다. 한 동진이 문화부 기자라 줄이라도 엮어줄까 하는 기대심리가 경에게 있다고 우겨댄다. 경이 아니라는데도 혼자서 막무가내로. 또한 동진의 무책임한 친절을 경멸한다. 고복수는 한동진에게서 전 경을 구하려 한다. 별 치사하고 유치한 짓을 다 해 가면서. 미래는 복수의 행동이웃긴다. 아니 불안하다. 복수를 빼앗기고 싶지 않다. 하지만…",국내,한국,https://www.youtube.com/watch?v=IxZrExbgZL0,-,-,-,-,-,권형준 전혜진 이원용 정두홍 김재만 김재욱 전혜진 허인범 김명국 이세창 이혜숙 조경환 윤여정 신구 공효진 이동건 이나영 양동근 ,  인정옥 (각본) 장근수 (기획) 김우선 (조연출),배우/제작진 수상 이력@수상정보 테이블표@2003@제 39회 백상예술대상@수상@TV 극본상 (인정옥)@수상@TV 남자신인연기상 (양동근)@수상@TV 작품상(드라마) (MBC),-,-,         -,-,,,,,,,,,,,,,,
2002,2002 .04.12 개봉,영화,코미디,다이아몬드를 쏴라,크리스 베르 윌,https://movie-phinf.pstatic.net/20111222_284/1324480903153Y0zuV_JPEG/movie_image.jpg,"고전영화광인 킬러에게 붙잡힌 어느 탈옥수 청년이 킬러에게 그간 자신의 모험담을 들려주면서 이야기가 시작된다. 캐롤라이나 연방교도소의 죄수 트레버 핀치(Trevor Finch/Cletis Tout: 크리스찬 슬레이터 분)는 다이아몬드를 훔친 죄로 체포된 노인 미카(리차드 드레이퍼스 분)와 함께 탈옥한다. 현란한 마술 솜씨를 이용하여 과감하게 백주대낮에 탈옥을 감행, 멋지게 성공한 두 사람은 신분증을 위조하고 헤어진 마이카의 딸과 감격적인 재회를 한다. 그러나 갑작스러운 킬러들의 습격을 받게 되고, 마이카는 핀치에게 자신의 딸을 부탁하며 숨을 거둔다.@  느닷없는 킬러의 습격에 어리둥절하던 핀치는 그 이유를 곧 알게 된다. 그들은 핀치가 위조한 신분증의 주인 클레티스 타우트를 노렸던 것. 클레티스 타우트는 마피아의 아들이 창녀를 살해하는 장면을 촬영하고 이 테이프로 마피아를 협박하다 킬러의 손에 죽는다. 그러나 그의 시체가 형체를 알아 볼 수 없게 타버려, 그의 죽음에 확신을 가지지 못한 마피아는 핀치를 클레티스 타우트로 오해하게 된다. 졸지에 경찰, 마피아, 킬러에게 쫓기게 된 핀치와 테스. 그들의 추적을 피해 간신히 다이아몬드가 묻혀 있는 곳에 도착했지만 그곳에는 교도소가 들어서 있다!@  다이아몬드는 교도소 안에 묻혀 있고, 마피아와 킬러에게 목숨을 위협받는 절박한 상황에 몰리게 된 핀치는 일생일대의 모험을 감행한다. 경찰에게 자신이 클레티스 타우트라고 속이고 보호를 요청하여 다시 교도소로 들어가는 것. 결국 다시 교도소로 들어간 탈옥수 핀치, 하지만 곧 트립에게 정체를 들킨 핀치는 클레티스의 테이프와 교환하는 조건으로 자신을 석방시켜달라는 제안을 하는데. 테스는 핀치에게 캐나다로 간다고 말하지만 핀치는 그녀를 사랑하면서도 붙잡지 못한다. 한편 로디의 조직은 암살자 크리티컬 짐(팀 알렌 분)에게 핀치의 제거를 의뢰하고, 곧 핀치는 짐에게 붙잡힌다. 하지만 고전영화광인 짐은 핀치가 들려준 영화같은 이야기에 감동받아서 멋진 해피엔딩을 만들라는 말을 남긴 채 그를 놓아준다.",해외,캐나다 / 영국,https://www.youtube.com/watch?v=RVf9SlHxeq0,감자,감자,15세 관람가,115분,-,조셉 스코렌 리차드 셰볼로 팀 알렌 포티아 드 로시 리차드 드레이퓨즈 크리스찬 슬레이터 ,  크리스 베르 윌 Chris Ver Wiel (각본) 매튜 그리맬디 Matthew Grimaldi (제작) 다니엘 그로드닉 Daniel Grodnik (제작) 조지 르베이 George Levai (제작) 로버트 스너칼 Robert Snukal (제작) 데니스 머피 Dennis Stuart Murphy (공동제작) 마이클 필립 Michael Philip (공동제작) 에릭 샌디스 Eric Sandys (공동제작) 메리 조 슬래터 Mary Jo Slater (공동제작) 제이 파이어스톤 Jay Firestone (기획) 애덤 헤이트 Adam Haight (기획) 피터 호프먼 Peter Hoffman (기획) 폴 모이어 Paul Moyer (기획) 예즈 지엘린스키 Jerzy Zielinski (촬영) 랜디 에델만 Randy Edelman (음악) 찰스 로즌 Charles Rosen (미술) 벳시 콕스 Betsy Cox (의상) 로저 본델리 Roger Bondelli (편집) 존 코머포드 Jon Comerford (배역) 메리 조 슬래터 Mary Jo Slater (배역),-,-,-,-,https://www.youtube.com/watch?v=x4V9vxnV9L0,,,,,,,,,,,,,,
2002,2002 .10.18 개봉,영화,다큐멘터리,다큐멘터리 한대수,장지욱  이천우,https://ssl.pstatic.net/static/movie/2012/06/dft_img77x110_1.png,암울했던 70년대 "물 좀 주소""라는 노래로 자유에 대한 갈증을 노래한 한대수는 서구적인 포크 음악을 국내에 처음 소개한 사람이자, 한국 모던 포크 음악의 창시자로 평가받는 전설적인 가수다. 시대의 자유를 노래한 한대수는 정치적인 압력 때문에 고국을 떠날 수 밖에 없었고, 그 후 20여 년간 공식적인 음악생활을 중단했었다. 이 다큐멘터리는 2001년 5월, '행복의 나라로' 공연을 위해 일시 귀국한 한대수의 여정을 담은 기록이다.@ “한국에서 태어났고, 몽고의 공주와 결혼했으며, 숨쉬기와 구름 구경하기를 즐기는 작가. 요리를 할 때 가장 즐거우며 정원을 갖고 있지 않은 정원사” 이것은 한대수가 자신을 소개하는 말이다. 인생의 반 이상을 미국에서 살았고, 음악을 하고자 한국에 왔지만 다시 음악을 하기 위해 미국으로 떠난 한대수. 영화는 한국 포크의 살아있는 전설, 한대수가 아닌 호기심 많고 괴상하게 웃는, 한 여자의 남편이면서 나이 들어 육체가 늙어가는 53세 아저씨 한대수와 그의 음악을 재조명한다. <다큐멘터리 한대수>는 장지욱 감독이 인터넷 서핑 중 발견한 한대수 홈페이지에 남긴 글에서 우연하게 탄생했다. 2000년 7월부터 끈기있게 한대수를 따라다닌 감독의 진지한 태도는 영화의 담담하면서도 인간적인 어조에서 드러난다. 또한 신문이나 잡지, 음반 쟈켓 프레임을 이용한 재치있는 미쟝센은 다소 칙칙할 수 있는 이야기에 활력을 불어 넣고, 초점 없이 흔들리는 카메라는 다큐멘터리의 장르적 특성에 부합한다. (제천국제음악영화제)",국내,한국,https://www.youtube.com/watch?v=807ZqS2hI4o,-,-,12세 관람가,80분,-,한대수 ,  이유진 (구성) 홍지용 (제작) 장지욱 (촬영) 이천우 (미술) 이천우 (편집),배우/제작진 수상 이력@수상정보 테이블표@2005@제 1회 제천국제음악영화제@후보@마니아를 위하여 (이천우 외),-,-,,https://www.youtube.com/watch?v=9XicOaq7r-s,,,,
