"","year","release_date","category","genre","title","creator","title_image","introduction","country_category","country_name","video","production","distribution","grade","runtime","remake","cast","staff","awards","series","soundtrack","amount","ref_video"
"38","-","-","영화","일본","거부 못할 제자의 향기","토미오카 타다후미","https://movie-phinf.pstatic.net/20171206_190/1512520893268XJ1KG_JPEG/movie_image.jpg","유명 문학작가로써 명성을 날리 타케나카에게 어느 날 요시코라는 어린 여자가 들어와 하숙을 청한다.@ 정교하면서도 끊임없이 들어오는 그녀의 향기로 인해 그녀에 대한 음란한 상상을 하게 된다.@ 상상은 점차 현실 속에서 나타나며 요시코의 문학적 스승으로서 책임감과 그녀의 성적 욕구에 대한 갈등으로 인하여 요시코에 대한 타케나카의 행동은 점차 변해간다.","해외","74분","https://www.youtube.com/watch?v=1b8-gDQKjeQ","-","-","-","-","-","-","-","-","-","-","-","https://www.youtube.com/watch?v=3yqeDFRgs10"
"39","2017","2017 .01.05 개봉","영화","드라마","걱정말아요","소준문  신종훈  김대견","https://movie-phinf.pstatic.net/20161207_283/1481074453828QM9bv_JPEG/movie_image.jpg","에피소드 01. <애타는 마음> (감독: 소준문)@ 택시 운전을 하는 ‘춘길’은 외로운 마음을 달래기 위해 종로로 나선 길에서@ 우연히 바람난 애인을 쫓고있는 ‘현준’을 만나게 된다.@ 택시에 오른 ‘춘길’과 ‘현준’은 점점 꼬여가는 상황을 마주하게 되는데…@ @ 에피소드 02. <새끼손가락> (감독: 김현, 김대견)@ 인권단체에서 일하고 있는 ‘혁’은 어느 날 사무실로 찾아온 옛 연인 ‘석’을 만나게 되고,@ 아무 말없이 ‘석’의 가입신청서 작성을 돕는다.@ 신청서에 정보가 하나씩 쓰여질 때마다 과거 과거의 사건을 마주하게 되는데..@ @ 에피소드 03. <소월길> (감독: 신종훈)@ ‘점순’은 낮이면 식당 일을 하고, 밤이면 아들 ‘용준’에게는 대리운전을 한다고 둘러댄 후,@ 소월길에서 몸을 파는 투잡을 하고 있다.@ 남몰래 일을 하던 어느 날, 그녀는 길 건너에 일하던 ‘은지’를 만나게 되는데…@ @ 모두에게 전하는 괜찮다는 위로의 말 <걱정말아요>@ 이건 우리들의 이야기","국내","한국","https://www.youtube.com/watch?v=ZVsQi8BOHnI","(주)레인보우팩토리","(주)레인보우팩토리","청소년 관람불가","61분","-","나종민 박진우 박수영 최무성 이휘종 이종걸 장민영 이준상 박상언 윤준석 조혜훈 고원희 박명신 박정근 권기하 이시후 정지순 ","  김현 (각본) 신종훈 JONG HUN SHIN (각본) 민용근 (각색) 안은호 (프로듀서) 김지연 (프로듀서) 곽수정 (제작실장) 송삼동 (제작부) 김태우 (제작부) 신소라 (제작부) 홍준표 (제작부) 김진규 (제작부) 김승환 (제작) 정다열 (제작지원) 이재환 (제작지원) 이준상 (제작지원) 한영인 (제작지원) 장현남 (제작지원) 김민 (제작지원) 임혜영 (제작지원) 김조광수 (기획) 김승환 (기획) 김원섭 (촬영부) 김명준 (촬영부) 유수진 (촬영부) 장영민 (촬영부) 김고려 (촬영부) 김기택 (촬영부) 권순경 (촬영) 김대견 (촬영) 권영준 (촬영) 이준일 (조명) 김대견 (조명) 고봉성 (조명) 김상영 (조명부) 김용현 (조명부) 이동혁 (조명부) 임병준 (조명부) 이광용 (조명부) 김봉준 (조명부) 황정우 (조연출) 이호현 (조연출) 문지영 (연출부) 유승범 (연출부지원) 김녹연 (연출부지원) 이승원 (연출부지원) 노진희 (스크립터) 최린 (스크립터) 장현설 (동시녹음) 김대견 (동시녹음) 김현 (동시녹음) 김현상 (동시녹음) 옥은혜 (녹음) 배유리 (믹싱) 고아영 (믹싱) 알고보니 혼수상태 (음악) 옥은혜 (음악) 방길성 (미술) 윤상윤 (미술) 소준문 (시각효과) 천익 (시각효과) 소준문 (타이틀디자인) 박현규 (타이틀디자인) 김철준 (-무술) 장혜령 (분장) 이은아 (분장) 강다윤 (분장) 김하경 (의상) 김소라 (의상) 소준문 (편집) 김대견 (편집) 이지연 (편집) 이연정 (편집) 박정훈 (발전차) 정덕원 (발전차) 이나경 (미술부) 태욱 (미술부) 박정근 (현장사진) 백재호 (현장사진) 김준영 (촬영장비) 김열회 (디지털색보정) 최철웅 (캐스팅) 하진경 (촬영지원) 이시형 (발전차) 신정은 (디지털색보정) 박현규 (캘리그라피) 김승환 (감수) 김도연 (번역) 박민영 (번역) 박설민 (콘티)","-","-","-","774","https://www.youtube.com/watch?v=WdSju2upujU"
"40","2017","2017 .03.09 개봉","영화","미스터리, 스릴러","걸 온 더 트레인","테이트 테일러","https://movie-phinf.pstatic.net/20170309_70/1489040422323yWtzn_JPEG/movie_image.jpg","톰과의 이혼으로 알코올 의존자가 된 레이첼은@ 매일 같은 시간, 같은 칸 통근 열차에 앉아 창 밖 풍경을 보는 게 낙이다.@ 그런 그녀의 눈에 들어온 완벽한 커플, 메건 부부.@ @ 어느 날 메건이 실종되고, 그녀의 남편 스콧이 용의선상에 오르지만@ 톰의 새로운 부인 애나는 사건의 용의자로 레이첼을 지목한다.@ @ 메건이 실종되던 날@ 피투성이로 돌아온 레이첼@ 부분부분 조각난 기억,@ 그날의 진실을 기억해 내야 한다!","해외","미국","https://www.youtube.com/watch?v=VatP3qlzYkc","CJ E&M 영화부문","CJ E&M 영화부문","청소년 관람불가","112분","-","리사 쿠드로 라나 영 대런 골드스타인 앨리슨 제니 로라 프레폰 에드가 라미레즈 저스틴 서룩스 레베카 퍼거슨 루크 에반스 헤일리 베넷 에밀리 블런트 ","  에린 크레시다 윌슨 Erin Cressida Wilson (각본) 폴라 호킨스 Paula Hawkins (원작자) 마크 플랫 Marc Platt (제작) 자레드 르보프 Jared LeBoff (제작) 홀리 바리오 Holly Bario (공동제작) 뎁 다이어 Deb Dyer (공동제작) 셀리아 D. 코스타스 Celia D. Costas (기획) 캐슬린 케네디 Kathleen Kennedy (기획) 프랭크 마샬 Frank Marshall (기획) 스티븐 스필버그 Steven Spielberg (기획) 샤롯 브루스 크리스틴슨 Charlotte Bruus Christensen (촬영) 폴 엄슨 Paul Urmson (사운드슈퍼바이저) 대니 엘프만 Danny Elfman (음악) 데보라 젠슨 Deborah Jensen (아트디렉터) 케빈 톰슨 Kevin Thompson (미술) 수잔 보드 타이슨 Susan Bode-Tyson (세트) 존 베이어 John Bair (시각효과) 미첼 펌 Mitchell Ferm (시각효과) 데이비드 이즈요민 David Isyomin (시각효과) 브렌던 테일러 Brendan Taylor (시각효과) 버나뎃 마주어 Bernadette Mazur (분장) 앨런 댄제리오 Alan D'Angerio (헤어) 미쉘 매틀랜드 Michelle Matland (의상) 앤 로스 Ann Roth (의상) 마이클 맥커스커 Michael McCusker (편집) 앤드류 버클랜드 Andrew Buckland (편집) 케리 바든 Kerry Barden (배역) 폴 쉬니 Paul Schnee (배역)","배우/제작진 수상 이력@수상정보 테이블표@2017@제 43회 새턴 어워즈@후보@최우수 스릴러상 (테이트 테일러)@후보@최우수 여우주연상 (에밀리 블런트)@제 23회 미국 배우 조합상@후보@영화부문 여우주연상 (에밀리 블런트)@제 70회 영국 아카데미 시상식@후보@여우주연상 (에밀리 블런트)","-","-","29011","https://www.youtube.com/watch?v=VatP3qlzYkc"
"41","2017","2017 .03.09 개봉","영화","액션, 드라마","검객풍운","장뢰","https://movie-phinf.pstatic.net/20170228_35/1488252334655OpYtm_JPEG/movie_image.jpg","봉황산에 오른 강호의 고수들이 하나 둘씩 사라진다는 괴소문이 돈다. 점점 흉흉해지는 강호의 분위기를 알아챈 검술의 일인자 이어풍은 소문의 진실을 찾기 위해 봉황산으로 떠난다. 그리고 그곳에서 밝혀진 충격적인 진실. 이어풍은 자신만이 절대악을 막고 사람들을 구할 수 있다는 사실을 깨닫고 다시 한 번 칼을 뽑아 든다.","해외","중국","https://www.youtube.com/watch?v=VFJf-sT8cWI","-","-","15세 관람가","87분","-","류탁정 금초 양서장 양준우 ","-","-","-","-","   ","-"
"42","2017","2017 .11.30 개봉","영화","스릴러, 드라마","검은 숲 속으로","질스 마챈드","https://movie-phinf.pstatic.net/20171129_62/1511946652282ViEaM_JPEG/movie_image.jpg","톰과 벤은 프랑스에 사는 엄마를 떠나 스웨덴에서 혼자 살고 있는 아빠를 찾아온다.@ 전문직 종사자인 아빠는 직장을 팽개친 채 두 아들을 데리고 아무도 없는 숲 속으로 캠핑을 떠난다.@ 그러나 기이한 행동을 보이는 아빠에게 아이들은 불안과 공포를 느끼고 캠핑장에서 빠져나가려고 애쓰는데...@ 어린 형제의 상상 속에서 아빠는 악마의 형상을 한 낯선 남자가 되어간다.","해외","스위스","https://www.youtube.com/watch?v=5QdmVNQfcos","영화사 진진","영화사 진진","15세 관람가","103분","-","데오 반 드 부르드 티모테 봄 토르프 제레미 엘카임 ","  질스 마챈드 Gilles Marchand (각본) 도미니크 몰 Dominik Moll (각본) 잔느 라프와리 Jeanne Lapoirie (촬영) 필립 숄러 Philippe Schoeller (음악)","배우/제작진 수상 이력@수상정보 테이블표@2017@제 2회 프렌치 시네마 투어@후보@상영작 (질스 마챈드)@제 21회 부천국제판타스틱영화제@후보@부천 초이스(장편) (질스 마챈드)@2016@제 49회 시체스영화제@후보@판타스틱 파노라마 (질스 마챈드)@제 60회 런던 국제 영화제@후보@컬트 (질스 마챈드)@제 69회 로카르노 영화제@후보@피아자 그란데 (질스 마챈드)","-","-","        ","https://www.youtube.com/watch?v=RgKfb522hWU"
"43","2017","2017 .12.25 개봉","영화","액션, 드라마, 멜로/로맨스","게발트 파이브:구타본능","야마가 타카유키","https://movie-phinf.pstatic.net/20171221_55/1513838037355Skmd3_JPEG/movie_image.jpg","일진들간의 치열한 주도권 싸움이 벌어지는 중앙고교. 그 곳에서 왕따라도 당할까 노심초사 학창시절을 보내던 루이토. 어느 날 양아치들에게 망신을 당한 것을 빌미로 친구들이 자신을 따돌리려는 낌새를 느낀 그는 스스로 일진이 되기 위해 교내 최강의 남자 ‘안노’에게 도움을 청하고, 우여곡절 끝에 교내 최강의 서클 ‘게발트파이브’를 만나게 된다.","해외","일본","https://www.youtube.com/results?search_query=%EC%98%81%ED%99%94%20%EA%B2%8C%EB%B0%9C%ED%8A%B8%20%ED%8C%8C%EC%9D%B4%EB%B8%8C:%EA%B5%AC%ED%83%80%EB%B3%B8%EB%8A%A5%20%EC%98%88%EA%B3%A0%ED%8E%B8","(주) 영진크리에이티브","(주) 영진크리에이티브","-","67분","-","-","-","-","-","-","1","https://www.youtube.com/watch?v=SqR-sdcw2Ww"
"44","2017","2017 .09.02 개봉","영화","드라마","게이봉박두5 : 자유로운 연애중","임형규  김상백  김민규","https://movie-phinf.pstatic.net/20170823_233/1503477645343RV7nq_JPEG/movie_image.jpg","돔 | 2017 | 13분 | 연출: 임형규@ 지훈은 현덕에게 첫날밤 사용하자며 콘돔을 선물한다. 하지만 현덕은 그새 우찬과 번개를 하고 지훈과 헤어진다. 그 와중에 우찬은 새로운 남자를 소개받게 되고, 둘은 모텔로 향한다. 지훈, 현덕, 우찬 세 사람의 사이를 여행하는 콘돔의 이야기.@ @ 돌아가는 길 | 2017 | 20분 | 연출: 김상백@ 순호는 중국집 배달원으로 취직하여 배달을 갔다 만난 유진을 보고 짝사랑에 빠진다. 첫 월급으로 순호는 유진에게 탕수육을 선물하는데, 마침 샤워하고 나온 유진과 마주친다.@ @ 기울어진 여름 | 2017 | 23분 | 연출: 김민규@ 2주년을 맞은 연인 준오와 민재는 여행을 떠난다. 그러나 준오의 실수로 그들은 호텔 대신 게스트하우스에 묵게 된다.","국내","한국","https://www.youtube.com/watch?v=27QTOTdabs4","-","-","-","60분","-","정요한 우다원 태웅 이지환 배미미 춘화 최가람 최대진 정준환 김치원 김세엽 강주형 김세환 하성훈 김종하 진양욱 ","  임형규 (각본) 김민규 Kim Min-Kyu (각본) 송한종 (프로듀서) 이민지 (프로듀서) 이건우 (촬영부) 박규태 (촬영부) 최종균 (촬영) 김상백 (촬영) 강철규 (촬영) 아키신 (조명) 최민철 (조명) 김현승 (조연출) 송한종 (조연출) 이욱 (조연출) 황상원 (연출부) 이버드 (스크립터) 허세준 (스크립터) 김홍민 (동시녹음) 아키신 (동시녹음) 문지영 (동시녹음) 소규섭 (동시녹음) 박초롱 (사운드) 이휘민 (음악) 권형준 (음악) 키라라 (음악) 이기쁨 (작곡) 강성우 (작곡) 김상백 (미술) 배동효 (분장) 황상원 (분장) 허챠밍 (분장) 권명호 (편집) 김상백 (편집) 오현정 (편집) 지현도 (콘돔디자인) 박세익 (콘돔디자인) 정운 (-스틸)","-","-","-","-","-"
"45","2017","2017 .05.17 개봉","영화","미스터리, 공포, 스릴러, 드라마","겟 아웃","조던 필","https://movie-phinf.pstatic.net/20170512_76/1494564316131VmHQY_JPEG/movie_image.jpg","흑인 남자가 백인 여자친구 집에 초대 받으면서 벌어지는 이야기","해외","미국","https://www.youtube.com/watch?v=5-H7DpEBZGo","유니버설 픽쳐스","유니버설 픽쳐스","15세 관람가","104분","-","제로니모 스핀스 에리카 알렉산더 제랄딘 싱어 루더포드 크레이븐스 카렌 L. 라키 존 윌못 애슐리 르꽁트 캠벨 스티븐 루트 키스 스탠필드 베티 가브리엘 마르쿠스 헨더슨 케일럽 랜드리 존스 릴렐 호워리 캐서린 키너 브래드리 휘트포드 앨리슨 윌리암스 다니엘 칼루야 ","  조던 필 Jordan Peele (각본) 제이슨 블룸 Jason Blum (제작) 숀 맥키트릭 Sean McKittrick (제작) 조던 필 Jordan Peele (제작) 에드워드 H. 햄 주니어 Edward H. Hamm Jr. (제작) 지넷 브릴 Jeanette Brill (기획) 레이몬드 맨스필드 Raymond Mansfield (기획) 숀 레딕 Shaun Redick (기획) 쿠퍼 사무엘슨 Couper Samuelson (기획) 토비 올리버 Toby Oliver (촬영) 마이클 아벨스 Michael Abels (음악) 러스티 스미스 Rusty Smith (아트디렉터) 레너드 R. 스피어스 Leonard R. Spears (세트) 나딘 헤이더스 Nadine Haders (의상) 그레고리 플로킨 Gregory Plotkin (편집) 테리 테일러 Terri Taylor (배역)","배우/제작진 수상 이력@수상정보 테이블표@2019@제 7회 디아스포라 영화제@후보@디아스포라의 눈 (조던 필)@제 33회 프리부르 국제영화제@후보@암호 해독 (조던 필)@제 41회 낭뜨 3대륙 영화제@후보@블랙 북 오브 아메리칸 시네마 (조던 필)@2018@제 8회 북경국제영화제@후보@미드나잇 (조던 필)@제 44회 새턴 어워즈@후보@최우수 각본상 (조던 필)@후보@최우수 감독상 (조던 필)@후보@최우수 남우주연상 (다니엘 칼루야)@후보@최우수 편집상 (그레고리 플로킨)@수상@최우수 호러상 (조던 필)@제 23회 크리틱스 초이스 시상식@수상@SF/호러영화상 (조던 필)@수상@각본상 (조던 필)@후보@감독상 (조던 필)@후보@남우주연상 (다니엘 칼루야)@후보@작품상 (조던 필)@제 38회 런던 비평가 협회상@후보@남우주연상 (다니엘 칼루야)@수상@영국남우주연상 (다니엘 칼루야)@후보@작가상 (조던 필)@후보@작품상 (조던 필)@제 70회 미국 작가 조합상@수상@각본상 (조던 필)@제 70회 미국 감독 조합상@수상@감독상(신인감독부문) (조던 필)@후보@감독상(영화부문) (조던 필)@제 24회 미국 배우 조합상@후보@영화부문 남우주연상 (다니엘 칼루야)@후보@영화부문 앙상블상 (조던 필)@제 52회 전미 비평가 협회상@후보@각본상 (조던 필)@후보@감독상 (조던 필)@수상@남우주연상 (다니엘 칼루야)@후보@작품상@제 71회 영국 아카데미 시상식@후보@각본상 (조던 필)@후보@남우주연상 (다니엘 칼루야)@제 90회 미국 아카데미 시상식@수상@각본상 (조던 필)@후보@감독상 (조던 필)@후보@남우주연상 (다니엘 칼루야)@후보@작품상 (조던 필)@제 75회 골든 글로브 시상식@후보@남우주연상-뮤지컬코미디 (다니엘 칼루야)@후보@작품상-뮤지컬코미디 (조던 필)@2017@제 9회 본 스릴러 국제영화제@후보@경쟁 외 (조던 필)@제 82회 뉴욕 비평가 협회상@수상@신인작품상 (조던 필)@제 30회 시카고 비평가 협회상@수상@각본상 (조던 필)@후보@감독상 (조던 필)@후보@유망연출상 (조던 필)@후보@편집상 (그레고리 플로킨)@제 43회 LA 비평가 협회상@수상@각본상 (조던 필)@제 26회 MTV 영화 & TV 어워즈@후보@영화 - 최고의 배우상 (다니엘 칼루야)@후보@최고의 싸움상 (조던 필)@후보@최고의 악당상 (앨리슨 윌리암스)@후보@최고의 영화상 (조던 필)@수상@최고의 코믹연기상 (릴렐 호워리)@후보@최고의 콤비상 (다니엘 칼루야 & 릴 렐 호워리)@접기","-","-","2139452","https://www.youtube.com/watch?v=UnJHDvpAewY"
"46","2017","2017 .09.14 개봉","영화","액션, 스릴러","경심파","오품유","https://movie-phinf.pstatic.net/20170831_115/15041456577393MHsw_JPEG/movie_image.jpg","악인을 심판한다는 명분으로 법망을 피해가며 연쇄 살인을 저지르는 전례 없는 연쇄살인범 ‘장군’.@ 살인 예고장을 보낸 뒤 3일 안에 살인 계획을 실행하는 그로부터 또 한 번의 살인 예고장이 접수된 가운데 강력계 형사 ‘마진’은 장군의 파놓은 함정을 알아채고 그를 현장에서 사살한다.@ 하지만 장군과의 대치 중 그는 총을 맞고 쓰러져 병원으로 이송되고, 장군의 심장을 이식 받고 다시 기적 같이 살아난다.@ 그로부터 1년 반 뒤, 또 다시 장군의 살인 예고장이 도착하고 그의 범죄는 더욱 대담해져 국제적인 사건이 된다.@ 이에 인터폴과 마진, 범죄심리학자 ‘처자웨이’ 교수가 수사팀에 합류된다.@ 하지만 마진과 처자웨이의 사이에서 알 수 없는 긴장감이 흐르고, 수사팀 내부에 장군의 협력자가 있음이 의심되는 가운데 두 사람은 서로가 장기 이식수술을 받았음을 알고 서로를 의심하는데..","해외","홍콩","https://www.youtube.com/watch?v=9szAi4syJLA","(주) 케이알씨지","(주) 케이알씨지","15세 관람가","102분","-","범효훤 동려아 유청운 사정봉 ","-","-","-","-","   ","-"
"47","2017","2017 .05.25 개봉","영화","다큐멘터리","고려 아리랑: 천산의 디바","김소영","https://movie-phinf.pstatic.net/20170419_223/1492566665697fGMH1_JPEG/movie_image.jpg","카자흐스탄, 우즈베키스탄, 투르크메니스탄, 키르기즈스탄, 모스크바…@ 세계 곳곳으로 흩어진 이들에게 ‘고려극장’이 찾아오는 날은 유일한 잔칫날이었다.@ 잃어버린 가족을 다시 만난 듯, 그렇게 눈물을 흘리며 기뻐했다.@ @ 러시아인 어머니, 고려인 아버지에게 물려받은 아름다운 목소리로 사랑 받았던 ‘방 타마라’,@ 100여 가지의 배역을 소화했던 무대의 여왕 ‘이함덕’,@ @ 시베리아 벌판을 무대 삼아 위로의 무대를 선사했던@ 두 디바의 경이로운 삶이 펼쳐진다!","국내","한국","https://www.youtube.com/watch?v=Mhp44Ol7yoA","822 필름","(주)시네마달","전체 관람가","96분","-","이함덕 방 타마라 ","  강진석 (프로듀서) 강진석 (촬영) 정지영 (음향) Jacob KHAN (음악) 김소영 Kim So-young (편집) 강진석 (편집)","배우/제작진 수상 이력@수상정보 테이블표@2017@제 5회 디아스포라 영화제@후보@코리안 디아스포라 (김소영)@제 14회 EBS 국제다큐영화제@후보@한국 다큐멘터리 파노라마 (김소영)@제 11회 이주민 영화제@후보@상영작 (김소영)@제 17회 인디다큐페스티발@후보@국내 신작전 (김소영)@2016@제 8회 DMZ국제다큐멘터리영화제@후보@한국다큐쇼케이스 (김소영)@제 13회 EBS 국제다큐영화제@후보@페스티벌 초이스 (김소영)@제 42회 서울독립영화제@후보@특별초청 - 장편 (김소영)@제 18회 서울국제여성영화제@후보@새로운 물결 (김소영)","-","-","  ","https://www.youtube.com/watch?v=Mhp44Ol7yoA"
"48","2017","2017 .11.23 개봉","영화","드라마","고령가 소년 살인사건","에드워드 양","https://movie-phinf.pstatic.net/20171108_105/1510121147542aUkXI_JPEG/movie_image.jpg","14살 소년 샤오쓰(장첸 분)는 국어 성적이 나쁘다는 이유로 중학교 주간부에서 야간부로 반을 옮기게 되고 ‘소공원’파와 어울려 다닌다.@ 그러던 중 샤오쓰는 양호실에서 밍(양정이 분)이라는 이름의 소녀를 만나게 된다.@ 소녀는 ‘소공원’파의 보스 허니의 여자로 허니는 샤오밍을 차지하기 위해 경쟁조직인 ‘217’파의 보스를 죽이고 은둔 중이다.@ 보스의 부재로 통제력을 상실한 ‘소공원’파는 보스 자리를 두고 혼란에 빠지고 돌연 허니가 돌아오게 되면서 ‘소공원’파 내부와 ‘217’파간의 대립이 격해진다.@ 그리고 밍을 사랑하게 된 샤오쓰도 이들의 싸움에 휘말리게 되는데…","해외","대만","https://www.youtube.com/watch?v=5KjprCpxllU","(주)리틀빅픽처스","(주)리틀빅픽처스","15세 관람가","237분","-","진상기 장한 소애 장국주 임홍명 예숙군 장영진 왕야민 왕백삼 왕연 강수경 장한 왕 주안 금연령 장 구주 양정이 장첸 ","  에드워드 양 양덕창 (각본) 유 웨이 옌 Yu Wei Yen (미술) 진박문 (편집)","배우/제작진 수상 이력@수상정보 테이블표@2018@제 17회 달라스 아시안 영화제@후보@상영작 (에드워드 양)@제 65회 시드니 영화제@후보@Hipper than Thou (에드워드 양)@후보@고전영화 (에드워드 양)@후보@음악영화 (에드워드 양)@제 14회 제주영화제@후보@아일랜드시네마 (에드워드 양)@2017@제 41회 홍콩 국제 영화제@후보@에드워드 양, 10th 커메모레이션 (에드워드 양)@제 13회 제주영화제@후보@아일랜드시네마 (에드워드 양)@2016@제 53회 금마장@후보@고전 상영 (에드워드 양)@제 29회 도쿄국제영화제@후보@월드 포커스 (에드워드 양)@2015@제 10회 로마 국제영화제@후보@우리 삶의 영화 (에드워드 양)@제 20회 부산국제영화제@후보@특별기획 프로그램 (에드워드 양)@2010@제 54회 런던 국제 영화제@후보@Satyajit Ray 상 (에드워드 양)@2008@제 30회 낭뜨 3대륙 영화제@후보@에드워드 양 헌정 (에드워드 양)@제 32회 홍콩 국제 영화제@후보@상영작 (에드워드)@2007@제 44회 금마장@후보@상영작 (에드워드 양)@제 12회 부산국제영화제@후보@특별전 (에드워드 양)@1991@제 13회 낭뜨 3대륙 영화제@후보@공식 부문- 경쟁 (에드워드 양)@제 28회 금마장@수상@작품상 (양덕창)@제 36회 아시아 태평양 영화제@수상@최우수작품상 (에드워드 양)@제 4회 도쿄국제영화제@수상@심사위원특별상 (양덕창)@접기","-","-","9531","https://www.youtube.com/watch?v=5KjprCpxllU"
