year,release_date,category,genre,title,creator,title_image,introduction,country_category,country_name,video,production,distribution,grade,runtime,remake,cast,staff,awards,series,soundtrack,amount,ref_video
1992,1992 .10.03 개봉,영화,드라마,반 고호,모리스 피알라,https://movie-phinf.pstatic.net/20111221_3/1324461923701fCmgv_JPEG/movie_image.jpg,"영화는 1890년 5월 빈센트 반 고흐(Van Gogh: Jacques Dutronc 분)가 휴양을 위해 오베르에 도착하면서 시작된다. 빈센트는 동생 테오(Theo: Bernard Le Coq 분)가 매달 대주는 적은 생활비로 하루에 방세가 3프랑 50 밖에 안 되는 초라한 카페 이층의 다락방에서 지내는 동안 오베르의 아름다운 자연과 그곳 사람들의 모습을 미친 듯이 그려나간다. 오베르에서 가깝게 지내던 의사 가셰 씨(Gachet: 제랄드 세티 분)의 어린 딸 마그리트(Marguerite: 알렉산드리아 런던 분)는 소녀적인 순수함과 맹목적인 사랑으로 그를 열렬히 사모한다. 그녀와의 밀회를 하는 중에도 그녀의 건강하고 티없는 세계는 빈센트의 바닥을 모르는 깊은 영혼의 갈증과 허무를 채워주기에는 미흡했다. 한편으로 그는 창녀 캐티(Cathy: 엘자 질베스테인 분)와의 관능적인 관계를 통해 소외된 사람들의 고독과 좌절을 나눔으로 해서 위안을 찾으려 한다. 또한 그를 끊임없이 따라다니던 가난은 불편함 외에도 자신이 동생에게 경제적인 부담을 주고 있다는 자책감을 준다. 동시에 동생에게 구걸해야만 하는 자신의 처지에 대한 굴욕감 등 이중으로 그를 괴롭히고 서서히 파괴해간다. 고흐의 그림이 평론가들의 주목을 받기 시작할 즈음 그의 영혼은 이미 너무도 고갈되고 황폐해져서, 그는 자신이 더 이상 그림을 그릴 수 없을 한계점에 이른 듯 느낀다. 게다가 자신을 유일하게 이해한다고 믿었던 동생이 다른 모든 화상들처럼 자신을 착취하고 있는 듯한 배신감은 정신적으로 그는 더욱더 막다른 골목으로 몰린다. 그에게 구원의 여신상처럼 비췄던 아름답고 열정적인 제수 조안나(Jo: 콜린느 보우든 분) 역시 남편 테오에게 갈등을 불러일으키고, 경제적인 부담을 주는 빈센트를 자신의 가정에 위협적인 존재로 생각해 그에게 등을 돌린다. 그에게 무조건적인 사랑을 쏟아왔던 마그리트도 시간이 감에 따라 빈센트의 광기와 정신의 황폐함에 절망한다. 예술의 애호가로 자처하고 빈센트의 후원자처럼 그를 환대해주던 가셰 박사 조차 빈센트와 딸 마그리트의 관계를 안 뒤로 그와 절연하자, 그에게는 더 이상 설자리가 없어진다. 고흐의 그림이 평론가들의 주목을 받기 시작할 때 그의 영혼은 이미 너무도 메마르고 황폐해져서 더 이상 그림을 그릴 수 없다고 그는 고백한다. 그리곤 끝내 권총 자살을 시도하고 그 상처로 인해 하루 동안 고통받다가 오베르의 싸구려 하숙집에서 37세로 생을 마감한다. 세상에 발을 못 붙였던 그의 자리는 워낙 없었으므로 또 다시 세상은 아무 일 없었던 듯 돌아가지만, 그의 강렬한 예술혼은 그를 사랑했던 마그리트의 가슴에, 그리고 후세의 많은 사람들의 가슴에 새겨질 것이다.",해외,프랑스,https://www.youtube.com/results?search_query=%EC%98%81%ED%99%94%20%EB%B0%98%20%EA%B3%A0%ED%98%B8%20%EC%98%88%EA%B3%A0%ED%8E%B8,-,-,15세 관람가,155분,-,리즈 라메트리에 엘자 질버스테인 코린 부르돈 제라르 세티 베르나르 르콕 알렉산드라 런던 자크 뒤트롱 ,  모리스 피알라 Maurice Pialat (각본) 엠마누엘 마켈 Emmanuel Machuel (촬영) 얀 드데 Yann Dedet (편집) 나탈리 허버트 Nathalie Hubert (편집),배우/제작진 수상 이력@수상정보 테이블표@2018@제 13회 로마 국제영화제@후보@회고전 (모리스 피알라)@2017@제 32회 마르델플라타 국제영화제@후보@포커스 (모리스 피알라)@2015@제 52회 금마장@후보@트리뷰트 (모리스 피알라)@2012@제 34회 모스크바 국제 영화제@후보@무빙 픽쳐스 (모리스 피알라),-,-,      -,https://www.youtube.com/watch?v=5oz3btkNMEE
-,-,영화,드라마,반디네집,심상목,https://ssl.pstatic.net/static/movie/2012/06/dft_img77x110_1.png,-,국내,한국,https://www.youtube.com/watch?v=KKPUEANoHAo,-,-,-,-,-,이효원 이건주 김성옥 신신애 김성환 ,-,-,-,-,-,-
1992,1992 .11.21 개봉,영화,"드라마, 멜로/로맨스",발몽,밀로스 포만,https://movie-phinf.pstatic.net/20111222_209/1324516045362621vU_JPEG/movie_image.jpg,"제르꾸르(Gercourt: 제프리 존스 분)의 정부인 메르떼이유(Merteuil: 아네트 베닝 분) 후작 부인은 제르꾸르가 마담드 볼랑즈(Madame De Volanges: 시안 필립스 분)의 외동딸 세실(Cecile: 파이루자 발크 분)과 결혼식을 올릴 예정이라는 사실을 알고는 젊은 탕아 발몽(Valmont: 콜린 퍼스 분)을 시켜 결혼식 전에 세실의 순결을 빼앗으려는 계략을 꾸민다.@  14세의 어린 소녀 세실은 아무 것도 모른 체 메르떼이유 후작 부인의 도움을 빌어 같은 또래의 음악 가정교사인 당스니(Danceny: 헨리 토마스 분) 기사와 연애 편지를 주고 받으며 사춘기적 풋사랑에 빠진다. 한편 발몽은 친척집에서 만난 젊은 유부녀 뚜르벨(Tourvel: 멕 틸리 분) 부인에게 반하여 그녀를 유혹하기에 바쁜데.@  결국 발몽은 질투에 가득찬 메르떼이유 후작 부인의 계략에 휘말려 세실의 순결을 차지하게 되지만, 당스니 기사와의 싸움에서 그의 칼에 목숨을 잃고 마는 위험한 관계의 희생양이 되고 만다. 임신을 한 세실은 권력을 쥔 제르꾸르와 예정된 결혼식을 올리고 당스니 기사는 새로운 발몽이 된다.",해외,프랑스 / 미국,https://www.youtube.com/watch?v=p_GIIhwxS1I,-,-,청소년 관람불가,130분,-,샌드린 듀마스 빈센트 쉬아벨리 로널드 레이시 아레타 밋첼 이안 맥네이스 일사 블레어 TP 맥케나 파비아 드레이크 헨리 토마스 제프리 존스 시안 필립스 페어루자 볼크 멕 틸리 아네트 베닝 콜린 퍼스 ,  장 클로드 카리에 Jean-Claude Carriere (각본) 밀로스 포만 Milos Forman (각본) 쇼데를르 드 라클로 Choderlos de Laclos (원작자) 폴 라삼 Paul Rassam (제작) 마이클 호스먼 Michael Hausman (제작) 미로슬라브 온드리섹 Miroslav Ondricek (촬영) 크리스토퍼 파머 Christopher Palmer (음악) 존 스트라우스 John Strauss (음악) 피에르 구프로이 Pierre Guffroy (미술) 데오도르 피스텍 Theodor Pistek (의상) 앨런 하임 Alan Heim (편집) 네나 다네빅 Nena Danevic (편집) 엘렌 체노워스 Ellen Chenoweth (배역) 매기 카티어 Maggie Cartier (배역),-,-,-,-,https://www.youtube.com/watch?v=Cc-QdeVGL0Y
1992,1992 .11.28 개봉,영화,코미디,밥 로버츠,팀 로빈스,https://movie-phinf.pstatic.net/20111216_230/1324028873051vanjc_JPEG/movie_image.jpg,"밥 로버츠(Bob Roberts: 팀 로빈슨 분)는 가수이자 자수성가한 백만장자이고 펜싱 애호가이며 정계의 유력한 인물이다. 그가 중하층 출신이라는 점을 보면 그의 성공은 미국이 기회의 나라라는, 다시말해 아메리카 드림은 여전히 실현가능한 것임을 웅변하는 모범적인 사례임을 기억해 둘 필요가 있다. 1990년 밥 로버츠는 미 상원의원에 출마하여 펜실베니아주의 선거 유세를 시작하면서 시작한다. 로버츠는 명쾌하고 단순하면서 심금을 울리는 방식으로 60년대 관용주의와 정치적 천진성이 파괴시킨 가치들의 회복을 주장하여 중산층 관중들의 환호를 받는다. 가수 출신인 밥은 유세장에서 자신이 옹호하는 보수주의 노래를 부르며 유권자의 정서에 파고든다. 이것은 90년대 스타일의 활동적이고 강력한 선거운동으로 무례함, 알콜중독, 마약, 성 문란 등을 상대방의 미온적 경제정책과 그것이 야기한 경기후퇴 탓으로 돌린다. 이러한 전략이 적중하여 밥에게 유리하게 나타난다. 그런데 방해꾼이 나타난다. 신문기자인 아랍계 벅스 래플린은 밥이 대부금 유용과 마약밀매에 연루되어 있다는 증거를 발견한 것이다. 그것이 폭로되자 밥의 선거운동은 타격을 받게된다. 그러나 예측할 수 없는 일이 발생한다. 어느날 밥을 한 남자가 저격한 것이다. 밥은 경호원들 사이에서 창백하게 변해 피를 흘리며 쓰러진다. 저격범은 바로 벅스 래플린(Bugs Raplin: 지안카를로 애스포시토 분)이었다. 밥이 병원 침대에 누워 회복을 기다리는 동안 대중 매체는 그의 편이 된다. 밥은 신우익의 선교자, 미래를 위해 불구가 된 예언자로 찬양된다. 한편 벅스 래플린은 자신의 무죄를 주장한다. 드디어 투표일이 되고 유권자들은 저마다 투표를 한다. 누가 선거의 우승자가 될 것인가?",해외,미국,https://www.youtube.com/watch?v=27oIJRJpv04,-,-,15세 관람가,105분,-,톰 앳킨스 메릴리 데일 켈리 윌리스 로버트 스탠튼 존 오타비노 해리 레닉스 레베카 젠킨스 고어 비달 브라이언 머레이 레이 와이즈 앨런 릭먼 지안카를로 에스포지토 팀 로빈스 ,  팀 로빈스 Tim Robbins (각본) 포레스트 머레이 Forrest Murray (제작) 제임스 빅우드 James Bigwood (협력프로듀서) 알랜 F. 니콜스 Allan F. Nicholls (협력프로듀서) 팀 베번 Tim Bevan (기획) 로나 B. 월리스 Ronna B. Wallace (기획) 폴 웹스터 Paul Webster (기획) 장 레핀 Jean Lepine (촬영) 데이비드 로빈스 David Robbins (음악) 리차드 후버 Richard Hoover (미술) 브리짓 켈리 Bridget Kelly (의상) 리사 제노 커진 Lisa Zeno Churgin (편집),배우/제작진 수상 이력@수상정보 테이블표@2018@제 53회 카를로비바리 국제 영화제@후보@특별 이벤트 (팀 로빈스)@1993@제 50회 골든 글로브 시상식@후보@남우주연상-뮤지컬코미디 (팀 로빈스)@1992@제 19회 겐트 영화제@수상@조르쥬 들르뤼 상 (데이비드 로빈스),-,-,-,https://www.youtube.com/watch?v=eyCMTfEFvG0
1992,1992 .09.05 개봉,영화,애니메이션,배트맨 - TV 만화 시리즈,켄트 버터워스  보이드 커클랜드  프랭크 포어,https://movie-phinf.pstatic.net/20111222_93/1324546467185IjB0X_JPEG/movie_image.jpg,-,해외,미국,https://www.youtube.com/watch?v=m3WtveNoaWI,-,-,-,30분,-,다이안 퍼싱 헬렌 슬레이터 에이드리언느 바보우 폴 윌리암스 존 글로버 마크 해밀 다이아나 물다르 멜리사 길버트 로렌 레스터 에프렘 짐발리스트 주니어 로버트 코스탄조 밥 하스팅스 케빈 콘로이 ,  앨런 버넷 Alan Burnett (제작) 팀 버튼 Tim Burton (제작) 진 맥커디 Jean MacCurdy (제작) 톰 루거 Tom Ruegger (제작) 대니 엘프만 Danny Elfman (음악) 셜리 워커 Shirley Walker (음악),-,-,-,-,https://www.youtube.com/watch?v=Xqm2yyTUYSY
1992,1992 .07.11 개봉,영화,"액션, SF, 판타지",배트맨 2,팀 버튼,https://movie-phinf.pstatic.net/20111222_254/1324535636005yUgQk_JPEG/movie_image.jpg,"33년 뒤의 고담시는 부패와 탐욕, 범죄로 썩어가고 있다. 고담시를 썩게하는 것은 천재적인 두뇌를 가진 희대의 펭귄맨(대니 드비토 분)과 맥스 쉐릭 백화점을 거점으로 하는 부도덕한 백만장자 맥스 쉐릭(크리스토퍼 월켄 분)이다. 특히 펭귄은 그에게 충성을 바치는 펭귄 군단과 붉은 서커스단으로 불리는 악당들을 동원해 고담 시민을 위협하고 배트맨마저 없애려 한다. 배트맨은 검은 쌍날 등이 부착된 배트 모밀과 배트 미사일, 배트 보트로 무장하고 악을 처단하기 위해 고담시로 돌아온다. 그러나 펭귄은 그리 호락호락한 적수가 아닐 뿐더러, 예상치 못한 또 하나의 적수 캣우먼(미쉘 파이퍼 분)을 만난다. 캣우먼인 셀리나는 고담시의 못된 재벌 맥스 쉐릭의 얌전한 여비서였다. 하지만 상관 맥스의 비리를 알게 되자 그에게서 죽음의 위기를 당할 뻔하지만 고양이의 도움으로 살아나 캣우먼으로 변신하여 쉐릭과 사회에 대한 복수를 시도한다. 배트맨처럼 비극적인 어린 시절을 보낸 캣우먼은 채찍으로 무장하고 막강한 파워와 지성, 그리고 비밀에 둘러싸인 채 배트맨에게 위협을 가하나 배트맨과 사랑에 빠진다.",해외,미국,https://www.youtube.com/watch?v=vlcNf6z9SHg,-,-,15세 관람가,126분,-,빈센트 쉬아벨리 마이클 머피 팻 힝글 마이클 고 크리스토퍼 월켄 미셸 파이퍼 대니 드비토 마이클 키튼 ,  다니엘 워터스 Daniel Waters (각본) 다니엘 워터스 Daniel Waters (원안) 샘 햄 Sam Hamm (원안) 밥 케인 Bob Kane (원조) 이안 브라이스 Ian Bryce (프로듀서) 데니스 디 노비 Denise Di Novi (제작) 팀 버튼 Tim Burton (제작) 래리 J. 프랭코 Larry J. Franco (공동제작) 이안 브라이스 Ian Bryce (협력프로듀서) 존 피터스 Jon Peters (기획) 피터 구버 Peter Guber (기획) 벤자민 멜니커 Benjamin Melniker (기획) 마이클 E. 우스랜 Michael E. Uslan (기획) 스테판 크자프스키 Stefan Czapsky (촬영) 대니 엘프만 Danny Elfman (음악) 보 웰치 Bo Welch (미술) 스탠 윈스턴 Stan Winston (특수효과) 봅 링우드 Bob Ringwood (의상) 메리 E. 보트 Mary E. Vogt (의상) 크리스 레번즌 Chris Lebenzon (편집),배우/제작진 수상 이력@수상정보 테이블표@1993@제 13회 골든 라즈베리 시상식@후보@최악의 남우조연상 (대니 드비토)@제 65회 미국 아카데미 시상식@후보@분장상 (Ve Neill)@후보@시각효과상 (Fink)@제 2회 MTV 영화 & TV 어워즈@후보@가장 매력적인 여우상 (미셸 파이퍼)@후보@최고의 악당상 (대니 드비토)@후보@최고의 키스상 (미셸 파이퍼)@1992@제 18회 새턴 어워즈@수상@최우수 분장상 (스탠 윈스톤 외 1명),-,-,-,-
1992,1992 .02.22 개봉,영화,"드라마, 멜로/로맨스",백치 애인,노세한,https://movie-phinf.pstatic.net/20111216_27/1324028953348SlBXR_JPEG/movie_image.jpg,고교 2학년으로 고통스런 사춘기를 보내고 있는 혜련은 어느날 구원처럼 나타난 명준이 국어 선생님으로 부임하자 번호가 붙은 시를 보내며 몰래 사랑을 불태운다. 조금씩 사랑을 완성해 가며 사랑을 고백하려는 혜린에게 명준은 과거 대학시절 친구의 죽음과 선희라는 여자와의 애정으로부터 벗어날 수 없는 자신을 얘기하고 행방을 감춘다. 파괴적 삶을 극복하며 대학에 들어간 혜린은 같은 학교 희섭의 사랑을 외면한 채 여전히 명준에 대한 사랑을 잊지 못하고 집요하게 추적하려 한다. 어느날 세미나 모임에서 재회하는 혜린과 명준. 그러나 명준은 선희라는 여자의 망상에서 헤어날 수 없음을 직시하고 사랑을 옛 애인을 위해 양보하려 한다. 결국 혜린은 기억상실증에 걸려 자신도 알아보지 못하는 명준을 보며 끝까지 절대적 사랑을 보내게 된다.,국내,한국,https://www.youtube.com/watch?v=SLGBpy4skzw,-,-,15세 관람가,129분,-,김주영 신동준 장희덕 김남기 소정섭 강유일 민용환 신덕재 박정호 박석규 박경혜 문미봉 윤일주 송석배 김효정 박미숙 조민기 허택진 김윤경 김예령 이경영 하희라 ,  송길한 (각본) 신달자 (원작자) 정경희 (제작) 신경숙 (기획) 성광제 (촬영) 신학성 (조명) 김은태 (조연출) 송희립 (조연출) 이신한 (조연출) 이성근 (붐어시스턴트) 전동석 (음악) 김희수 (편집),-,-,-,-,https://www.youtube.com/watch?v=P1GT__gMbzY
1992,1992 .11.28 개봉,영화,"드라마, 스릴러",뱃 인플루언스,커티스 핸슨,https://movie-phinf.pstatic.net/20111222_238/1324537804927McFiC_JPEG/movie_image.jpg,"장래가 촉망되는 증권 분석가 마이클(Michael Boll: 제임스 스페이더 분)은 명석한 두뇌를 지녔지만 우유부단하고 용기와 결단력이 부족한 전형적인 나약한 인텔리 샐러리맨이다. 증권 업무와 승진경쟁으로 스트레스를 받은 마이클은 술집에서 우연한 기회에 건달 청년 알렉스(Alex: 롭 로우 분)를 만난다. 밑바닥 사회에서 잔뼈가 굵은 알렉스의 영향을 받아 무모할 정도로 과감한 행동을 펼치게 되고 그런 행동이 기막히게 맞아 떨어지자 마이클은 쉽게 알렉스의 손아귀에 잡히게 된다. 알렉스의 도움으로 미모의 여인 클레어(Claire: 리자 제인 분)를 사귀고, 회사에서는 경쟁자를 물리치고 수석 분석가 자리로 승진한다. 그러나 그때부터 알렉스는 악마적 본색을 드러내며 마이클을 파멸의 길로 인도한다. 마이클이 눈치를 채고 알렉스와 인연을 끊으려고하자 알렉스는 점점더 마이클을 죄여온다. 끝내는 클레어를 살해하고, 용의주도하게 마이클이 뒤집어 쓰도록 만든다. 참다못한 마이클은 알렉스를 유인하여 그의 자백을 몰래 녹음한 뒤 결투 끝에 그를 살해하고 자수한다. 알렉스는 마이클에게 가까이 해서는 안되는, 즉 나쁜 영향(Bad Influence)을 주는 사람이다.",해외,미국,https://www.youtube.com/watch?v=EFVXOpV7wmE,-,-,청소년 관람불가,99분,-,서니 스미스 마샤 크로스 캐슬린 윌호이트 토니 마지오 로잘린 랜더 제임스 스페이더 로브 로우 파머 리 토드 ,  데이빗 코엡 David Koepp (각본) 스티브 티쉬 Steve Tisch (제작) 버니 골드먼 Bernie Goldmann (공동제작) 아이야 라번카 Iya Labunka (라인프로듀서) 리처드 베커 Richard Becker (기획) 모리 아이슨먼 Morrie Eisenman (기획) 로버트 엘스윗 Robert Elswit (촬영) 트레버 존스 Trevor Jones (음악) 론 포어먼 Ron Foreman (미술) 말리사 다니엘 Malissa Daniel (의상) 보니 콜러 Bonnie Koehler (편집) 리사 비치 Lisa Beach (배역),-,-,-,-,-
1992,1992 .03.14 개봉,영화,드라마,벅시,베리 레빈슨,https://movie-phinf.pstatic.net/20111223_150/1324580730132Te9Bi_JPEG/movie_image.jpg,"벅시 시겔은 메이어 랜스키와 찰리 루치아노와 함께 뉴욕의 유흥가를 장악하고 있는 거부이자 처음 만난 여자와 호텔로 직행하기도 하는 천하의 플레이보이. 그는 웨스트 코스트의 환락가를 통제하기 위해 뉴욕 교외의 대저택에 아내와 두 딸을 두고 로스엔젤레스로 온다. 그는 곧 대담함과 로맨스와 음모가 가득한 헐리우드의 현란함에 유혹당하게 되고, 금세 헐리우드의 미디어들이 다투어 보도하는 유명한 갱스터가 된다. 이때부터 마치 영화배우와도 같이 벅시 시겔의 전설적인 인생이 시작된다.@  어릴 때 친구이지만 지금은 헐리우드의 인기 스타인 죠지 래프트와 영화 촬영 세트를 방문한 벅시는 자신의 동료 중 한 명의 여자 친구인 버지니아 힐(Virginia Hill)의 미모와 능수능란한 말솜씨에 매료되고 만다. '플라밍고'라는 별명을 가진 이 여배우에 대한 갈망에 사로잡힌 벅시는 도도하기만 한 버지니아를 끈질기게 설득, 둘은 사랑을 나누게 되지만 버지니아가 벅시 못지않은, 아니 그보다 더한 불같은 성격을 지녀 그로 인해 서로에 대한 사랑과 분노, 질투로 헤어짐과 만남을 반복하게 된다.@  무솔리니를 암살하여 2차대전을 종식시키겠다고 호언장담하고, 매일밤 연기 연습을 하며 자신의 스크린을 은밀히 즐기기도 하는 이상주의자인 벅시는 드디어 자신의 연인을 위해 동료들의 만류에도 불구하고 플라밍고라는 호텔을 라스베가스의 사막 한가운데 짓기 시작한다. 그러던 중 동료 살인 혐의로 벅시는 기소되고, 공사를 전담하게 된 버지니아는 막대한 돈을 몰래 챙긴다. 벅시는 곧 풀려나지만 엄청난 공사비로 인해 자금 압박은 가중 되고 불안해진 그의 동료들은 대책 마련에 전정긍긍, 결국은 극비의 계획을 세우게 된다.@  한편 버지니아의 계획을 알아챈 벅시는 그녀에게 진실을 말해달라 간청한 뿐, 동료들 앞에서 부하를 죽이고, 사업상의 이유로 동료도 무참히 살해하는 잔인한 갱 스터의 모습은 찾아볼 수가 없다. 그녀를 위한 무모한 계획이 결국 그를 파열로 몰아 갔음에도 불구하고. 억수같은 비로 엉망이 된 호텔의 개막식 날, 휴업을 선언하고, 쓸쓸히 집으로 돌아온 그는 동료들의 손에 살해되고 그가 보던 스크린의 벅시에게도 총알은 관통되고 그와 함께 최후를 맞이하면서 영화는 막을 내린다.@  {벅시 시걸이 죽은 지 일주일 후 버지니아 힐은 사라진 돈을 메이어 랜스키(Meyer Lansky)에게 돌아왔다. 그후 버지니아 힐은 오스트리아에서 자살했다. 600만 달러로 이뤄진 벅시의 꿈 라스베가스는 1991년 현재 1천억 달러(100 Billion)의 수입을 이루고 있다.}",해외,미국,https://www.youtube.com/watch?v=XfmiAhpYIA8,-,-,청소년 관람불가,135분,-,조 맨테그나 엘리어트 굴드 벤 킹슬리 하비 케이틀 아네트 베닝 워렌 비티 ,  제임스 토백 James Toback (각본) 마크 존슨 Mark Johnson (제작) 배리 레빈슨 Barry Levinson (제작) 워렌 비티 Warren Beatty (제작) 알렌 데비오 Allen Daviau (촬영) 엔니오 모리꼬네 Ennio Morricone (음악) 데니스 가스너 Dennis Gassner (미술) 알버트 울스키 Albert Wolsky (의상) 스터 린더 Stu Linder (편집) 엘렌 체노워스 Ellen Chenoweth (배역),배우/제작진 수상 이력@수상정보 테이블표@1992@제 26회 전미 비평가 협회상@수상@남우조연상 (하비 케이틀)@제 64회 미국 아카데미 시상식@후보@감독상 (배리 레빈슨)@후보@남우조연상 (하비 케이틀)@후보@남우조연상 (벤 킹슬리)@후보@남우주연상 (워렌 비티)@수상@미술상 (데니스 가스너)@수상@의상상 (알버트 울스키)@후보@작품상 (마크 존슨)@제 49회 골든 글로브 시상식@후보@각본상 (제임스 토백)@후보@감독상 (베리 레빈슨)@후보@남우조연상 (하비 케이틀)@후보@남우조연상 (벤 킹슬리)@후보@남우주연상-드라마 (워렌 비티)@후보@여우주연상-드라마 (아네트 베닝)@수상@작품상-드라마 (베리 레빈슨)@제 1회 MTV 영화 & TV 어워즈@후보@최고의 키스상 (아네트 베닝 & 워렌 비티)@1991@제 4회 시카고 비평가 협회상@수상@남우조연상 (하비 케이틀)@제 17회 LA 비평가 협회상@수상@각본상 (제임스 토백)@수상@감독상 (베리 레빈슨)@수상@작품상,-,-,-,https://www.youtube.com/watch?v=mR0XV18iAy0
