year,release_date,category,genre,title,creator,title_image,introduction,country_category,country_name,video,production,distribution,grade,runtime,remake,cast,staff,awards,series,soundtrack,amount,ref_video
1995,1995 .05.27 개봉,영화,"드라마, 액션, 멜로/로맨스, 전쟁",롭 로이,마이클 카튼-존스,https://movie-phinf.pstatic.net/20111216_239/1324027828709D9F43_JPEG/movie_image.jpg,18세기초. 잉글랜드에서 독일의 조지 1세를 왕으로 삼자 스코틀랜드에서는 그를 왕으로 인정하지 않고 제임스 스튜어트를 왕으로 삼기위해 반란을 일으킨다. 반란을 일으킨 여러 문중 중에 롭 로이 맥그레거(MacGregor: 리암 니슨 분)가 이끄는 맥그레거 문중이 마지막에 남게 된다. 롭 로이는 어머니쪽 친척이 되는 아가일 공작(Duke of Argyll: 앤드류 케이어 분)이 이끄는 잉글랜드 군대에 패해 잡히는 처지가 된다. 이 소식을 들은 롭 로이의 어머니는 런던으로 압송되어 가던 아들을 아가일 공작의 양해 아래 기회주의자 몬트로즈 공작(Marquis of Montrose: 존 허트 분)의 손에서 구출한다. 집으로 무사히 돌아온 롭 로이는 평소에 연모하고 있던 헬렌 메리(Mary MacGregor: 제시카 랭 분)에게 청혼하고 결혼식을 치른다. 그때 아가일 공작대신 새로운 스코틀랜드 총독이 된 몬트로즈 공작이 보낸 킬리언(Killearn: 브라이언 콕스 분)이 롭 로이의 체포영장을 가지고 나타나 롭 로이는 다시 끌려가는 신세가 된다.,해외,미국,x5stsGMoe1Q,-,-,15세 관람가,139분,-,앤드류 케이어 브라이언 콕스 에릭 스톨츠 팀 로스 존 허트 제시카 랭 리암 니슨 ,  알랜 샤프 Alan Sharp (각본) 서 월터 스콧 Sir Walter Scott (원작자) 피터 브로우언 Peter Broughan (제작) 리처드 잭슨 Richard Jackson (제작) 래리 드워이 Larry DeWaay (공동제작) 마이클 카튼 존스 Michael Caton-Jones (기획) 칼 월터 린덴로브 Karl Walter Lindenlaub (촬영) 카터 버웰 Carter Burwell (음악) 애쉬턴 고턴 Assheton Gorton (미술) 샌디 파웰 Sandy Powell (의상) 피터 호네스 Peter Honess (편집) 수지 피기스 Susie Figgis (배역),배우/제작진 수상 이력@수상정보 테이블표@1996@제 49회 영국 아카데미 시상식@수상@남우조연상 (팀 로스)@제 68회 미국 아카데미 시상식@후보@남우조연상 (팀 로스)@제 53회 골든 글로브 시상식@후보@남우조연상 (팀 로스),-,-,-,-
1995,1995 .11.25 개봉,영화,"코미디, 드라마",룸메이트,피터 예이츠,https://movie-phinf.pstatic.net/20111222_227/1324494330923Sy6kU_JPEG/movie_image.jpg,폴란드에서 미국으로 건너온 이민 1세대 할아버지 록키(Rocky Holzcek: 피터 포크 분)는 땡전 한푼 없고 배운 것도 없지만 107세의 고령에도 불구하고 제과점에서 빵을 구우며 스스로의 가치관을 고집스럽게 지켜간다. 여기에 월남전에서 아버지를 여윈 채 할아버지와 함께 생활하는 손자 마이클(Michael Holzcek: D.B. 스위니 분)이 30여년의 세월동안 룸메이트로 살면서 세대간의 갈등과 감동을 웃음과 반전으로 엮어낸다. 어려서 부모를 모두 여의고 고아가 되버린 마이클을 할아버지 록키는 남들이 보기에는 괴팍하고 완고하기 짝이 없지만 정작 남다른 애정과 사랑으로 돌본다.@  그러다가 마이클은 장성하여 외과 레지던트로 일하게 되면서 베쓰(Beth Holzcek: 줄리안 무어 분)라는 이름의 사회 봉사활동가를 만나 사랑에 빠진다. 자신 외에는 누구의 도움도 필요없으리라 느꼈던 록키는 사회봉사가인 베쓰를 곱게 보아주지 못한다. 세 사람 사이엔 몇 차례의 갈등이 있었지만 결국 록키는 손자의 인생을 이해하고 결혼을 승낙한다. 그러나 베쓰는 불의의 교통사로고 즉사하게 되고 마이클은 다시 할아버지와 룸메이트의 관계를 이어가게 된다. 그러나 마이클의 장모는 어머니도 없는 상태에서 외손주들을 괴팍하고 고집스런 구식 늙은이에게 맡겨둘 수 없다고 판단하여 아이들의 양육권을 주장하고 나선다. 그러나 록키는 자신의 방식으로 마이클과 증손자들을 지켜내고 만다. 록키는 평생을 두고서 마이클에게 가르치고 싶었던 가족의 소중함과 행복함을 깨닫게 하고서 얼마 후 손자와 증손자들이 지켜보는 가운데 조용히 눈을 감는다. 가족의 이름을 부르며.,해외,미국,nnoiQ0ZQsH4,-,-,15세 관람가,108분,-,잔 루베스 줄리안 무어 디비 스위니 피터 포크 ,  맥스 애플 Max Apple (각본) 스티븐 멧칼프 Stephen Metcalfe (각본) 맥스 애플 Max Apple (원안) 로버트 W. 코트 Robert W. Cort (제작) 테드 필드 Ted Field (제작) 스콧 크루프 Scott Kroopf (제작) 맥스 애플 Max Apple (협력프로듀서) 이라 할버스터트 Ira Halberstadt (기획) 애덤 레입지그 Adam Leipzig (기획) 마이크 사우돈 Mike Southon (촬영) 엘머 번스테인 Elmer Bernstein (음악) 댄 비숍 Dan Bishop (미술) 더글라스 히긴스 Douglas Higgins (미술) 세스 플로움 Seth Flaum (편집) 존 틴토리 John Tintori (편집) 린다 로위 Linda Lowy (배역),배우/제작진 수상 이력@수상정보 테이블표@1996@제 68회 미국 아카데미 시상식@후보@분장상 (그래그 캐놈),-,-,467,-
1995,1995 .03.11 개봉,영화,"액션, 스릴러",리버 와일드,커티스 핸슨,https://movie-phinf.pstatic.net/20111222_31/1324538828348YvFFv_JPEG/movie_image.jpg,아이들과 함께 휴가 여행을 떠나기로 한 게일(Gail: 메릴 스트립 분)은 남편 톰(Tom: 데이비드 스트래던 분)이 회사일로 바쁘자 남편을 떼어놓은 채 아이들만 데리고 할머니 할아버지가 사는 타본 강가로 떠난다. 결혼전 래프팅 가이드였던 게일은 여행객 웨이드(Wade: 케빈 베이컨 분)를 만나 그들과 함께 강을 따라 래프팅하기로 한다. 그러나 남편 톰은 우여곡절 끝에 이 팀에 합류하고 아이들은 소극적인 아빠보다 웨이드와 함께 있는 것을 즐긴다. 여행을 계속하는 동안 톰은 웨이드 일행에 불안을 느낀다. 게일과 톰은 이들을 떼어놓고 가족만의 여행을 하려 하나 강도였던 웨이드 일행은 이들을 협박 강의 하류로 도망치려 한다. 평온하던 가족 여행은 일순 인질극으로 변하고 가족을 지켜야할 운명에 놓인 게일은 용감히 현실을 이겨낸다.,해외,미국,BcIbH4wmUd8,CJ 엔터테인먼트,-,15세 관람가,108분,-,존 C. 라일리 조셉 마젤로 데이빗 스트라탄 케빈 베이컨 메릴 스트립 ,  데니스 오닐 Denis O'Neill (각본) 데이빗 포스터 David Foster (제작) 로렌스 터먼 Lawrence Turman (제작) 데니스 오닐 Denis O'Neill (공동제작) 레이몬드 하트윅 Raymond Hartwick (기획) 일로나 허즈버그 Ilona Herzberg (기획) 로버트 엘스윗 Robert Elswit (촬영) 제리 골드스미스 Jerry Goldsmith (음악) 모리스 자르 Maurice Jarre (음악) 빌 케니 Bill Kenney (미술) 말린 스튜어트 Marlene Stewart (의상) 데이빗 브레너 David Brenner (편집) 조 헛슁 Joe Hutshing (편집) 낸시 클로퍼 Nancy Klopper (배역),배우/제작진 수상 이력@수상정보 테이블표@1995@제 1회 미국 배우 조합상@후보@영화부문 여우주연상 (메릴 스트립)@제 52회 골든 글로브 시상식@후보@남우조연상 (케빈 베이컨)@후보@여우주연상-드라마 (메릴 스트립),-,-,-,U7BgZGPNlRY
1995,1995 .02.18 개봉,영화,"코미디, 가족",리치 리치,도날드 페트리,https://movie-phinf.pstatic.net/20111222_173/13244856322612hM6c_JPEG/movie_image.jpg,7백억 달러 리치 재벌가의 유일한 상속자인 리치(Richie Rich: 매컬리 컬킨 분)는 세상부러울 게 없는 소년이다. 리치의 재산과 행복은 아버지(Mr. Rich: 에드워드 허먼 분)와 사랑이 많은 어머니(Mrs. Rich: 크리스틴 에버솔 분) 그리고 완전무결해 결점이라고는 찾아볼 수 없는 개인 시종 캐드버러(Cadbury: 조나단 하이드 분) 충직한 개 달러에 의해 증식되어 왔다. 그런데 리치 그룹의 기획이사인 로렌스 밴 도우(Van Dough: 존 래로퀘트 분)는 오로지 인생의 목적을 리치가 재산을 훔치는데 있다. 탐욕에 눈이 먼 그는 리치가족을 제거하려는 계획을 세우는 데 리치 부부는 바다에서 실종되고 어린 리치만 살아남는다. 리치는 그의 계획을 눈치채고 충직한 집사와 킨빈 교수(Professor Keenbean: 마이클 맥샤인 분) 또래 친구들과 똘똘뭉쳐 재산을 관리해 나가면서 진정한 우정을 깨닫는다.,해외,미국,bG-_QyzAOe4,-,-,전체 관람가,90분,-,클라우디아 쉬퍼 레지 잭슨 조나단 힐라리오 조엘 로빈슨 마이클 맥카론 셸시 로스 마리안젤라 피노 마이클 맥쉐인 스테피 라인버그 크리스틴 에버솔 조나단 하이드 에드워드 허먼 존 라로케트 맥컬리 컬킨 ,  톰 S. 파커 Tom S. Parker (각본) 짐 제니베인 Jim Jennewein (각본) 닐 톨킨 Neil Tolkin (원안) 존 데이비스 John Davis (제작) 조엘 실버 Joel Silver (제작) 재클린 조지 Jacqueline George (공동제작) 제프리 A. 몽고메리 Jeffrey A. Montgomery (공동제작) 웬디 원더먼 Wendy Wanderman (협력프로듀서) 조 비엘라 Joe Bilella (기획) 댄 콜스러드 Dan Kolsrud (기획) 존 샤피로 Jon Shapiro (기획) 돈 버제스 Don Burgess (촬영) 엘렌 듀스 Ellen Dux (조감독) 제프리 핸슨 Geoffrey Hansen (조감독) 더글러스 S. 온스타인 Douglas S. Ornstein (조감독) 마이클 샘슨 Michael Samson (조감독) 밥 사운더스 Bob Saunders (조감독) 앨런 실베스트리 Alan Silvestri (음악) 윌리엄 F. 매튜즈 William F. Matthews (아트디렉터) 제임스 H. 스펜서 James H. Spencer (미술) 존 H. 앤더슨 John H. Anderson (세트) 패트리시아 말론 Patricia Malone (세트) 리사 젠슨 Lisa Jensen (의상) 말콤 캠벨 Malcolm Campbell (편집) 돈 아비낸티 Don Abbinanti (분장부문) 스티브 아트몬트 Steve Artmont (분장부문) 라이넬 커티스 Linell Curtis (분장부문) 데보라 K. 디 Deborah K. Dee (분장부문) 린다 멜라조 Linda Melazzo (분장부문) K.G. 램지 K.G. Ramsey (분장부문) 린다 리주토 Linda Rizzuto (분장부문) 릭 샤프 Rick Sharp (분장부문) 마저리 심킨 Margery Simkin (배역) 리처드 H. 프린스 Richard H. Prince (프로덕션매니저),배우/제작진 수상 이력@수상정보 테이블표@1995@제 15회 골든 라즈베리 시상식@후보@최악의 남우주연상 (맥컬리 컬킨),-,-,-,3VhZsZNFilI
1995,1995 .12.16 개봉,영화,"드라마, 멜로/로맨스",리허설,강정수,https://movie-phinf.pstatic.net/20111221_244/1324473768073nrV3l_JPEG/movie_image.jpg,민수(최민수 분)는 자기 스스로 터프가이가 되고 싶어하며 폼도 재보고 주먹다짐도 자주한다. 그의 직업은 뒷골목 건달로 이리 채이고 저리 밀리며 인생을 살아간다. 그는 어느날 연극공연장에 채무관계를 해결해달라는 청탁을 받고 가는데 그곳에서 신출내기 연극단원 승혜(박영선 분)를 만나게 된다. 빈 무대. 딱 좋은 장소다. 달려드는 민수. 거부하는 여자. 거칠어 지는 민수. 포기하는 여자. 그리고 그날 이후. 여자 승혜는 여자로서의 기쁨을 알아버렸다. 여자는 그것을 사랑이라고 믿었다. 남자 민수는 또 한 게임 했을 뿐이라고 생각했다. 그러나 이전과는 달리 사실 조금은 묘한 감정이 스스로의 내부에서 싹트고 있었음을 눈치채지 못했다. 민수는 그녀를 탐한 이후 서로는 육체를 불사르며 사랑을 확인하려 한다. 국립극장으로부터 '내 사랑 히로시마'의 여주인공역을 제안받은 승혜. 서서히 그녀의 삶이 변해가고. 사채업자 장사장의 표적이 되어 쫓기는 민수 한마리 외로운 짐승처럼 서서히 곤궁한 처지에 놓이게 되고. 썩 어울리지 않았던 둘의 관계에도 점차 균열이 가기 시작하는데. 사랑이 아니었다고 생각하게 된 승혜 멀어지려하고 사랑이었음을 깨닫게 된 민수 광적으로 집착하게 되고 파행적인 사랑의 행로 어긋나는 두사람의 운명.,국내,한국,t7TYLDhczs8,선익필름,대우시네마,청소년 관람불가,104분,-,이성훈 김부선 전무송 윤문식 이호재 손숙 방은희 최용석 박영선 최민수 ,  강정수 (각본) 이동권 (제작실장) 임충렬 (제작) 임충렬 (기획) 신옥현 (촬영) 임재영 (조명) 김원용 (동시녹음B팀) 송병준 (음악) 홍종오 (미술) 윤예령 (분장) 김민희 (의상) 박순덕 (편집),-,-,-,-,Kl6jJqP-t-M
1995,-,영화,-,마리,마리안 핸드워커,https://movie-phinf.pstatic.net/20111223_11/1324592862011W9fUL_JPEG/movie_image.jpg,학교가 파하는 종소리가 울리면 머리를 하나로 동여맨 소녀가 교문을 나선다. 집으로 돌아가는 소녀는 남의 눈을 피하며 서둘러 입고 있던 바지를 짧은 미니스커트로 갈아 입는다. 태어나자마자 자신과 엄마를 버리고 떠나버린 아버지 - 마리에게 아버지는 끊임없이 솟아나는 꿈이며 가장 큰 의문이다 - 생활에 지친 어머니는 자신을 사랑하는지 알 수가 없다. 가슴속의 공허함을 채우기 위해 진정한 사랑을 찾아 방황한다. 남자 친구 벤의 아이를 갖게된 마리는 그녀의 과거로 인해서 벤으로부터 버림을 받는다. 벤에게 버림을 받았다는 사실에서 시작된 배신감 수치 이미 뱃속에서 자라고 있을 아이와 그 아이로 인한 자신의 인생 모든 것이 혼란스러운 그녀는 자신을 이해해 줄 것 같은 남자인 마약밀매자 파울로를 따라 브뤼셀로 떠난다. 하지만 경찰에 쫓기던 파울로는 교통사고로 갑작스럽게 죽고 마리는 파울로의 아들인 토니오의 보호자가 된다. 어머니의 낙태 권유로 수수을 받으려다 도저히 할 수 없어 수술실을 뛰쳐나와 가출했던 그녀는 두 아이의 보호자가 된다. 그녀도 이제부터는 누군가를 돌봐야 한다. 마리는 토니오에게 엄마를 찾아주기 위해서 브뤼셀에서 포르투갈의 비데몬트를 향해 길을 떠난다. 때로는 히치 하이크로 때로는 오토바이를 얻어 타고 버스를 타고 토니오의 엄마 루시아가 살고 있다는 비데몬트를 찾아 가지만 인생이란 그런 것. 완전히 절망 속에서 사랑은 시작되고 사랑밖에 가진 것이 없는 사람에게 "어딘가(Elsewhere)""라는 말은 ""내일(Tomorrow)"" 이란 말보다 아름다울 수가 있는 것이다.",해외,벨기에,TQcFzZVqoeY,-,-,NR,85분,-,스테판 페라라 사브리나 르퀸 오로르 클레망 알레산드로 시고나 마리 질랭 ,  마리안 핸드워커 Marian Handwerker (각본) 허버트 토인트 Hubert Toint (제작) 데니즈 빈드보걸 Denise Vindevogel (편집),-,-,-,-,ShFDpsg2Ht4
1995,1995 .04.01 개봉,영화,"멜로/로맨스, 드라마",마스카라,이훈,https://movie-phinf.pstatic.net/20111221_263/1324459615293CInk5_JPEG/movie_image.jpg,조사장(장두이 분)이 경영하는 신비스러운 Buzz싸롱. 단골 손님인 사진작가 오기혁(김세영 분)은 Buzz의 호스테스 해주가 게이인 것도 모르고 마음을 빼앗긴다. 한편 암흑가의 두목(곽재용 분)으로부터 노름빚 독촉을 받아오던 조사장은 해주를 이용하여 청부살인을 감행한다. 그러는 와중에 해주의 비밀이 밝혀지고 오기혁은 환멸에 빠진다. 좌절한 해주는 성전환수술과 성형수술로 다시 태어나기로 결심한다. 유정(장송미 분)이라는 이름으로 오기혁 앞에 나타나는 그녀는.,국내,한국,pOgugqncZL4,-,-,청소년 관람불가,92분,-,김세영 하지나 장송미 장두이 ,  이훈 (각본) 손영호 (제작) 최찬규 (촬영) 신준하 (조명) 전상윤 (음악) 김희수 (편집),-,-,-,-,bvaGUVjgFa0
1995,1995 .04.29 개봉,영화,드라마,마지막 사랑,베르나르도 베르톨루치,https://movie-phinf.pstatic.net/20111216_71/1324028097028w6SwE_JPEG/movie_image.jpg,1947년 아프리카 북동부의 모로코의 항구 탕헤르. 여기에 결혼 10년을 맞이하는 부부 포트(Port Moresby: 존 말코비치 분)와 그의 아내 키트(Kit Moresby: 데브라 윙거 분)가 찾아온다. 포트는 수년 동안 일자리를 구하지 못한 뮤지션인데 북 아프리카로의 여행이 그에게 예술적 영감을 불어 넣어주고 그의 결혼 생활도 새롭게 신선한 감정을 갖고 재출발할 수 있기를 기대한다.@  그러나 그녀는 이미 여행에 지쳐 있었고 남편과의 관계가 회복되리란 생각에 회의를 품기 시작했다. 여기에 그들의 여행 친구 존 터너(Tunner: 캠벨 스콧 분)가 등장한다. 그는 이 기묘한 부부에 매료되고 더구나 키트의 미모에 빠져 버린다. 포트는 그 자신이 어디로 갈 지 결정하지 않았지만 여행객이 아닌 순례자로서 도시로 부터 가장 먼 곳까지 가보기를 원한다. 키트는 존 터너와 불륜의 관계를 맞고 포트는 아랍 여자에게 깊이 빠진다. 모든 것은 알 수 없는 혼란으로 이어진다.,해외,영국,ugKZ2LCSuqQ,-,-,청소년 관람불가,138분,-,티모시 스폴 질 베넷 캠벨 스코트 존 말코비치 데브라 윙거 ,  마크 피플 Mark Peploe (각본) 베르나르도 베르톨루치 Bernardo Bertolucci (각본) 폴 볼스 Paul Bowles (원작자) 데니즈 오델 Denise O'Dell (프로듀서) 제레미 토머스 Jeremy Thomas (제작) 비토리오 스토라로 Vittorio Storaro (촬영) 류이치 사카모토 Ryuichi Sakamoto (음악) 앤드류 샌더스 Andrew Sanders (미술) 제임스 애치슨 James Acheson (의상) 가브리엘라 크리스티아니 Gabriella Cristiani (편집) 줄리엣 테일러 Juliet Taylor (배역),배우/제작진 수상 이력@수상정보 테이블표@2019@제 9회 북경국제영화제@후보@트리뷰츠 (베르나르도 베르톨루치)@2012@제 59회 시드니 영화제@후보@회고전 (베르나르도 베르톨루치)@1991@제 44회 영국 아카데미 시상식@수상@촬영상 (비토리오 스토라로)@제 48회 골든 글로브 시상식@후보@감독상 (베르나르도 베르톨루치)@수상@음악상 (사카모토 류이치)@1990@제 55회 뉴욕 비평가 협회상@수상@촬영상 (비토리오 스토라로)@제 16회 LA 비평가 협회상@수상@음악상 (리처드 호로위츠)@수상@음악상 (사카모토 류이치),-,-,-,m_RLBfKSCiU
1995,1995 .04.01 개봉,영화,드라마,말미잘,유현목,https://movie-phinf.pstatic.net/20111212_68/1323671807404P7CcW_JPEG/movie_image.jpg,한 섬에 엄마를 몹시 사랑하는 9살짜리 소년(수영)이 살고 있다. 엄마는 해녀일을 하며 집안 살림을 꾸려 나가지만 아빠는 수영이 기억하기도 먼 오래 전에 배를 타고 나간 이후 소식이 없다. 어느날 도시에서 온 한 사내(독고)가 수영의 집에 하숙을 들어온다. 수영에겐 무척 낯선 이방인이지만 수영에게 연줄을 만들어 주는 등 신경을 써줘 아주 싫지 않다. 사실 독고 아저씨를 싫어하는 사람은 따로 있다. 바로 엄마를 짝사랑하는 최선장 아저씨다.@  하지만 어느날 독고 아저씨가 엄마를 애무하는 모습을 본 이후로 수영은 독고 아저씨를 경계하기 시작한다. 엄마를 뺏길 것 같은 위기감 때문이다. 더구나 새 아빠가 생겼다는 아이들의 놀림은 수영을 마음 아프게 한다. 수영은 결국 마을 사람들의 수중 도굴을 탐문하던 형사에게 독고 아저씨를 수상한 사람으로 신고한다. 독고 아저씨는 수영이 신고했듯 간첩은 아니었지만 시대 상황이 만들어낸 수배자(민중 소설가)였다. 잡혀가는 독고를 보며 수영은 좋아하지만 지켜보던 엄마는 가슴이 저민다. 독고와의 사랑이 싹텄기 때문이다. 결국엔 수영이가 신고했다는 사실을 뒤늦게 엄마도 알게 되고.@  가을이 깊어갈 무렵 수영은 할아버지 심부름으로 광주에 있는 고모네집에 간다. 섬에서만 살다가 처음 육지에 온 수영에게는 모든 것이 신기하다. 더구나 유곽을 운영하는 고모와 고모부는 수영을 당황하게 하는데 그나마 집에서 도망쳤던 지순누나가 있어 수영을 위로가 된다. 수영은 그곳에서 텔레비젼 속에서나 보던 데모와 탱크처럼 거리를 휘젓고 다니는 헌병대 백차를 통해 불안한 사회를 느끼고 고모네집 누나들의 애처로운 생활도 보지만 역시 수영은 어느 것 하나 이해할 수가 없다. 어딜 가나 세상은 수영이 이해하기엔 너무 힘든 곳이다.@  얼마 후 섬에 와보니 엄마가 없어졌다. 할아버지 말로는 친정에 갔다고 한다. 하지만 섬을 다시 찾은 독고아저씨를 보고 수영은 알게 된다. 엄마는 독고아저씨에게 시집을 간 것이다. 아니 엄마를 뺏긴 것이다. 수영은 떠나는 아저씨를 향해 소리를 지른다. 그가 아무리 훌륭한 이상을 지닌 사람일지라도 수영에겐 다만 엄마를 뺏아간 '나쁜놈'이기 때문이다. 할아버지는 수영을 위로하지만 수영은 쓸쓸하다. 더구나 가끔씩 수영과 놀아주던 최선장 아저씨마저 하늘나라로 갔다. 폭풍우가 치던 밤 아저씨의 배와 함께. 많은 사람들이 수영에게서 떠나갔다. 특히 엄마의 자리는 너무나 허전하다. 그래도 수영은 여전히 엄마를 사랑하며 기다린다. 조금씩 엄마를 이해하려하면서 엄마는 말미잘처럼 자웅 동체가 아니라는걸 배울 것이니까.,국내,한국,VGdlRU6SBHo,-,-,청소년 관람불가,113분,-,사은 이정윤 손보영 방은진 박정자 김희라 장동휘 이영하 나영희 안성기 천영덕 ,  권재우 (각본) 김승래 (제작총지휘) 박영대 (제작지휘) 김상근 (제작부장) 나한일 (제작) 아트피아 (기획) 진영호 (촬영) 차정남 (조명) 권순미 (스틸) 양윤호 (조연출) 진민국 (조연출) 김병수 (녹음) 손규식 (동시녹음) 송병준 (음악) 조융삼 (미술) 박광남 (특수효과) 이상근 (분장) 권상천 (의상) 박순덕 (편집),배우/제작진 수상 이력@수상정보 테이블표@1995@제 33회 대종상 영화제@후보@감독상 (유현목)@수상@기타 (유현목),-,-,-,yRXhLAXnkvE
