year,release_date,category,genre,title,creator,title_image,introduction,country_category,country_name,video,production,distribution,grade,runtime,remake,cast,staff,awards,series,soundtrack,amount,ref_video,,,,,,,,,,,,,,
2002,2002 .09.13 개봉,영화,"모험, 범죄, 드라마, 스릴러",로드 투 퍼디션,샘 멘데스,https://movie-phinf.pstatic.net/20111222_6/1324539201186vdVUU_JPEG/movie_image.jpg,"1931년 대공황과 금주령의 미국. '죽음의 천사'라고 불리는 마이클 설리반(톰 행크스 분). 마피아 보스의 양아들이기도 한 그는 조직의 일원으로 중요한 임무를 해결하며 살아가고 있다. 물론 거기에는 상대 세력을 제거하는 일(킬러)도 포함되어 있다. 집에서는 자상한 남편이자 든든한 아버지인 마이클. 하지만 그는 세상에서 가장 사랑하는 두 아들에게 차마 자신의 직업을 말하지 못한다.@  그러던 어느날 보스의 친아들 코너와 함께 라이벌 조직에게 경고 메시지를 전하러 갔는데 코너가 보스의 명령을 어기고 돌발적인 살인을 저지르고 만다. 그런데 그것보다 더 심각한 일이 발생한다. 평소 아버지의 직업을 궁금해 하던 마이클의 큰 아들 마이클 주니어(타일러 후츨린 분)가 그 광경을 목격한 것이다.@  이 사건으로 아버지의 신임을 잃게 된 코너는 마이클 일가(아내와 막내)를 처참하게 살해한다. 아슬아슬한 시간 차로 목숨을 건진 마이클과 그의 큰 아들. 이제 마이클은 이 모든 일의 배후에 조직이 개입되어 있다고 판단, 어린 아들과 함께 거대 조직을 상대로 힘겹고 험난한 복수의 여정을 시작한다.@  세상에서 가장 고독한 아버지와 아들. 그들은 비로소 서로의 존재감을 그 어느 때 보다 절실히 느끼게 된다. 그리고 늘 아버지의 사랑에 목 말라 하던 마이클 주니어는 동생과 달리 자신에게는 절제된 사랑을 베풀었던 아버지의 진실을 읽게 되는데.",해외,미국,https://www.youtube.com/watch?v=LcQ-b8-x70s,이십세기폭스코리아(주),이십세기폭스코리아(주),15세 관람가,117분,-,테일러 후츨린 다니엘 크레이그 스탠리 투치 제니퍼 제이슨 리 주드 로 폴 뉴먼 톰 행크스 ,  데이빗 셀프 David Self (각본) 맥스 앨런 콜린스 Max Allan Collins (원작자) 샘 멘데스 Sam Mendes (제작) 리처드 D. 자눅 Richard D. Zanuck (제작) 체릴앤 마틴 Cherylanne Martin (협력프로듀서) 조안 브래드쇼우 Joan Bradshaw (기획) 콘라드 L. 홀 Conrad L. Hall (촬영) 토마스 뉴먼 Thomas Newman (음악) 데니스 가스너 Dennis Gassner (미술) 알버트 울스키 Albert Wolsky (의상) 질 빌콕 Jill Bilcock (편집) 데브라 제인 Debra Zane (배역),"배우/제작진 수상 이력@수상정보 테이블표@2016@제 11회 로마 국제영화제@후보@회고전 (샘 멘데스)@2003@제 28회 새턴 어워즈@수상@최우수 신인배우상 (테일러 후츨린)@수상@최우수 액션,모험상 (샘 멘데스)@제 56회 영국 아카데미 시상식@후보@남우조연상 (폴 뉴먼)@수상@촬영상 (콘라드 L. 홀)@수상@프로덕션디자인상 (데니스 가스너)@제 75회 미국 아카데미 시상식@후보@남우조연상 (폴 뉴먼)@후보@미술상 (데니스 가스너)@후보@음악상 (토머스 뉴먼)@후보@음향믹싱상 (Scott Millan)@후보@음향편집상 (Scott Hecker)@수상@촬영상 (콘라드 L. 홀)@제 60회 골든 글로브 시상식@후보@남우조연상 (폴 뉴먼)",-,-,-,https://www.youtube.com/watch?v=OS0fg49vXgE,,,,,,,,,,,,,,
2002,-,영화,드라마,로망스,이대영,https://movie-phinf.pstatic.net/20111222_16/1324497469724h9wJy_JPEG/movie_image.jpg,"여자 스승과 남자 제자간의 사랑을 그린 김하늘, 김재원 주연의 MBC 수목드라마.",국내,한국,https://www.youtube.com/watch?v=3Jh55EwWkuI,-,-,-,-,-,문지윤 진태현 한혜진 김용건 박원숙 심양홍 고명환 현석 김해숙 김유미 정성환 김하늘 김재원 ,  배유미 (각본) 정운현 (기획) 김대진 (조연출),-,-,-,371700,-,,,,,,,,,,,,,,
2002,2002 .03.29 개봉,영화,"코미디, 드라마",로얄 테넌바움,웨스 앤더슨,https://movie-phinf.pstatic.net/20111222_176/1324518700903i0wRX_JPEG/movie_image.jpg,"로얄 테넌바움과 그의 아내 에슬린 테넌바움에게는 세 명의 어린 자녀가 있다. 태어날 때부터 천부적인 재능을 가진 이들 세 명의 자녀는 부모가 별거하는 바람에 그 충격으로 모두 뿔뿔이 흩어져서 산다. 채스(벤 스틸러)는 10대 초의 나이에 부동산 투자 전문가가 됐고 국제금융에 관해서도 믿기 어려울 정도로 해박한 지식을 갖고 있다. 입양된 딸인 마고(기네스 팰트로)는 극작가이며 15세 의 나이에 브레이버만 그란트(Braverman Grant) 상과 부상으로 5만 달러를 받은 경력이 있다. 훗날 퓰리처 상까지 수상한다. 리치(루크 윌슨)는 주니어 챔피언 테니스 선수이며 3년 연속 US 오픈 타이틀을 획득한 경력이 있다.@  하나같이 천재였던 이들 세 남매들의 어린 시절은 20여 년에 걸친 배신과 실패 그리고 비극적인 사고로 인하여 그들의 기억 속에서 모두 사라져버린다. 그들의 천재성이 꽃을 피우지 못한 것은 모두 그들의 아버지 탓이었다. <로얄 테넌바움>의 드라마틱하고 감동적인 이야기는 산산조각 난 가족들이 20여 년의 세월이 지난 어느 겨울 날, 불치의 병에 걸렸다고 알려온 아버지 때문에 으로 한 집에서 다시 만나면서부터 시작된다.",해외,미국,https://www.youtube.com/watch?v=caMgokYWboU,브에나비스타코리아,브에나비스타코리아,15세 관람가,109분,-,알렉 볼드윈 쿠마르 팔라나 세이무어 카셀 대니 글로버 빌 머레이 오웬 윌슨 루크 윌슨 기네스 팰트로 벤 스틸러 안젤리카 휴스턴 진 핵크만 ,  웨스 앤더슨 Wes Anderson (각본) 오웬 윌슨 Owen Wilson (각본) 웨스 앤더슨 Wes Anderson (제작) 베리 멘델 Barry Mendel (제작) 스콧 루딘 Scott Rudin (제작) 윌 스위니 Will Sweeney (협력프로듀서) 루드 시몬스 Rudd Simmons (기획) 오웬 윌슨 Owen Wilson (기획) 로버트 D. 예먼 Robert D. Yeoman (촬영) 마크 마더스바우 Mark Mothersbaugh (음악) 랜달 포스터 Randall Poster (음악) 데이빗 와스코 David Wasco (미술) 카렌 패치 Karen Patch (의상) 다니엘 R. 퍼젯 Daniel R. Padgett (편집) 딜런 티케노 Dylan Tichenor (편집) 더글러스 아이벨 Douglas Aibel (배역),배우/제작진 수상 이력@수상정보 테이블표@2002@제 36회 전미 비평가 협회상@수상@남우주연상 (진 핵크만)@제 74회 미국 아카데미 시상식@후보@각본상 (웨스 앤더슨)@제 59회 골든 글로브 시상식@수상@남우주연상-뮤지컬코미디 (진 핵크만)@2001@제 14회 시카고 비평가 협회상@수상@남우주연상 (진 핵크만)@제 39회 뉴욕영화제@후보@장편 상영작 (웨스 앤더슨),-,-,-,https://www.youtube.com/watch?v=ZDk24Wj3YIM,,,,,,,,,,,,,,
2002,2002 .03.22 개봉,영화,"액션, 스릴러",롤러볼,존 맥티어난,https://movie-phinf.pstatic.net/20111223_23/13245683306221wWd7_JPEG/movie_image.jpg,"근 미래, 전세계는 더욱 빠르고 더욱 거친 게임을 원했다. 거친 몸싸움과 짜릿한 스피드, 팀을 이룬 전사들의 전쟁 롤러볼. 농구와 모터 싸이클 그리고 스피드 스케이트의 장점이 결합된 신종 데스 게임 롤러볼은 팀배틀로 치러지는 경기인데 승부에 목숨을 건 전사들의 격렬한 게임 진행은 전세계의 시청자와 관중들의 열렬한 환호를 받는다. 수천억의 배팅이 오가는 경기장, 본능이 이성을 지배하는 게임의 종반전. 헬멧이 벗겨진 홀스맨팀의 전사 한명이 심한 바디체크로 실신해버리는데- 팀의 리더 조나단(크리스 클레인)은 이성을 잃고 게임은 더욱 거칠어지며 순식간에 아수라장이 되어버린다.@  그러나 거칠면 거칠어질 수록 시청률과 배팅은 더욱 거세지기만 하고- 롤러볼의 프로모터 페트로비치(장 르노)는 또 다른 음모를 준비한다. 연이은 불의의 사고 그리고 전사의 죽음. 탈출할 수조차 없는 고립된 경기장과 삼엄한 감시로 전사들은 검투사와 같은 노예로 전락하게 되고 이제 롤러볼은 매 게임마다 살아남기 위한 필사의 전쟁터로 바뀌게 되는데.",해외,미국,https://www.youtube.com/watch?v=IhN7YQd3i_s,콜럼비아트라이스타,콜럼비아트라이스타,15세 관람가,98분,-,이반 스미스 앤드류 브리니아스키 자넷 라이트 데이비드 헴블런 나빈 앤드류스 올렉 탁타로프 레베카 로미즌 LL 쿨 J 장 르노 크리스 클라인 ,  존 포그 John Pogue (각본) 하워드 A. 로드먼 Howard A. Rodman (각본) 데이빗 C. 윌슨 David C. Wilson (각본) 윌리엄 해리슨 William Harrison (원작자) 존 맥티어난 John McTiernan (제작) 찰스 로벤 Charles Roven (제작) 보 세인트 클레어 Beau St. Clair (제작) 크리스틴 브래넌 Kristen Branan (기획) 마이클 타드로스 Michael Tadross (기획) 스티브 메이슨 Steve Mason (촬영) 에릭 세라 Eric Serra (음악) 노먼 가우드 Norman Garwood (미술) 케이트 해링턴 Kate Harrington (의상) 로버트 K. 램버트 Robert K. Lambert (편집) 존 라이트 John Wright (편집) 팻 맥코클 Pat McCorkle (배역),배우/제작진 수상 이력@수상정보 테이블표@2015@제 7회 본 스릴러 국제영화제@후보@오마주 - 존 맥티어난 (존 맥티어난)@2003@제 23회 골든 라즈베리 시상식@후보@최악의 여우조연상 (송경희),-,-,-,-,,,,,,,,,,,,,,
2002,2002 .09.27 개봉,영화,드라마,루키,존 리 행콕,https://movie-phinf.pstatic.net/20111221_74/1324462452717kvLBo_JPEG/movie_image.jpg,"텍사스 고등학교에서 화학을 가르치며 고교 야구팀의 감독직을 맡고 있는 짐 모리스(데니스 퀘이드 분)는 세 아이의 아빠이자, 사랑스런 아내가 있는 평범한 가장이다. 그러나 그에게는 미국 프로야구 마이너리그에 입단 했다가, 어깨에 치명적인 부상을 입고 은퇴한 쓰디쓴 경험이 있다.@  어릴 때부터 메이저 리그의 투수가 꿈이 었던 그는 군인이었던 아버지 때문에 한 곳에 정착하지 못하고 무수하게 이사를 다녀야 했다는 이유로 아버지와는 서먹하기만 하고, 무엇보다도 그에게는 이루지 못한 꿈에 대한 미련이 남아있다. 해질 무렵이면 혼자서 투구 연습하는 짐을 목격한 제자들은 짐에게 한 가지 제안을 한다. 자신들에게 늘 하는 말 꿈을 가져라을 증명해 보이라고. 즉, 자신들이 지역 예선에서 우승하고 주 챔피언 전에서도 우승을 하면 메이저 리그를 향한 꿈에 다시 도전해보겠느냐는 것.@  혹시나 하는 생각에 선뜻 내렸던 결정과는 반대로, 바닥을 헤매던 제자들은 약속대로 주 챔피언 전에서 우승하고, 짐은 메이저 리그 트라이 아웃에 나간다. 마운드를 오르기 전 비웃음과 조롱의 대상이었든 짐은 무려 157km의 광속구를 던진다.",해외,미국,https://www.youtube.com/watch?v=thn3Z3044pM,브에나비스타코리아,브에나비스타코리아,전체 관람가,127분,-,브라이언 콕스 앵거스 T. 존스 베스 그랜트 제이 헤르난데즈 레이첼 그리피스 데니스 퀘이드 ,  마이크 리치 Mike Rich (각본) 고든 그레이 Gordon Gray (제작) 마크 치아르디 Mark Ciardi (제작) 마크 존슨 Mark Johnson (제작) 필립 스투어 Philip Steuer (기획) 존 슈왈츠만 John Schwartzman (촬영) 카터 버웰 Carter Burwell (음악) 존 비셀 John Bissell (음악) 베리 로빈슨 Barry Robison (미술) 브루스 핀레이슨 Bruce Finlayson (의상) 에릭 L. 비슨 Eric L. Beason (편집) 론나 크레스 Ronna Kress (배역),-,-,-,-,https://www.youtube.com/watch?v=thn3Z3044pM,,,,,,,,,,,,,,
2002,118분,영화,드라마,리빙 하바나,조셉 서전트,https://movie-phinf.pstatic.net/20111221_7/1324456518132cw3wY_JPEG/movie_image.jpg,"1989년 아테네의 한 재즈클럽. 콘서트홀을 메운 것은 트럼펫 선율과 청중들의 환호성뿐. 울려퍼지는 향연속에서 아투로 산도발의 솔로연주가 이어진다. 공연이 끝난 후 어두운 복도를 지나 숨죽여 들어간곳은 쿠바에서 미국으로의 망명요청을 위한 아테네주재 미대사관! 산도발은 면접 도중 아내 마리아넬라와의 아름다웠던 과거를 회상하게 되는데. 버스 정류장, 순결한 아름다움을 지닌 매혹적인 여인 마리아넬라를 발견하곤 한눈에 반한 그는 그녀를 텅빈 야구장으로 초대한다. 아름답고도 신비로운 재즈 트럼펫 선율만이 울려퍼지고 사랑을 고백하는 아투로 산도발! 그의 가슴에 손을 얹고 뜨거운 심장소리를 느끼며, 은밀하고도 감미로운 트럼펫 선율에 빠져있는 마리아넬라는 두려움 섞인 눈빛으로 아투로를 바라본다. 마치 앞으로 다가올 비극적 상황을 예견하는 듯. 쿠바의 하바나. 산도발의 해외공연이 있기 전날 밤, 마리아넬라는 다시는 돌아오지 않겠다고 약속하면 함께 밤을 보내겠다고 한다. 산도발은 음악의 자유를 갈망하는 재즈뮤지션이었고 마리아넬라는 체 게바라를 사랑하고픈 여인. 혁명의 소용돌이의 정점에 서 있었던 쿠바의 현실에서 그들의 사랑은 위험한 것이었다. 하지만 운명의 사랑은 더욱 깊어가기만 하고. 마리아넬라는 알 수 없는 불안감에 휩싸이게 된다. 진실한 사랑. 혁명과 공산주의 그리고 억압으로 얼룩진 쿠바도 그들의 사랑을 막진 못했다. 둘은 하나가 되어 살아가게 되지만, 산도발은 여전히 자유로운 음악세계를 그리워하고 급기야는 망명쪽으로 결심하기에 이른다. 그 후 10년. 기회만을 엿보고 있던 산도발에게 단 한 번의 탈출기회가 찾아온다. 디지밴드의 세계순회공연에 게스트로 참가하게 된 것. 하지만 큰 아들 레오넬이 징집대상에 올라 떠날 수 없다는 통보를 전해듣게 되고 마리아넬라는 떠날 수 없다고 한다. 아들과 사랑하는 여인. 그리고 음악의 자유. 갈림길에 선 아투로의 마음은 한없이 무거워지고. 이들의 망명계획을 눈치챈 정부는 필사적으로 이들을 저지하려 하는데. 과연 그들은 탈출과 자유, 그리고 비운의 사랑을 이룰 수 있을까.",해외,TV영화,https://www.youtube.com/watch?v=3W2XGZOi6QA,넷네오,넷네오,15세 관람가,미국,-,찰스 듀튼 프레디 로드리게스 토마스 밀리안 데이빗 페이머 글로리아 에스테판 미아 마에스트로 앤디 가르시아 ,  티모시 J. 섹스턴 Timothy J. Sexton (각본) 셀리아 D. 코스타스 Celia D. Costas (제작) 앤디 가르시아 Andy Garcia (기획) 젤리빈 베니테즈 Jellybean Benitez (기획) 도날드 M. 모건 Donald M. Morgan (촬영) 찰스 C. 베넷 Charles C. Bennett (미술) 마이클 브라운 Michael Brown (편집) 아만다 맥키 존슨 Amanda Mackey Johnson (배역) 캐시 샌드리치 Cathy Sandrich (배역),배우/제작진 수상 이력@수상정보 테이블표@2002@제 54회 미국 작가 조합상@수상@파울 셀빈 명예상 (티모시 J. 섹스턴)@2001@제 1회 광주국제영화제@후보@상영작 (조세프 서전트),-,-,-,https://www.youtube.com/watch?v=cy_iSHPEy1g,,,,,,,,,,,,,,
2002,2002 .08.31 개봉,영화,"가족, 코미디",리틀 뱀파이어,울리히 에델,https://movie-phinf.pstatic.net/20111221_67/1324468931020USObb_JPEG/movie_image.jpg,"토니는 부모님을 따라 스코틀랜드의 외딴 작은 마을로 이사하게 된다. 새로 이사온 집에서 토니는 매일 밤 뱀파이어들이 등장하는 악몽을 꾼다. 어느날 저녁 커다란 박쥐 한 마리가 방 안으로 날아 들어와 뱀파이어 소년 루돌프로 변신한다. 새로운 친구가 생겨서 기쁘기만 한 토니. 루돌프는 토니가 꿈속에서 그려놓은 부적을 보고 그 부적에 얽힌 사연을 들려준다. 삼백년 마다 한 번씩 달을 통과하는 혜성에 대해 설명해주며 만약 이 순간에 뱀파이어들이 하늘을 향해 그 부적을 들고 서있으면, 뱀파이어들이 평화를 찾아 인간이 된다는 전설이다. 루돌프는 지금 몇 백 년 동안 어른이 되지 못하고 아홉 살 아이의 모습으로 살고 있다. 루돌프의 변치 않는 소망은 어른이 되고, 뱀파이어의 저주에서 풀려나는 것이다.@ 혜성이 달을 지나치는 날이 꼭 하루 남았다. 문제는 루돌프의 가족이 부적의 절반만 갖고 있다. 부적은 삼백 년 전 혜성이 지나가던 순간 끔찍한 사고로 인해 두동강이 나버렸다. 루돌프의 가족은 그 후로 삼백 년 동안 나머지 부적을 찾아 헤매고 있다. 빨리 나머지 부적을 찾지 못하면 이제 또 기나긴 삼백 년을 기다려야 한다. 토니는 이제 혜성의 힘이 땅 위에 비추어서 자신의 친구들을 데려가는 것을 지켜봐야 한다. 루돌프는 토니에게 뱀파이어 가족의 소망을 같이 빌어달라고 한다. 빛이 사라지자 토니의 친구들도 사라지고 없다. 토니는 친구들과 헤어진 건 슬펐지만, 자신의 도움으로 루돌프가 꿈을 이루길 바라며 슬픔을 달랜다.",해외,독일 / 네덜란드 / 미국,https://www.youtube.com/watch?v=OkRG_NOqCLM,태원엔터테인먼트,시네마서비스,전체 관람가,95분,-,에드 스톱파드 제이크 다시 엘리자베스 베링톤 딘 쿡 안나 팝플웰 토미 힌클리 파멜라 기들리 존 우드 롤로 윅스 앨리스 크리지 짐 카터 리차드 E. 그랜트 조나단 립니키 ,  캐리 커크패트릭 Karey Kirkpatrick (각본) 래리 윌슨 Larry Wilson (각본) 리처드 클라우스 Richard Claus (제작) 카스튼 H.W. 로렌즈 Carsten H.W. Lorenz (공동제작) 안소니 월러 Anthony Waller (기획) 래리 윌슨 Larry Wilson (기획) 번드 하이니 Bernd Heinl (촬영) 마이클 카이-윌즈 Michael Csanyi-Wills (음악) 나이젤 클락 Nigel Clarke (음악) 조셉 C. 네멕 3세 Joseph C. Nemec III (미술) 제임스 애치슨 James Acheson (의상) 피터 R. 애덤 Peter R. Adam (편집) 조이스 네틀스 Joyce Nettles (배역),배우/제작진 수상 이력@수상정보 테이블표@2001@제 5회 부천국제판타스틱영화제@후보@패밀리 판타 (울리히 에델),-,-,23014,https://www.youtube.com/watch?v=AXRsMbpwTUw,,,,,,,,,,,,,,
