year,release_date,category,genre,title,creator,title_image,introduction,country_category,country_name,video,production,distribution,grade,runtime,remake,cast,staff,awards,series,soundtrack,amount,ref_video
2010,2010 .09.30 개봉,영화,판타지,불청객,이응일,https://movie-phinf.pstatic.net/20111223_208/1324623546470P4mU9_JPEG/movie_image.jpg,만년 고시생 진식은 시험을 앞두고 슬럼프에 빠져 있다. 진식과 같이 반지하 자취방에 살고 있는 취업준비생 강영과 응일은 폐인처럼 잠만 자며 인생을 허비하고 있다. 이 집에 어느날 큰 폭발음이 나며 정체 모를 소포상자가 떨어진다. 진식이 상자를 열자 4차원의 포인트맨이 나타나 은하연방 론리스타 수명은행과 계약이 성립됐음을 알린다. 포인트맨의 초능력에 의해 집과 함께 우주로 납치된 세 사람 진식 강영 응일. 그들은 집으로 돌아가기 위해 포인트맨과 처절한 사투를 벌이는데…@ 영화제 소개글. 큰 폭발음이 나더니 어느 자취방 앞에소포상자가 떨어진다. 두 백수와 만년 고시생이 상자를 열자 4차원의 포인트맨이 나타나 은하연방 론리스타 수명은행과 계약이 성립했음을 알린다. 포인트맨이 수명을 뺏으려 하는 가운데 우주로 납치된 세 사람. 그들은 자신이 원하는 것을 찾을 수 있을까? 놀라운 비주얼의 독립장편SF환타지. (제14회 부천국제판타스틱영화제),국내,한국,ynqkeq0WvGk,이모션 픽처스,-,12세 관람가,66분,-,이응일 원강영 김진식 ,  이응일 (각본) 안건형 Ahn Kearn-Hyung (각본) 김정훈 (각본),배우/제작진 수상 이력@수상정보 테이블표@2013@제 1회 서울시민영화제@후보@도시만화경 (이응일)@2010@제 10회 광주국제영화제@후보@영 시네마 (이응일)@제 14회 부천국제판타스틱영화제@후보@월드 판타스틱 시네마 (이응일),-,-,   ,-
2010,2010 .03.25 개봉,영화,"멜로/로맨스, 코미디",불타는 내 마음,최원섭,https://movie-phinf.pstatic.net/20111223_249/1324607873589QyREl_JPEG/movie_image.jpg,커피 전문점에서 만난 운명 같은 그녀. 병열(최요한)은 보람(김미희)의 마음을 사로잡기 위해 마시지도 못하는 커피를 무려 100잔이나 사 마신다. 하지만 그녀에겐 이미 남친이 있고 그가 할 수 있는 일이라고는 제발 두 연인이 깨지라는 기도뿐이다. 오매불망 그녀를 바라본 지 어언 3년 드디어 꿈은 이루어진다.@ 짝사랑 3년 불타는 사랑 3년 합이 6년. 이제 병열에게 남은 것이라고는 반짝반짝 빛나는 대머리 뿐이다. 싸늘히 식어버린 병열과 보람에게 새로운 자극이 필요하게 되면서 서서히 그들에게는 전운이 감돌고 본격적인 막장 전쟁이 시작되는데…@ 영화제 소개글. 밝고 건강하면서 섹시한 영화가 가능하다면 바로 이런 작품일 것이다. 애타는 마음으로 ‘보람’을 수년간 짝사랑한 ‘병렬’. 집요한 구애 끝에 마침내 불타는 사랑을 이룬다. 하지만 시간이 흐르며 이들에게도 권태기가 찾아오고 두 사람은 자주 다툰다. 취업난과 탈모와 그녀를 노리는 경쟁자들에 맞서 두 사람이 만드는 좌충우돌 러브스토리. (부천국제판타스틱영화제),국내,한국,M7_Rk5cm7w8,CJ CGV  신파필림,-,15세 관람가,95분,-,김가란 황현주 여지현 박경근 조한희 최미용 김다흰 최혜선 이인호 유채림 유시우 근휘 이승민 장대통 김세훈 권형진 최요한 김미희 ,  최원섭 (각본) 조회온 (총괄프로듀서) 박재형 (프로듀서) 감규식 (제작부) 김재욱 (제작부) 유경하 (제작부) 안선유 (제작부) 박진표 PARK Jin-pyo (제작) 최창희 (제작투자) 임인숙 (제작투자) 이용채 (라인프로듀서) 유성진 (라인프로듀서) 이승재 (라인프로듀서) 문필규 (라인프로듀서) 한승희 (라인프로듀서) 박오순 (라인프로듀서) 장기영 (라인프로듀서) 이현승 Lee Hyun Seung (기획) 사량 (촬영부) 최력명 (촬영부) 진정우 (촬영부) 정재훈 (촬영부) 지민희 (촬영부) 정현부 (촬영) 홍수일 (촬영) 정현부 (조명) 홍수일 (조명) 김성진 (조명부) 이재훈 (조명부) 윤부희 YUN Pu-hui (조명부) 배환 (조명부) 백승재 (조명부) 김소영 (연출부) 이태희 (연출부) 최선아 (연출부) 임윤정 (연출부) 이소원 (스크립터) 최혜선 (스크립터) 신중렬 (조감독) 박제욱 (조감독) 김해원 (동시녹음) 권오경 Gwon Oh-Gyoung (동시녹음) 장우람 (붐오퍼레이터) 정수진 (붐오퍼레이터) 차현준 CHA Hyun-jun (붐오퍼레이터) 박기헌 (음악) 김민선 (미술) 한송희 (미술) 김상택 (시각효과) 김다인 (분장) 전수완 (분장) 김정철 (분장) 손재연 (분장) 최원섭 (편집) 김권군 (무술) 박예양 (촬영B팀) 정현문 (촬영B팀) 공태원 (음향부문) 이회빈 (음향부문) 이형주 (음향부문) 윤선명 (음향부문) 김경호 (음향부문) 이회빈 (음향부문) 성하중 (음향부문) 이형주 (음향부문) 황성기 (음향부문) 공태원 (음향부문) 김기영 (음향부문) 이연정 (예고편) 정근수 (크레인) 황지현 (메이킹),배우/제작진 수상 이력@수상정보 테이블표@2009@제 13회 부천국제판타스틱영화제@후보@월드 판타스틱 시네마 (최원섭),-,-,9089,G4ohnrLY4ec
2010,2010 .05.05 개봉,영화,"전쟁, 드라마, 스릴러",브라더스,짐 쉐리단,https://movie-phinf.pstatic.net/20111223_124/1324610140041rbQnf_JPEG/movie_image.jpg,다정한 남편이자 친구 같은 아빠 믿음직한 아들인 샘(토비 맥과이어)이 아프가니스탄 내전에서 헬리콥터 추락사고로 사망했다는 소식은 가족들을 망연자실하게 만든다. 감옥에서 갓 출소한 동생 토미(제이크 질렌할)는 형의 아내 그레이스(나탈리 포트만)와 조카들을 돌보고 형의 빈자리를 채워가는 동안 불편했던 예전과 달리 가족으로서 인정 받게 된다.@ 그러나 샘은 죽지 않았다. 구사일생으로 돌아온 그는 차가운 눈빛과 웃음기 사라진 얼굴로 묘한 긴장감과 어색함을 만들고 급기야 토미와 그레이스의 관계를 의심하며 가족들을 위협하기 시작하는데- 잃어버린 시간 동안 그에게 무슨 일이 있었던 걸까? 그가 결코 밝히지 않는 비밀은 무엇일까? 한 번 변해버린 마음은 돌이킬 수 없는 것일까?,해외,미국,Ds6QS9zvveQ,새인컴퍼니,-,15세 관람가,104분,-,레이 프리윗 아론 쉬버 에단 서플리 네이비드 네가반 오미드 압타히 캐리 멀리건 제니 웨이드 패트릭 플러거 테일러 기어 메어 위닝햄 샘 쉐퍼드 베일리 매디슨 클리프톤 콜린스 주니어 나탈리 포트만 제이크 질렌할 토비 맥과이어 ,  데이비드 베니오프 David Benioff (각본) 수잔 비에르 Susanne Bier (각본) 앤더스 토마스 옌센 Anders Thomas Jensen (각본) 마이클 드 루카 Michael De Luca (제작) 라이언 카바노 Ryan Kavanaugh (제작) 시그리온 시그밧슨 Sigurjon Sighvatsson (제작) 맷 바타글리아 Matt Battaglia (공동제작) 스콧 피셔 Scott Fischer (기획) 라이언 카바노 Ryan Kavanaugh (기획) 터커 툴리 Tucker Tooley (기획) 프레더릭 엘머스 Frederick Elmes (촬영) 토마스 뉴먼 Thomas Newman (음악) 토니 패닝 Tony Fanning (미술) 가이 반즈 Guy Barnes (아트디렉터) 듀린다 우드 Durinda Wood (의상) 제이 캐시디 Jay Cassidy (편집) 웬디 오졸스-바니스 Wendy Ozols-Barnes (세트) 에이비 코프먼 Avy Kaufman (배역),배우/제작진 수상 이력@수상정보 테이블표@2010@제 15회 크리틱스 초이스 시상식@후보@아역배우상 (베일리 매디슨)@제 28회 뮌헨 국제영화제@후보@국제 프로그램 부문 (짐 쉐리단)@제 67회 골든 글로브 시상식@후보@남우주연상-드라마 (토비 맥과이어)@후보@주제가상 ('Winter')@2009@제 22회 시카고 비평가 협회상@후보@여우조연상 (나탈리 포트만),-,-,68291,-
2010,2010 .11.18 개봉,영화,드라마,브라더후드,윌 캐논,https://movie-phinf.pstatic.net/20111223_241/1324626227373HUwBE_JPEG/movie_image.jpg,불량 서클의 리더 프랭크는 차기 리더인 아담을 비롯한 세 명의 신입 멤버들에게 각자 지정된 편의점을 털어 서클 멤버로서의 용기를 증명하라는 미션을 내린다. 두려움에 갈등하던 끝에 첫 멤버가 과감히 복면을 쓰고 19달러 10센트를 훔쳐오는 미션에 성공한다. 이어 아담 또한 성공하고 프랭크를 비롯한 신입 멤버들은 흥분에 휩싸인다. 마지막 아담의 단짝 캐빈의 차례. 유난히 겁이 많은 캐빈은 망설이지만 아담의 격려에 비장한 표정으로 복면을 쓰고 편의점을 향해 내달린다. 그 때 프랭크에게 전화 한 통이 걸려오고 연이어 한발의 총성이 울려나는데..!@ 상황의 심각성을 직감한 아담은 형을 따라 편의점으로 향하고 쓰러져 있는 캐빈을 발견한다. 부상당한 캐빈을 놓고 은밀히 사건을 처리해 서클을 지켜야 하는 리더 프랭크와 더 이상의 사고를 막으려는 차기 리더 아담의 갈등이 시작되고.. 여기에 엎친 데 덮친 격으로 또 다른 사건들이 연이어 벌어지면서 이들의 밤은 점점 더 위험해져 가는데..,해외,미국,YW3d-ugU2bA,KT&G 상상마당,KT&G 상상마당,청소년 관람불가,80분,-,마이어 드리우 라이언 리플 맷 필립스 잭 오도넬 제프 깁스 캐서린 밴더린든 에번 겜블 타일러 코리 프레스턴 밴더슬라이스 채드 핼브룩 루크 섹스턴 제니퍼 사이프스 제시 스텍카토 알렌 에스카페타 루 테일러 푸치 존 포스터 트레버 모간 ,  윌 캐논 Will Canon (각본) 스티브 헤인 Steve Hein (제작) 팀 오헤어 Tim O'Hair (제작) 크리스 폴락 Chris Pollack (제작) 사라 J. 도나휴 Sarah J. Donohue (라인프로듀서) 크리스 오윙가 Chris Ouwinga (기획) 제이미 패트리코프 Jamie Patricof (기획) 다린 웰치 Darryn Welch (기획) 마이클 피모그나리 Michael Fimognari (촬영) 에릭 휘트니 Eric Whitney (미술) 미쉘 영 Michelle Young (세트) 미쉘 모리스 Michelle Morris (배역),배우/제작진 수상 이력@수상정보 테이블표@2010@제 21회 스톡홀름영화제@후보@미국 독립 영화 (윌 캐논),-,-,-,-
2010,2010 .12.16 개봉,영화,다큐멘터리,브라보! 재즈 라이프,남무성,https://movie-phinf.pstatic.net/20111223_125/1324628715323ePM2C_JPEG/movie_image.jpg,국내 최초로 재즈이론을 연구해온 ‘이판근연구실’이 철거된다는 소식과 함께 지금은 은퇴한 트럼펫의 대가 강대관을 찾아 동료들이 경북 봉화의 어느 마을로 여행길에 오른다. 겨울날 탁주 한 사발을 앞에 두고 추억을 나누던 사람들은 악기를 하나 둘 꺼내 들고 즉흥연주를 시작한다. 이들이 바로 험난한 인생여정을 걸어왔지만 ‘음악을 잘 하면 사람이 된다’며 웃어 보이는 한국 재즈 1세대의 거장들. 나이 80이 다 되어가지만 재즈에 관해서는 넘치는 의욕과 포부를 드러내며 꿈을 향해 여전히 갈 길이 바쁜 청춘들이다. 음악을 향한 식지 않는 열정을 품고 오늘도 재즈를 연주하는 그들을 위해 후배 뮤지션들이 뜻을 모아 헌정 기념공연을 준비하고 마침내 한자리에 모인 재즈 1세대들의 후일을 기약할 수 없는 마지막 공연이 시작되는데…@ 영화제 소개글. 한국 재즈 1세대에 대한 기록 다큐 영화. 1950년대 후반부터 현재까지 활동해 온 한국 재즈 1세대 장인들의 예술과 인생을 주제로 했다. 50년대 이후 주한미군부대의 무대에서 활동하며 재즈를 배우기 시작한 한국재즈 1세대 연주자들의 이야기. 노환으로 치아를 거의 상실하여 고향으로 내려가 있는 트럼펫 연주자 강대관을 찾아 동료 연주자들이 여행길에 오른다. 그즈음 한국에서 최초로 재즈 이론을 가르쳤던 이판근 선생의 연구실이 재개발로 인해 철거된다는 소식이 전해진다. 젊은 재즈 칼럼니스트와 연주자들은 선배들을 기리기 위한 헌정음반제작과 콘서트를 기획한다. 이 영화는 그 몇 개월간의 과정을 담은 기록이다.,국내,한국,6Npw6bh0sNo,이써씬픽쳐스,KT&G 상상마당,전체 관람가,105분,-,정태호 신관웅 강태환 최선배 박성연 김준 이동기 김수열 류복성 조상국 이판근 강대관 ,  박홍열 (촬영) 김창훈 (동시녹음) 지윤정 (촬영B팀),배우/제작진 수상 이력@수상정보 테이블표@2011@제 9회 피렌체 한국영화제@후보@상영작 (남무성)@2010@제 6회 제천국제음악영화제@후보@세계 음악영화의 흐름 (남무성),-,-,5110,a2s3eLpWjUI
2010,2010 .03.12 개봉,영화,"액션, 코미디, 멜로/로맨스",브로큰 데이트,숀 레비,https://movie-phinf.pstatic.net/20111223_83/1324600832683mtnPq_JPEG/movie_image.jpg,필과 클레어 포스터 부부는 각각 세무사와 공인중개사를 하며 두 아이를 키우고 있는 전형적인 뉴저지 거주 중산층 부부이다. 직장일과 어린 아이들에게 시달리는 둘은 일주일에 한번 ‘데이트 나잇’을 정해 동네 레스토랑에서 외식을 하며 레스토랑에 있는 다른 커플들의 이야기를 짐작하는 것으로 직장과 육아 스트레스를 해소한다. 친한 친구 브래드의 이혼 소식을 알고 나서 자기 부부도 그렇게 될 지 모른다는 불안감을 가지게 된 필은 옛날의 로맨스를 되살리기 위해 ‘데이트 나잇’에 클레어를 데리고 맨하탄의 인기 시푸드 레스토랑에 간다. 하지만 예약하지 않고 간 이들에게 자리가 있을 리 만무. 기약없이 기다려야하는 상황이 되자 필은 대기자중 이름을 불러도 나타나지 않는 트리플혼 부부인 척 테이블을 잡는다. 이때부터 둘 앞에는 황당한 일들이 일어나는데 식사도중 갑자기 테이블에 나타난 두 남자가 이들을 레스토랑 뒤 골목으로 끌고가 갱두목 조 밀레토에게서 훔쳐간 USB 메모리가 어디에 있냐고 추궁한다. 자신들은 트리플혼 부부가 아니라 포스터 부부라고 말해보지만 두 남자는 총을 들이대며 막무가내. 할 수 없이 센트럴 파크의 보트 선착장에 USB를 두었다고 둘러댄 필과 클레어는 그곳에서 가까스로 두 남자를 따돌리고 보트를 타고 탈출한다. 경찰서에 상황을 신고하러간 둘은 자신을 협박하던 두 남자가 경찰이었음을 깨닫게 되는데…,해외,미국,YVJjo29eR_I,이십세기폭스코리아(주),-,15세 관람가,88분,-,사반나 페이지 레이 조나단 모건 헤이트 빌 버 밀라 쿠니스 제임스 프랭코 마크 러팔로 크리스틴 위그 레이튼 미스터 윌리암 피츠너 커먼 지미 심슨 타라지 P. 헨슨 마크 월버그 티나 페이 스티브 카렐 ,  조쉬 클라우스너 Josh Klausner (각본) 숀 레비 Shawn Levy (제작) 톰 맥널티 Tom McNulty (제작) 조셉 M. 카라시올로 주니어 Joseph M. Caracciolo Jr. (기획) 조쉬 맥라글렌 Josh McLaglen (기획) 딘 셈러 Dean Semler (촬영) 크리스토퍼 벡 Christophe Beck (음악) 데이비드 그롭먼 David Gropman (미술) 댄 웹스터 Dan Webster (아트디렉터) 말린 스튜어트 Marlene Stewart (의상) 딘 짐머맨 Dean Zimmerman (편집) 빌리 로즌버그 Billy Rosenberg (Ass-PD) 제이 하트 Jay Hart (세트) 도나 아이삭슨 Donna Isaacson (배역),배우/제작진 수상 이력@수상정보 테이블표@2011@제 16회 크리틱스 초이스 시상식@후보@코미디 영화상 (숀 레비),-,-,-,JmmzDbZSkQg
2010,2010 .04.15 개봉,영화,드라마,블라인드 사이드,존 리 행콕,https://movie-phinf.pstatic.net/20111223_159/13246089113705W9ps_JPEG/movie_image.jpg,어린 시절 약물 중독에 걸린 엄마와 강제로 헤어진 후 여러 가정을 전전하며 커가던 ‘마이클 오어’. 건장한 체격과 남다른 운동 신경을 눈여겨 본 미식축구 코치에 의해 상류 사립학교로 전학하게 되지만 이전 학교에서의 성적 미달로 운동은 시작할 수도 없게 된다. 급기야 그를 돌봐주던 마지막 집에서조차 머물 수 없게 된 마이클. 이제 그에겐 학교 수업 운동보다 하루하루 잘 곳과 먹을 것을 걱정해야 하는 날들만이 남았다.@  추수감사절 하루 전날 밤 차가운 날씨에 반팔 셔츠만을 걸친 채 체육관으로 향하던 ‘마이클’을 발견한 ‘리 앤’. 평소 불의를 참지 못하는 확고한 성격의 리 앤은 자신의 아이들과 같은 학교에 다닌다는 마이클이 지낼 곳이 없음을 알게 되자 집으로 데려와 하룻밤 잠자리를 내어주고 함께 추수감사절을 보낸다. 갈 곳 없는 그를 보살피는 한편 그를 의심하는 마음도 지우지 못하던 리 앤. 하지만 시간이 흐르며 마이클의 순수한 심성에 빠져 든 리 앤과 그녀의 가족은 그를 마음으로부터 받아들이기 시작한다.@  리 앤 가족의 도움으로 성적까지 향상된 마이클은 본격적으로 미식 축구 훈련을 시작하며 놀라운 기량과 실력을 발휘하고 리 앤은 그의 법적 보호자를 자청하며 마이클의 진짜 가족이 되고자 한다. 주변의 의심 어린 편견 그리고 마이클이 언젠가 자신을 떠나 사라질 지도 모른다는 불안감을 뒤로 한 채-,해외,미국,lEHfQDSHjAo,워너 브러더스 코리아(주),워너 브러더스 코리아(주),12세 관람가,128분,-,캐시 베이츠 아드리앤 르녹스 킴 딕켄스 레이 맥키넌 릴리 콜린스 퀸튼 아론 제이 헤드 팀 맥그로 산드라 블록 ,  존 리 행콕 John Lee Hancock (각본) 마이클 루이스 Michael Lewis (원작자) 브로데릭 존슨 Broderick Johnson (제작) 앤드류 A. 코소브 Andrew A. Kosove (제작) 길 네터 Gil Netter (제작) 요랜다 T. 코크란 Yolanda T. Cochran (공동제작) 스티븐 P. 웨그너 Steven P. Wegner (공동제작) 티모시 M. 번 Timothy M. Bourne (기획) 몰리 스미스 Molly Smith (기획) 어윈 스토프 Erwin Stoff (기획) 아랄 키빌로 Alar Kivilo (촬영) 카터 버웰 Carter Burwell (음악) 토머스 민튼 Thomas Minton (아트디렉터) 마이클 코렌블리스 Michael Corenblith (미술) 수잔 벤자민 Susan Benjamin (세트) 다니엘 올랜디 Daniel Orlandi (의상) 마크 리볼시 Mark Livolsi (편집) 론나 크레스 Ronna Kress (배역),배우/제작진 수상 이력@수상정보 테이블표@2010@제 15회 크리틱스 초이스 시상식@후보@아역배우상 (제이 헤드)@수상@여우주연상 (산드라 블록)@제 16회 미국 배우 조합상@수상@영화부문 여우주연상 (산드라 블록)@제 82회 미국 아카데미 시상식@수상@여우주연상 (산드라 블록)@후보@작품상 (존 리 행콕)@제 67회 골든 글로브 시상식@수상@여우주연상-드라마 (산드라 블록)@제 19회 MTV 영화 & TV 어워즈@후보@주목할만한 배우상 (퀸튼 아론)@후보@최고의 여자배우상 (산드라 블록),-,-,355516,HCTN6T_lW8c
2010,2010 .06.10 개봉,영화,"공포, 드라마, 판타지, 멜로/로맨스",블러드 앤 초콜렛,카챠 본 가르니에,https://movie-phinf.pstatic.net/20111223_1/13246163027887y0Sy_JPEG/movie_image.jpg,-,해외,미국 / 영국 / 독일 / 루마니아,BwOgEe1eVzA,(주)누리픽쳐스,-,15세 관람가,98분,-,카타 도보 보그단 보다 비탈리 우슈 잭 윌슨 존 카 톰 하퍼 크리스 기르 브라이언 딕 카챠 리만 올리비에 마르티네즈 휴 댄시 아그네스 브루크너 ,  에런 크러거 Ehren Kruger (각본) 크리스토퍼 랜던 Christopher Landon (각본) 울프강 이센웨인 Wolfgang Esenwein (제작) 호크 코치 Hawk Koch (제작) 게리 루체시 Gary Lucchesi (제작) 톰 로젠버그 Tom Rosenberg (제작) 리처드 S. 라이트 Richard S. Wright (제작) 안드레이 본시 Andrei Boncea (공동제작) 피터 로저스 Peter Rogers (공동제작) 엔자 스타델만 Anja Stadelmann (공동제작) 로버트 버나키 Robert Bernacchi (기획) 에런 크러거 Ehren Kruger (기획) 브렌단 겔빈 Brendan Galvin (촬영) 라인홀트 하일 Reinhold Heil (음악) 조니 클리멕 Johnny Klimek (음악) 케빈 핍스 Kevin Phipps (미술) 브라치우 에두아르 다니엘 Vraciu Eduard Daniel (아트디렉터) 애덤 오닐 Adam O'Neill (아트디렉터) 블라드 비에루 Vlad Vieru (아트디렉터) 이오아나 알바이우 Ioana Albaiu (의상) 엘리자베터 베랄도 Elisabetta Beraldo (의상) 엠마 E. 힉콕스 Emma E. Hickox (편집) 레슬리 다이어 Lesley Dyer (Ass-PD) 사라 플랫 Sarah Platt (Ass-PD) 피터 월풀 Peter Walpole (세트) 낸시 네이어 Nancy Nayor (배역) 안드레아 타나세스쿠 Andreea Tanasescu (배역) 메리 트리샤 우드 Mary Tricia Wood (배역) 제레미 지머먼 Jeremy Zimmerman (배역),-,-,-,1,69aJaOzHvt8
2010,2010 .11.11 개봉,영화,"액션, 공포, 미스터리, 스릴러",블러드 헌터,세바스찬 구티에레즈,https://movie-phinf.pstatic.net/20111223_169/132462703355728MPo_JPEG/movie_image.jpg,악마를 추종하는 그룹을 취재하던 기자 이튼은 그 그룹에 속해있던 트리샤가 제공해준 정보를 좇던 중 회사에 결근하게 된다. 또한 트리샤 역시 시체로 발견되고 같은 기자인 새디는 이튼의 집을 찾아간다. 하지만 엉망이 된 그의 집을 보고 급히 나오다가 뱀파이어 루크를 만나 뱀파이어 비숍에게 끌려가게 된다. 비숍은 그녀에게 알고 있는 것을 말하라고 다그치면서 그녀를 뱀파이어로 만든다. 한편 딸 트리샤의 시체를 본 경찰이자 그녀의 아버지인 롤린스는 그런 짓을 한 범인을 쫓아다니다가 새디를 체포하고 새디는 자신 역시 피해자로 비숍을 찾아다니고 있다고 말하는데……,해외,미국,6vmBklpPcGo,-,-,청소년 관람불가,98분,-,게리 시에버스 새디 크리스토퍼 알렌 넬슨 닉 라세이 엘든 헨슨 마릴린 맨슨 사마이어 암스트롱 프란 크랜즈 자크 길포드 사이먼 렉스 이사벨라 구티에레즈 줄리오 오스카 메초소 크리스티나 스테이시 나추코 오하마 샘 쿠퍼 이와마츠 마코 폴 카셀 마이클 치클리스 칼라 구기노 제임스 다시 홀트 맥칼라니 카메론 굿맨 마고 하쉬먼 케빈 웨틀리 사만다 쉘톤 알랜 리치 카메론 리차드슨 로버트 포스터 루시 리우 ,  세바스찬 구티에레즈 Sebastian Gutierrez (각본) 한스 C. 리터 Hans C. Ritter (Line PD) 조세프 리엑 Josef Lieck (프로듀서) 카스튼 H.W. 로렌즈 Carsten H.W. Lorenz (제작) 그렉 샤피로 Greg Shapiro (제작) 켈리 코노프 Kelli Konop (공동제작) 오브리 헨더슨 Aubrey Henderson (기획) 나단 카헤인 Nathan Kahane (기획) 카스튼 H.W. 로렌즈 Carsten H.W. Lorenz (기획) 샘 레이미 Sam Raimi (기획) 로버트 G. 타펫 Robert G. Tapert (기획) 존 톨 John Toll (촬영) 나단 바 Nathan Barr (음악) 제리 플레밍 Jerry Fleming (미술) 오스틴 고르그 Austin Gorg (아트디렉터) 데니즈 윈게이트 Denise Wingate (의상) 리사 브롬웰 Lisa Bromwell (편집) 롭 설리반 Robb Sullivan (편집) 베티 버버리언 Betty Berberian (세트) 낸시 네이어 Nancy Nayor (배역) 켈리 와그너 Kelly Wagner (배역),-,-,-,-,beGrx-2c2Fw
