year,release_date,category,genre,title,creator,title_image,introduction,country_category,country_name,video,production,distribution,grade,runtime,remake,cast,staff,awards,series,soundtrack,amount,ref_video,,,,,,,,,,,,,,
2002,2002 .11.01 개봉,영화,"코미디, 멜로/로맨스",미스터 디즈,스티븐 브릴,https://movie-phinf.pstatic.net/20111222_168/1324529975729LOhgT_JPEG/movie_image.jpg,"뉴 햄프셔의 작은 마을에서 조그만 피자 가게를 운영하는 롱펠로우 디즈(아담 샌들러 분)는 운명적인 사랑을 꿈꾸며 나름대로 아름다운(?) 카드 문구로 손님들을 즐겁게 해주는, 좋게 말해 순수하고, 솔직히 말해 조금은 어리숙한 청년이다. 그러던 그에게 별안간 돈벼락이 떨어지는데, 다름아닌 뉴욕 최대 갑부인 외삼촌이 처자식은 고사하고 마땅한 상속자도 없이 세상을 뜬 것. 외삼촌이 남긴 재산은 풋볼팀과 야구팀, 그리고 방송사까지 가지고 있는 거대한 미디어 그룹 블레이크. 자산이 무려 400억 달러다.@  마을 사람들의 축하를 받으며, 촌뜨기 청년 '디즈'가 뉴욕으로 상경한다. 메아리가 울리는 거대한 저택과 양말까지 신겨 주려는 하인, 멋진 리무진. 그런 그에게 고향 마을에선 구경도 못해 본 아리따운 여자(위노나 라이더 분)를 만나 사랑에 빠지는데.",해외,미국,https://www.youtube.com/watch?v=mAlv8qW-K94,콜럼비아트라이스타,콜럼비아트라이스타,12세 관람가,96분,-,존 터투로 에릭 아바리 엘런 코버트 자레드 해리스 피터 갤러거 위노나 라이더 아담 샌들러 ,  팀 헐리히 Tim Herlihy (각본) 클라렌스 버딩톤 켈런드 Clarence Budington Kelland (원조) 로버트 리스킨 Robert Riskin (원조) 시드니 게니스 Sidney Ganis (제작) 잭 지아라푸토 Jack Giarraputo (제작) 알렉스 시스킨 Alex Siskin (공동제작) 엘런 코버트 Allen Covert (협력프로듀서) 아담 샌들러 Adam Sandler (기획) 조셉 M. 카라시올로 Joseph M. Caracciolo (기획) 피터 리온스 콜리스터 Peter Lyons Collister (촬영) 테디 캐스틀루치 Teddy Castellucci (음악) 마이클 딜벡 Michael Dilbeck (음악) 페리 앤드린 블레이크 Perry Andelin Blake (미술) 엘렌 루터 Ellen Lutter (의상) 제프 거손 Jeff Gourson (편집) 로저 무센든 Roger Mussenden (배역),배우/제작진 수상 이력@수상정보 테이블표@2003@제 23회 골든 라즈베리 시상식@후보@최악의 남우주연상 (아담 샌들러)@후보@최악의 속편상@후보@최악의 여우주연상 (위노나 라이더)@제 12회 MTV 영화 & TV 어워즈@후보@최고의 코믹연기상 (아담 샌들러),-,-,-,https://www.youtube.com/watch?v=8TKAVWFhDb0,,,,,,,,,,,,,,
2002,-,영화,애니메이션,미스터 빈 - 애니메이션 시리즈,로완 앳킨슨,https://ssl.pstatic.net/static/movie/2012/06/dft_img77x110_1.png,-,해외,미국,https://www.youtube.com/watch?v=LtPnwCxlAiE,-,-,-,-,-,로완 앳킨슨 ,-,-,-,-,-,https://www.youtube.com/watch?v=LtPnwCxlAiE,,,,,,,,,,,,,,
2002,2002 .05.31 개봉,영화,드라마,미워도 다시 한번 2002,정소영,https://movie-phinf.pstatic.net/20111222_152/1324557362968YGqV8_JPEG/movie_image.jpg,당당한 태도와 솔직한 웃음으로 항상 주변 사람들의 관심과 사랑을 받는 수정(이승연 분)의 직업은 잡지사 사진 기자. 남자 기자들과의 몸싸움에도 지지않을 정도로 일에 대한 프로정신이 넘치는 수정이 일과 삶에 지칠 때면 의례 찾는 곳이 있다. 아주 오래 전부터 수정에게 의지가 되어 온 친구 영하(박용하 분)의 작업실. 항상 밝고 구김 없는 모습인 수정이지만 영하를 찾을 때만은 자신의 감추어진 슬픔과 외로움을 그대로 드러내곤 한다. 그런 수정을 바라보는 영하의 눈길에는 연민과 사랑이 뒤섞인 복잡한 감정이 담겨있고- 수정의 아픔을 감싸 안고 싶지만 둘 사이에는 있는 벽은 너무나 높게 느껴진다. 한편 또 다시 감당하기 어려운 절망에 부딪힌 수정은 5년 전의 가슴 아린 기억을 되새기며 지환(이경영 분)을 만나는데.,국내,한국,https://www.youtube.com/watch?v=A7us1DoKlw0,"합동영화사 , 합동영화주식회사",-,12세 관람가,102분,-,박용하 김나운 이경영 이승연 ,  김수현 김순옥 (각본) 김성실 (각색) 정지훈 (프로듀서) 하휘룡 (제작상무) 이용훈 (제작부장) 남궁훈 (제작) 고려찬 (제작진행) 김나란 (제작진행) 최연근 (제작진행) 김영대 (라인프로듀서) 정지훈 (기획) 이철효 (촬영부) 오종현 (촬영부) 서명성 (촬영부) 송진열 (촬영부) 황성욱 (촬영부) 하경구 (촬영부) 이성춘 (촬영) 최찬규 (촬영) 조길수 (조명) 양진석 (조명부) 서창한 (조명부) 최원 (조명부) 최대호 (조명부) 하나공아트 (그립) 이도협 (연출부) 김부년 (연출부) 윤지현 (스크립터) 이정아 (스크립터) 박준일 (조감독) 이윤빈 (동시녹음) 김석호 (녹음) 소원종 (음향) 김지훈 (음향) 이종식 (음악) 정혜원 (아트디렉터) 미밈 (미술) 김진아 (분장) 민지영 (헤어) 김진 (의상) 김상인 (의상) 고임표 (편집) 최현숙 (네가편집) 전종혁 (음악부문) 김세정 (아비드편집) 정원일 (음향부문) 주광동 (자막) 송홍욱 (운송) 최호진 (발전차) 조규범 (음악부문) 박기영 (음향부문) 윤종두 (옵티컬) 황의돈 (현상부문) 윤현석 (음악부문) 서광열 (옵티컬) 박천숙 (디자인) 정주형 (디자인),-,-,-,   ,https://www.youtube.com/watch?v=PwxHtdNjsIc,,,,,,,,,,,,,,
2002,-,영화,미국,믿거나 말거나 - 3차 TV 시리즈,딘 케인,https://ssl.pstatic.net/static/movie/2012/06/dft_img77x110_1.png,-,해외,60분,https://www.youtube.com/watch?v=bT9ORjUu5I0,-,-,-,-,-,딘 케인 ,-,-,-,-,-,https://www.youtube.com/watch?v=UDTPv5aUPzY,,,,,,,,,,,,,,
2002,2002 .05.31 개봉,영화,"스릴러, 드라마, 멜로/로맨스",밀리언 달러 호텔,빔 벤더스,https://movie-phinf.pstatic.net/20111216_65/1324028595037HFIQ0_JPEG/movie_image.jpg,"수많은 불빛들로 밤이 사라진 미국 최고의 도시 LA시내 중심에 사회로부터 버림받고 적응하지 못하는 부랑자 무리들이 지저분한 호텔에서 생활하고 있다. 우리는 그곳을 밀리언 달러 호텔이라고 부른다. 어느 날 평화롭던 밀리언 달러 호텔에서 마약 복용자 '이지'가 옥상에서 떨어져 죽는 사건이 발생한다. 사건의 경위를 파악하기 위해 경찰의 조사가 이뤄지고, 수사 도중 '이지' 가 언론 재벌의 아들임이 밝혀지면서 사건은 점점 더 미궁으로 치닫는다. 단순한 마약 복용자의 자살로 치부되었던 사건은 다시 물위로 떠오르고, 결국 FBI 요원인 '스키너'(멜 깁슨)가 사건 해결을 위해 밀리언 달러 호텔로 파견된다.@  밀리언 달러 호텔에서 잡다한 심부름을 도맡아하고 있는 바보, '톰 톰'은 너무도 착하고 순진한 청년이다. 세상과 마음의 문을 닫은 채 살아가는 아름다운 미모의 소유자 '엘로이즈'에게 반해 끝없는 구애를 펼치지만 세상에 대해 알지 못하는 '톰 톰'의 구애는 미숙하기만 하다. 이들을 중심으로 변함없는 깨끗한 영혼의 소유자인 인디언 '제로니모', 헐리우드의 환상속에 빠져있는 '쇼티', 비틀즈의 다섯 번째 멤버라고 주장하는 록 가수 '딕시', 죽은 '이지'가 자신을 사랑하여 결혼하려 했다는 주장으로 일관하는 '비비안' 등 모두가 이번 사건과 관련된 용의자이다. 그러나 좀처럼 실마리는 잡히지 않은 채 FBI 요원의 집요한 수사가 시작된다. 그러나 자살과 타살, 현실과 상상 모든 것이 뒤섞이면서 수사는 점점 더 미궁속으로 빠져드는데.",해외,독일 / 영국 / 미국,https://www.youtube.com/watch?v=BU2SwgSjt0o,베어엔터테인먼트,CJ 엔터테인먼트,15세 관람가,121분,-,줄리안 샌즈 버드 코트 다널 로귀 톰 바우어 글로리아 스튜어트 아만다 플러머 피터 스토메어 지미 스미츠 밀라 요보비치 제레미 데이비스 ,  보노 Bono (원안) 보노 Bono (제작) 브루스 데이비 Bruce Davey (제작) 데팍 나야르 Deepak Nayar (제작) 빔 벤더스 Wim Wenders (제작) 울리치 펠스버그 Ulrich Felsberg (기획) 페든 파파마이클 Phedon Papamichael (촬영) 할 윌너 Hal Willner (음악) 보노 Bono (음악) 다니엘 라노이스 Daniel Lanois (음악) 브라이언 에노 Brian Eno (음악) 낸시 스타이너 Nancy Steiner (의상) 타티아나 S. 리겔 Tatiana S. Riegel (편집) 헤이디 르빗 Heidi Levitt (배역) 모니카 니켈슨 Monika Mikkelsen (배역),배우/제작진 수상 이력@수상정보 테이블표@2018@제 14회 취리히 영화제@후보@회고전 (빔 벤더스)@2000@제 50회 베를린국제영화제@수상@은곰상:심사위원상 (빔 벤더스),-,-,-,https://www.youtube.com/watch?v=XqHjJTuLUsw,,,,,,,,,,,,,,
2002,2002 .11.08 개봉,영화,"드라마, 멜로/로맨스",밀애,변영주,https://movie-phinf.pstatic.net/20111222_143/13245526437603YQqL_JPEG/movie_image.jpg,"서른의 전업주부 미흔의 집에 찾아온 빨간 스웨터의 여자. 그녀가 입을 열어 미흔의 남편을 '오빠'라 부르기 시작했다. 그것은 단 몇마디로 미흔의 삶을 송두리째 빼앗는, 크리스마스 오후의 끔찍한 테러였다.@  고요한 나비마을의 평화로움에 도취되어 미흔 가족은 마치 아무일이 없었던 것처럼 살고 있다. 그날밤 이후 원인을 알수 없는 두통에 시달리고 있던 미흔은, 아주 고통스럽게 자신의 아픔을 내쏟는다. 그렇지만 변한 것은 아무것도 없어 보인다.@  인규는 근처 호숫가에서 낚시를 즐기고, 나머지 시간엔 물고기를 낚듯 여자를 만나 섹스를 즐기는 한적한 시골병원 의사. 평화로운 나비 마을에서 자신의 방식대로 삶을 즐기는 것이 익숙해지려는 즈음, 그가 그녀를 만난다. 그때였다. 뜨거운 햇빛이 내비치는 휴게소에 멍하니 앉아있던 미흔에게 날카로운 경적소리처럼 그를 일깨우는 낯선 목소리의 인규. 미흔은 온몸으로 그를 거부하지만, 동시에 온몸으로 그에게 빠져들고 있다.@  인규는 미흔의 질문에 말할수 없이 벅찬 대답을 주었다. 삶이 무너졌다고 생각한 인생의 끝자락에서, 섹스는 하되, 절대로 사랑해서는 안되는 위험한 게임에 빠진 미흔. 그녀는 자신도 모르게 이 게임을 탐닉하고 있다.@  미흔의 남편은 얼마전부터 연못을 만들고 싶어했다. 연못은 모든 것을 잊고 물고기를 가꾸며 단란하게 살자는 그의 꿈이다. 그러나, 그 자리에 함께 있어야할 미흔은 없고 연못만 남아있다. 그리고 그의 아내는 이시간 여관속 숲길을 걸어나온다. 온동네에 퍼져있는 미흔과 인규의 소문을 인정하고 싶지 않는 효경과 끝이 어딘지 모르는 이 남녀의 위험한 사랑은 어떤 결과를 가져올것인가?",국내,한국,https://www.youtube.com/watch?v=0pBrdvTnbxU,-,-,청소년 관람불가,110분,-,김정태 홍세나 하승리 김민채 윤다경 김민경 계성용 이종원 김윤진 ,  김재연 (각본) 변영주 BYUN Youngjoo (각본) 전경린 (원작자) 신혜은 SHIN Hye-eun (프로듀서) 임지영 (제작실장) 김태완 (제작부장) 김미희 (제작) 최선희 (제작관리) 이종화 (제작회계) 백지현 (제작회계) 강우석 (기획) 오승환 (촬영부) 권혁준 (촬영) 안드레이 킬바신스키 Andrzej Kilbasinski (조명부) 조제프 시에프루차 Jozef Cieplucha (조명부) 김승규 (조명부) 조철호 (조명부) 여철수 (조명부) 김태호 (조명부) 신명화 (조연출) 조규삼 (조연출) 선동현 (조연출) 최양현 (조연출) 안소현 (스크립터) 이영길 (동시녹음) 김석원 (음향) 김창섭 (믹싱) 조영욱 (음악) 최승현 (음악) 심현정 (음악) 이근아 (미술) 이인옥 (미술) 송혜진 (미술팀) 김은호 (미술팀) 이장환 (미술팀) 이만수 (세트) 노상억 (세트) 이광봉 (세트) 정도안 (특수효과) 이희경 (특수효과) 방성철 (특수효과) 김태훈 (시각효과) 양연영 (분장) 김성미 (분장팀) 함현주 (의상) 현정훈 (현장편집) 박곡지 (편집) 정진희 (편집) 김미영 (네가편집) 홍정호 (녹음팀) 이호원 (녹음팀) 임형주 (녹음팀) 이홍표 (무술연출) 김동현 (배급부문) 이화배 (배급부문) 김재민 (배급부문) 장우룡 (스토리보드) 정정은 (의상팀) 정선영 (의상팀) 이영숙 (마케팅진행) 이유진 (스타일리스트) 김송이 (스타일리스트) 전민 (진행) 용세형 (진행) 강혜정 (진행) 김규혜 (진행) 헐리우드영상제작기술 (현상),배우/제작진 수상 이력@수상정보 테이블표@2008@제 6회 피렌체 한국영화제@후보@상영작 (변영주)@2003@제 2회 뉴욕 한국 영화제@후보@상영작 (변영주)@제 5회 서울국제여성영화제@후보@새로운 물결 (변영주)@2002@제 5회 디렉터스 컷 어워즈@수상@올해의 여자배우상 (김윤진)@제 23회 청룡영화상@후보@신인감독상 (변영주)@수상@여우주연상 (김윤진),-,-,-,https://www.youtube.com/watch?v=wmCRqsojFNE,,,,,,,,,,,,,,
2002,-,영화,한국,바람이 분다,이영희,https://movie-phinf.pstatic.net/20111216_90/1324028678813dM6e1_JPEG/movie_image.jpg,"자신의 의지와는 상관없이 벌어진 두 친구간의 오해. 준은 상이를 돕지 못한 비겁함에 자신을 자책하게 되고, 상이 또한 두 사람 사이의 깊은 우정의 골에 대해 굉장한 실망과 회의를 하게 된다. 그러나 그것도 잠시 어떤 계기가 없이도 그들은 자연스레 서로의 입장을 이해하게 되고, 그럴 수 밖에 없었을 자기만의 사정이 있었을 거라고 진심으로 믿게 된다. 그들은 서로 다른 공간에서, 달린다, 힘을 다해! 달리기를 통해, 마치 같이 달리는 듯한 느낌의 두 사람은 마음 깊은 곳으로부터의 화해를 하게 된다.",해외,7분,https://www.youtube.com/watch?v=KmIn0XjaWAQ,-,-,-,-,-,강태영 ,  이영희 (각본) 이우현 (촬영) 이영희 (음향) 김진희 (편집),-,-,-,   ,https://www.youtube.com/watch?v=DTzZsAP8JJQ,,,,,,,,,,,,,,
2002,2002 .11.22 개봉,영화,드라마,바람이 우리를 데려다 주리라,압바스 키아로스타미,https://movie-phinf.pstatic.net/20111216_53/1324028682457I10eG_JPEG/movie_image.jpg,"테헤란에서 450마일, 지도에도 나와있지 않은 외딴 마을 시어 다레(검은 계곡)로 지프 한 대가 들어선다. 붉은 언덕과 나무들을 길잡이 삼아 어렵게 도착한 베흐저드 일행. 스스로를 전화 기술자라고 소개하지만 멀리까지 와서는 하는 일이 없다. 묘지로 차를 몰아가는 모습에 마을 사람들은 그들이 보물을 찾으러 온 것은 아닐까 추측할 뿐-@  사실 베흐저드 일행은 이 마을 최고령 할머니의 장례식을 촬영하러 온 취재팀이다. 문제는 일이 벌어지기도 전에 너무 앞질러 왔다는 것. 모두가 느긋하기만 한 이 곳에서, 곧 돌아가실 줄만 알았던 여배우는 여유만만. 좀처럼 천국행을 서두르지 않으신다. 심지어는 무심하게도 회복의 기미마저 보이고-@  초조한 마음으로 할머니의 소식을 기다리는 보름동안, 베흐저드는 마을 사람들과 우정을 나눈다. 언제나 바쁘고 재촉하는 일에 익숙했던 그에게 마을사람들의 여유로운 삶과 넉넉한 자연의 모습은 신선한 충격. 서서히 이곳의 리듬에 젖어드는 베흐저드는 자기도 모르는 사이 놀라운 변신을 경험한다. 맨 처음 마을을 찾아온 불순한 목적과는 180도 다른 일에 뛰어드는데.",해외,이란 / 프랑스,https://www.youtube.com/watch?v=KmIn0XjaWAQ,백두대간,백두대간,-,118분,-,바흐만 고바디 ,  압바스 키아로스타미 Abbas Kiarostami (각본) 마린 카미츠 Marin Karmitz (제작) 압바스 키아로스타미 Abbas Kiarostami (제작) 마흐무드 칼러리 Mahmoud Kalari (촬영) 바흐만 고바디 Bahman Ghobadi (조연출) 페이만 야즈다니안 Peyman Yazdanian (음악) 압바스 키아로스타미 Abbas Kiarostami (편집),배우/제작진 수상 이력@수상정보 테이블표@2016@제 47회 인도국제영화제@후보@스페셜 트리뷰트 (압바스 키아로스타미)@제 53회 금마장@후보@트리뷰트 (압바스 키아로스타미)@제 21회 부산국제영화제@후보@특별기획 프로그램 (압바스 키아로스타미)@2010@제 28회 뮌헨 국제영화제@후보@영화매리트 부문 (압바스 키아로스타미)@1999@제 21회 낭뜨 3대륙 영화제@후보@공식 부문- 비경쟁 (압바스 키아로스타미)@제 56회 베니스국제영화제@수상@심사위원 특별상 (압바스 키아로스타미),-,-, ,https://www.youtube.com/watch?v=gDZBv0yqjHA,,,,,,,,,,,,,,
2002,2002 .12.06 개봉,영화,드라마,바운스,하라다 마사토,https://movie-phinf.pstatic.net/20111221_4/1324449325230QNbL6_JPEG/movie_image.jpg,"여기, 시부야에 막 도착한 소녀 하나 있다. 하얗고 낡은 가방 하나 등에 꼭 붙들어매고 주위를 경계하며 계단을 내려오는 그녀에게 누군가 말을 건다. "돈 벌러 왔지? 내가 놀아줄까?"" 리사는 미국에 가고 싶다. 아니 가야한다. 그것도 바로 내일 당장! 그렇다! 돈 벌러 왔다. 그것도 당장 내일까지! 속옷을 벗어 팔아본다. 즉석 벗기도 있다. 그리고 비디오 찍는 곳에 간다. 카메라는 치마 아래로만 돈다. 또래의 소녀들이 한껏 발랄한 웃음을 날리며", 직선을 따라 좁은 방에서 빙빙 돈다. 그리고 들이닥친 깡패들. 시간은 얼마 안 남았는데 있는 돈 마저 털리고- 이젠 어떡하지?@ 그때 나타난 고갸르 비즈니스 계의 카리스마 라쿠. 스트릿 댄스를 즐기며 직선은 절대 안 밟는 소녀. 전화 연결로 원조교제를 알선하며 살아가지만 그렇게 돈을 버는 것에 대한 개념이 없던 그녀에겐 미국행을 위해 과감한 원조 비즈니스로의 투신을 한 리사가 신기하고 새롭다. 그래? 그럼 내가 도와주지. 전형적인 고갸르 스타일인 존코. 그러나, 그녀는 절대 안 자고도 건당 수입이 제일 많은 베테랑 고갸르. 이건 정말 완벽한 원조친구들이다! 임무는 시작됐다. 육교에 한명. 동쪽 모퉁이에 한명. 녹색 옷 입은 놈 옆에 한명. 육교 밑 가로등에 한명. 텔레크라(전화메세지)로 바보 4명이 지갑을 열고 기다리고 있다.",해외,일본,https://www.youtube.com/watch?v=5yOo_25Z738,-,-,15세 관람가,109분,-, 쿄노 코토미 코사카이 카즈키 야쿠쇼 코지 모모이 가오리 야자와 신 무라카미 준 오카모토 유키코 사토 야스에 사토 히토미 ,  하라다 마사토 Masato Harada (각본) 리즈미 힐로 Hilo Iizumi (Co-PD) Masakasu Suzuki (제작) 사카모토 요시타카 Yoshitaka Sakamoto (촬영) 카와사키 마사히로 Masahiro Kawasaki (음악) Hiroshi Maruyama (미술) 아베 히로히데 Hirohide Abe (편집),배우/제작진 수상 이력@수상정보 테이블표@2003@제 2회 뉴욕 아시아 영화제@후보@일본영화 (하라다 마사토)@1998@제 2회 부천국제판타스틱영화제@후보@월드 판타스틱 시네마 (하라다 마사토),-,-,-,https://www.youtube.com/watch?v=x5dR0UclXuA,,,,,,,,,,,,
2002,"2017 .01.18 재개봉, 2002 .12.19 개봉",영화,"판타지, 모험, 액션",반지의 제왕: 두 개의 탑,피터 잭슨,https://movie-phinf.pstatic.net/20170112_295/1484183596684X2ucM_JPEG/movie_image.jpg,"모든 힘을 지배할 악의 군주 ‘사우론’의 절대반지가 깨어나고@ 악의 세력이 세상을 지배해가며 중간계는 대혼란에 처한다.@ @ 호빗 ‘프로도’와 그의 친구들, 엘프 ‘레골라스’, 인간 전사 ‘아라곤’과 ‘보로미르’@ 드워프 ‘김리’ 그리고 마법사 ‘간달프’로 구성된 반지원정대는@ 평화를 지키기 위해 절대반지를 파괴할 유일한 방법인@ 반지가 만들어진 모르도르를 향해 목숨을 건 여정을 떠난다.@ @ 한편, 점점 세력을 넓혀온 사우론과의 피할 수 없는 전쟁을 앞둔@ 반지원정대는 드디어 거대한 최후의 전쟁을 시작하는데-",해외,뉴질랜드 / 미국,https://www.youtube.com/watch?v=8TG0Fz5dN2o,(주)영화사 오원,디스테이션,12세 관람가,235분,-,크레이그 파커 칼 어번 앤디 서키스 브래드 듀리프 데이비드 웬햄 미란다 오토 휴고 위빙 올랜도 블룸 도미닉 모나한 빌리 보이드 크리스토퍼 리 버나드 힐 존 라이스 데이비스 케이트 블란쳇 숀 애스틴 리브 타일러 비고 모텐슨 이안 맥켈런 일라이저 우드 ,  프랜 월시 Fran Walsh (각본) 필리파 보엔스 Philippa Boyens (각본) 스티븐 싱클레어 Stephen Sinclair (각본) 피터 잭슨 Peter Jackson (각본) J.R.R. 톨킨 J.R.R. Tolkien (원작자) 베리 오스본 Barrie M. Osborne (제작) 프랜 월시 Fran Walsh (제작) 피터 잭슨 Peter Jackson (제작) 릭 포러스 Rick Porras (공동제작) 제이미 셀커크 Jamie Selkirk (공동제작) 마크 오데스키 Mark Ordesky (기획) 봅 웨인스타인 Bob Weinstein (기획) 하비 웨인스타인 Harvey Weinstein (기획) 로버트 샤이 Robert Shaye (기획) 마이클 린 Michael Lynne (기획) 앤드류 레즈니 Andrew Lesnie (촬영) 데이빗 파머 David Farmer (사운드디자인) 마이크 홉킨스 Mike Hopkins (사운드슈퍼바이저) 에단 반 더 린 Ethan Van Der Ryn (사운드슈퍼바이저) 하워드 쇼어 Howard Shore (음악) 조 블레이클리 Joe Bleakley (아트디렉터) 댄 헨나 Dan Hennah (아트디렉터) 필립 아이비 Philip Ivey (아트디렉터) 롭 아우터사이드 Rob Outterside (아트디렉터) 마크 로빈스 Mark Robins (아트디렉터) 앨런 리 Alan Lee (아트디렉터) 그랜트 메이저 Grant Major (미술) 린 월쉬 Lynne Walsh (특수분장) 리처드 테일러 Richard Taylor (특수분장) 리처드 테일러 Richard Taylor (특수효과) 짐 리지엘 Jim Rygiel (특수효과) 지노 아세베도 Gino Acevedo (특수효과) 제이슨 도커티 Jason Docherty (특수효과) 스티브 인그람 Steve Ingram (특수효과) 킴 세인스버리 Kym Sainsbury (특수효과) 도미니 틸 Dominie Till (특수효과) 리차드 애디슨-우드 Richard Addison-Wood (시각효과) 맷 에잇킨 Matt Aitken (시각효과) 짐 버니 Jim Berney (시각효과) 조 레터리 Joe Letteri (시각효과) 딘 리옹 Dean Lyon (시각효과) 제임스 E. 프라이스 James E. Price (시각효과) 존 쉐일스 John Sheils (시각효과) 피터 G. 트레버스 Peter G. Travers (시각효과) 피터 킹 Peter King (분장) 피터 오웬 Peter Owen (분장) 엔길라 딕슨 Ngila Dickson (의상) 리처드 테일러 Richard Taylor (의상) D. 마이클 호튼 D. Michael Horton (편집) 자베즈 올슨 Jabez Olssen (편집) 랜달 윌리엄 쿡 Randall William Cook (애니메이션감독) 셰인 프리그모어 Shane Prigmore (애니메이션) 마이크 월리스 Mike Wallis (애니메이션) 데미안 맥도넬 Damian McDonnell (색채) 존 허바드 John Hubbard (배역) 에이미 허바드 Amy MacLean (배역) 빅토리아 버로우즈 Victoria Burrows (배역) 리즈 멀레인 Liz Mullane (배역) 앤 로빈슨 Ann Robinson (배역),배우/제작진 수상 이력@수상정보 테이블표@2004@제 29회 새턴 어워즈@수상@최우수 DVD/BD 스페셜 에디션@제 27회 일본 아카데미상@수상@우수 외국작품상@2003@제 28회 새턴 어워즈@수상@최우수 남우조연상 (앤디 서키스)@수상@최우수 분장상 (피터 오웬 외 1명)@수상@최우수 의상상 (엔길라 딕슨 외 2명)@수상@최우수 판타지영화상 (피터 잭슨)@제 9회 미국 배우 조합상@후보@영화부문 앙상블상 (일라이저 우드 외 16인)@제 56회 영국 아카데미 시상식@후보@데이빗 린 상 (피터 잭슨)@후보@분장상@후보@음향상 (게리 섬머스 외)@후보@의상상 (엔길라 딕슨 외)@후보@작품상@후보@촬영상 (앤드류 레즈니)@수상@특수시각효과상 (리처드 테일러)@후보@편집상 (D. 마이클 호튼 외)@후보@프로덕션디자인상 (그랜트 메이저)@제 75회 미국 아카데미 시상식@후보@미술상 (그렌트 메이저)@수상@시각효과상 (Jim Rygiel)@후보@음향믹싱상 (크리스토퍼 보에즈)@수상@음향편집상 (Ethan Van der Ryn)@후보@작품상 (피터 잭슨)@후보@편집상 (D. 마이클 호튼)@제 60회 골든 글로브 시상식@후보@감독상 (피터 잭슨)@후보@작품상-드라마 (피터 잭슨)@제 12회 MTV 영화 & TV 어워즈@후보@최고의 남자배우상 (비고 모텐슨)@수상@최고의 버츄얼 퍼포먼스 (앤디 서키스)@수상@최고의 액션장면@수상@최고의 영화상 (피터 잭슨)@수상@최고의 호흡상 (일라이저 우드 & 션 에스틴),-,-,-,https://www.youtube.com/watch?v=p_6XgzI4ikE,,,,,,,,,,,,,,
