year,release_date,category,genre,title,creator,title_image,introduction,country_category,country_name,video,production,distribution,grade,runtime,remake,cast,staff,awards,series,soundtrack,amount,ref_video
2010,2010 .05.20 개봉,영화,"코미디, 드라마, 멜로/로맨스",내 깡패 같은 애인,김광식,https://movie-phinf.pstatic.net/20111223_167/1324613028138CQdms_JPEG/movie_image.jpg,싸움 하나 제대로 못하지만 입심 하난 끝내주는 삼류건달 동철(박중훈 분). 예전만큼 실력발휘는 못하지만 아직 가오만큼은 살아있다. 그런데 겉보기엔 참하게 생긴 옆집에 이사온 여자가 날 보고도 전혀 기죽지 않는다. 웬걸 이 여자 '옆방여자'라 부르면 눈에 힘부터 잔뜩 주고서는 바락바락 대들기까지 한다. 하지만 이 여자 어쩐지 잘해주고 싶다!@ 열혈 취업전선에 뛰어든 깡만 센 여자 세진(정유미 분). 큰 뜻 품고 구한 반지하 방 그런데 겉보기에는 깡패 같지도 않은 깡패가 옆집에 살고 있다. 웬걸 이 남자 '옆방여자'라 부르며 꼬박꼬박 아는 척을 한다. 말이 더 많은 옆집깡패 왠지 싫지 않다!@ 깡 없는 깡패와 깡만 센 여자 두 남녀가 매일 부딪치는 격렬한 반지하 반동거가 시작된다!,국내,한국,TQwSjoNIrtM,(주)JK필름,-,15세 관람가,105분,-,민경진 노승범 권율 정인기 정우혁 박원상 정유미 박중훈 ,  김광식 (각본) 길영민 KIL Yeong-min (제작총괄) 최건용 (투자총괄) 이원화 (투자총괄) 구태진 (프로듀서) 김용선 (제작실장) 이강진 (제작부장) 이대영 (제작부) 문창원 (제작부) 박준열 (제작부) 윤제균 (제작) 김지훈 (제작지원) 진일규 (제작지원) 박정훈 (제작지원) 오은석 (제작지원) 조혜정 (제작지원) 이원희 (제작지원) 유형석 (제작지원) 건미지 (제작지원) 김홍규 (제작지원) 함광민 (제작지원) 김종호 (제작지원) 최원규 (제작지원) 윤정환 (제작지원) 이은기 (제작지원) 박형철 (제작회계) 손광익 (제작투자) 박준휘 (투자진행) 이진훈 (투자책임) 황문수 (투자책임) 김은숙 (투자책임) 김현우 (공동투자) 이승호 (공동투자) 이진성 (제작관리부문) 이소희 (제작관리부문) 이영한 (제작관리부문) 오소영 (제작관리부문) 진영재 (제작관리부문) 임지현 (제작관리부문) 방옥경 (제작관리부문) 이경범 (제작관리부문) 조가희 (제작관리부문) 전혜란 (제작관리부문) 구태진 (기획) 박세승 (촬영부) 임준우 (촬영부) 조진우 (촬영부) 하진경 (촬영부) 고낙선 (촬영) 고낙선 (조명) 이승원 (조명부) 김평기 (조명부) 신승훈 (조명부) 장윤경 (조명부) 조혜진 (조명부) 강종수 (조명부) 박득운 (그립) 김장훈 (그립) 권성태 (키그립) 조근성 (키그립) 개미영상 (키그립) 김도훤 (연출부) 임경진 (연출부) 김녹연 (스크립터) 이학수 (조감독) 이은주 (동시녹음) 김미미 (붐오퍼레이터) 목영진 (음악) 김유정 (미술) 양희선 (미술팀) 이민희 (미술팀) 심혜진 (미술팀) 유재영 (세트팀) 전병호 (세트팀) 정상호 (세트팀) 전관호 (세트팀) 우경희 (소품) 박선영 (소품팀) 박창희 (소품팀) 이은일 (소품팀) 김솔 (소품팀) 전건익 (특수효과) 정상성 (특수효과팀) 최명선 (특수효과팀) 양새롬 (분장팀) 조진영 (분장팀) 김지현 (현장편집) 신서린 (편집보) 김우현 (편집보) 이진 (편집) 민재경 (경영지원) 민인영 (스토리보드) 민윤영 (스토리보드) 김병서 (촬영B팀) 김정원 (촬영B팀) 김주연 (촬영B팀) 김양수 (촬영지원) 전홍규 (촬영지원) 이재필 (촬영지원) 정희재 JEONG Heejae (데이터매니저) 이상윤 (스테디캠) 임상수 (슈팅카) 삼일렉카 (슈팅카) 조성민 (촬영장비) 이석용 (촬영장비) 김경 (조명B팀) 조용준 (조명B팀) 이대종 (조명B팀) 김영호 (발전차) 무쇠발전기 (발전차) 김인수 (발전차) 나영옥 (발전차) 이종원 (발전차) 이기준 (조명크레인) 서대식 (조명크레인) 박성식 (조명장비) 전성호 (세트시공) 손나리 (의상팀) 최영주 (의상팀) 박유정 (헤어협찬) 이홍표 (무술감독) 박성규 (무술팀) 조원철 (무술팀) 허민 (무술팀) 양윤선 (촬영버스) 신덕규 (안무지도) 이미경 (캐스팅지원) 엄현숙 (캐스팅지원) 마이티마우스 (음악부문) 김이영 (음악부문) 방현승 (음악부문) 구자완 (음악부문) 김진하 (음악부문) 하근영 (음악부문) 오정수 (음악부문) 변주원 (음악부문) 서영준 (음향부문) 김기탁 (음향부문) 김용주 (음향부문) 김영호 (음향부문) 서재영 (음향부문) 안기성 (음향부문) 김기탁 (음향부문) 김재경 (음향부문) 최현규 (음향부문) 장성호 (시각효과부문) 박영수 (시각효과부문) 장원익 (시각효과부문) 김성태 (시각효과부문) 김현우 (시각효과부문) 성새롬 (시각효과부문) 신대용 (시각효과부문) 권오성 (시각효과부문) 이효진 (시각효과부문) 조혜령 (시각효과부문) 박철홍 (시각효과부문) 임주호 (시각효과부문) 이상욱 (시각효과부문) 채백호 (시각효과부문) 김영주 (시각효과부문) 김철민 (시각효과부문) 문인식 (시각효과부문) 유광현 (시각효과부문) 이영석 (시각효과부문) 문성오 (시각효과부문) 이태원 (시각효과부문) 박정훈 (시각효과부문) 송희권 (시각효과부문) 김상헌 (시각효과부문) 허영선 (시각효과부문) 이나경 (시각효과부문) 전현기 (시각효과부문) 안원모 (시각효과부문) 박준우 (시각효과부문) 유지은 (시각효과부문) 이종혁 (시각효과부문) 손오형 (시각효과부문) 안선영 (시각효과부문) 이선영 (시각효과부문) 김기서 (시각효과부문) 이지영 (시각효과부문) 김미다 (시각효과부문) 김진아 (시각효과부문) 장성호 (디지털처리부문) 이재선 (디지털처리부문) 육영선 (디지털처리부문) 양창길 (디지털처리부문) 손현일 (디지털처리부문) 이호우 (디지털처리부문) 김태성 (디지털처리부문) 신정민 (디지털처리부문) 김용범 (디지털처리부문) 김기문 (디지털처리부문) 최순호 (현상부문) 이용기 (현상부문) 박남석 (현상부문) 방종갑 (현상부문) 한충구 (현상부문) 김남준 (현상부문) 방원주 (현상부문) 신창호 (현상부문) 신영호 (현상부문) 박영준 (현상부문) 이대로 (현상부문) 황의돈 (현상부문) 이재헌 (현상부문) 신동명 (현상부문) 이종인 (현상부문) 이성근 (현상부문) 최창성 (현상부문) 박상철 (현상부문) 노종욱 (현상부문) 장강석 (현상부문) 이영헌 (현상부문) 박선화 (현상부문) 김양래 (현상부문) 김미중 (현상부문) 정윤홍 (배급부문) 김민호 (배급부문) 배형준 (배급부문) 임아영 (배급부문) 한민형 (배급부문) 한지선 (마케팅부문) 최정선 (마케팅부문) 박선주 (마케팅부문) 이효진 (마케팅부문) 김시내 (마케팅부문) 황혜임 (마케팅부문) 편두숙 (마케팅부문) 임하연 (마케팅부문) 전수진 (마케팅부문) 이전호 (포스터사진) 정광진 (예고편) 정유미 (예고편) 조이슬 (예고편) 유경선 (예고편) 김진희 (현장스틸) 김희선 (홈페이지) 김현영 (홈페이지) 이원희 (홈페이지) 최소연 (마케팅부문) 박정숙 (급식) 서대성 (매니저부문) 김장균 (매니저부문) 양현승 (매니저부문) 이상훈 (매니저부문) 임효욱 (매니저부문) 지영석 (매니저부문) 오준 (매니저부문) 김신영 (매니저부문) 김완수 (매니저부문) 정종원 (메이킹) 유용지 YOO Yong-ji (메이킹) 박봉욱 (보조출연) 강욱 (보조출연) 이상훈 (배역) 이상진 (배역) 이남규 (보험) 강진희 (로케이션지원) 진형성 (로케이션지원) 배상진 (로케이션지원) 김유형 (로케이션지원) 손동호 (로케이션지원) 임상수 (렉카) 삼일렉카 (렉카),배우/제작진 수상 이력@수상정보 테이블표@2011@제 9회 피렌체 한국영화제@후보@상영작 (김광식)@제 13회 우디네 극동영화제@후보@한국영화 (김광식)@제 33회 황금촬영상 시상식@수상@최우수 여우주연상 (정유미)@제 47회 백상예술대상@후보@영화 신인감독상 (김광식)@2010@제 18회 춘사영화제@수상@심사위원특별연기상 (박중훈)@후보@출품작 (김광식)@제 47회 대종상 영화제@후보@신인감독상 (김광식)@제 31회 청룡영화상@수상@신인감독상 (김광식)@제 8회 대한민국 영화대상@후보@각본상 (김광식)@후보@남우주연상 (박중훈)@후보@신인감독상 (김광식)@후보@여우주연상 (정유미),-,-,688639,Y_w4lMJa1P8
2010,2010 .05.27 개봉,영화,코미디,내 남자의 순이,김호준,https://movie-phinf.pstatic.net/20111223_57/13246147058853rjQ0_JPEG/movie_image.jpg,인생 역전 한방을 노리고 모든 것을 올인한 수상한 가족 세라 라미 광수와 사채업자 일당 춘배파의 50억 다이아몬드 ‘순이’ 쟁탈전을 그린 코미디.,국내,한국,q-fxsA0l1uU,여해 엔터테인먼트,새인컴퍼니,15세 관람가,91분,-,김태수 한철우 안석천 심원철 엄춘배 정경호 이태성 신이 박해미 ,  마상열 (각본) 김호준 (각색) 기노영 (프로듀서) 백홍철 (제작이사) 권오태 (제작부장) 김동균 (제작부) 방성민 (제작부) 곽지훈 (제작부) 송세욱 (제작부) 김명철 (제작) 윤제영 (제작) 임성현 (제작회계) 윤제영 (제작투자책임) 김명철 (공동투자) 조덕현 (공동투자) 김명철 (기획) 윤제영 (기획) 최병훈 (촬영부) 김진환 (촬영부) 정상범 (촬영부) 한두희 (촬영부) 김동은 (촬영) 김계중 (조명) 손영규 (조명부) 박상화 (조명부) 이상훈 (조명부) 오승엽 (조명부) 임대건 (조명부) 전근수 (그립) 윤중업 (그립) 장윤진 (그립) 정동락 (연출부) 홍기석 (연출부) 원진희 (연출부) 김영아 (스크립터) 김면지 (조감독) 신동원 (동시녹음) 김영호 (음향) 문창준 (붐오퍼레이터) 유준상 (붐어시스턴트) 조기원 (미술) 오인호 (세트) 이학석 (세트팀) 백혜성 (소품) 백혜성 (미술-소품팀) 지현숙 (미술-소품팀) 홍성학 (미술-소품팀) 이정용 (미술-소품팀) 이학석 (미술-소품팀) 김광수 (특수효과) 추광호 (특수효과) 김진호 (특수효과) 유주오 (특수효과) 오창원 (시각효과) 김혜연 (분장-헤어) 정경미 (의상) 윤석주 (현장편집) 이세훈 (편집보) 박순덕 (편집) 김재희 (편집) 김정민 (광고디자인) 김민지 (광고디자인) 최은영 (광고디자인) 박선민 (광고디자인) 장호중 (카스턴트) 강숙 (스토리보드) 윤구희 (촬영B팀) 이승규 (촬영B팀) 김동주 (촬영B팀) 노윤아 (촬영B팀) 김석진 (스테디캠) 백광규 (스테디캠) 박천복 (지미집) 오송도 (지미집) 홍승완 (지미집) 이학송 (스콜피오) 이상조 (스콜피오) 황용근 (스콜피오) 최주영 (스콜피오) 정훈 (GFM) 정일서 (GFM) 김용태 (GFM) 이현국 (GFM) 이재인 (카메라카) 최기훈 (카메라카) 양영민 (카메라카) 양경태 (촬영장비) 유재규 (조명B팀) 김동효 (조명B팀) 공정혁 (조명B팀) 손영규 (조명탑차) 박상화 (발전차) 김동주 (발전차) 김주열 (조명크레인) 신광대 (조명크레인) 장수연 (의상팀) 심보라 (의상팀) 정하나 (분장-헤어팀) 이유미 (분장-헤어팀) 김유형 (스튜디오) 박성식 (스튜디오) 손동오 (스튜디오) 김익성 (스턴트) 문정수 (스턴트) 권민석 (스턴트) 박순덕 (아비드편집) 김재희 (아비드편집) 이용기 (디지털처리) 신충섭 (디지털처리) 이강곤 (촬영버스) 박혜정 (마케팅부문) 김현정 (마케팅부문) 우창우 (마케팅부문) 손효색 (마케팅부문) 이경천 (마케팅부문) 최지성 (현장스틸) 이상욱 (포스터사진) 김동영 (배급부문) 주윤호 (배급부문) 김희연 (배급부문) 김태원 (배급부문) 한진희 (메이킹) 김동주 (배역) 안용진 (보험),-,-,-,10449,NmEjSeI3ol8
2010,2010 .08.05 개봉,영화,드라마,내 첫사랑을 너에게 바친다,신조 타케히코,https://movie-phinf.pstatic.net/20111223_205/1324633007453IeIl3_JPEG/movie_image.jpg,선천성 심장질환으로 인해 20세까지밖에 살 수 없다고 선고된 소년 다쿠마와 그 소년을 사랑한 동갑내기 소녀 마유 이 스토리는 그 두 사람의 8살 때부터 시작된다.@ 8살의 마유는 어느 날 아버지가 근무하는 병원에서 입원 생활을 보내는 다쿠마와 우연히 만난다. 호기심에 서로를 좋아하는 두 사람이지만 우연히 다쿠마가 선천성 심장질환 때문에 20세까지만 살 수 없는 것을 알아버린다. 충격으로 어린 두 사람은 덧없는 미래를 향해서 이루어질 수 없는 “약속”을 한다. “우리 어른이 되면 결혼하자”,해외,일본,47UcWC6_p8Y,(주)이모션 컨텐츠 네트워크,(주)마운틴픽쳐스,15세 관람가,122분,-,야마모토 가쿠 테레다 유키 스기모토 텟타 나카무라 토오루 모리구치 요코 쿠보타 마사타카 호소다 요시히코 호리우치 케이코 하라다 나츠키 오카다 마사키 이노우에 마오 ,  반도 켄지 Kenji Bando (각본) 아오키 코토미 Kotomi Aoki (원작자) 이케 요시히로 Yoshihiro Ike (음악) 가나카츠 히로카즈 Hirokazu Kanekatsu (아트디렉터) 후카자와 요시후미 Yoshifumi Fukazawa (편집),배우/제작진 수상 이력@수상정보 테이블표@2009@제 22회 도쿄국제영화제@후보@특별 초대작 (신조 타케히코),-,-,4297,P6rDtGrPiHY
2010,2010 .08.11 개봉,영화,"코미디, 가족, 판타지",내니 맥피 2 - 유모와 마법소동,수잔나 화이트,https://movie-phinf.pstatic.net/20111223_169/13246199111147mHjT_JPEG/movie_image.jpg,말썽꾸러기 세 남매 뒤치다꺼리하랴 도시에서 놀러 온 조카들 돌보랴 농장 지키랴 할 일이 산더미인 ‘미세스 그린’(메기 질렌할) 앞에 내니 맥피가 등장한다. 평범한 유모인 줄 알았는데 알고보니 놀라운 마법사인 그녀! 내니 맥피가 지팡이만 한 번 내리치면 다투던 아이들은 싸움을 멈추고 사촌과 침대를 나눠 쓰지 않으려는 아이도 코끼리와 한 침대에서 자게 된다. 내니맥피의 다섯 가지 교육을 받으며 달라진 아이들은 위기의 농장을 지키기 위해 일생 일대의 환상모험을 시작하게 되는데…,해외,영국 / 프랑스 / 미국,coUslLzeRkk,유니버설픽쳐스인터내셔널코리아,-,전체 관람가,109분,-,매기 스미스 빌 베일리 리스 이판 랄프 파인즈 매기 질렌할 엠마 톰슨 ,  엠마 톰슨 Emma Thompson (각본) 크리스티아나 브랜드 Christianna Brand (원작자) 팀 베번 Tim Bevan (제작) 린제이 도란 Lindsay Doran (제작) 에릭 펠너 Eric Fellner (제작) 데이비드 브라운 David Brown (공동제작) 리자 차신 Liza Chasin (기획) 데브라 헤이워드 Debra Hayward (기획) 엠마 톰슨 Emma Thompson (기획) 마이크 엘리 Mike Eley (촬영) 제임스 뉴튼 하워드 James Newton Howard (음악) 스티븐 프라이스 Steven Price (음악지원) 사이몬 엘리어트 Simon Elliott (미술) 수잔 오스틴 Suzanne Austin (아트디렉터) 빌 크루처 Bill Crutcher (아트디렉터) 닉 던트 Nick Dent (아트디렉터) 게리 조플링 Gary Jopling (아트디렉터) 재클린 듀런 Jacqueline Durran (의상) 심 에반-존스 Sim Evan-Jones (편집) 루시 베반 Lucy Bevan (배역),배우/제작진 수상 이력@수상정보 테이블표@2010@제 58회 산세바스티안국제영화제@후보@호라이즌 라틴부문 (수잔나 화이트),-,-,206674,kse93UAu9Yk
2010,2010 .02.08 개봉,영화,"코미디, 뮤지컬",네이키드 보이즈 싱잉,로버트 쉬록크  트로이 크리스찬,https://movie-phinf.pstatic.net/20111223_78/1324602835619duJws_JPEG/movie_image.jpg,미국 LA의 65석짜리 한 작은 극장에서 시작되어 뉴욕 브로드웨이에 입성 장기 롱런 공연에 이어 2008년 미국 LA의 헤이월스극장에서 10명의 배우들이 출연하는 뮤지컬 영화로 제작된 작품. 남성들의 솔직한 ‘성’ 이야기를 16곡의 멋진 음악과 배우들의 목소리 춤동작으로 연기했다.,해외,미국,t64FzuLdsE8,은석필름,은석필름,청소년 관람불가,83분,-,마이클 하보시 빈센트 자모라 살바토레 바살로 하 트루옹 케빈 알렉산더 스테 조 소자 안소니 매너그 피터 렘퍼트 조셉 킨 제이미스 호지스 데이비드 호킨스 말린 피셔 제이슨 커리 앤드류 블레이크 에이미스 ,  스티븐 베이츠 Stephen Bates (각본) 마리 케인 Marie Cain (각본) 쉘리 마크햄 Shelly Markham (각본) 데이빗 페브스너 David Pevsner (각본) 마크 세비지 Mark Savage (각본) 로버트 쉬록크 Robert Schrock (각본) 레이미 사이아로니 Rayme Sciaroni (각본) 트랜스 톰슨 Trance Thompson (각본) 브루스 빌란흐 Bruce Vilanch (각본) 마크 윙클러 Mark Winkler (각본) 제니퍼 쉐퍼 Jennifer Schaefer (Line PD) 커클랜드 티벨스 Kirkland Tibbels (제작) 다릴 앤더르 Darryl Anderle (공동제작) 일로 올리언스 Ilo Orleans (공동제작) 케미트 존스 Kermit Johns (기획) G. 스털링 진스미어 G. Sterling Zinsmeyer (기획) 트로이 크리스찬 Troy Christian (촬영) 제리 에반스 Jerry Evans (촬영) 로라 브로디 Laura Brody (의상) 트로이 크리스찬 Troy Christian (편집) 제리 에반스 Jerry Evans (편집),-,-,-,386,MRTBTlQExrc
2010,2010 .06.17 개봉,영화,"다큐멘터리, 드라마, 가족",노 임팩트 맨,로라 가버트  저스틴 쉐인,https://movie-phinf.pstatic.net/20111223_142/1324614990205xGwH8_JPEG/movie_image.jpg,작가이자 환경운동가인 ‘콜린’은 1년간 가족과 함께 지구에 무해(無害)한 생활을 하는 프로젝트를 시작하기로 결심한다. TV를 버리고 쇼핑을 끊고 대중교통을 이용하면서 시작된 이 프로젝트는 1년 365일 동안 점차 하기 힘든 행동으로 발전되며 가속화 된다. 지역에서 나온 농산물만 사먹기 전기 사용 안 하기 일회용품 사용 안 하기 쓰레기 배출 제로 등 지구를 앓게 하는 모든 것들을 간소화 시킨다. 그러나 시간이 지날수록 아내와 2살 된 딸은 점차 힘겨워하고 야심 차게 시작되었던 프로젝트는 위기를 맞게 되는데- 실수 연발 의견 충돌! 과연 그들은 이 프로젝트를 무사히 끝낼 수 있을까?,해외,미국,wAE94iJeRRk,시네마중심,KT&G 상상마당,전체 관람가,92분,-,미쉘 콘린 콜린 비밴 ,  로라 가버트 Laura Gabbert (제작) 토비 리스트 Tobey List (협력프로듀서) 다샤 톨스티코바 Dasha Tolstikova (협력프로듀서) 저스틴 쉐인 Justin Schein (촬영) 바비 존스턴 Bobby Johnston (음악) 매튜 마틴 Matthew Martin (편집),배우/제작진 수상 이력@수상정보 테이블표@2010@제 13회 시네맘비엔터 환경 영화제@후보@특별 이벤트 (로라 가버트 외 1명)@제 5회 부산국제어린이청소년영화제@후보@해외초청작 (로라 가버트 외 1명)@제 7회 서울환경영화제@후보@액션! 지구를 지켜라 (로라 가버트)@2009@제 29회 하와이국제영화제@후보@상영작 (로라 가버트)@제 25회 선댄스영화제@후보@스펙트럼 (로라 가버트 외1명),-,-,-,-
2010,2010 .09.09 개봉,영화,"코미디, 드라마, 뮤지컬",노다메 칸타빌레 Vol.1,타케우치 히데키,https://movie-phinf.pstatic.net/20111223_135/1324622932462Vmpg4_JPEG/movie_image.jpg,세계 무대를 향한 큰 꿈을 안고 파리에 온 노다메(우에노 쥬리)와 치아키(타마키 히로시). 형편 없는 실력으로 붕괴 직전인 말레오케스트라의 상임지휘자가 된 치아키는 급한 공연을 앞두고 노다메에게 연주를 부탁한다. 드디어 치아키와 협연을 한다는 생각에 날아갈 듯 기뻐하는 것도 잠시 유명 피아니스트 루이(야마다 유)가 그 자리를 대신하게 되고 노다메는 쓸쓸하게 공연장을 떠난다. 드디어 코앞으로 다가온 공연날 치아키는 또다시 환상적인 공연을 선보일 수 있을까? 노다메가 그토록 바라는 치아키와의 협연은 언제쯤 가능해질까?@ 니노미야 토모코 의 동명 인기 만화를 우에노 쥬리 타마키 히로시 주연으로 드라마화 하여 폭발적인 인기와 함께 클래식 붐을 일으켰던 <노다메 칸타빌레> 극장판 2부작의 전편이다. 피아노에 남다른 재능을 가졌지만 독특한 사고방식의 노다 메구미와 지휘자를 꿈을 갖고있는 엘리트 음대생 치아키 신이치의 알콩달콩한 사랑을 중심으로 이야기가 전개된다. 유럽으로 유학을 떠난 노다메와 치아키를 그렸던 특집극의 속편으로 출발하며 프랑스 체코 슬로바키아 러시아 등 해외로케 촬영도 가미되었다. 감독은 역시 TV판의 연출을 맡았던 타케우치 히데키. 2009년 12월 19일 일본 개봉. (gloomyeyes님),해외,일본,2mPyiJxgc0g,미로비젼  아뮤즈코리아,미로비젼  아뮤즈코리아,전체 관람가,121분,-,나다기 타케시 다케나카 나오토 후쿠시 세이지 키치세 미치코 타니하라 쇼스케 야마다 유 야마구치 사야카 벡키 코이데 케이스케 미즈카와 아사미 에이타 타마키 히로시 우에노 주리 ,  에토 린 Rin Eto (각본) 니노미야 토모코 Tomoko Ninomiya (원작자) 마에다 큐칸 Kyukan Maeda (프로듀서) 와다쿠라 카즈토시 Kazutoshi Wadakura (프로듀서) 카메야마 치히로 Chihiro Kameyama (제작) 야마모토 히데오 Hideo Yamamoto (촬영) 오노 아키라 Akira Ono (조명) 카키자와 키요시 Kiyoshi Kakizawa (음향) 시바타 신이치로 Shinichiro Shibata (미술) 마틴 맬리 Martin Maly (아트디렉터) 마츠오 히로시 Hiroshi Matsuo (편집) 라딤 박 Radim Bak (세트) 백클레브 싱컬 Vaclav Sinkule (세트) 페트라 스바린스카 Petra Svarinska (배역),-,-,-,75847,-
2010,2010 .10.21 개봉,영화,드라마,노라 없는 5일,마리아나 체닐로,https://movie-phinf.pstatic.net/20111223_287/13246227841646jxyp_JPEG/movie_image.jpg,그녀가 남기고 간 것은 영원한 사랑이었습니다.@ 20년 전 이혼했지만 전남편 호세의 맞은편 아파트에 살고 있는 노라. 그녀는 큰 명절을 앞두고 10인용 식탁에 새하얀 레이스 식탁보를 깔고 정갈한 하얀 접시와 윤기 나는 와인잔을 올려놓는다. 잠시 망원경으로 맞은편에 사는 호세를 바라보던 노라는 정성껏 준비한 요리재료들을 꼼꼼히 적은 레시피와 함께 냉장고에 넣어둔다. 그리고 마지막으로 몇 통의 초대전화를 돌린다.@ 다음날 초대받은 가족과 친구들은 영문도 모른 채 반가운 마음으로 하나 둘 모이기 시작하는데… 그 자리에 노라는 보이지 않는다. 침대 밑에 떨어진 사진 한 장이 호세에게 발견되면서 노라의 만찬 계획은 의도치 않은 방향으로 흐르고 예상치 못한 사건들이 노라 없는 5일 동안 펼쳐지는데…,해외,멕시코,cbgMwrYqRvQ,프리비전,프리비전,15세 관람가,91분,-,세실리아 수아레즈 아란차 모레노 후안 파블로 메디나 퍼민 마르티네즈 마틴 라살레 마리나 데 타비라 후안 카를로스 콜롬보 엔리크 아레올라 베로니카 랑헤르 막스 켈로우 안젤리나 페라에즈 아리 브릭맨 페르난도 루한 ,  마리아나 체닐로 Mariana Chenillo (각본) 마리아나 체닐로 Mariana Chenillo (제작) 로라 임퍼리얼 Laura Imperiale (제작) 알레한드로 가르시아 Alejandro Garcia (미술) 마리아나 체닐로 Mariana Chenillo (편집) 오스카 피구에로아 Oscar Figueroa (편집) 알레한드로 레자 Alejandro Reza (배역),배우/제작진 수상 이력@수상정보 테이블표@2009@제 25회 바르샤바 국제영화제@후보@상영작 (마리아나 체닐로)@제 28회 벤쿠버국제영화제@후보@관객상 (마리아나 체닐로)@제 31회 모스크바 국제 영화제@수상@감독상 (마리아나 체닐로)@후보@모스크바 행복감 (마리아나 체닐로),-,-,-,NwUZv0HeAAU
