year,release_date,category,genre,title,creator,title_image,introduction,country_category,country_name,video,production,distribution,grade,runtime,remake,cast,staff,awards,series,soundtrack,amount,ref_video,,,,,,,,,,,,,,
2002,2002 .12.31 개봉,영화,"액션, 모험, 스릴러",007 어나더 데이,리 타마호리,https://movie-phinf.pstatic.net/20111222_159/1324480503143RIyf1_JPEG/movie_image.jpg,"모든 것이 베일에 싸인 동토의 제국 북한, 그곳에도 평화를 원하는 온건파의 노력은 있다. 하지만 이러한 것이 전세게를 위협하고자하는 알 수 없는 세력에 의해 위협받고 세계평화를 위협할만한 초강력 신무기가 등장한다. 이것이 실험되고 있는 아이슬랜드로 가게된 007은 모든 사건의 시발점이 된 강력한 적과 마주치게 되는데.@  북한 내 무기밀매 현장에 위장 잠입해 비밀 임무를 수행하던 제임스 본드는 강경파 일원인 문대령과 자오를 만나게 된다. 그러나 본드는 자오에 의해 정체가 발각되어 북한군에게 포로로 잡히고, 그와 대결하던 문대령은 목숨을 잃는다. 수개월 후, 제임스 본드는 포로협상으로 풀려나지만 정보누설 혐의로 영국 정보국에 의해 모든 지위를 박탈당한다. 홍콩과 쿠바, 런던 등을 오가며 베일에 싸인 배신자의 정체를 찾아 나선 그는 배후에 자오의 음모가 도사리고 있음을 직감하고 혼자서 해결하기로 한다.@  그러던 중 사건의 열쇠를 쥔 신비의 여인 징크스를 만나고, 전세계를 파멸로 몰아넣을 놀라운 신무기가 개발되고 있다는 사실을 알게 된다. 이에 단서를 추적하던 제임스 본드는 베일에 쌓인 백만장자 구스타프의 존재를 확인하고, 그의 본거지인 아이슬란드의 얼음궁전으로 향한다. 그곳에서 자오와 맞닥뜨린 제임스 본드는 구스타프 일당이 개발한 엄청난 위력의 인공위성 이카루스의 정체를 파악한다. 구스타프의 세계 지배 야욕을 확인한 제임스 본드는 최후의 일전을 치르기 위해 징크스와 함께 DMZ로 향하는데..",해외,영국 / 미국,https://www.youtube.com/watch?v=9UCBLPtNRQg,이십세기폭스코리아(주),이십세기폭스코리아(주),15세 관람가,133분,-,로자먼드 파이크 토비 스티븐스 할리 베리 피어스 브로스넌 ,  닐 퍼비스 Neal Purvis (각본) 로버트 웨이드 Robert Wade (각본) 이안 플레밍 Ian Fleming (원작자) 마이클 G. 윌슨 Michael G. Wilson (제작) 바바라 브로콜리 Barbara Broccoli (제작) 칼럼 맥도갈 Callum McDougall (공동제작) 안소니 웨이 Anthony Waye (기획) 데이빗 테터살 David Tattersall (촬영) 빅 암스트롱 Vic Armstrong (조연출) 데이비드 아놀드 David Arnold (음악) 피터 라몬트 Peter Lamont (미술) 크리스 코보울드 Chris Corbould (특수효과) 마크 생어 Mark Sanger (시각효과) 다니엘 클레인맨 Daniel Kleinman (타이틀디자인) 린디 헤밍 Lindy Hemming (의상) 크리스찬 와그너 Christian Wagner (편집) 조지 아귈라 George Aguilar (스턴트) 데비 맥윌리엄스 Debbie McWilliams (배역),배우/제작진 수상 이력@수상정보 테이블표@2003@제 14회 유바리국제판타스틱영화제@후보@초청영화 (리 타마호리)@제 23회 골든 라즈베리 시상식@수상@최악의 여우조연상 (마돈나)@제 60회 골든 글로브 시상식@후보@주제가상 (마돈나)@제 12회 MTV 영화 & TV 어워즈@후보@최고의 여자배우상 (할리 베리),-,-,      -,https://www.youtube.com/watch?v=9UCBLPtNRQg,,,,,,,,,,,,,,
2002,2002 .04.12 개봉,영화,"공포, 미스터리, 스릴러",13 고스트,스티브 벡,https://movie-phinf.pstatic.net/20111222_174/1324553959939O56Bd_JPEG/movie_image.jpg,"어둠이 깊게 드리운 거대한 폐차장, 사이러스 일행은 12번째 가장 강력한 힘을 지닌 악령 저그넛을 유인하고 있다. 죽기 전 아홉을 헤치우고 죽은 후 악령으로 부근을 떠돌며 사십여명을 헤친 저그넛을 부르기 위해 몇십톤의 피가 주위에 뿌려지게 되고..@  얼마 후 영매자 레프킨은 강한 살기를 느끼게 된다. 그리고 순식간에 그곳을 지키던 요원들은 보이지 않는 존재에 의해 사지가 절단되며 하나씩 죽어가는데- 자신을 미끼로 봉인 장치에 저그넛을 유인하는 레프킨은 봉인에 성공하지만 이미 거대한 폐차장은 검붉은 피와 비명으로 넘쳐난다.@  삼촌 사이러스의 부고를 전해들은 아서는 유산을 남겼다는 말에 의아해 하지만 화재로 아내와 재산을 잃은 처지라 반가움이 더한다. 일행이 행복에 빠져있는 순간, 전기공사 인부를 가장해 저택에 침입한 영매자 레프킨은 아서에게 이곳에 악령이 있으니 모두 피해야 한다고 외치고, 그사이에 변호사는 유유히 사라진다.@  지하로 성큼성큼 들어서는 변호사는 정체를 알수 없는 투명한 안경을 꺼내어 쓴다. 그러자 각각의 봉인 장치에 의해 갇힌 끔찍한 모습의 분노한 영혼들이 보이기 시작한다. 태연하게 그들 사이를 지나 자신이 찾아 헤맨 돈가방을 집어드는 순간, 가방의 무게에 의해 고정되어있던 저택의 제어장치는 서서히 움직이기 시작하는데- 그 순간 저택의 모든 출입구는 모양을 바꾸며 흔적도 없이 사라져 버린다. 갇혀버린 아서 일행에게는 알 수 없는 두려움이 엄습하고- 이때 분노한 영혼들은 하나씩 봉인에서 풀리며 끔찍한 죽음이 닥쳐오게 되는데.",해외,미국 / 캐나다,https://www.youtube.com/watch?v=ItOuomMxUho,콜럼비아트라이스타,콜럼비아트라이스타,15세 관람가,91분,-,매튜 해리슨 F. 머레이 아브라함 라 디가 JR 보른 알렉 로버츠 섀넌 엘리자베스 매튜 릴라드 엠베스 데이비츠 토니 샬호브 ,  벤자민 카 Benjamin Carr (각본) 리처드 도비디오 Richard D'Ovidio (각본) 롭 화이트 Robb White (원안) 길버트 아들러 Gilbert Adler (제작) 조엘 실버 Joel Silver (제작) 로버트 저메키스 Robert Zemeckis (제작) 테리 캐슬 Terry Castle (공동제작) 리차드 미리쉬 Richard Mirisch (공동제작) 댄 크라치올로 Dan Cracchiolo (기획) 스티브 리처즈 Steve Richards (기획) 게일 태터샐 Gale Tattersall (촬영) 존 프리젤 John Frizzell (음악) 숀 하그리브즈 Sean Hargreaves (미술) 도미니크 파쿠엣-르메이트리 Dominique Fauquet-Lemaitre (세트) 팀 비치 Tim Beach (아트디렉터) 돈 맥콜리 Don Macaulay (아트디렉터) 제니 걸렛 Jenni Gullett (의상) 데릭 브리친 Derek Brechin (편집) 에드워드 A. 워쉴카 Edward A. Warschilka (편집) 크리스틴 쉑스 Christine Sheaks (배역),-,-,-,-,https://www.youtube.com/watch?v=kpJHd__bwug,,,,,,,,,,,,,,
2002,2002 .02.01 개봉,영화,"SF, 액션",2009 로스트 메모리즈,이시명,https://movie-phinf.pstatic.net/20111222_176/132451641962182fbA_JPEG/movie_image.jpg,"동아시아 일대는 '일본제국'이라는 이름 하에 '대동아 공영권'으로 재 통합 된지 이미 100년의 시간이 흘렀으며, 이제 조선이라는 이름은 지구상 어디에도 자취를 잃은 지 오래다. 그러나- 정체를 알 수 없는 반정부 레지스탕스 후레이센진들과 모든 음모의 원흉인 이노우에 재단 사이의 싸움은 아직 끝나지 않았다.@  일본 제3도시 서울. 반정부 레지스탕스 후레이센진(不令鮮人)들이 정계의 거물급 인사 이노우에가 주최하는 유물 전시장에 침투, 파티장을 순식간에 아수라장으로 만든다. 이 테러를 진압하기 위해 JBI(Japan Bureau of Investigation) 특수 수사 요원 사카모토 마사유키(장동건 분)와 그의 절친한 친구 사이고 쇼지로(나카무라 토루 분)가 투입된다. 테러는 발생 10분만에 완전 진압되지만, 사카모토는 비정치적 전시 행사를 습격한 이들의 불분명한 테러 목적과 단 한명의 민간인 희생자도 없는 절묘한 테러 방식에 의문을 품게 된다. 이 테러 사건의 면밀한 재조사를 주장하는 사카모토는 사건을 축소 은폐시키려는 JBI 수뇌부들과 갈등 하게 된다. 사카모토는 독단적으로 수사를 감행하고, 후레이센진들이 지속적으로 이노우에 재단과 관련된 테러를 벌여왔다는 사실을 알게 된다. 그리고 동시에 이 사건들의 배후에는 거물급 정계인사 이노우에의 음모가 숨어있음을 발견하게 된다. 그러나 JBI 수뇌부들은 이런 사카모토의 주장을 묵살, 정직처분까지 내리고, 그의 친구 사이고마저 사카모토에게 수사 중단을 강권한다.@  혼자서 후레이센진들의 조직을 파헤쳐나가던 사카모토는 급기야 JBI의 조작극에 의해 동료 경찰 살해라는 누명까지 쓴 채 체포되고 사이고의 도움으로 가까스로 탈출을 감행하지만 심한 부상을 입고 만다. 거기다 유일한 친구 사이고 마저 다시 만날 땐 총구를 겨눌 수 밖에 없을 거라는 말까지 남긴 채 사카모토를 떠난다. 부상을 입고 거리를 헤매던 사카모토는 자신도 모르는 사이 후레이센진들의 아지트까지 흘러 들어가고- 그리고 마침내 후레이센진과 이노우에 재단을 둘러싼 거대한 음모의 진상을 알게 되는데-",국내,한국,https://www.youtube.com/watch?v=0fwV4kVEFqw,"튜브엔터테인먼트 , CJ 엔터테인먼트",-,12세 관람가,134분,-,카세 신이치 카츠베 노부유키 미츠이시 켄 조상건 다이몬 마사아키 안길강 천호진 서진호 나카무라 토오루 장동건 ,  이시명 (각본) 이상학 (각본) 현남섭 (각본) 복거일 (원안) 나카타 신이치로 Shinichiro Nakata (Line PD) 정민우 (총괄프로듀서) 조우주 조진호 (제작책임) 김윤영 (프로듀서) 서준원 (프로듀서) 양시영 (프로듀서) 권준형 (제작실장) 정철우 (제작부장) 염동복 (제작부) 김영찬 (제작부) 김민경 (제작부) 임영주 (제작부) 이준 (제작부) 김태영 (제작) 인디컴 Indecom (제작) 류수철 (제작관리) 김승범 (제작투자) 드림디스커버리 창업투자 (공동제공) 제일다이렉트 (공동제공) 김익상 (기획) 고형욱 (기획) 김재용 (기획진행) 이봉주 (촬영부) 박현철 (촬영) 남진아 (조명) 이상학 (조연출) 남주근 (조연출) 김영진 (연출부) 노승수 (연출부) 이기훈 (연출부) 박소영 (연출부) 윤금순 (스크립터) 안상호 (동시녹음) 윤종민 (녹음) 이동준 Dong-jun Lee (음악) 김기철 (미술) 강소영 (미술) 이현주 (미술팀) 정도안 (특수효과) 이석연 (특수효과) 장성호 (특수효과) 이서진 (분장-헤어) 김진우 (의상) 경민호 (편집) 김광수 (무술연출) 신대용 (시각효과부문) 김승혁 (시각효과부문) 박종근 (녹음부) 이주언 Juaen Lee (액션팀),배우/제작진 수상 이력@수상정보 테이블표@2005@제 1회 한일영화제@후보@장동건/송강호 DAY (이시명)@2002@제 25회 황금촬영상 시상식@수상@신인감독상 (이시명)@제 39회 대종상 영화제@수상@남우조연상 (나카무라 토오루)@수상@시각효과상 (장성호)@수상@신인감독상 (이시명)@수상@음향기술상 (이규석.안상호)@제 23회 청룡영화상@수상@기술상 (장성호)@후보@신인감독상 (이시명),-,-,-,https://www.youtube.com/watch?v=HLWtOacOW74,,,,,,,,,,,,,,
2002,2002 .10.18 개봉,영화,"코미디, 액션",2424,이연우,https://movie-phinf.pstatic.net/20111222_212/1324507310634baCOF_JPEG/movie_image.jpg,"일자무식 단순극치, 잔머리만 살아 도는 마약밀매단 넘버 2 박태호(전광렬 분)가 300억 짜리 ‘물건’을 고추장 단지 속에 꼭꼭 숨겨 해외로 이사를 간다. 조직 소탕에 혈안이 된 검찰은 이삿짐센터 직원으로 위장 잠입, ‘결정적 증거’를 잡는다는 계획을 세우는데- 작전명 2424!@  문제는 사고뭉치 초짜 검사 최두칠(정웅인 분)! 기를 쓰고 작전에 지원하더니 적지에 들어서기 무섭게 이삿짐을 하나 둘씩 작살내고 만다. 물증은 고사하고, 박태호의 담배 심부름에 온 동네 뛰어다니기 바쁜 최두칠, 설상가상 진짜 이삿짐 센터 사장 한익수(김래원 분)와 싸움까지 붙어 눈썹을 몽땅 날리는 아픔까지 겪는데-@  좌충우돌 고군분투 끝에 간신히 이삿짐 트럭을 통째로 빼돌리는 데 성공한 검찰팀, 하지만 문제의 단지 속에서 나온 것은 100% 조선된장 뿐! 아무도 모르게 사라진 300억 짜리 ‘물건’. 박태호 역시 무소식 깜깜 ‘물건’의 행방을 찾기 위해 아파트를 뒤엎기 시작하는데-",국내,한국,https://www.youtube.com/watch?v=YwS9FiYfbu8,"JR픽처스 , JR 픽쳐스","CJ 엔터테인먼트 , CJ 엔터테인먼트",15세 관람가,105분,-,조영호 송기훈 맹봉학 김은정 안내상 이상인 박성진 박재웅 정경호 한필수 김세형 주현 예지원 소유진 김래원 정웅인 전광렬 ,  김형진 (각본) 윤학렬 (각색) 박기복 (각색) 김경세 (각색) 이연우 (각색) 정연욱 (제작총지휘) 김삼진 (프로듀서) 김삼진 (프로듀서) 전용석 (프로듀서) 장지현 (제작부장) 안창국 (제작) 이민주 (제작관리부문) 안창국 (기획) 조현경 (기획진행) 이현주 (기획진행) 최진규 (촬영부) 한태용 (촬영부) 송혜경 (촬영부) 김시백 (촬영부) 김봉조 (촬영부) 방수용 (촬영부) 박재홍 (촬영부) 누학수 (촬영부) 태영진 (촬영부) 서기원 (촬영부) 박종철 (촬영부) 김문수 (촬영부) 최진규 (촬영부) 최정순 (촬영부) 김윤창 (촬영부) 여경보 (촬영부) 김민수 (촬영부) 함순호 (촬영) 이철오 (조명) 이주열 (조명부) 한중대 (조명부) 노은호 (조명부) 유혁준 (조명부) 민병희 (조명부) 문상용 (조명부) 송윤주 (스크립터) 이찬 (조감독) 박용집 (조감독) 권희철 (조감독) 안현숙 (조감독) 김대준 (조감독) 정욱창 (동시녹음) 손무현 (음악) 김효신 (미술) 신영진 (미술팀) 엄미선 (미술팀) 강창길 (세트) 김현주 (세트팀) 차주상 (소품) 나승현 (소품팀) 한창우 (소품팀) 김병기 (특수효과) 이현우 (특수효과팀) 진현용 (분장) 심향화 (분장팀) 김경민 (분장팀) 이지영 (의상) 고정표 (현장편집) 고임표 (편집) 최현숙 (네가편집) 조세영 (네가편집) 윤수정 (카피라이터) 전문식 (무술감독) 김형석 (음악부문) 캔 (음악부문) 이종원 (음악부문) 배기성 (음악부문) 박지운 (스토리보드) 임선예 (스토리보드) 최유미 (의상팀) 김세정 (아비드편집) 우희정 (시각효과부문) 조한진 (시각효과부문) 박기원 (시각효과부문) 이성석 (시각효과부문) 조용석 (시각효과부문) 임수환 (시각효과부문) 장덕수 (시각효과부문) 김용우 (시각효과부문) 박선형 (시각효과부문) 채우라 (시각효과부문) 여대영 (시각효과부문) 송병준 (음향부문) 이영수 (음향부문) 문기식 (음향부문) 이준배 (음향부문) 조계화 (음향부문) 김재경 (음향부문) 김종석 (예고편) 조창완 (예고편) 김응균 (홈페이지) 홍상석 (무술팀) 전상준 (무술팀) 안갑용 (무술팀) 배재일 (무술팀) 백경찬 (무술팀) 이재웅 (무술팀) 김신웅 (무술팀) 금종택 (무술팀) 강현주 (무술팀) 차재근 (무술팀) 한지빈 (무술팀) 권삼욱 (무술팀) 김진이 (마케팅부문) 김민지 (마케팅부문) 채봉의 (마케팅부문) 안진의 (마케팅부문) 신유미 (마케팅부문) 임영주 (마케팅부문) 박소연 (마케팅부문) 유경화 (마케팅부문) 포트폴리오 (마케팅부문) 하영은 (마케팅부문) 유경화 (프로모션) 이진은 (프로모션) 류재형 (현장지원) 조계환 (사운드팀) 임선애 (스토리보드) 이규엽 (메이킹) 박선익 (메이킹) 안창화 (배역) 장덕진 (로케이션지원),-,-,-,-,https://www.youtube.com/watch?v=1De7TZRmPlY,,,,,,,,,,,,,,
2002,2002 .05.17 개봉,영화,"멜로/로맨스, 코미디, 드라마",40 데이즈 40 나이트,마이클 레만,https://movie-phinf.pstatic.net/20111223_209/1324637166491oCS4G_JPEG/movie_image.jpg,"매트 설리(Matt Sullivan: 죠시 하트넷 분)은 평범한 20대의 웹디자이너이다. 어느날, 부자와 결혼하기 위해 애인 니콜(Nicole: 바네사 쇼 분)이 매트를 차버리게 되자, 그의 일상은 어느새 엉망진창이 되어버린다. 게다가 주체할 수 없는 성욕으로 마음의 평정까지 잃어가던 매트는 신부인 형(John Sullivan: 아담 트리즈 분)을 찾아가 고민을 상담하던 중 부활절에 앞서 40일간의 금욕 생활을 하는 사순절을 따라서 40일 동안 섹스없이 지내기로 결심한다. 어떤 여자와도 키스도 스킨쉽도 없이 장장 40일간의 멀고도 험한 금욕 생활을 선언한 바로 그날 저녁 매튜는 우연히 들른 빨래방에서 자신의 이상형의 여인 에리카((Erica Sutton: 섀닌 소사몬 분)를 만나게 된다. 매튜의 금욕 소식을 듣게 된 여자 동료들은 오히려 매튜와 섹스를 하기 위해 대담한 포즈로 유혹을 하게 되고, 남자 동료들은 인터넷에 그의 섹스일 맞추기 도박 게임을 만들어 공개적으로 내기를 시작한다. 섹스없이 40일간의 약속을 지키려는 매튜와 그를 섹스로 이끌려는 동료들간의 포복절도할 공방이 벌어지는데.",해외,미국,https://www.youtube.com/watch?v=BDhCnRoAtM4,-,-,청소년 관람불가,94분,-,폴로 코스탄조 비네사 쇼 샤닌 소세이먼 조쉬 하트넷 ,  롭 페레즈 Rob Perez (각본) 팀 베번 Tim Bevan (제작) 에릭 펠너 Eric Fellner (제작) 마이클 런던 Michael London (제작) 스튜어트 M. 베저 Stuart M. Besser (공동제작) 리자 차신 Liza Chasin (기획) 데브라 헤이워드 Debra Hayward (기획) 엘리어트 데이비스 Elliot Davis (촬영) 롤페 켄트 Rolfe Kent (음악) 샤론 세이모어 Sharon Seymour (미술) 질 M. 오하네슨 Jill M. Ohanneson (의상) 니콜라스 C. 스미스 Nicholas C. Smith (편집) 숀 코시 Sean Cossey (배역) 조세프 미들톤 Joseph Middleton (배역),-,-,-,       ,https://www.youtube.com/watch?v=cDzNU82JmS0,,,,,,,,,,,,,,
2002,2002 .05.17 개봉,영화,"코미디, 액션",4발가락,계윤식,https://movie-phinf.pstatic.net/20111222_146/1324560710316M3gqQ_JPEG/movie_image.jpg,"아우디(허준호 분), 르까프(이창훈 분), 각그랜져(박준규 분), 해태(이원종 분), 우리의 4발가락은 광주 고등학교 시절부터 죽이 잘 맞는 한 주먹 하는 친구들로서, 의리에 살고 의리에 죽는 의형제로 통한다. 고등하교 때부터 공부를 잘 했던 르까프는 졸업과 함께 서울로 올라가게 되고, 나머지 친구 3명도 각기 다른 보스 밑에서 힘든 밑바닥 갱스터 생활을 이겨 나가며, 서서히 그 영향력을 키워나가 자신들의 서울 입성 기회를 잡게 된다. 광주에서 자라난 이들에게 서울 땅은 결코 만만한 곳은 아니었지만, 어린 시절부터 똘똘 뭉친 4발가락 친구들은 서로에게 힘이 되어 주며, 어느 한 구역을 책임지고 관할할 정도의 중간 급 보스로 성장해 나간다. 서울에서의 안정적인 갱스터 생활과 함께 미래에 대한 고민도 함께 커져만 갔던 평온하고 조용했던 폭풍전야 어느 날.@  4발가락 친구들은 서울 바닥 중간 급 보스들(4발가락, 곰탕, 쑤시게, 도대체, 삑사리 등)이 모두 참석하는 홍두깨(정성모 분) 주체의 모임에서 강남 요지 호텔 건립에 따른 반대세력 제거 작업을 위한 심각한 모의를 하게 되고, 서울 지역 중간 보스 급인 4발가락과 그들의 라이벌인 역4인방 패거리는 ‘금도끼, 은도끼’와 얽힌 전설에 얽매이게 되면서 서로간 심각한 상황으로 대립하게 된다. 금도끼를 찾으려는 자와 은도끼를 찾으려는 자의 대결 구도 속에서, 4발가락은 금도끼를 지킬 수 있을 것인가?",국내,한국,https://www.youtube.com/watch?v=HnP86WC8gY8,파이시스 필름,에스에스원시네마,청소년 관람불가,104분,-,이한갈 박승호 안석환 정성모 김갑수 고구마 정은표 이원종 박준규 이창훈 허준호 ,  계윤식 (각본) 최희대 (각색) 이정선 (각색) 김대영 (프로듀서) 나용국 (제작실장) 조성욱 (제작부장) 김성훈 (제작부장) 서세원 (공동제작) 김대영 (기획) 이유찬 (기획) 하금선 (기획) 양희만 (촬영) 김일준 (조명) 임춘택 (조연출) 김대범 (조연출) 김완섭 (조연출) 강현구 (조연출) 김홍천 (조연출) 여운철 (조연출) 남정화 (조연출) 문정미 (스크립터) 유대현 (음향) 신윤철 (음악) 고구마 (음악) 정선문 (음악) 손경호 (음악) 오상만 (미술) 최기호 (미술) 이창만 (특수분장) 김태용 (특수효과) 박예리 (분장) 권유진 (의상) 김다정 (의상) 최정민 (현장편집) 고임표 (편집) 원진 (무술연출),-,-,-,-,https://www.youtube.com/watch?v=eIF58HuT7Qw,,,,,,,,,,,,,,
2002,2002 .06.06 개봉,영화,"액션, 코미디",51번째 주,우인태,https://movie-phinf.pstatic.net/20111221_156/1324469874472cHSWg_JPEG/movie_image.jpg,"캘리포니아 약학 대학을 수석으로 졸업하고 성공의 아우토반을 보장 받은 맥클로이(사무엘 잭슨)는 대학 졸업식날 마약 제조 혐의로 모든 사회적 자격과 지위를 박탈 당한다. 그리고 30년 후, 마약 거래상 리자드 밑에서 약사가 아닌 마약 제조자로서 명성을 떨치며 새로운 인생을 살고 있던 맥클로이는 지금껏 단 한번도 경험하지 못한 환각의 신소재 마약 개발에 성공한다. 코카인보다 51배 강하고, 엑시터시보다 51배 자극적인 마약으로 사람의 기억마저 마비시킬 환각의 위력을 지닌 pos51 서서히 드러나게 되는데.@  리자드는 pos51을 두고 영국의 최대 마약 거래상 듀란과의 거래를 시도한다. 하지만 유일한 마약 공식을 알고 있는 맥클로이는 거래 뒤에 또 다른 작품을 준비한다. 거래당일, 듀란과 맥클로이는 나타나지 않고 약속장소는 송두리째 폭파된다. 가까스로 목숨을 구한 리자드는 자신을 속인 맥클로이에게 분노하고 완벽한 실력에 미모까지 갖춘 킬러 에밀리에게 그를 처지할 것을 명령한다. 이 사실을 전혀 눈치 채지 못한 맥클로이는 유유히 새로운 거래를 위해 51번째주 영국으로 떠나는데.@  영국에 도착한 맥클로이는 직접 마약 거래상 듀란과 거래를 벌이려 하지만 그를 주시하고 있던 킬러 에밀리에 의해 거래장소는 쑥대밭으로 변하고, 듀란마저 목숨을 잃는다. 가까스로 목숨을 구한 맥클로이는 지하 세계에 밝은 펠릭스(로버트 칼라일)와 손을 잡고 또 다른 마약상과 거래를 시도한다. 하지만 자신을 쫓는 킬러가 펠릭스의 옛 연인이었던 사실이 드러나면서, 맥클로이는 뛰어난 재능을 이용하여 킬러와 위험한 협상을 벌이는데.",해외,미국 / 캐나다 / 영국,https://www.youtube.com/watch?v=BNQbaLeI2gU,미디어필림인터내셔날,필름뱅크,청소년 관람불가,92분,-,릭키 톰린슨 숀 퍼트위 에밀리 모티머 로버트 칼라일 사무엘 L. 잭슨 ,  스텔 파브로우 Stel Pavlou (각본) 조나단 데빈 Jonathan Debin (제작) 앤드라스 하모리 Andras Hamori (제작) 말콤 콜 Malcolm Kohll (제작) 시튼 맥린 Seaton McLean (제작) 데이빗 펍케위츠 David Pupkewitz (제작) 마크 앨드리지 Mark Aldridge (공동제작) 스텔 파브로우 Stel Pavlou (공동제작) 스테파니 데이비스 Stephanie Davis (기획) 사무엘 L. 잭슨 Samuel L. Jackson (기획) 엘리 셀던 Eli Selden (기획) 줄리 실버먼 Julie Silverman (기획) 반항생 (촬영) 헤드릴러즈 Headrillaz (음악) 캐스퍼 케드로스 Casper Kedros (음악) 다리어스 케드로스 Darius Kedros (음악) 아비 르랜드 Abi Leland (음악) 댄 로즈 Dan Rose (음악) 앨런 맥도널드 Alan MacDonald (미술) 케이트 카린 Kate Carin (의상) 호대위 (편집) 니나 골드 Nina Gold (배역),-,-,-,-,https://www.youtube.com/watch?v=O2X7eQP9Yoo,,,,,,,,,,,,,,
