year,release_date,category,genre,title,creator,title_image,introduction,country_category,country_name,video,production,distribution,grade,runtime,remake,cast,staff,awards,series,soundtrack,amount,ref_video
2010,2010 .02.04 개봉,영화,"드라마, 판타지",리키,프랑소와 오종,https://movie-phinf.pstatic.net/20111223_69/1324602269238FOuUK_JPEG/movie_image.jpg,7살짜리 딸 '리자'와 단둘이 생활하던 싱글맘 ‘케이티’(알렉산드라 라미)는 '파코’(세르지 로페즈)’와 사랑에 빠진다. 이 평범한 두 남녀는 사랑의 결실로 비범한? 아기 ‘리키’를 낳는데… 리키의 비밀… 그리고 리키의 운명은?,해외,프랑스 / 이탈리아,VI6e18Fdj8k,세종커뮤니케이션스,CJ 엔터테인먼트,12세 관람가,89분,-,매튜 아르노딘 줄스 드베일리우스 엘리어트 보송 신시아 쉬브리 델핀 그랑사르트 패트리시아 켈 미셸 베트랑 파비아니 귀욤 레놀트 요한 스페즈 엘로이즈 라브로 에이차 케베 피에르 파비아니 마크 서시니 캐서린 자봇 존 아놀드 해킴 로마티프 에릭 포르테르 줄리앙 하우랑 프랑소와 르쿠에스네 디에고 토시 미리암 아젠콧 마르틴 밴데빌 베로니크 졸리 마릴린 에벤 쟝-끌로드 볼레-레드닷 안드레 윌름스 아서 페이렛 멜루신 메이얀스 세르지 로페즈 알렉산드라 라미 ,  프랑소와 오종 Francois Ozon (각본) 크리스 볼즈리 Chris Bolzli (제작) 클로드 오자르 Claudie Ossard (제작) 비에리 라지니 Vieri Razzini (제작) 잔느 라프와리 Jeanne Lapoirie (촬영) 필립 롬비 Philippe Rombi (음악) 카샤 비스콥 Katia Wyszkop (미술) 파스칼린 샤반느 Pascaline Chavanne (의상) 사라 테퍼 Sarah Teper (배역),배우/제작진 수상 이력@수상정보 테이블표@2015@제 15회 광주국제영화제@후보@유럽영화 특별전 (프랑소와 오종)@2009@제 11회 씨네마닐라 국제영화제@후보@메인 경쟁 (프랑소와 오종)@제 32회 밀 밸리 영화제@후보@세계영화 (프랑소와 오종)@후보@프리미어 (프랑소와 오종)@제 44회 카를로비바리 국제 영화제@후보@수평선부문 (프랑소와 오종)@제 45회 시카고국제영화제@후보@메인 경쟁 (프랑소와 오종)@제 59회 베를린국제영화제@후보@경쟁부문 (프랑소와 오종),-,-,5022,VSl69q_RPZw
2010,2010 .03.11 개봉,영화,멜로/로맨스,리틀 디제이,나가타 코토,https://movie-phinf.pstatic.net/20111223_241/1324605535481fsq79_JPEG/movie_image.jpg,타마키는 신청곡이나 사연이 담긴 엽서 한 장 오지 않는 심야 프로그램 라디오 PD이다. 덕분에 청취율의 문제로 프로그램이 개편되며 1달간 휴가를 가지게 된다. 지친 타마키는 우연히 자기를 라디오 PD로 만들어 준 작은 소년의 추억을 떠올린다.@ 타마키가 불의의 사고로 병원을 찾게 되던 중학교 2학년의 여름 병원 내 점심 방송을 담당하는 모든 사람들을 행복하게 해주던 DJ 타로. 덕분에 타마키 역시 힘든 병원 생활을 이겨나가게 되며 타로와 타마키는 아름다운 추억을 만들어 가는데..,해외,일본,aF6kiDFFEIY,피케이팜,(주)마운틴픽쳐스,전체 관람가,129분,-,사토 시게유키 니시다 나오미 무라카와 에리 모리 야스코 미츠이시 켄 마츠시게 유타카 코바야시 카츠야 카쿠 켄토 이시구로 켄 하라다 요시오 히로스에 료코 후쿠다 마유코 카미키 류노스케 ,  나가타 코토 Kotoe Nagata (각본) 미우라 우이코 Uiko Miura (각본) 오니즈카 타다시 Tadashi Onizuka (원작자) 준 후쿠모토 Jun Fukumoto (촬영) 와타나베 신지 Watanabe Shinji (음향) 사토 나오키 Naoki Sato (음악) 사사키 노리타카 Noritaka Sasaki (미술) 이마이 츠요시 Tsuyoshi Imai (편집),배우/제작진 수상 이력@수상정보 테이블표@2010@제 1회 스프링 뮤직 필름페스티벌@후보@청춘의 봄 (나가타 코토)@2009@제 4회 부산국제어린이청소년영화제@후보@비키 장편 초청 (나가타 코토)@2007@제 20회 도쿄국제영화제@후보@특별 초대작 (나가타 코토),-,-,1317,ZbaJDBYVw9A
2010,2010 .01.14 개봉,영화,드라마,리틀 애쉬: 달리가 사랑한 그림,폴 모리슨,https://movie-phinf.pstatic.net/20111223_165/13246009340207yu1W_JPEG/movie_image.jpg,스페인 마드리드의 대학에 진학한 18살의 살바도르 달리는 후일 각각 스페인의 거장 시인과 영화감독으로 이름을 남길 페데리코 가르시아 로르카와 루이스 부뉘엘을 만나게 된다. 달리의 천재성과 독특함은 두 사람의 시선을 끌게 되고 그들은 함께 우정을 나눈다. 변화의 바람이 거세게 불던 시대 속에서 그들은 자신만의 예술 세계를 이루기 위해 힘쓰고 특히 달리와 로르카는 서로의 작품에 영감을 주며 더욱더 가까워진다. 그러던 어느 날 달빛이 빛나는 호수에서 두 사람의 우정은 조금 다른 의미로 변하게 되는데……@ 영화제 소개글. 변화의 바람이 불고 있던 1922년 스페인 마드리드 18살의 살바도르 달리는 대학에서 페데리코 가르시아 로르카와 루이스 부뉘엘을 만나게 된다. 살바도르 달리의 천재성과 독특함은 두 사람의 시선을 끌게 되고 그들은 함께 우정을 나눈다. 한치 앞을 알 수 없는 격동의 시대 속에서 그들은 자신들의 신념과 예술을 위해 힘쓰고 달리와 페데리코는 서로의 작품에 영감을 주며 더욱더 가까워진다. 그러던 어느 날 빛나는 호숫가에서 두 사람에게 우정의 의미는 좀더 다른 것으로 변하는데… 시대를 풍미한 초현실주의 화가 살바도르 달리의 유년 시절을 그린 작품. 변화의 바람이 불던 1922년 스페인 마드리드를 배경으로 예술과 사랑을 탐닉한 달리 그리고 그에게 큰 영향을 끼친 그의 친구들의 깊은 우정과 사랑을 격정적으로 그려냈다. <트와일라잇>의 히어로 로버트 패티슨이 열정적인 예술가로 변신한 모습도 주목할 것.,해외,영국 / 스페인,De4g4c_Is6Y,판씨네마(주),판씨네마(주),청소년 관람불가,112분,-,크리스찬 로드리고 마크 푸졸 시몬 앤드루 매튜 맥널티 로버트 패틴슨 자비에 벨트란 ,  Philippa Goslett (각본) Fernando Bofill de La Fuente (Line PD) 카를로 더시 Carlo Dusi (제작) 자니 퍼시 Jonny Persey (제작) Jaume Vilalta (제작) Philippa Goslett (공동제작) 스튜어트 르 마르첼 Stewart Le Marechal (공동제작) 스티븐 P. 자초 Stephen P. Jarchow (기획) Luke Montagu (기획) Adam Suschitzky (촬영) Miguel Mera (음악) Antonio Belart (의상) Rachel Tunnard (편집),배우/제작진 수상 이력@수상정보 테이블표@2009@제 10회 메가박스 유럽영화제@후보@베이스드 온 트루 스토리 (폴 모리슨),-,-,-,_BVDQ0bbRA8
2010,2010 .03.04 개봉,영화,"판타지, 공포",마녀의 관,박진성,https://movie-phinf.pstatic.net/20111223_169/1324606130545Okmf0_JPEG/movie_image.jpg,영화감독이 여배우에 대한 강박증 신학교에서 일어나는 일을 그린 연극 장님 연주자를 통해 본 마녀의 환상성을 보여주는 3가지 에피소드로 이뤄진 옴니버스.@ 러시아 작가 고골의 <VIY>를 각색하여 만든 공포 연대기. 1부에서는 영화감독P가 박피디와 함께 배우를 캐스팅하고 촬영하는 과정에서 느낀 이상한 감정을 다루고 있다. 2부는 연극무대를 통해 등장하는 러시아 이야기이고 3부는 일본 공포를 각색했다. 박진성 감독은 <기담>의 시나리오 작가이기도 하다(This movie is a horror chronicle adapted from Russian author Gogol’s VIY. Act one describes the strange feelings of director P and producer Park while casting and shooting. Act two is about a story of Russia in the theater while Act three dramatizes Japanese horror stories.)@ chapter 1> 고골 원작의 <VIY>를 영화화해야하는 젊은 영화감독 P는 오디션을 통해 뽑은 신인여배우가 어쩐지 불길하다. P는 그녀의 지나칠 정도로 완벽한 재능을 알 수 없는 이유로 자신에 대한 적개심이라고 해석하게 되는데-@ chapter 2> 19세기 키예프의 신학생 호마는 들판에서 마녀를 만나 때려죽인다. 기구한 사연으로 영주의 딸 시신 옆에서 사흘 동안 기도문 낭독을 하게 된 호마. 호마는 이 젊은 아가씨의 시신이 마녀인 것을 알지만 기도문 낭독을 거부할 수 없다.@ chapter 3> 오브리 밴드 뮤지션인 시각장애인 앙리박은 요즘 매우 행복하다. 젊은 연극인들을 소개받아서 밴드 일이 끝난 후 극단 음악 감독으로 활동하기 때문이다. 자신의 음악을 완벽하게 이해하고 사랑해주는 예술가 친구들을 얻은 앙리박. 그러나 그의 뒤를 미행한 룸메이트는 극단 연습실을 엿보다 소름끼치도록 무서운 비밀을 목격한다.,국내,한국,SEUyEpGHcsA,-,-,청소년 관람불가,116분,-,이세랑 김두용 황택하 임지영 정승길 ,  박진성 (각본) 윤일중 (제작총지휘) 온정준 (제작실장) 배용국 (제작) 송현창 (촬영부) 이석민 (촬영부) 김문일 (촬영) 유재규 (조명) 박상화 (조명부) 김정혁 (조명부) 박상규 (조명부) 박철환 (조연출) 김원 (동시녹음) 박진석 (음악) 안성현 (미술) 조아라 (분장) 양민혜 (의상) 김선민 (편집),배우/제작진 수상 이력@수상정보 테이블표@2010@제 4회 시네마디지털서울@후보@퍼스펙티브 (박진성)@2008@제 2회 서울국제가족영상축제@후보@특별상영 (박진성)@제 13회 부산국제영화제@후보@한국영화의 오늘 - 비전 (박진성),-,-,450,6skLjiTbMd4
2010,2010 .09.09 개봉,영화,"애니메이션, 판타지",마루 밑 아리에티,요네바야시 히로마사,https://movie-phinf.pstatic.net/20111223_230/1324622664939kJnrD_JPEG/movie_image.jpg,10cm 소녀 아리에티 마루 위 인간 세상으로 뛰어들다! 교외에 위치한 오래된 저택의 마루 밑에는 인간들의 물건을 몰래 빌려 쓰며 살아가는 소인들이 살고 있다. 그들 세계의 철칙은 인간에게 정체를 들키면 그 집을 당장 떠나야 한다는 것! 14살이 된 10cm 소녀 아리에티는 부모님의 도움 없이 홀로 마루 위 인간 세상으로 뛰어든다. 빨래집게로 머리를 질끈 묶으면 작업 준비 완료!@ 작업 첫 날 인간 소년 쇼우에게 정체를 들키다! 첫 작업 목표는 각설탕. 생쥐와 바퀴벌레의 방해 공작에도 무사히 주방에서 각설탕을 손에 넣은 아리에티는 두 번째 목표인 티슈를 얻으러 간 방에서 저택에 요양을 온 인간 소년 쇼우의 눈에 띄게 된다. 인간은 무서운 존재라고 생각했던 것과 달리 쇼우의 다정한 모습에 조금씩 마음을 열기 시작한 아리에티. 마루 밑 세계의 규칙을 어기고 쇼우에게 다가가던 어느 날 아리에티 가족에게 예기치 않은 위험이 찾아온다.,해외,일본,kQlzQu1GQZQ,스튜디오 지브리,대원미디어,전체 관람가,94분,-,타케시타 케이코 키키 키린 오타케 시노부 미우라 토모카즈 카미키 류노스케 시다 미라이 ,  미야자키 하야오 Hayao Miyazaki (각본) 메리 노턴 Mary Norton (원작자) 스즈키 토시오 Toshio Suzuki (제작) 미야자키 하야오 Hayao Miyazaki (기획) 오쿠이 아추시 Atsushi Okui (촬영) 타케시게 요지 Yoji Takeshige (아트디렉터) 요시다 노보루 Noboru Yoshida (아트디렉터) 마츠하라 리에 Rie Matsuhara (편집),배우/제작진 수상 이력@수상정보 테이블표@2018@제 24회 브졸국제아시아영화제@후보@어린이 관객 (요네바야시 히로마사)@2015@제 17회 리우 데 자네이루 국제영화제@후보@스튜디오 지브리 - 더 매드니스 앤드 더 드림즈 (요네바야시 히로마사)@2012@제 15회 시네맘비엔터 환경 영화제@후보@에코 키드 부문 (요네바야시 히로마사)@제 25회 시카고 비평가 협회상@후보@애니메이션상 (요네바야시 히로마사)@2011@제 34회 일본 아카데미상@수상@우수 애니메이션 작품상@제 65회 에든버러국제영화제@후보@최우수 국제 장편 (요네바야시 히로마사)@2010@제 5회 로마 국제영화제@후보@공식 비경쟁 부문 (요네바야시 히로마사)@후보@포커스 (요네바야시 히로마사),-,-,1068004,qH2MwzIO1n0
2010,"2010 .07.15 재개봉, 2010 .05.20 개봉",영화,드라마,마마 앤드 파파,장태령,https://movie-phinf.pstatic.net/20111223_61/1324614268551QyhJF_JPEG/movie_image.jpg,아내의 출산비용을 마련하기 위해 아끼던 암소 판돈을 처남 만수에게 몽탕 털린 민철은 결국 아내의 병원비를 마련하려고 악질 사채업자 덕칠의 사채를 빌려 눈덩이처럼 불어나는 이자와 원금을 면하지 못하자 처자를 두고 고향을 떠난다..@ 고향에 아이들과 홀로 남은 아내는 사채업자 전주 강민달에게 집과 전답을 빼앗기고 지병을 얻어 어린 세 자매를 남긴채 원통하게 죽는다. 한편 고향소식을 뒤늦게 알게 된 민 철 사채업자 덕칠과 전주 강민달 일당의 계획적인 수법에 전답을 빼앗기고 아내마저 죽은 사실을 뒤늦게 알게 된 후 어리석었던 자신을 후회하면서 강민달 일당을 찾아가 칼부림을 하게 되는데..@ 고향에선 엄마아빠 없이 이웃들의 보살핌 속에 살아가던 민철의 세 딸들-@ 큰딸 지영은 아무것도 눈치 채지 못하고 큰 외삼촌의 꼬임에 의해 봉제공장에 들어가 주야로 열심히 일을 하나 이미 월급을 1년 치나 선불 받아 가로챈 큰 외삼촌.@ 그리고 외삼촌 식구들의 갖은 구박 등으로 온갖 고초를 당한다.@ 그러나 희망을 일치 않고 고아원에 맡겨진 어린 동생 지수 지아를 데려와 함께 살기 위해 열심히 살아가며 틈틈이 수기를 작성하는데 이러한 사실이 유명한 배우에게 알려져 지영이의 이야기가 세상에 알려지는데-,국내,한국,4JsJYoHFQwU,케이엠스타,-,전체 관람가,117분,-,손민지 정규운 이재민 유달산 김성남 최은석 길달호 김호영 허기호 김문찬 장정국 도승희 이현정 권도경 조동희 김준환 김채민 노시정 유하은 박정은 김진아 ,  장태령 (각본) 이병철 (프로듀서) 최인아 (프로듀서) 전금주 (제작) 최원기 (기획) 정희영 (촬영부) 신동관 (촬영부) 장종훈 (촬영) 안호진 (조명) 김영빈 (조명부) 문승주 (조명부) 윤태호 (연출부) 이형구 (연출부) 김명규 (연출부) 박순명 (조감독) 송민호 (동시녹음) 이건우 (동시녹음) 김선국 (사운드디자인) 김민섭 (사운드디자인) 이종식 (음악) 배영춘 (미술) 유일문 (미술) 조을희 (분장) 김정미 (분장) 장종훈 (편집) 정희영 (편집팀) 채수억 (무술감독) 김호길 (소품지원) 신경심 (소품지원) 송민호 (지미집) 조용호 (지미집) 김종문 (발전차) 이성환 (조명지원) 정문용 (조명지원) 김문옥 (라인디렉터) 장기훈 (매니저부문) 김진철 (메이킹) 이호성 (효과),배우/제작진 수상 이력@수상정보 테이블표@2010@제 18회 춘사영화제@후보@출품작 (장태령),-,-,3099,-
2010,2010 .07.21 개봉,영화,"액션, 모험, 코미디, 드라마, 판타지",마법사의 제자,존 터틀타웁,https://movie-phinf.pstatic.net/20111223_218/1324618723690Yn1ed_JPEG/movie_image.jpg,현대 과학이 집결된 최첨단의 도시 맨하탄. 이 화려한 도시의 한쪽에는 한때는 누군가의 상상이었으며 이제는 사람들의 손가락질을 받는 어느덧 환상 속의 신화가 되어버린 위대한 마법사 ‘발타자 블레이크(니콜라스 케이지 분)’가 살고 있다. 물론 그의 본업은 사악한 어둠의 마법사 ‘맥심 호르바스(알프레드 몰리나 분)’로부터 도시를 지키는 것.@ 전세계 어둠의 세력을 모으는 맥심을 물리치기 위해 발타자 역시 평범해 보이지만 엄청난 마법의 잠재력을 지닌 데이브(제이 바루첼 분)를 과감히 제자로 거둔다. 자신의 의지와는 상관없이 인류의 운명을 책임지는 임무를 맡게 된 데이브. 그러나 목숨이 왔다갔다하는 마법 훈련만으로도 모자랐는지 스승인 발타자는 사상 최악 어둠의 마법사 맥심과 지상 최대의 마법 전쟁을 시작한다.@ 다소 엉뚱하지만 분명 위대한 마법사 발타자와 더 없이 사악한 어둠의 마법사 맥심. 그들의 불꽃튀는 대결 속에서 마법사의 제자로 다시 태어난 데이브는 도시와 인류를 구원할 수 있을 것인가? 아니! 도시와 인류보다 자신의 목숨을 구할 수 있을 것인가?!,해외,미국,FJ1weS78ovo,한국소니픽쳐스릴리징브에나비스타영화,-,전체 관람가,107분,-,토비 켑벨 모니카 벨루치 알프리드 몰리나 제이 바루첼 니콜라스 케이지 ,  더그 미로 Doug Miro (각본) 카를로 버나드 Carlo Bernard (각본) 맷 로페즈 Matt Lopez (각본) 로렌스 코너 Lawrence Konner (각본) 마크 로젠덜 Mark Rosenthal (각본) 요한 볼프강 괴테 Johann Wolfgang Goethe (원작자) 브라이험 테일러 Brigham Taylor (프로듀서) 제리 브룩하이머 Jerry Bruckheimer (제작) 니콜라스 케이지 Nicolas Cage (기획) 토드 가너 Todd Garner (기획) 노먼 골라이틀리 Norman Golightly (기획) 벤 하버 Ben Haber (기획) 채드 오만 Chad Oman (기획) 마이크 스텐슨 Mike Stenson (기획) 베리 H. 월드먼 Barry H. Waldman (기획) 보잔 바젤리 Bojan Bazelli (촬영) 트레버 라빈 Trevor Rabin (음악) 나오미 쇼핸 Naomi Shohan (미술) 조지 드티타 주니어 George DeTitta Jr. (세트) 데이빗 라잰 David Lazan (아트디렉터) 데이빗 스웨이지 David Swayze (아트디렉터) 마이클 카플란 Michael Kaplan (의상) 윌리엄 골든버그 William Goldenberg (편집) 론나 크레스 Ronna Kress (배역),-,-,-,570775,vOaWVCpl0hk
2010,2010 .08.19 개봉,영화,애니메이션,마법천자문 - 대마왕의 부활을 막아라,윤영기,https://movie-phinf.pstatic.net/20111223_26/13246218490417Qi5I_JPEG/movie_image.jpg,勇[용] 강력한 한자마법으로 마법천자문 조각을 내놓으라며 선전포고를 하는 혼세마왕! 손오공은 용기를 내 한자 마법을 배우기로 결심한다!@ 忍[인] 보리선원에 입단한 손오공은 놀고 싶은 것을 참아내며 한자마법을 익힌다.@ 學[학] 삼장에게 늘 뒤지기만 하던 손오공은 부두목이 위기에 처해있다는 것을 알고 한자마법에 매진하며 일취월장한다! 그러던 어느날 친구 돈돈마저 혼세마왕에게 잡혀가고…@ 信[신] 삼장과 손오공은 힘을 합치고! 자신이 버려졌다고 믿었던 돈돈은 두 친구의 의리를 보고 다시 서로를 믿기 시작한다!@ 友[우] 돈돈을 구했지만 모든 천자문을 거의 다 모은 혼세마왕의 힘은 더욱 강해지고 손오공은 친구들과 힘을 합쳐 최후의 결전을 펼치게 되는데….@ 과연 손오공은 한자마법을 모두 깨우치고 5가지 주요 한자를 모아 혼세마왕을 물리칠 수 있을까?,국내,한국,U9rfwZ2QrBQ,디엔에이 프로덕션,CJ 엔터테인먼트,전체 관람가,85분,-,박소연 이청열 박연진 김갑선 강효배 양유정 박현 심규혁 이은주 윤지수 김진수 임한국 성슬 김동현 이장원 엄상현 안장혁 문관일 최한 손종환 윤소라 은정 박신희 정선혜 ,-,-,-,-,121572,44wzKUn-qJY
