year,release_date,category,genre,title,creator,title_image,introduction,country_category,country_name,video,production,distribution,grade,runtime,remake,cast,staff,awards,series,soundtrack,amount,ref_video
1995,1995 .09.30 개봉,영화,"멜로/로맨스, 코미디",누가 나를 미치게 하는가!,구임서,https://movie-phinf.pstatic.net/20111221_284/1324452280985AtmF2_JPEG/movie_image.jpg,어느 누구에게나 인생에 기회의 순간과 위기의 시기는 찾아온다. 제약회사 세일즈맨인 이종두는 자신의 인생에 기회는 이미 흘러갔고 위기만이 남아있다고 생각하며 20대 후반의 한때를 보내고 있다. 7번 도전했던 신춘문예 응모를 포기한 그는 사랑스런 연인 주영과의 결혼만이 마치 인생의 목표가 되어버린듯 온갖 종류의 수단을 동원 신혼집을 꾸미고 주영을 모셔오기 위한 방법을 쓰지만 주영의 마음은 꿈쩍도 안하고 종두를 궁지로만 몰아 넣는다.@ 회사내 인사 이동으로 주영이 종두가 근무하는 지점의 팀장으로 승진 발령이 나면서 종두의 스트레스는 극에 달한다. 주영의 뛰어난 능력은 회사사람들을 감동시키고 반면 종두는 무능력한 세일즈맨 1호로 낙인찍혀 사랑 돈 명예 모두 잃기 직전이다. 마침내 종두는 우연히 얻은 총 한자루를 들고 예비군 훈련장에서 호프집으로 진격해 들어간 곳에서는 주영의 실적을 축하하기 위해 파티가 벌어지고 있던 것이다. 스트레스를 주던 인간들은 종두앞에 무릎을 꿇고 총한자루 아래서 고해파티를 벌인다. 주영의 개입으로 종두의 오해는 풀리고 사람들을 단죄하려던 총은 두사람의 미래를 위한 축포로 울린다.,국내,한국,zMTTI1d9w1I,-,-,청소년 관람불가,100분,-,조미애 서범수 심성우 성은제 운행자 오세금 지용호 권범택 김성수 엄효섭 서동수 차영옥 도기륜 장문호 이창직 하덕성 김정애 구보석 최홍일 오정민 김오수 김환교 최학락 윤일주 이봉규 엄춘배 권용운 임대호 조주미 김예령 조선묵 권병길 김일우 최종원 최진실 이병헌 ,  현남석 (각본) 구임서 (각본) 이영수 (제작지휘) 권영락 (제작지휘) 이석원 (제작실장) 박창훈 (제작) 권영락 (기획) 김윤수 (촬영부) 김동천 (촬영부) 오봉식 (촬영부) 김소정 (촬영부) 정광석 (촬영) 신학성 (조명) 원명준 (조명부) 지길수 (조명부) 박순봉 (조명부) 송수진 (조명부) 안정웅 (조명부) 윤진호 (그립) 엄현수 (조연출) 장미애 (연출부) 이재희 (연출부) 김영달 (연출부) 한경우 (연출부) 임지연 (조감독) Steve Burgess (붐어시스턴트) 이병하 (동시녹음B팀) 송재일 (음악) 미하엘 슈타우다허 Michael Staudacher (음악) 조융삼 (미술) 오상만 (미술) 김철석 (특수효과) 송혜림 (분장) 국희정 (분장) 박예리 (분장) 노미현 (헤어) 안윤정 (의상) 김현 (편집) 경민호 (네가편집) 최윤정 (네가편집) 한미진 (스틸부) 육상수 (홍보스틸) 임동석 (녹음팀) 황상용 (홍보스틸) 진희문 (스틸부) 조성민 (녹음팀) 윤여진 (녹음팀) 이창 (녹음팀) 한국방송캐스팅 (보조출연) 장석훈 (스타일리스트) 최승영 (스타일리스트) 세방현상소 (현상),배우/제작진 수상 이력@수상정보 테이블표@1995@제 6회 춘사영화제@수상@신인남우상 (이병헌),-,-,-,-
1995,1995 .06.10 개봉,영화,"액션, 범죄, 스릴러",다이 하드 3,존 맥티어난,https://movie-phinf.pstatic.net/20111222_277/1324559986817WnbYT_JPEG/movie_image.jpg,싸이코 테러리스트 사이먼(제레미 아이런스 분)은 백화점을 폭파한 후 제2의 범행을 하겠다고 위협하면서 정직 중인 뉴욕 경찰관 맥클레인(브루스 윌리스 분)을 내놓으라고 요구한다. 사이먼의 협박대로 맥클레인은 흑인가에서 흑인을 미워한다는 간판을 메고 있다가 흑인들에게 죽음을 당하기 직전 같은 흑인인 제우스(사뮤엘 L. 잭슨 분)의 도움으로 살아나고 이때부터 제우스와 행동을 같이한다.@  사이먼은 1편에서 맥클레인에게 죽음을 당한 범인의 형으로서 동생의 복수를 위해 맥클레인을 끌어드린 것이다. 사람이 많이 모이는 곳에 폭발물을 설치한 사이몬은 수수께끼를 풀어야만 폭발물을 제거할 수 있도록 만들어 놓아서 맥클레인과 제우스는 그 수수께끼를 풀기위해 뉴욕 시내를 미친듯이 돌아다닌다. 그러나 사이먼은 다시 한번 지하철을 폭파시키고 3번째로 어느학교에 또 폭발물을 설치해 놓았다고 경고한다.@  뉴욕의 전 경찰과 FBI가 각 학교마다 성원되어 폭발물을 찾는 동안 사이먼은 연방 준비 은행의 엄청난 금괴를 털어 유유히 사라진다. 사이먼의 음모를 눈치챈 맥클레인은 제우스와 함께 치열한 추격전을 벌인다. 사이먼이 배를 타고 도주하자 맥클레인과 제우스는 그배에 오르지만 오히려 체포된다. 배가 폭파되기 직전 간신히 도망친 두사람은 캐나다 국경을 넘어 도망치는 사이먼 일행을 끝까지 추적하여 끝내 그의 헬기를 폭파시킨다.,해외,미국,ckhTDtyCnGc,-,-,15세 관람가,128분,-,사무엘 L. 잭슨 제레미 아이언스 브루스 윌리스 ,  조나단 헨슬레이 Jonathan Hensleigh (각본) 로데릭 돌프 Roderick Thorp (원조) 마이클 타드로스 Michael Tadross (제작) 존 맥티어난 John McTiernan (제작) 데이비드 윌리스 David Willis (공동제작) 카민 조조라 Carmine Zozzora (공동제작) 앤드류 G. 바나 Andrew G. Vajna (기획) 버즈 파이트션스 Buzz Feitshans (기획) 로버트 로렌스 Robert Lawrence (기획) 마이클 카멘 Michael Kamen (음악) 잭슨 데고비아 Jackson DeGovia (미술) 조셉 G. 얼리시 Joseph G. Aulisi (의상) 존 라이트 John Wright (편집) 팻 맥코클 Pat McCorkle (배역),배우/제작진 수상 이력@수상정보 테이블표@2015@제 7회 본 스릴러 국제영화제@후보@오마주 - 존 맥티어난 (존 맥티어난)@1996@제 5회 MTV 영화 & TV 어워즈@후보@최고의 액션장면,-,-,-,VFDX7L3YL4Q
1995,1995 .09.23 개봉,영화,"드라마, 미스터리, 스릴러",다크 눈,필립 리들리,https://movie-phinf.pstatic.net/20111223_256/13246082133524zT6u_JPEG/movie_image.jpg,숲속에서 길을 잃고 기절한 다크 눈(Darkly Noon: 브렌단 프레이저 분)은 아름다운 여인 캘리(Callie: 애쉴리 쥬드 분)에게 구조된다. 다크 눈은 첫눈에 그녀에게 반하지만 캘리는 이미 남편이 있는 몸이었다. 거대한 숲속에 외딴 섬처럼 자리한 캘리의 집에서 지내면서 다크 눈은 뜨거운 열정을 홀로 억누를 수 밖에 없었다. 어느날 캐리와 다크 눈은 숲속에 용암이 녹아내려 생겨난 굴을 찾아간다. 그 굴 속에서 다크 눈은 캘리에게 깊은 사랑을 느끼지만 다가설 수는 없다. 6일째 되는 날 다크 눈은 캘리를 바라보며 자위 행위에 빠지고 공허감만을 느낀다. 한편 캘리의 시어머니는 다크 눈에게 그녀가 악녀라고 얘기하고 걷잡을 수 없는 충동을 느낀 다크 눈은 진위를 파악할 겨를도 없이 캘리를 죽이겠다고 결심한다. 하지만 그 결심은 다크 눈의 못이룰 열정이 증오로 화한 것이었다. 다크 눈은 온 몸에 붉은 페인트를 칠한 채 캐리와 그녀의 남편이 사랑을 나누는 현장에 작두를 들고 나타나서 온 집안을 때려 부수는데.,해외,미국,JMwYnn5OgW4,-,-,NR,100분,-,케이트 하퍼 그레이스 자브리스키 로렌 딘 비고 모텐슨 애슐리 쥬드 브렌든 프레이저 ,  필립 리들리 Philip Ridley (각본) 도미닉 안시아노 Dominic Anciano (제작) 짐 비치 Jim Beach (기획) 레이 버디스 Ray Burdis (기획) 존 드 보맨 John de Borman (촬영) 닉 비캣 Nick Bicat (음악) 허버트 푸일 Hubert Pouille (미술) 레슬리 힐리 Leslie Healey (편집),-,-,-,-,b5_DLRoGdrY
1995,1995 .09.08 개봉,영화,스릴러,다크 댄서,로버트 버지,https://ssl.pstatic.net/static/movie/2012/06/dft_img77x110_1.png,17살의 마가렛 심프슨(Dr. Margaret Simpson: 샤논 트위드 분)은 아름다운 사춘기의 소녀로 조금 반항 기질이 있는 고교생이다. 그 이유는 홀어머니가 건달 기질이 짙은 라몬(Ramone: 프란시스코 퀸 분)을 집안에 끌어들여 동거 생활을 하고 있기 때문이다. 라몬은 마가렛에게 눈독을 들이고 어느날 그녀를 덮친다. 그 장면을 목격한 어머니는 칼로 라몬을 찔러 치명상을 입히고 경찰에 체포된다. 17년 후 마가렛은 정신학 박사과정을 수료하고 리젠트 대학 교수로 부임한다. 섹시한 성인이 된 그녀의 애인은 유능한 외과의사인 폴 오렌스텐 박사(Dr. Paul Orenstein: 앤드류 프린스 분)로. 유능하고 중후한 중년 신사이긴 하지만 여러 여자들과 섹스를 즐기는 플레이보이. 마가렛이 첫 강의 하는 날 론 소여(Ron Sawyer: 케빈 위크햄 분)라는 남학생이 유난히 그녀에게 관심을 보이고 다음날 그녀 사무실에 꽃다발을 보내온다. 그러나 사춘기에 그녀가 보는 앞에서 어머니가 사람을 찌르는 장면을 목격한 그녀는 심한 정신적 충격을 받은 나머지 성인이 된 지금에도 그때의 일을 잊지 못하고 이중 생활을 하고 있다. 밤에는 황홀경의 여인이란 익명으로 클럽에서 누드 댄서로 일하고 있는 것이다. 그러던 중 그 도시에서 연속 살인사건이 발생한다. 피해자들은 모두 목을 찔려 출혈과다로 사망하고 그녀의 주머니에서 황홀경 여인의 누드 사진이 발견된다. 수사반장인 핸콕 경위(Lt. Alan Hancock: 제이슨 카터 분)는 황홀경의 여인의 신원을 밝히는데 모든 수사력을 집중하지만 사건은 점점 미궁에 빠지게 되는데.,해외,미국,EZerN_U4WWk,-,-,청소년 관람불가,98분,-,리 스트링거 헤더 핸슨 마이클 크랩트리 테리 하렐 에이미 린제이 앤드류 프린 프란체스코 퀸 리사 페쉬아 제이슨 카터 샤논 트위드 ,  로버트 버지 Robert Burge (각본) 테리 챔버스 Terry Chambers (각본) 테리 챔버스 Terry Chambers (제작) 파멜라 블래스타스 Pamela Vlastas (제작) 에릭 스콧 Eric Scott (촬영) 데이빗 코너 David Connor (음악) 로나 라몽 Rona Lamont (의상) 테리 챔버스 Terry Chambers (편집),-,-,-,-,W1anECJJsPQ
1995,1995 .04.29 개봉,영화,"코미디, 멜로/로맨스",닥터 봉,이광훈,https://movie-phinf.pstatic.net/20111223_41/13245827787415KmPa_JPEG/movie_image.jpg,사랑하는 아내를 잃고 국민학교 1학년 짜리 아들 훈과 살면서 애인이 다섯 손가락을 넘나드는 바람둥이 치과의사 봉준수. 두 부자가 사는 빌라 아래층에 고집 세고 콧대 센 노처녀 가요작사가 여진이 이사를 오게 되면서 이들의 만남은 시작된다. 준수와 여진의 첫번째 만남 빌라내 주차장에서 운전이 서툰 여진의 고물차가 준수의 차에 흠집을 내면서 인상을 붉히게 되는 여진과 준수의 첫만남은 서로 나쁜 감정만 갖게 되는데.@  훈과 여진의 첫번째 만남. 아빠와는 달리 좋은 관계가 유지되는 여진을 훈이 처음 만난 장소는 만화 가게. 나란히 앉아 만화책에 몰두하는 여진과 훈은 서로에게 동질감을 느끼며 서로 잘 통하게 되고 훈은 상냥하고 따뜻한 여진이 자신의 엄마가 되기를 은근히 바라게 되는데. 준수 여진 훈의 극적인 만남. 훈을 통해 여진의 이야기를 듣게 되는 준수는 주차장 사건의 인물이 여진이라는 사실을 모르는 채 여진에 대한 은근한 기대감과 환상을 갖게 되고 그러면서도 계속되는 애인들과의 연이은 데이트는 훈의 불만을 사게 된다.@  그러던 어느 날 훈을 데리고 대중목욕탕을 나서는데 그 앞에 목욕통을 들고 서 있는 여진. 훈은 준수에게 여진을 소개시키려 하고 그 환상 속의 인물이 여진이라는 사실을 알게 된 닥터 봉은 경악하며 달아나는데. 이제부터 훈의 중매작전은 본격적으로 시작. 노처녀 여진과 바람둥이 우리의 닥터 봉의 관계는 어떻게 발전할지.,국내,한국,FITrT68JfqE,-,-,청소년 관람불가,92분,-,선화 이주현 우윤경 이하얀 유오성 류태호 이나리 최정 김혜수 한석규 ,  육정원 (각본) 이광훈 (각본) 우종원 (제작부장) 황기성 (제작) 송경훈 (기획) 최영택 (촬영부) 박종철 (촬영부) 최영진 (촬영부) 김형구 Kim Hyung ku (촬영) 손달호 (조명) 이강산 (조명부) 손영태 (조명부) 양우상 (조명부) 강대희 (조명부) 이선영 (조명부) 곽종진 (수중촬영) 한석환 (조연출) 김세겸 (조연출) 표영수 (조연출) 김호정 (스크립터) 김범수 (동시녹음) 김범수 (녹음) 이성근 (녹음) 안지홍 (음악) 김효선 (미술) 김명진 (미용) 이명희 (분장) 강창희 (분장) 김보경 (의상) 김아영 (의상) 김현 (편집) 경민호 (네가편집) 최윤정 (네가편집) 명기획 (홍보) 최재호 (녹음부) 김만택 (녹음부) 장미영 (녹음부) 전상현 (배역) 양대호 (효과),배우/제작진 수상 이력@수상정보 테이블표@2005@제 2회 서강데뷔작영화제@후보@특별전 (이광훈)@1996@제 19회 황금촬영상 시상식@수상@신인감독상 (이광훈)@제 34회 대종상 영화제@후보@신인감독상 (이광훈)@후보@신인남자배우상 (한석규)@후보@여우주연상 (김혜수)@후보@편집상 (김현)@제 32회 백상예술대상@수상@영화 남자신인연기상 (한석규)@1995@제 6회 춘사영화제@수상@신인남우상 (한석규)@제 16회 청룡영화상@후보@남우주연상 (한석규)@수상@여우주연상 (김혜수)@후보@최우수 작품상 (황기성 사단)@수상@한국영화 최다관객상,-,-,-,1FOjMKzmsvQ
1995,1995 .06.10 개봉,영화,"에로, 코미디",단추를 채우지 않는 여자,황태래,https://movie-phinf.pstatic.net/20111212_27/1323677659104NSjjz_JPEG/movie_image.jpg,막 소녀티를 벗은 숙녀 진진은 남자를 사귀지만 매번 남자들에게 실연을 당한다. 이에 진진은 다시는 사랑을 하지 않겠다고 다짐하고는 해변가로 놀러 간다. 그녀는 그곳에서 용묘라는 암흑가 두목의 부하들로부터 사람들이 괴롭힘 당하는 것을 목격하게 되는데 불의를 참지 못하는 진진은 용묘를 찾아간다. 하지만 진진은 용묘의 진실한 모습에 반해 그와 사랑에 빠지고 만다. 그러나 반대파에 쫓기던 용묘는 어처구니 없게도 죽고 만다. 그후 슬픔에 빠진 진진은 우연히 시위자들 틈에서 방의원을 만나게 되고 방의원은 정신분열증상을 보이는 아내와 이혼할 것이라며 진진에게 청혼을 한다. 이 사실을 눈치챈 아내는 오주석에게 부탁해 남편을 되돌리려는 계획을 세운다.,해외,홍콩,wryRr34iwVw,-,-,청소년 관람불가,84분,-,황화화 범애길 광지명 임초영 장준홍 구국양 양옥매 홍옥란 오묘의 서금강 소중형 양사호 이려진 ,  황태래 (각본) 양지화 (음악),-,-,-,-,yvpkOsFJFmE
1995,1995 .01.14 개봉,영화,"멜로/로맨스, 드라마",당신에게 일어날 수 있는 일,앤드류 버그먼,https://movie-phinf.pstatic.net/20111222_57/1324532185917KxY0W_JPEG/movie_image.jpg,찰리 랭(Charlie Lang: 니콜라스 케이지 분)이 인생에서 원하는 것은 좋은 경찰과 도움을 주는 이웃이 되는 것과는 달리 아내(Muriel Lang: 로지 페레즈 분)는 모든 일이 돈으로 필요한 것 뿐이다. 미용사인 그녀는 가난한 퀸스 동네를 벗어나 맨하탄에 진출하고 싶어한다. 그리고 또 한 명 작은 커피숍의 마음씨 착한 웨이트리스 이본느 비아시(Yvonne Biasi: 브리지트 폰다 분)는 헤어진 남편 때문에 방금 파산 선고를 받고 말았다.@  그녀가 법원으로부터 파산 선고를 받던 날 찰리는 단지 점심을 먹으려고 그 커피샵에 들어오게 된다. 천성은 못속인다고 찰리는 이본느의 그늘진 얼굴을 지나치지 못하고 기분을 풀어주려 마음을 쓴다. 점심값외의 팁이 모자란 찰리는 아내를 위해 샀던 복권을 생각해 내고 이본느에게 복권에 당첨되면 상금의 반을 나누고 떨어지면 팁의 2배를 주겠다고 약속한다. 놀랍게도 찰리는 4백만달러 복권에 당첨된다. 더군다나 그는 이본느에 한 약속을 지켰다는 사실이다. 돈독이 오른 아내는 화를 냈지만 뉴욕 신문들은 백마탄 기사같은 경찰과 신데렐라같은 웨이트리스 얘기에 스포트라이트를 비춘다. 찰리 이본느 머리얼에게 주어진 갑작스런 부와 명성은 그들이 예상치 못한 경험을 하게 한다.,해외,미국,kW0EyIFZx9c,-,-,15세 관람가,101분,-,레드 버튼스 리차드 젠킨스 스탠리 투치 세이무어 카셀 이삭 하에스 웬델 피어스 로지 페레즈 브리짓 폰다 니콜라스 케이지 ,  제인 앤더슨 Jane Anderson (각본) 마이크 로벨 Mike Lobell (제작) 게리 아델슨 Gary Adelson (기획) 크레이그 보가튼 Craig Baumgarten (기획) 조셉 하트윅 Joseph Hartwick (기획) 칼렙 디샤넬 Caleb Deschanel (촬영) 카터 버웰 Carter Burwell (음악) 빌 그룸 Bill Groom (미술) 줄리 웨이스 Julie Weiss (의상) 베리 말킨 Barry Malkin (편집) 존 S. 라이온스 John S. Lyons (배역),-,-,-,-,kW0EyIFZx9c
1995,1995 .05.13 개봉,영화,"멜로/로맨스, 코미디, 가족",당신이 잠든 사이에,존 터틀타웁,https://movie-phinf.pstatic.net/20111222_276/1324483809349bF1zf_JPEG/movie_image.jpg,루시(Lucy Eleanor Moderatz: 산드라 블록 분)의 삶엔 소중한 무언가가 빠지고 없다. 비록 초라한 아파트와 고양이 한마리 그리고 시카고 철도국의 토큰 판매 부쓰에서 일하는 동료 친구가 몇명 있지만 그녀에게 정작 소중한 부모나 가족이 없다. 루시는 단 한번 만난 적도 또 얘기를 나눠본 적도 없는 넋이 빠질 정도로 잘 생긴 남자를 짝사랑하게 되는데 어느날 아침 그 남자는 불량배들에게 떠밀려 역의 플랫폼에서 철로 위로 떨어지고 결국 혼수상태에 빠진다.@  루시는 고속으로 달려오는 기차로부터 아슬아슬하게 그 남자를 구해낸다. 루시가 병원에 찾아갔을 때 그녀는 그 남자의 약혼녀로 오해받게 된다. 얼떨결에 루시도 자신이 그의 약혼녀임을 인정해 버린다. 꿈 속에서 조차 흠모하던 남자가 코마(의식불명상태)에 빠져있는 동안 까짓것 굳이 약혼녀가 아니라고 부인할 필요도 없지 않겠는가. 신분조차 알지 못하는 그 남자의 가족들이 입원실에 나타나고 루시는 그 남자의 이름이 피터 켈라한(Peter Callaghan: 피터 겔라거 분)이며 사업가라는 사실을 알게 된다.@  피터의 아버지 옥스(Ox: 피터 보일 분) 어머니 밋지(Midge: 미콜 머큐리어 분) 그리고 할머니 엘시(Elsie: 글리니스 존스 분)는 피터의 병 간호를 통해 오랫동안 사이가 벌어졌던 피터와 다시 화목해질 수 있기를 기대한다. 이들 가족은 간호사의 착오로 약혼녀라고 소개된 루시가 피터의 목숨을 구해낸 은인이었다는 사실에 감사하며 그녀를 크리스마스 파티에 초대한다. 루시의 출현으로 그들의 삶에는 한결 생기가 일기 시작한다. 비록 본의는 아니었지만 약혼녀 행세를 시작한 이래 거짓이 언제 들통날지 몰라 불안해 하면서도 루시는 오랫동안 느껴보지 못한 가족과 가정의 따뜻함에 행복해 한다.@  그러나 피터의 동생인 잭(Jack Callaghan: 빌 폴만 분)만큼은 가족의 호의와 호감과는 달리 루시가 약혼녀라는 사실을 믿으려 하지 않는다. 한편 루시는 그동안 완벽한 신랑감일 것으로 여겨온 피터에 관해 모르고 있었던 사실들을 차츰 알게 됨에 따라 만일 피터가 '이상적인 남편감'이 아니면 어쩌나 하는 걱정을 하기 시작한다. 루시는 자신을 의심하여 집요하게 파고드는 잭의 질문을 요령껏 피해 나간다. 그러나 루시는 잭의 순수하고 정직한 매력에 조금씩 빨려들고 있는 자신을 발견하곤 갈등하게 되는데.,해외,미국,SAhX44Lvkbg,-,-,PG,103분,-,잭 워든 미콜 메르쿠리오 글리니스 존스 피터 보일 피터 갤러거 빌 풀만 산드라 블록 ,  조 로스 Joe Roth (제작) 로저 번바엄 Roger Birnbaum (제작) 찰스 J.D. 쉴리셀 Charles J.D. Schlissel (공동제작) 조나단 글릭먼 Jonathan Glickman (협력프로듀서) 아서 M. 사키시언 Arthur M. Sarkissian (기획) 스티브 바론 Steve Barron (기획) 페든 파파마이클 Phedon Papamichael (촬영) 랜디 에델만 Randy Edelman (음악) 거레스 스토버 Garreth Stover (미술) 벳시 콕스 Betsy Cox (의상) 브루스 그린 Bruce Green (편집) 아만다 맥키 존슨 Amanda Mackey Johnson (배역) 캐시 샌드리치 Cathy Sandrich (배역),배우/제작진 수상 이력@수상정보 테이블표@1996@제 53회 골든 글로브 시상식@후보@여우주연상-뮤지컬코미디 (산드라 블록)@제 5회 MTV 영화 & TV 어워즈@후보@가장 매력적인 여우상 (산드라 블록)@후보@최고의 여자배우상 (산드라 블록),-,-,-,C0gwr42fgYo
