"","year","release_date","category","genre","title","creator","title_image","introduction","country_category","country_name","video","production","distribution","grade","runtime","remake","cast","staff","awards","series","soundtrack","amount","ref_video"
"80","2017","2017 .11.09 개봉","영화","액션, 드라마","그레이트 파이트","쉐리 카욱","https://movie-phinf.pstatic.net/20171031_74/1509411998371JBbCv_JPEG/movie_image.jpg","종합격투기 선수 출신인 경찰 ‘닉’은@ 용의자 검거 과정에서 벌인 과도한 무력 행사로@ 고등학교의 상주 경찰로 임시 근무하는 징계를 받는다.@ 학교에서 근무 중, 자폐석학을 가진 ‘앤서니’가 평소 자신을 괴롭히던@ 친구들을 폭행해 법정소송에 휘말리게 되자 그를 도와주려 한다.@ 이것을 계기로 앤서니의 잠재된 재능을 알아 본 닉은 그를 대회에 출전시키려 하고,@ 과거에 닉과 라이벌 관계였던 ‘제인’이 닉에게 도전장을 내밀며 대결을 제안하는데...@ @ 전설의 파이터!@ 링 위의 한판 승부가 펼쳐진다!","해외","미국","https://www.youtube.com/watch?v=yIuDbiNBQLY","(주)시네마리퍼블릭","(주)시네마리퍼블릭","15세 관람가","80분","-","켄 델 벡치오 마이클 리베라 잭 멀케이 에리카 스미스 카타르지나 울레니오 톤예 파타노 토머스 G. 웨이츠 찰스 더닝 안젤라 리틀 조이스 드윗 마틴 코브 에릭 에트버리 로버트 로지아 미구엘 자킨-모어랜드 프랭크 지글리오 ","  켄 델 벡치오 Ken Del Vecchio (각본) 켄 델 벡치오 Ken Del Vecchio (제작) 로드 웨버 Rod Weber (공동제작) 조이스 보른먼 Joyce Borneman (기획) 로버트 보르먼 Robert Borneman (기획) 네스 나오모스키 Nace Naumoski (기획) 조 발렌티 Joe Valenti (기획) 쉐리 카욱 Sherri Kauk (촬영) 로드 웨버 Rod Weber (촬영) 케네스 램플 Kenneth Lampl (음악) 사라 스퀘터 Sarah Schetter (아트디렉터) 제너 마티올리 Jana Mattioli (미술) 제프 스터디번트 Jeff Sturdivant (의상) 카산드라 맥마누스 Cassandra McManus (편집) 로이어 니콜라스 Lawyer Nicholas (배역)","-","-","-","-","-"
"81","2017","2017 .11.23 개봉","영화","미스터리, 드라마","그렌델","윤한민","https://movie-phinf.pstatic.net/20170919_277/15057822158750AOgI_JPEG/movie_image.jpg","소설에 나오는 살인게임 모티브로 저명한 심리학 교수가 살해당한 사건이 생겼다.@ 하지만 한 젊은 작가 한준은 눈앞의 성공을 위해 살인범을 은폐시키고 만다@ 이로 인해 소설의 원작자인 한준은 모방 범죄로 인해 미디어와 여론에 휩쓸려 인기를 얻게 되고 갑작스러운 성공으로 인생이 뒤바뀌게 된다.@  한 달 뒤 한준에게 의문의 여인이 살해당한 사진과 함께 한준의 비밀을 알고 있다는 뉘앙스의 협박편지가 택배로 오게 되며, 이에 갈등에 빠진 한준은 그의 성공의 조력자인 젊은 여기자 정현과 함께 범인 추적 가운데서 사진 속 여인을 만나게 되는데...@ @ 2016 Canadian Diversity Film Festival Best picture of the month 11월 초청작@ 2017 London Independent Flim Awards Best Foreign Feature 수상@ 2017 AAB International Film Festival Official Selection: February 2017 경쟁부문 초청작@ 2017 Lake view international film festival march international feature film 경쟁부문 초청@ 2017 International Independent Film Awards ""Platinum Award Winners"" 수상@ 2017 Toronto international Nollywood film festival ""Finalist"" 초청작@ 2017 Hollywood International Cinefest ""OFFICIAL SELECTION: FEATURE FILMS (FOREIGN)"" 초청@ 2017 festical internacional de cnine de queretaro ""Tombstone Nights"" 초청작@ 2017 Switzerland International Film Festival 'Best Foreign Film' 초청작","국내","한국","https://www.youtube.com/watch?v=ri88hSjzo3w","엑시트팩토리 , 인디내셔널","(주)씨엠닉스","15세 관람가","98분","-","황보정일 김사훈 김예지 김지혜 김정석 장선 권남희 서동복 남태훈 주보영 윤한민 김가은 김태현 ","  윤한민 (각본) 김태현 (제작) 박지훈 (제작) 나익진 (촬영보) 이상윤 (촬영보) 이찬희 (촬영보) 김기환 (촬영부) 황성운 (촬영) 임철희 (조명) 배준표 (조명보) 김진영 (그립) 안소훈 (연출부) 이신기 (연출부) 이지 (연출부) 이혜미 (스크립터) 전주영 (조감독) 김시현 (동시녹음) 이규하 (동시녹음) 김시현 (믹싱) 전주현 (음악) 윤한민 (미술) 윤한웅 (소품) 윤한민 (-무술) 이은지 (분장-헤어) 오영서 (분장-헤어) 유용상 (편집보) 유용상 (편집보) 최희영 (편집) 윤한민 (스토리보드) 황성운 (스테디캠) 박지훈 (로케이션) 김태현 (로케이션) 김민경 (분장지원) 오교진 (연출지원)","배우/제작진 수상 이력@수상정보 테이블표@2018@제 38회 황금촬영상 시상식@수상@신인촬영상 (황성운)","-","-","5","https://www.youtube.com/watch?v=ri88hSjzo3w"
"82","2017","2017 .05.11 개봉","영화","공포, 판타지","그렘린","라이언 벨가드","https://movie-phinf.pstatic.net/20170508_260/1494218650189kwkTc_JPEG/movie_image.jpg","어느 날 수상한 상자를 들고 어머니 집을 찾은 짐.@ 짐은 어머니에게 상자를 전하면서 꼭 사랑하는 사람에게 전달 해야한다고 말하지만@ 그 상자는 함께 살고 있는 아들(아담)에게 건네진다.@ 얼마 뒤 상자에서는 괴 생명체가 튀어나와 어머니를 살해하고@ 아담과 그의 가족들의 생명을 위협하게 되는데...","해외","미국","https://www.youtube.com/watch?v=HIzU4jzUyxk","나우콘텐츠","나우콘텐츠","청소년 관람불가","89분","-","캐쳐 스테어 크리스티 K. 분 아담 햄튼 ","-","-","-","-","-","https://www.youtube.com/watch?v=643ESocrIso"
"83","2017","2017 .10.26 개봉","영화","드라마","그리다","장호준  이인의  박재영","https://movie-phinf.pstatic.net/20171020_108/15084662800578dsvi_JPEG/movie_image.jpg","“이럴 거면 왜 내려왔어요!” <평양냉면>@ 평생 동안 북에 두고 온 가족들을 그리워하던 상범의 아버지. 상범은 그런 아버지의 행동이 지긋지긋했다. 아버지가 돌아가신 뒤, 상범은 그가 즐겨 찾았던 뒷골목 평양냉면 집을 찾는다.@ @ “날… 알아볼까?” <관계의 가나다에 있는 우리는>@ 상경은 이산가족 찾기 프로젝트에서 이산가족 인터뷰 영상을 촬영하는 일을 하고 있다. 1.4 후퇴 직후 헤어진 남편을 찾는 할머니를 인터뷰하던 상경은 남편을 그리는 애틋한 그녀의 모습에 얼마 전 헤어진 여자친구를 떠올린다.@ @ ""아버지 저 모르시겠어요?” <림동미>@ 어린 시절 탈북해 남한에서 어른이 된 동미. 결혼을 앞두고 인생의 2막을 시작하려는 그녀에게 어느 날, 북한에서 그녀의 아버지를 만났다는 남자가 찾아온다. 동미는 결혼도 뒤로 미루고 북한에 계신 아버지를 남한으로 데려오기 위해 고군분투 한다.","국내","한국","https://www.youtube.com/watch?v=2lQpzChhZMU","인디스토리","-","12세 관람가","75분","-","정동락 고은희 이성준 박찬용 손재민 박영준 정예진 고영욱 정한별아 최하은 오희준 김진구 김대승 이묘리 박선 박채송 박채운 김금옥 정재호 윤시우 이정현 양형석 김해인 이추자 김근식 이상훈 한동희 안현빈 김수현 배호근 박지혜 임형택 신승리 장준휘 문창길 박혜진 김다빈 이선재 김가애 이고은 안지선 최연우 조연수 김형근 김산 정수진 김성 이인선 김인권 서덕 홍여진 전영운 정인기 고은민 박지연 황상경 한가림 서준영 ","  장호준 (각본) 이인의 (각본) 박재영 (각본) 조준형 (제작총괄) 박의준 (총괄프로듀서) 이동현 (프로듀서) 이은주 (프로듀서) 박영준 (프로듀서) 김인권 (제작부장) 신정훈 (제작부장) 박민 (제작부) 이승환 (제작부) 이묘리 (제작부) 최진욱 (제작) 최영재 (제작) 하주영 (제작지원) 김지원 (제작지원) 박의준 (제작지원) 장호준 (공동제작) 서명성 (촬영부) 홍승완 (촬영부) 김아람 (촬영부) 박경석 (촬영부) 이성국 (촬영부) 김희원 (촬영부) 허순희 (촬영부) 윤성원 (촬영부) 이민주 (촬영부) 남진아 (촬영) 조성우 (촬영) 오승철 (촬영) 박정희 (조명) 이동화 (조명) 조대연 (조명) 배태원 (조명) 곽영미 (조명) 림민주 (조명부) 이동훈 (조명부) 이호준 (그립) 김태근 (그립) 최윤호 (조연출) 박상호 (조연출) 김찬동 (조연출) 이상훈 (조연출) 정동락 (조연출) 김이슬 (연출부) 이정현 (연출부) 김은아 (스크립터) 심혜정 (스크립터) 신이피 (스크립터) 최하은 (스크립터) 강봉성 (동시녹음) 진동훈 (동시녹음) 정상현 (동시녹음) 안성일 (동시녹음) 정순도 (녹음) 민지연 (녹음) 주미경 (녹음) 홍랑기 (음향효과) 김은송 (음향효과) 김진구 (붐오퍼레이터) 도태우 (붐오퍼레이터) 박동선 (붐어시스턴트) 홍성선 (믹싱) 김용수 (믹싱) 양정원 (사운드) 김수현 (사운드) 김용수 (사운드디자인) 김수영 (음악) 장민호 (음악) 정순도 (음악) 이장혁 (음악) 정재환 (음악) 조서윤 (음악지원) 정나현 (음악지원) 김수영 (음악지원) 박민지 (음악지원) 이신애 (음악지원) 이종익 (음악지원) 이지현 (음악지원) 장민호 (음악지원) 정순도 (음악지원) 한보람 (음악지원) 한윤미 (음악지원) TryEgg 윤지민 TryEgg YunJimin (음악지원) 민은혜 (음악지원) 노을 (음악지원) 전수민 (음악지원) 김아인 (음악지원) 고우리 (음악지원) 신형창 (음악지원) 황보령 (작곡) 고재영 (아트디렉터) 김민오 (미술) 이지은 (미술) 한창훈 (미술) 이병덕 (미술) 권혜민 (미술팀) 이서로 (미술팀) 송승환 (시각효과) 김은경 (시각효과) 정세빈 (시각효과) 권영길 (시각효과) 김수한 (시각효과) 전사섭 (타이틀디자인) 최은지 (타이틀디자인) 추민정 (타이틀디자인) 고유 (분장) 박선 (분장) 신연정 (분장-헤어) 이석호 (의상) 김경미 (의상) 오장은 (현장편집) 조혜인 (편집보) 엄윤주 (편집) 이인의 (편집) 이연정 (편집) 최현숙 (편집) 오가윤 (광고디자인) 권윤경 (디지털색보정) 박시진 (현장제작지원) 최원대 (현장제작지원) 박은영 (현장제작지원) 금교희 (제작총괄회계) 이진환 (장비총괄) 오장은 (데이터매니저) 이시영 (발전차) 이수영 (분장팀장) 이수영 (헤어팀장) 이해상 (디지털색보정) 최현석 (디지털색보정) 이인원 (디지털색보정) 서민부 (디지털색보정) 김지민 (디지털색보정) 현덕연 (디지털색보정) 김성 (-스틸) 최정곤 (디지털처리) 김효정 (프로덕션 매니저) 정지민 (프로덕션 매니저) 김승규 (발전차) 오병걸 (디지털색보정) 강소선 (판화) 김혜나 (판화) 문하경 (판화) 박상아 (판화) 안영찬 (판화) 이언정 (판화) 홍승혜 (판화) 황혜선 (판화) 권순왕 (판화) 이정빈 (조명팀) 정한별아 (조명팀) 배요셉 (-스틸) 손재민 (-스틸) 최하은 (데이터매니저) 강상우 (디지털색보정) 김일광 (디지털색보정) 류연 (디지털색보정) 신정은 (디지털색보정) 권보근 (디지털색보정) 이재훈 (디지털색보정) 유상훈 (디지털색보정) 지동훈 (동화 일러스트) 함지현 (북 디자인) 박송화 (북한말 감수) 김금주 (북한말 감수) ㅇ (ㅈ) 김유민 (영문번역) 김용곤 (캐스팅지원) 곽용수 (배급마케팅총괄) 김소나 (국내배급) 김소나 (마케팅홍보) 고아라 (국내배급) 이나현 (국내배급) 고아라 (마케팅홍보) 이나현 (마케팅홍보) 김화범 (국내배급) 황수진 (국내배급) 최효주 (국내배급) 최진재 (멀티미디어) 장현순 (매니저부문) 김동우 (매니저부문) 서동진 (매니저부문) 이원정 (매니저부문) 정예진 (매니저부문) 김대승 (매니저부문) 이환정 (매니저부문) 고영욱 (매니저부문) 추두영 (매니저부문) 이준영 (매니저부문) 정재호 (매니저부문) 심종오 (매니저부문) 장영훈 (매니저부문) 양재원 (매니저부문) 최원석 (매니저부문) 조용경 (번역) 이근철 (로케이션지원) 김윤미 (로케이션지원) 황태웅 (로케이션지원)","-","-","-","861","https://www.youtube.com/watch?v=dlwyfMzYC3c"
"84","2017","2017 .08.10 개봉","영화","애니메이션, SF, 가족, 모험","극장판 도라에몽:진구의 남극 꽁꽁 대모험","다카하시 아츠시","https://movie-phinf.pstatic.net/20170713_47/1499907463413CgUMz_JPEG/movie_image.jpg","더위를 피해 남극으로 놀러 간 도라에몽과 친구들은 얼음에 묻혀있던 신기한 팔찌를 발견한다.@ 팔찌가 묻힌 곳은 바로 10만년 전 남극!@ 그곳에서 도라에몽과 친구들은 수수께끼를 찾는 소녀 카라와 햣코이 박사를 만나고, 지구가 꽁꽁 얼어버릴 위기에 처했다는 사실을 알게 되는데…!","해외","일본","https://www.youtube.com/watch?v=7Z4J8h1i19s","대원미디어(주)","(주)NEW","전체 관람가","101분","-","채민지 치아키 세키 토모카즈 키무라 스바루 카카즈 유미 오오하라 메구미 미즈타 와사비 ","  다카하시 아츠시 Atsushi Takahashi (각본) 후지코 F 후지오 F. Fujio Fujiko (원작자)","-","-","-","167052","-"
"85","2017","2017 .04.27 개봉","영화","애니메이션","극장판 또봇: 로봇군단의 습격","이달  고동우","https://movie-phinf.pstatic.net/20170403_18/14911863568994AIQc_JPEG/movie_image.jpg","제주도로 여행을 떠난 아빠 ‘도운’과 쌍둥이 형제 ‘하나’와 ‘두리’.@ 즐거운 시간도 잠시, 일을 하겠다며 떠난 아빠에 서운함을 느낀다.@ 한편, 제주도는 정체불명의 로봇군단에게 습격을 받고,@ 이를 구하고자 나선 또봇과 친구들은 악당 로봇이 되어 공격해오는 아빠와 마주하게 되는데…!@ @ 인간을 로봇으로 만들려는 악당의 음모에 맞서 아빠를 구하라!","국내","한국","https://www.youtube.com/watch?v=fpbLhIJAAYo","레트로봇","-","전체 관람가","80분","-","전재형 안효민 박지훈 윤민영 장하영 오유진 노영주 이현 신경선 하룡이 ","  김미혜 (각본)","배우/제작진 수상 이력@수상정보 테이블표@2017@제 19회 부천국제애니메이션페스티벌@후보@애니 투게더 (이달)","-","-","    ...","-"
"86","2017","2017 .05.03 개봉","영화","애니메이션, 코미디, 가족","극장판 마이 리틀 포니: 이퀘스트리아 걸스","제이슨 티에슨","https://movie-phinf.pstatic.net/20170424_163/1493024434058pVBhL_JPEG/movie_image.jpg","셀레스티아 공주가 다스리는 이퀘스트리아의 포니 마을에 살고 있는 유니콘 포니 ‘트와일라잇 스파클’은@ 공주의 왕관을 물려 받아 포니 마을의 평화를 지키려고 하지만@ 질투심 많은 욕심쟁이 포니 ‘선셋 쉬머’가 왕관을 훔쳐간다.@ @ 트와일라잇 스파클은 왕관을 되찾기 위해 선셋 쉬머가 숨어있는 다른 세계로 가고@ 그 곳에서 이퀘스트리아의 포니들과 똑 닮은 친구들을 만난다.@ @ 왕관을 되찾기 위한 트와일라잇 스파클의 모험은 계속 되지만@ 그 곁을 든든하게 지켜주는 친구들과 함께 선셋 쉬머에 맞서 우정의 힘을 배워가는데…","해외","캐나다 / 미국","https://www.youtube.com/results?search_query=%EC%98%81%ED%99%94%20%EA%B7%B9%EC%9E%A5%ED%8C%90%20%EB%A7%88%EC%9D%B4%20%EB%A6%AC%ED%8B%80%20%ED%8F%AC%EB%8B%88:%20%EC%9D%B4%ED%80%98%EC%8A%A4%ED%8A%B8%EB%A6%AC%EC%95%84%20%EA%B1%B8%EC%8A%A4%20%EC%98%88%EA%B3%A0%ED%8E%B8","그린나래미디어(주)","(주)팝엔터테인먼트","전체 관람가","72분","-","안드리아 리브먼 애슐리 볼 타라 스트롱 ","  메건 맥카시 Meghan McCarthy (각본)","-","-","-","     ","https://www.youtube.com/watch?v=E7tTQr-Beg0"
"87","2017","2017 .02.22 개봉","영화","모험","극장판 빰바라빤쮸: 바나나 왕국의 비밀","벤비 네코","https://movie-phinf.pstatic.net/20170202_61/1486003131003TM9Uo_JPEG/movie_image.jpg","하와이 항공권에 당첨되어 첫 해외여행을 떠나게 된 아기돼지 빰바돈과 가족.@ 하지만 길을 잃은 빰바돈과 절친 고양이 쮸냥은 그만 잘못된 비행기를 타게 되고,@ 숲으로 뒤덮인 정글에 도착하고 만다.@ 그곳에서 빰바돈은 바나나 왕국을 구할 전설의 빤쮸 용사로 오해받고,@ 식신 악어에 맞선 여정을 함께하게 되는데…!@ 과연 빰바돈과 쮸냥은 바나나 왕국을 위기에서 구해내고 가족과 다시 만날 수 있을까?","해외","일본","https://www.youtube.com/watch?v=R8_QNac3gBg","(주)스마일이엔티","(주)스마일이엔티","전체 관람가","63분","-","이병용 장병관 윤세웅 사문영 황원 김채하 김율 ","-","-","-","-","10681","https://www.youtube.com/watch?v=SPPjl3Tq48I"
"88","2017","2017 .02.23 개봉","영화","애니메이션, SF, 액션","극장판 소드 아트 온라인 -오디널 스케일-","이토 토모히코","https://movie-phinf.pstatic.net/20170203_137/1486084416321ESQw3_JPEG/movie_image.jpg","2022년. 천재 프로그래머 카야바 아키히코가 개발한 세계 최초의 풀 다이브 전용 디바이스 ‘너브기어’ --- 그 혁신적인 머신은 VR(가상현실) 세계에 무한한 가능성을 가져왔다.@ 그로부터 4년 후…….@ ‘너브기어’의 후계 VR머신 ‘어뮤스피어’에 대항하는 것처럼 하나의 차세대 웨어러블 멀티 디바이스가 발매되었다.@ ‘어그마’.@ 풀 다이브 기능을 배제하는 대신, AR(증강현실) 기능을 최대한으로 확대한 최첨단 머신.@ ‘어그마’는 깨어있는 상태에서 사용할 수 있는 안전성과 편리성을 바탕으로 순식간에 유저들에게 확산되었다.@ 그 폭발적인 확산을 견인한 것은 ‘오디널 스케일(OS)’로 불리는 ‘어그마’ 전용 ARMMO RPG였다.@ 아스나와 동료들도 플레이하는 그 게임에 키리토도 참전하려 하는데…….","해외","일본","https://www.youtube.com/watch?v=5l6EH84i3Sg","(주)애니플러스","BoXoo 엔터테인먼트","12세 관람가","120분","-","이토 카나에 토마츠 하루카 마츠오카 요시츠구 ","-","배우/제작진 수상 이력@수상정보 테이블표@2018@제 15회 바르셀로나 빅 아시안 섬머 필름페스티벌@후보@아동영화부문 (이토 토모히코)@후보@특별상영부문 (이토 토모히코)","-","-","     ","https://www.youtube.com/watch?v=2TKlyqMjH14"
"89","2017","2017 .12.14 개봉","영화","애니메이션","극장판 숲의 요정 페어리루 ~크리스마스의 기적: 마법의 날개~","고로 사쿠라","https://movie-phinf.pstatic.net/20171201_239/15121075662688EIHD_JPEG/movie_image.jpg","‘리프’와 ‘바이올렛’, 그리고 ‘해바라기’와 ‘로즈’는@ 선배 트윙클 페어리루인 ‘스피카’, ‘시리우스’와 함께@ 트리를 장식할 크리스마스 스타를 함께 만들다 친구들과 다툼을 벌이게 된다.@ 한편, 여행을 떠난 ‘산타’가 돌아오지 않자 곤란해진 ‘크리’와 ‘트리’는@ 직접 ‘산타’로 변신해 선물을 나눠주기로 하는 등@ 크리스마스 준비에 바쁜 시간을 보내는데…@ @ 과연 ‘리틀 페어리루’의 요정들은 모두 행복한 크리스마스를 보낼 수 있을까요?","해외","일본","https://www.youtube.com/watch?v=TTRpRonwaSQ","SMG홀딩스(주)","(주)이수 C&E , (주)에이원 엔터테인먼트","전체 관람가","65분","-","남도형 윤아영 이지현 이재현 조경이 ","-","-","-","-","    ...","https://www.youtube.com/watch?v=lIDipEaVSXg"
"90","2017","2017 .03.23 개봉","영화","애니메이션","극장판 암살교실: 365일의 시간","키시 세이지","https://movie-phinf.pstatic.net/20170216_80/1487210444716vT0Bt_JPEG/movie_image.jpg","자신을 암살하라는 ‘살생님’의 밑에서 현상금을 걸고 싸우던 기막힌 학창 시절을 졸업하고,@ 이제 훌쩍 자란 모습으로 교실을 다시 찾은 ‘나기사’@ ‘살생님’과 함께했던 버라이어티한 추억들에 미소 지우며 교실로 들어서는데,@ 아무도 없어야 할 교실에는 이미 먼저 온 손님 ‘카르마’가 있었다.@ ‘살생님’이 없는 교실에서 지난 시간을 돌아보기 시작한 두 사람,@ 아련하게 피어나는 특별했던 1년간의 기억.@ 그리고 이제야 알 수 있을 것 같은 ‘살생님’의 마음.@ 과연 그들이 하게 된 새로운 다짐은 어떤 것이었을까?","해외","일본","https://www.youtube.com/watch?v=HTTSuLaPzVQ","(주)애니맥스 브로드캐스팅 코리아","BoXoo 엔터테인먼트","12세 관람가","92분","-","오오사카 료타 오카모토 노부히코 이토 시즈카 스기타 토모카즈 후쿠야마 쥰 ","  마츠이 유세이 (원작자)","-","-","-","28364","https://www.youtube.com/watch?v=XvhF9raUDfI"
"91","2017","2017 .04.13 개봉","영화","애니메이션","극장판 어드벤처 타임: 비밀의 아일랜드","엘리자베스 이토  콜 산체스","https://movie-phinf.pstatic.net/20170405_50/1491355834504HIuk4_JPEG/movie_image.jpg","무시무시한 버섯 전쟁이 끝난 지 천 년 후@ 마법이 돌아온 세상 ‘우랜드’의 유일한 인간 소년 ‘핀’과@ 생각하면 뭐든지 될 수 있는 마법 개 ‘제이크’는@ 평화를 지키는 영웅을 꿈꾸던 중@ 기억을 잃어버린 채 지하 통로에 살던 힘센 ‘수잔’을 만나게 된다@ @ 어느 날, 알 수 없는 비행 물체가 ‘우랜드’를 습격해@ 친구들을 괴롭히기 시작하고@ 언제나 그렇듯 사건 현장에 출동한 ‘핀’과 친구들은@ 비행 생물체에서 ‘수잔’의 과거의 흔적을 발견하게 된다@ 기억을 찾기 위해 떠나는 ‘수잔’을 위해!@ 어디선가 ‘나’를 기다릴 엄마, 아빠를 찾기 위해!@ ‘핀’도 함께 길을 나서게 되는데…@ @ 핀과 제이크의 모험은@ 늘 짜릿해!@ 늘 놀라워!@ 늘 끝내줘!","해외","미국","https://www.youtube.com/watch?v=OFIP87IFIvs","카툰 네트워크","터너코리아 유한회사","전체 관람가","84분","-","임하진 서원석 김연우 이재범 이명희 김보영 양유진 최낙윤 사문영 전진아 곽윤상 이지현 ","  켄트 오스본 Kent Osborne (각본) Jack Pendarvis (각색) 준 교토 루 June Kyoto Lu (각색) 켈리 크류즈 Kelly Crews (제작) 임성아 (믹싱) Tom Syslo (사운드슈퍼바이저) Timothy J. Borquez (사운드슈퍼바이저) 이지현 (노래) Sandra Lee (아트디렉터) Paul Douglas (편집) Lindsey Pollard (애니메이션) Benjamin Anders (캐릭터) Michael DeForge (캐릭터디자인) Joy Ang (캐릭터디자인) Nick Edwards (캐릭터디자인) 톰 헤피치 Tom Herpich (캐릭터디자인) Derek Kirk Kim (캐릭터디자인) 서승희 (더빙 번역) 이승연 (종합편집) 신비 (더빙 연출) Erik Fountain (스토리보드) Jacob Winkler (배경작화) Jesse Balmer (배경작화) Matthew Houston (배경작화) Chris Tsirgiotis (배경작화) Abigail Magno (배경작화) Xavier Irvine (배경작화) Ron Russell (배경채색) 팀 브락 Tim Brock (배경채색) Holly Williams (배경채색) Rachel Kim (배경채색) Karie Gima Pham (배역) Sophia Monico (프로덕션매니저)","-","-","-","19986","https://www.youtube.com/watch?v=-GVEeBxvq3A"
"92","2017","2017 .09.07 개봉","영화","애니메이션","극장판 에그엔젤 코코밍: 푸르밍과 두근두근 코코밍 세계","닛타 노리오","https://movie-phinf.pstatic.net/20170825_121/1503645926333TFHAU_JPEG/movie_image.jpg","코코밍이라면 누구나 꿈꿔 온 코코밍 세계에@ 특별히 초대받은 미소와 코코밍들은@ 신비롭고 환상적인 코코밍 세계를 신나게 탐험하기 시작한다.@ @ 한편, 초대받지 못한 새 친구 푸르밍은 주인인 리아를 생각하는 마음에 코코밍 세계에 몰래 숨어들고@ 남몰래 훔친 도토리 열쇠를 이용해 해피트리 입구에 들어간다.@ @ 이 때, 푸르밍의 마이너스 파워로 해피트리에 큰 구멍이 생겨나고@ 소중한 해피스타들이 우르르 세상 밖으로 쏟아지게 되는데..@ @ 위험에 빠진 코코밍 세계와 인간세계!@ 과연 코코밍들은 힘을 합쳐 마법으로 세상을 구할 수 있을까?","해외","일본","https://www.youtube.com/watch?v=BuoIAq4sld4","CJ E&M 영화부문","CJ E&M 영화부문","전체 관람가","76분","-","한신 박성태 김하영 강시현 장은숙 안현서 은정 안영미 조현정 양정화 방연지 여민정 여윤미 이지현 ","  츠치야 미치히로 Michihiro Tsuchiya (각본)","-","-","-","137052","https://www.youtube.com/watch?v=4eiVl4OSE2M"
