year,release_date,category,genre,title,creator,title_image,introduction,country_category,country_name,video,production,distribution,grade,runtime,remake,cast,staff,awards,series,soundtrack,amount,ref_video
1992,1992 .07 개봉,영화,"판타지, 액션, 모험",비스트마스터 2,실비오 타베,https://ssl.pstatic.net/static/movie/2012/06/dft_img77x110_1.png,"농담을 즐기는 상원의원의 딸 재키 트랜트(Jackie Trent: 카리 우러 분)는 고속도로 순찰대의 추격을 벗어나려고 그녀의 포르쉐 자가용을 전속력으로 몰아 캘리포니아 5번 도로위를 질주하고 있었다. 그순간 두개의 시공간이 충돌하는 사건이 벌어져, 재키는 자신도 모르는 사이에 시간의 통로를 지나 다트(Dar: 마크 싱거 분)의 세계로 들어와 있는 자신을 발견한다. 그녀는 자신이 태초의 선사시대에 있는 것을 모르고 어리둥절한 상황에서 다트와 마주치고, 자기 차의 연료가 떨어졌음을 알게된다. 다트는 그녀의 말을 이해할 수 없음에도 그녀를 자신의 서역여행에 동반시켜 준다. 그들은 동지가 되어 함께 여행을 하게되고, 재키는 다트가 동물들과 대화를 나누는 능력 뿐만이 아니라 완전한 자기 신념으로 독립한 사람임을 알고 흥미를 느낀다. 한편, 매혹적인 여자 마법사 리란나(Lyranna: 사라 더글러스 분)는 아크론(Arklon: 윙스 호저 분)에게 시간 통로를 보여주고, 그 문의 밖에 존재하는 '엘-아예'의 세계에 있는 엄청나게 강력한 무기에 대해 설명한다. 그것은 이동식 핵폭탄장치로 미육군에 의해 개발된 최첨단 핵무기이다. 저항력에 대한 두려움과 마곡의 힘이 쇠잔하고 있음을 우려한 아크론은 핵폭탄 장치를 손에 넣으려고 애쓴다. 그는 재키를 납치하여 그녀로 하여금 핵장치가 있는곳으로 인도하도록 강요한다. 다트는 그의 흉계를 알지는 못하지만 재키의 신변을 보호하기 위해 아크론의 뒤를 따르고, 리란나와 그녀의 인질도 시간의 통로를 지나 현대세계로 오게된다. 현대 미국사회는 그들에겐 너무나 신기헤서 여러가지 사건이 펼쳐진다. 아수라장이 벌어진 벌어진 동안에 재키는 탈출하여 그녀의 집으로 간다. 그곳에서 재키는 다트의 신상에 관해 알게된다. 그녀는 곧장 달려가 다트를 구하고, 그는 문명의 몇 가지 이로운 점들을 깨닫게 된다. 그뒤 아크론과 리란나가 중성폭탄이 있는 미군 기지의 비밀을 훔쳐내려고 침투한 사실을 알게 되면서 이야기는 긴장이 감돌기 시작. 3차대전이 일어날지도 모른다는 두려움에 재키는 비밀기지로 달려가나 벌써 비밀을 복사해 간 사실을 알게된다. 다트와 재키는 고속도로를 따라 필사적으로 아크론을 추적해, 폭발장치 기밀이 사라지기전에 그를 잡으려 한다. 종국에는 다트의 승리가 확연해지면서, 그가 이룩한 업적으로 양쪽의 세계에서 모두 영웅으로 추대된다. 다트가 그의 세계로 귀환하는 순간, 그 원시세계가 로스엔젤레스보다 더 문명화되었음을 알게된다. 그는 재키가 타던 포르쉐 승용차가 쓸모없이 버려진 장소를 지나며. 라디오에서 터져나오는 록앤롤음악을 들으려 몰려드는 수많은 순례자의 행렬을 기이하게 바라본다.",해외,미국,https://www.youtube.com/watch?v=DbX-XKPeM48,-,-,PG-13,107분,-,찰스 하이먼 로버트 자르 로버트 필드스틸 제임스 아베리 캐리 우러 사라 더글러스 윙스 하우저 마크 싱어 ,  R.J. 로버트슨 R.J. Robertson (각본) 실비오 타베 Sylvio Tabet (각본) 짐 위노스키 Jim Wynorski (각본) 실비오 타베 Sylvio Tabet (제작) 제롤드 W. 램버트 Jerrold W. Lambert (라인프로듀서) 론 슈미트 Ronn Schmidt (촬영) 로버트 포크 Robert Folk (음악) 베티 페카 매든 Betty Pecha Madden (의상) 애덤 버나디 Adam Bernardi (편집),-,-,-,-,https://www.youtube.com/watch?v=Tve_LOwi4yQ
1992,1992 .02.01 개봉,영화,드라마,비처럼 음악처럼,안재석,https://movie-phinf.pstatic.net/20111221_41/1324465104061DKklz_JPEG/movie_image.jpg,"사랑의 아픔이나 이별의 절망, 외로움 등을 노래를 통해서 절규하는 가수 현식은 레코드와 라이브 무대를 통해서만 팬들과 만나는 언더그라운드 가수이다. 프리랜서인 사진작가 인경이 무대에서 열창하는 현식을 카메라에 담게 되면서 두 사람은 사랑하는 사이가 된다. 현식은 인경을 통해 가수로서 느끼는 고독감이나 무대에서의 외로움을 잊게되지만, 인경은 현식에게 점점 혼란을 느끼며 갑작스런 청혼을 피해 일본으로 떠난다. 인경이 떠난 후 현식의 외로움은 더욱 커지고 공허를 술로 달래며 환각 상태로 노래를 부르기도 하고, 신경질적인 성격으로 변한다. 결국 현식은 다른 여자와 결혼한다. 그러나 새롭게 살아보기 위해 한 결혼생활이었지만 그는 마약상용 혐의로 구속되어 부인과 이혼하고 만다. 출감 후 재기 콘서트의 성공으로 정상의 자리에 올라서지만 절망적인 폭음은 계속된다. 죽음을 예감한 현식은 마지막 녹음을 위해 각혈을 하면서까지 마이크 앞에 서지만 절망, 좌절, 사랑, 이별, 죽음까지도 그의 삶은 노래로 만 남게 된다.",국내,한국,https://www.youtube.com/watch?v=L2_jdLFA7mo,삼영필름,-,15세 관람가,128분,-,정낙희 심혜진 김형철 ,  정정희 (각본) 강대진 (제작) 서정민 (촬영) 강대성 (녹음) 김영 (음악) 엄인호 (음악) 박순덕 (편집) 박곡지 (편집),-,-,-,  ,https://www.youtube.com/watch?v=oQSPyyKxmT8
1992,1992 .03.07 개봉,영화,드라마,비황,문여송,https://movie-phinf.pstatic.net/20111222_160/1324559572564GtHMl_JPEG/movie_image.jpg,"이조 마지막 도공 이노인은 일제 통치 이후 유리그릇 유입으로 가마에 불을 지피지 못한다. 사기그릇은 더이상 백성들의 생필품이 아니기 때문이다. 또한 이노인의 딸 분례마저 일자리를 찾아 경성으로 떠난다. 그러나 이조 백자에 남다른 관심을 갖고 있는 다께야마는 이노인에게 다시 가마에 불을 지피게 하지만 곧 중지시킨다. 완전한 이조 백자가 재현된다면 자신이 소장한 백자의 희소가치가 떨어질 뿐만 아니라, 일본보다 우수한 조선의 도예기술이 알려지는 것이 싫기 때문이다. 그래서 그들은 창길을 회유하여 이조 백자 도굴 앞잡이로 삼으려 하고, 창길은 일본기생이 된 분례를 빼내기 위해서 돈이 필요하게 되자 도굴을 시작한다. 한편, 다께야마는 창길과 분례가 가지고 있는 철사로문호 백자를 빼앗으려 하지만 창길이 민족혼을 팔아먹었던 자신을 뉘우치고 유혹을 물리치자 장물아비의 죄목으로 연행당해 고문을 받고 철사호문호를 포기하고 만다. 그러나 분례는 서장을 회유하여 철사호문호를 산 뒤 이노인의 영전에 바치고 떠난다.",국내,한국,https://www.youtube.com/watch?v=y2AAVYBwgyg,-,-,청소년 관람불가,100분,-,김윤재 이치우 전무송 이동준 박현숙 ,  문상훈 (각본) 임하 (각본) 심회만 (각본) 문여송 (각본) 서기원 (원작자) 문여송 (제작) 김갑의 (기획총지휘) 허문녕 (촬영) 정덕규 (조명) 곽은혜 (조연출) 나호범 (조연출) 유지숙 (조감독) 소원종 (붐어시스턴트) 최창권 (음악) 현동춘 (편집) 염대호 (스탭),-,-,-,-,-
1992,1992 .09.26 개봉,영화,"범죄, 드라마",빌리 배스게이트,로버트 벤튼,https://movie-phinf.pstatic.net/20111221_268/1324445940862ciiXf_JPEG/movie_image.jpg,"미국에 경제공황이 휘몰아치던 1930년대 중반의 뉴욕. 뉴욕 빈민가의 소년 빌리(Billy Bathgate: 로렌 딘 분)는 똑똑하고 성실한데다 용기도 있으며, 장래를 위한 포부도 가지고 있었다. 그러나 어느 시대 어떤 곳의 10대와 마찬가지로 빌리 역시 자기가 사는 세상에 대해서는 정확한 판단력이 부족했다. 그래서 그가 영웅으로 택한 것은 갱두목 덧치 슐츠(Dutch Schultz: 더스틴 호프만 분)였고, 얼마나 무서운 일에 휘말렸는지도 모르고 그의 부하가 된다. 멀리서는 봉우리만 보이는 산도 가까이 가보면 깊은 골짜기가 보이는 법, 돈과 세력을 갖추고 막강한 힘을 부리는 갱의 세계를 내면에서 보게된 빌리는 자신이 범죄와 살인을 일삼는 정신병자들의 소굴에 있다는 것을 깨닫기 시작한다. 와인버그가 살해되는 순간부터 갱의 세계에 회의를 갖기 시작한 빌리는 처음으로 슐츠의 명령을 어기고 아름답지만 멍청한 프레스턴 부인(Drew Preston: 니콜 키드먼 분)의 목숨을 구해내 남편에게 돌려보낸다. 그리고 갱두목 슐츠의 운이 다한 순간, 함께 죽을 운명에 처해진 빌리는 재치있게 위기를 벗어나고, 갱의 세계에 영원히 등을 돌린다.",해외,미국,https://www.youtube.com/watch?v=0PZzT-3_iQ8,-,-,청소년 관람불가,102분,-,모이라 켈리 프란시스 콘로이 스티븐 조이스 로버트 F. 콜스베리 마이크 스타 스탠리 투치 존 코스텔로 스티브 부세미 브루스 윌리스 로렌 딘 스티븐 힐 니콜 키드먼 더스틴 호프만 ,  톰 스토파드 Tom Stoppard (각본) 알린 도노반 Arlene Donovan (제작) 네스토르 알멘드로스 Nestor Almendros (촬영) 마크 아이샴 Mark Isham (음악) 패트리지아 본 브랜던스타인 Patrizia Von Brandenstein (미술) 조셉 G. 얼리시 Joseph G. Aulisi (의상) 앨런 하임 Alan Heim (편집) 로버트 레이타노 Robert Reitano (편집) 하워드 퓨어 Howard Feuer (배역),배우/제작진 수상 이력@수상정보 테이블표@1992@제 49회 골든 글로브 시상식@후보@여우조연상 (니콜 키드먼),-,-,-,https://www.youtube.com/watch?v=vteRrKPa4T4
1992,1992 .05.16 개봉,영화,"드라마, 멜로/로맨스, 에로",빠담풍,엄종선,https://movie-phinf.pstatic.net/20111222_247/1324507886086MXP1c_JPEG/movie_image.jpg,"조동찬 변호사의 집에 어느 날 밤 강도가 침입, 그가 보는 앞에서 아내를 성폭행하고 사라진다. 어느 날 남편이 출근하고 난 대낮에 하회탈을 뒤집어 쓴 괴한으로부터 또다시 성폭행을 당한 장여사는 갈등에 빠진다. 이웃집 학생 성기는 이 광경을 발견하고 신고를 하지만 끝내 정신착란으로 오해까지 받는다. 자기 혐오에 번민하는 장여사는 남편에게 고백할 것을 결심하지만 기회를 잃는다. 그러나 두번째 하회탈의 침입이 있은 후부터 죄책감은 사라지고 오히려 하회탈을 기다리는 마음을 갖게 된다. 얼마후 또다시 화회탈이 나타나고, 이 때 또 다른 하회탈이 출현하여 두 하회탈간에 치열한 격투가 벌어진다. 결국 두 하회탈은 자신의 결백을 주장하기 위한 성기와 아내의 위선을 벗기기 위한 조변호사였다는 사실이 밝혀진다. 그리고 조변호사는 자살을 기도하는 장여사에게 부부관계란 육체관계가 전부가 아닌 정신적인 애정이라는것을 설파하고 용서를 구한다.",국내,한국,https://www.youtube.com/watch?v=g6gLOaYsexk,-,-,청소년 관람불가,109분,-,육철 전무송 강리나 ,  홍지윤 (각본) 황기성 (제작) 서정민 (촬영) 김진도 (조명) 이성근 (녹음) 이종식 (음악) 현동춘 (편집),-,-,-,  ,-
1992,1992 .10.03 개봉,영화,드라마,뽕 3,이두용,https://movie-phinf.pstatic.net/20111222_250/1324555446134lNppr_JPEG/movie_image.jpg,"일제치하의 1930년대, 옥산골이라는 마을에 정처없이 떠돌아다니는 삼보(실은 독립운동가)가 만주에서 살던 안악네라는 여인을 데리고 나타난다. 이 마을에서 주막을 하는 덕팔의 집에 머물며 삼보는 신변의 위협을 느껴 의도적으로 노름판에서 돈을 잃고 안악까지 담보로 잡힌 채 마을에서 사라진다. 홀로 남은 안악은 뛰어난 미모때문에 동네 남정네의 인기를 한몸에 받게된다.@  삼보가 빚진 돈을 갚기위해 덕팔의 주막에서 찬모노릇을 하지만 덕팔의 끈질긴 추근과 찬모 노릇으로 빚을 갚는데 역부족을 느낀다. 이에 덕팔의 처는 안악을 꼬여 몸을 팔아 빚을 갚도록한다. 안악은 비록 몸을 팔지만 자기요구를 들어주면 빚을 없던걸로 하겠다는 덕팔에게만은 허락하지 않는다. 온갖 수단을 다 동원하지만 번번히 실패하는 덕팔은 칠성의 도움으로 안악을 손에 넣으려하지만 안악은 오히려 칠성과 관계를 가져 두사람을 원수로 만든다. 이런 차에 삼보가 나이어린 복녀를 데리고 독립자금을 가져가기 위해 마을로 돌아온다. 일본 순사는 동네 첩자인 칠성의 정보로 아무런 확증이 없는 삼보를 잡으려 한다.@  한편, 덕팔은 안악에게 죽기살기로 협박하여 안악과 관계를 가지지만 순순히 승락하는 것에 대해 불길한 예감을 가진다. 그때 삼보는 동네 석훈장과 맹구장에게 독립자금을 받아 마을을 떠나려는데 칠성을 앞세운 순사가 들이 닥친다. 삼보와 순사가 격투끝에 결국 순사가 죽게 되고, 칠성이 마저 죽는다. 이럴 쯤에 덕팔의 처는 모든 재산을 챙겨 동네 박가와 같이 야밤도주를 하게 되고, 덕팔은 엎친데 덮친격으로 순사와 칠성의 살인용의자로 체포되고 삼보와 안악은 유유히 떠난다.",국내,한국,https://www.youtube.com/watch?v=J9TpELiMWrE,-,-,청소년 관람불가,97분,-,박용팔 양택조 김정하 이무정 한태일 유연실 ,  김진혁 (각본) 이동섭 (제작지휘) 주인석 (제작지휘) 선종길 (제작지휘) 김만수 (제작부장) 김봉근 (제작주임) 이두용 LEE Doo-yong (제작) 김영대 (제작진행) 이순용 (기획) 변희성 (촬영부) 김만상 (촬영부) 최건희 (촬영부) 정춘화 (촬영부) 이성춘 (촬영) 임춘행 (조명) 최성원 (조명부) 최석재 (조명부) 남진아 (조명부) 김병철 (조명부) 박종원 (조명부) 서민영 (연출부) 장규성 (연출부) 김도경 (연출부) 최사라 (스크립터) 정경천 (동시녹음) 이호 (동시녹음) 이선욱 (동시녹음) 더스틴 아론슨 (동시녹음) 김경일 (믹싱) 최창권 (음악) 성미자 (분장) 권유진 (의상) 이경자 (편집) 한근수 (제작전무) 강문수 (현장진행) 양대호 (효과),-,-,-,-,https://www.youtube.com/watch?v=J9TpELiMWrE
1992,1992 .02.01 개봉,영화,코미디,사랑 전쟁,서영수,https://ssl.pstatic.net/static/movie/2012/06/dft_img77x110_1.png,"유민은 시골에서 순수하게 성장한 젊은이다. 1년 재수 끝에 대학에 합격한 그는 남달리 열성적으로 대학생활을 한다. 학기가 끝난 어느 여름, 방학을 이용해 카페에서 아르바이트를 하던 유민은 도시적인 삶에 익숙한 찰리 브라운을 만나게 되면서 차츰 성에 대해 눈을 뜨기 시작한다. 도시생활에 익숙해 갈 무렵 유민은 어머니로부터 아득히 잊고 있었던 숙이의 편지 묶음을 받지만, 우연한 기회에 대학에서 연극연습을 하던 발랄한 여대생 나나를 알게되면서 숙이를 멀리한다. 이런 와중에 상대적 소외감을 느낀 찰리가 유민에게 다시 순수한 모습으로 돌아오라는 부탁을 하고 사라져버리자, 비로소 찰리의 충고를 받아들인 그는 나나와 결별을 하고 숙이를 찾아간다. 하지만 숙이가 이미 다른 사람과 약혼한 사실을 알고 충격과 쓰라린 가슴을 안고 귀향 열차에 오른다.",국내,한국,https://www.youtube.com/watch?v=WeMj4EV3mfA,-,-,청소년 관람불가,95분,-,손영순 노사강 전숙 양택조 방희 김원희 김상중 유진화 유민 ,  이규형 (각본) 김승의 (제작부장) 김형준 (제작) 서영수 (기획) 이규형 (기획) 구교환 (촬영) 이주생 (조명) 안정희 (그립) 오덕환 (조연출) 조진만 (연출부) 노권식 (연출부) 성원 (연출부) 손인호 (붐어시스턴트) 수태환 (음악) 김경진 (분장) 최혜정 (분장) 현대원 (편집) 이재희 (효과),-,-,-,-,https://www.youtube.com/watch?v=SHk--vHzN0s
1992,1992 .08.08 개봉,영화,"드라마, 멜로/로맨스",사랑과 슬픔의 여로,폴커 슐렌도르프,https://movie-phinf.pstatic.net/20111221_223/1324453213508OikhP_JPEG/movie_image.jpg,"월터 화버(Walter Faber: 샘 쉐퍼드 분)의 눈에는 오직 한 사람의 모습만 떠오른다. 반짝이는 금발 머리카락과 호기심 가득한 큰 눈동자의 아가씨. 그것은 4월의 어느날부터 시작되었다. 화버는 명성과 부를 손에 넣고, 오직 과학과 기술만을 믿으며 자신의 인생까지 조절이 가능하다고 믿는 중년의 남자다. 그가 탄 비행기가 엔진고장으로 멕시코 사막에 불시착하고 거기서 우연히 대학시절 사랑했던 한나(Hannah: 바바라 스코바 분)의 소식을 듣게 된다.@  장래를 약속했던 두 사람의 사랑은 한나의 임신으로 끝나고 말았는데, 원한다면 결혼하자던 화버의 뉘앙스에 민감한 반응을 느낀 한나가 같은 대학동창 요아킴과 결혼해 버린 것이다. 결혼 후 얼마 안되어 유태인인 한나는 공산주의에 흘러 독일에 항거하면서 요아킴과 이혼하고, 그 후로는 소식을 알 길이 없다는 것이다. 복잡한 생각으로 뉴욕에 온 화버를 기다리고 있는 사람은 남편과 이혼한 애인 아이비(Ivy: 데보라-리 퍼니스 분), 점점 결혼을 재촉하고 파리 출장까지 동행하겠다는 아이비에게서 도망치 듯 거리로 나선다. 그는 모든 걸 잊고 자신을 직시하고자 파리행 호화 여객선에 오른다.@  여행을 줄기던 화버의 시선이 언제부터인가 한명의 아름다운 아가씨를 쫓고 있다. 젊고 아름다운 시베트의 한마디 한마디가 화버에게는 새로운 생명의 기운처럼 느껴진다. 회의 중에도 화버의 머리속에는 시메트의 모습이 떠오르고 있었다. 그녀를쫓아 회의장을 빠져나오는 화버. 중년의 엔지니어와 문학 소녀와의 운명은 단단히 맞물려 돌기 시작한다. 무전 여행으로 이탈리아에 있는 어머니를 찾아가겠다는 시베트. 화버는 그녀를 그곳까지 데려다 주기로 한다. 영원히 계속될것 같은 즐거운 여행, 두사람은 자연스럽게 맺어진다. 그러나 시베트가 말해버린 부모의 이름에 화버는 얼어 붙는다. 그리고 그것은 비극을 향한 한 걸음이었다.",해외,프랑스 / 독일 / 그리스 / 영국,https://www.youtube.com/watch?v=rUYoTeRbYOY,-,-,PG-13,117분,-,어거스트 지너 데보라 리 퍼니스 트러시 린드 다이터 커크리츠너 바바라 수코바 줄리 델피 샘 쉐퍼드 ,  폴커 슐렌도르프 Volker Schlondorff (각본) 루디 워리처 Rudy Wurlitzer (각본) 막스 프리쉬 Max Frisch (원작자) 에버하르트 융커스도르프 Eberhard Junkersdorf (제작) 요르고스 아르바니티스 Yorgos Arvanitis (촬영) 피에르 롬 Pierre Lhomme (촬영) 스탠리 마이어스 Stanley Myers (음악) 니코스 퍼라키스 Nicos Perakis (미술) 바바라 바움 Barbara Baum (의상) 다그마르 히르츠 Dagmar Hirtz (편집),-,-,-,-,https://www.youtube.com/watch?v=myq-YgolKQs
1992,1992 .03.25 개봉,영화,"드라마, 전쟁",사랑과 우정,시몬 도턴,https://movie-phinf.pstatic.net/20111223_152/1324638903902UPu9h_JPEG/movie_image.jpg,"해머(Hammer: 롭 로우 분)와 딘(Dean: 게일 한슨 분)은 훈련소에서 특공부대원이 돕기위한 혹독한 수중 훈련을 받고 있으며, 만약, 그들이 이 훈련에서 살아난다면 S.E.A.L.S.(Sea Air And Land Specialist)라는 해군특공부대에 입대하게 된다. 해머는 훈련 이전부터 오랜 해상 경력을 갖고 있으며 훈련 과정에서도 해상이나 육상에서 최고라는 평가를 받는다.@ 한편, 아나폴리스(Annapolis) 해군 사관 학교 졸업생인 딘은 해머와는 정반대로 조용하고 내성적인 성격이다. 이런 이유로 해머는 딘을 자주 놀려대며, 이에 진력이난 딘은 어느날 해머와 큰 싸움을 벌인다. 동료들이 지켜보는 가운데 해가 질때까지 싸운 그들은 둘다 마음의 상처를 입지만, 이를 계기로 서로를 존중하게 되고 SEALS에서 멋진 파트너가 되자고 맹세한다. 얼마 후 해머는 딘을 그의 여자 친구인 바바라(Barbara: 트레이시 그리피스 분)와 그녀의 친구인 다이엔과의 더블데이트에 초대한다. 딘은 바바라를 만난 순간부터 매력을 느끼지만 바바라에 대한 사랑과 해머와의 약속을 저버리고 다른 부대로 지원한다.@ 일년 후 중동에서는 이라크가 미사일과 화학 무기를 비축하고, 주변 석유 보유국들을 침략하려는 위험한 상황이 발생한다. 중동 지역에 주재하고 있던 해머는 페르시아만 입구의 핸검 아일런드로 보낼 진상조사단에 합류된다. 그들은 정탐 활동 중 적군에게 적발되어 해머는 가까스로 벗어 나지만, 동료 보스코는 적에게 붙잡히게 된다. 해머의 부대장은 그가 다시 섬으로 가서 임무를 완성하고 가능하다면 보스코의 생사 여부까지 확인하도록 명령한다.@ [스포일러 주의] 이제 해머가 믿는 것은 오직 딘 뿐이었다. 해머의 부탁으로 딘은 다시 합류하게되고 그들은 S.D.V라는 잠수정을 이용하여 섬으로 잠입한다. 보스코를 구해낸 그들은 섬의 무기저장고와 방위 시설을 사진에 담고 귀환을 서두른다. 이러한 과정에 해머는 심한 부상을 입고 부대로 무사히 귀환하나 의사들은 해머의 확신을 갖지 못한다. 그러나 딘의 소식을 받고 병원에 도착한 바바라는 해머의 여성 편력때문에 이혼할 것이라고 딘에게 고백한다. 딘은 바바라를 위로하면서 해머와의 정때문에 묻어두었던 사랑의 감정을 되살리게 된다. 이러한 와중에 걸프전이 발발하고 화학무기가 숨어져 있는 핸검 아일랜드섬을 폭파하기위한 SEALS팀이 구성된다. 해머는 여기에 참가키로 결심하고 의사 몰래 폭파작전에 참여하게 된다.",해외,미국,https://www.youtube.com/watch?v=RBsFZLQEJ8Y,-,-,15세 관람가,104분,-,홍-필-름 그레고리 탤 아바 해더드 질야 스턴 잭 위더커 존 필립스 우리 가브리엘 나탄 스건 코헨 에릭 데근 아리 소코-람 이태준 에비아타 라자르 마이클 펀테인 다니엘 디에커 바러크 드로 에브 로티머 트레이시 그리피스 게일 핸슨 로브 로우 ,  시몬 도턴 Shimon Dotan (각본) 스튜어트 소프먼 Stuart Schoffman (각본) 메나헴 골란 Menahem Golan (제작) 아미 아치 Ami Artzi (기획) 아브라함 카픽 Avraham Karpick (촬영) 야엘 골란 Yael Golan (조감독) 애비샤이 아비비 Avishay Avivi (미술) 로첼 잴츠만 Rochelle Zaltzman (의상) 밥 덕세이 Bob Ducsay (편집) 마크 S. 피셔 Marc S. Fischer (프로덕션매니저) 가디 레비 Gadi Levy (프로덕션매니저),-,-,-,-,https://www.youtube.com/watch?v=QIEHRJYy8f4
