"","year","release_date","category","genre","title","creator","title_image","introduction","country_category","country_name","video","production","distribution","grade","runtime","remake","cast","staff","awards","series","soundtrack","amount","ref_video"
"1","2017","2017 .07.20 개봉","영화","드라마, 코미디","100미터","마르셀 바레나","https://movie-phinf.pstatic.net/20170626_262/1498460542134vDS2F_JPEG/movie_image.jpg","성공한 광고회사 직원 라몬은@ 회사와 집에서는 사랑과 존경을 받아오지만@ 홀아비인 장인어른이 자신의 집으로 이사온 이후 성격 차이로 늘 티격태격 이다.@ 그러던 어느 날 갑자기 온 몸이 마비되는 다발성 경화증이라는 진단을 받은 라몬은@ 30대 중반의 나이에 생을 포기해야 할지,@ 아니면 병마와 싸워 이겨낼지 선택의 기로에 서지만@ 자신의 가족과 다발성 경화증 환자들의 완치를 위해@ 가장 힘든 철인 3종 경기인@ ‘아이언 맨’에 도전하기로 결정하는데…","해외","스페인","https://www.youtube.com/watch?v=Gw9Kpv3y0qE","(주)코리아스크린","(주)코리아스크린","15세 관람가","108분","-","마크 발라게르 리카도 페레이라 브루노 베르온시니 알바 리바스 클라라 시구라 마리아 드 메데이로스 데이비드 베르다거 알렉산드라 지메네즈 카라 엘레할데 다니 로비라 ","  마르셀 바레나 Marcel Barrena (각본) 카를로스 페르난데즈 Carlos Fernandez (제작) 카를로스 페르난데즈 Carlos Fernandez (기획) Laura Fernandez (기획) 아드리아 몬스 Adria Mones (기획) 사비 지메네즈 Xavi Gimenez (촬영) 자비에 지메네즈 Xavi Gimenez (촬영) 호드리구 레아우 Rodrigo Leao (음악) 실비아 슈타인브레히트 Sylvia Steinbrecht (미술) 알렉스 비야그라사 Alex Villagrasa (시각효과) Isabel Finkler (의상) 나초 루이즈 카필라스 Nacho Ruiz Capillas (편집) 마르셀 바레나 Marcel Barrena (배역)","배우/제작진 수상 이력@수상정보 테이블표@2017@제 31회 고야상@후보@남우조연상 (카라 엘레할데)","-","-","1770","https://www.youtube.com/watch?v=APqhNU8_3XM"
"2","2017","2017 .04.06 개봉","영화","드라마","1812 나폴레옹 대전투","올렉 페센코","https://movie-phinf.pstatic.net/20170330_153/1490837326107OKS1S_JPEG/movie_image.jpg","나폴레옹의 부하가 러시아의 전투 작전계획을 훔쳐 프랑스 황제에게 전달한다.@ 이 사실은 젊은 귀족 알렉세이 타루소프 덕분에 러시아 군의 지휘관인 쿠투조프 장군에게 알려진다.@ 타루소프는 쿠투조프에게 간청하여 러시아 창기병 연대에 합류해 고르제프스키, 키크나드제 왕자, 그리고 푸트카 상사와 같은 새로운 친구를 만나게 된다.@ 보로디노의 끔찍한 전투가 끝난 후에 그들은 많은 예기치 못한 모험을 하게 되는데...","해외","러시아 연방","https://www.youtube.com/watch?v=MKxfBx1VO_o","(주) 케이알씨지","(주) 케이알씨지","12세 관람가","99분","-","세르게이 베르주코프 아나톨리 벨리 ","-","-","-","-","   ","https://www.youtube.com/watch?v=Oonn4ByxcD0"
