"","year","release_date","category","genre","title","creator","title_image","introduction","country_category","country_name","video","production","distribution","grade","runtime","remake","cast","staff","awards","series","soundtrack","amount","ref_video"
"136","2017","2017 .08.24 개봉","영화","애니메이션, 판타지, 드라마","낮잠 공주 : 모르는 나의 이야기","카미야마 켄지","https://movie-phinf.pstatic.net/20170720_289/1500535421209PGFxN_JPEG/movie_image.jpg","작은 시골마을에서 아빠와 둘이 사는 평범한 여고생 코코네.@ 요즘 들어 자신을 닮은 소녀가 나오는, 똑같은 꿈을 계속 꾼다.@ 희한한 꿈과 대학 진학, 가족 등 고등학교 마지막 여름방학을 앞두고 생각이 많지만@ 그런 마음을 아는지 모르는지 무뚝뚝한 아빠는 자동차 개조에만 열중한다.@ @ 그러던 어느 날 아빠가 경찰에 체포되어 도쿄로 연행된다.@ 코코네는 아빠를 찾기 위해 소꿉친구 모리오를 이끌고 무작정 도쿄로 향하고@ 반복되는 꿈속에 사건을 해결할 열쇠가 있다는 사실을 깨닫게 된다.@ 결국 꿈속에서 ‘나’와 가족의 비밀을 보게 되는데…@ 그 여정의 끝에 있는 작은 진실은…?","해외","일본","https://www.youtube.com/watch?v=e0AxGUu2kAc","시그널MD","(주)얼리버드픽쳐스","전체 관람가","111분","-","타카기 와타루 마에노 토모야 쿠기미야 리에 타카하시 히데키 후루타 아라타 미츠시마 신노스케 에구치 요스케 타카하타 미츠키 ","  카미야마 켄지 Kenji Kamiyama (각본)","배우/제작진 수상 이력@수상정보 테이블표@2018@제 45회 애니어워드@후보@최우수 독립 장편 애니메이션 (Nippon TV)@제 24회 브졸국제아시아영화제@후보@일본 애니메이션 (카미야마 켄지)@제 41회 일본 아카데미상@후보@우수 애니메이션 작품상 (카미야마 켄지)@2017@제 21회 판타지아 영화제@수상@관객상-베스트 애니메이션(금) (카미야마 켄지)@후보@장편 영화 (카미야마 켄지)@제 50회 시체스영화제@후보@애니메이션 (카미야마 켄지)@제 37회 하와이국제영화제@후보@Planet Anime (카미야마 켄지)@후보@스포트라이트 온 재팬 (카미야마 켄지)@제 66회 멜버른 국제 영화제@후보@MIFF 키즈 (카미야마 켄지)@제 27회 유바리국제판타스틱영화제@후보@초청영화 (카미야마 켄지)@제 43회 시애틀국제영화제@후보@가족영화 (카미야마 켄지)@접기","-","-","8145","https://www.youtube.com/watch?v=etm9XUfKGWY"
"137","2017","2017 .02.16 재개봉, 2017 .01.03 개봉","영화","멜로/로맨스","내 남편의 가정교사","박선욱","https://movie-phinf.pstatic.net/20170206_241/1486370213351JIaf6_JPEG/movie_image.jpg","정으로 살고있는 백선과 수겸은 20년차 섹스리스 부부다.@ 부부는 삶의 활력을 찾기 위해 취미를 갖기로 하는데,@ 살과의 전쟁을 선언한 수겸은 PT강사를@ 그림은 포기했던 백선은 그림 선생을 가정교사로 맞아 배우려 하는데.@ 오 이런! 젊고 잘 생긴 PT강사 인학과 예쁘고 착한 미술 선생 지원의 지도를 받게되는 부부.@ 부부는 점차 수업보다는 가정교사와의 사랑을 꿈꾸는데.@ 과연, 백선과 수겸의 은밀한 수업의 결말은?","국내","한국","https://www.youtube.com/watch?v=blL0a86pfzM","스마일컨텐츠","-","청소년 관람불가","113분","-","민도윤 백세리 백선 홍새희 ","  채설아 (각본) 양범석 (프로듀서) 양범석 (제작이사) 김문현 (제작부) 윤병수 (촬영부) 남기수 (촬영부) 김정훈 (촬영) 김경훈 (조명) 김윤석 (조명부) 김희주 (그립) 박정섭 (조연출) 이종영 (연출부) 김재희 (스크립터) 이영우 (동시녹음) 이상우 (미술) 이창환 (미술팀) 김윤석 (미술팀) 이상우 (특수효과) 정향 (분장) 이지현 (분장팀) 김수빈 (분장팀) 양범석 (편집) 양범석 (디지털색보정) 박정준 (캐스팅디렉터)","-","-","-","   ","-"
"138","2017","2017 .08.10 개봉","영화","드라마","내 마음을 벗어난 시간","오렌 무버만","https://movie-phinf.pstatic.net/20170804_295/1501809395156qM1zT_JPEG/movie_image.jpg","높이 솟은 빌딩과 분주한 일상으로 정신 없이 돌아가는 뉴욕의 맨하탄, 시간이 멈춘 듯 의미 없이 살아가는 조지(리차드 기어 분)는 오늘도 길거리를 헤매며 하루 하루를 보낸다.@ 아내를 잃고 집, 직장, 딸까지도 모두 놓아버린 그에게 유일한 희망은 성년이 된 딸 매기(지나 말론 분) 곁을 서성이며 그녀를 바라보는 것.@ 하지만 매기는 자신을 내팽개치고 노숙자로 자신의 주위를 맴도는 조지로 인해 혼란스럽기만 하다.@ 문득 조지는 자기 자신의 삶에 대해 되돌아보게 되고 처음으로 세상을 향해 도움의 손길을 청하고 매기를 만나기로 결심하는데……","해외","미국","https://www.youtube.com/watch?v=yWyxjIkoda4","(주)코리아스크린","(주)코리아스크린","15세 관람가","112분","-","피터 마크 켄달 리사 다츠 톰 비숍스 톤예 파타노 아비게일 세비지 이얼 바즈퀫즈 도미닉 콜론 제랄딘 휴즈 브라이언 다아시 제임스 미란다 베일리 콜맨 도밍고 도브 타이펜버치 마이클 부세미 카이라 세드윅 제레미 스트롱 스티브 부세미 벤 베린 지나 말론 리차드 기어 ","  오렌 무버만 Oren Moverman (각본) 제프리 케인 Jeffrey Caine (각본) 오렌 무버만 Oren Moverman (각본) 미란다 베일리 Miranda Bailey (제작) 리차드 기어 Richard Gere (제작) 로렌스 잉리 Lawrence Inglee (제작) 캐롤라인 캐플런 Caroline Kaplan (제작) 빌 포래드 Bill Pohlad (제작) 에드워드 월슨 Edward Walson (제작) 모하메드 알 터키 Mohammed Al Turki (기획) 에바 마리아 다니엘스 Eva Maria Daniels (기획) 잭 터커 Zak Tucker (기획) 아만다 마셜 Amanda Marshall (기획) 바비 버코우스키 Bobby Bukowski (촬영) 켈리 맥게히 Kelly McGehee (미술) 제시카 페트루첼리 Jessica Petruccelli (세트) 존 베이어 John Bair (시각효과) 캐서린 조지 Catherine George (의상) 알렉스 홀 Alex Hall (편집) 조디 앵스트라이크 Jodi Angstreich (배역) 로라 로센달 Laura Rosenthal (배역)","배우/제작진 수상 이력@수상정보 테이블표@2015@제 50회 카를로비바리 국제 영화제@후보@공식부문-비경쟁 (오렌 무버만)@제 41회 시애틀국제영화제@후보@새로운미국영화 경쟁 (오렌 무버만)@2014@제 9회 로마 국제영화제@후보@공식 경쟁 부문 (오렌 무버만)@제 39회 토론토국제영화제@수상@FIPRESCI-상 (오렌 무버만)@후보@특별한 발표 부문 (오렌 무버만)@제 52회 뉴욕영화제@후보@장편 상영작 (오렌 무버만)","-","-","-","https://www.youtube.com/watch?v=JRgpLWJ6LRA"
"139","2017","2017 .07.12 개봉","영화","드라마, 멜로/로맨스","내 사랑","에이슬링 월쉬","https://movie-phinf.pstatic.net/20170623_154/1498200552664BBuB4_JPEG/movie_image.jpg","운명처럼 세상에서 가장 작은집에서 만난 에버렛과 모드.@ 혼자인 게 익숙했던 이들은 서서히 서로에게 물들어가며 깊은 사랑을 하게 되고 서로의 사랑을 풍경처럼 담는다.","해외","아일랜드 / 캐나다","https://www.youtube.com/watch?v=nIGSBcqEdGw","오드 AUD","오드 AUD","12세 관람가","115분","-","닉 섹스톤 데이비드 피헨 마르뜨 버나드 빌리 맥크렐런 자카리 베네트 가브리엘 로즈 캐리 매쳇 에단 호크 샐리 호킨스 ","  쉐리 화이트 Sherry White (각본) 봅 쿠퍼 Bob Cooper (제작) 매리 영 렉키 Mary Young Leckie (제작) 수잔 멀렌 Susan Mullen (제작) 메리 섹스턴 Mary Sexton (제작) 메리 판텔리디스 Mary Pantelidis (라인프로듀서) 헤더 핼데인 Heather Haldane (기획) 로스 제이콥슨 Ross Jacobson (기획) 타일러 밋첼 Tyler Mitchell (기획) 앨런 모로니 Alan Moloney (기획) 에드워드 리체 Edward Riche (기획) 마크 로버츠 Mark A. Roberts (기획) Hussain Amarshi (기획) Sheldon Rabinowitz (기획) 조한나 호건 Johanna Hogan (기획) 가이 갓프리 Guy Godfree (촬영) 마이클 티민스 Michael Timmins (음악) 쉘리 코닉 Shelley Cornick (아트디렉터) 오웬 파워 Owen Power (아트디렉터) 존 핸드 John Hand (미술) 다라 핸드 Dara Hand (세트) 트리샤 백커 Trysha Bakker (의상) 스티븐 오코넬 Stephen O'Connell (편집) 존 부챈 John Buchan (배역) 제이슨 나이트 Jason Knight (배역) 황석희 (번역)","배우/제작진 수상 이력@수상정보 테이블표@2018@제 8회 북경국제영화제@후보@스페셜 컬렉션-여성 파워 (에이슬링 월쉬)@제 52회 전미 비평가 협회상@수상@여우주연상 (샐리 호킨스)@2017@제 7회 CINE ICON: KT&G 상상마당 배우기획전@후보@ICON OF THE YEAR (샐리 호킨스)@제 19회 리우 데 자네이루 국제영화제@후보@월드 파노라마 (에이슬링 월쉬)@제 64회 시드니 영화제@후보@SFF @ Hayden Orpheum Picture Palace Cremorne (에이슬링 월쉬)@후보@포커스 온 캐나다 (에이슬링 월쉬)@제 60회 샌프란시스코 국제 영화제@후보@어워즈 & 트리뷰츠 (에이슬링 월쉬)@제 66회 멜버른 국제 영화제@후보@국제영화 (에이슬링 월쉬)@제 54회 금마장@후보@파노라마 (에이슬링 월쉬)@제 71회 에든버러국제영화제@후보@세계 관점 (에이슬링 월쉬)@제 67회 베를린국제영화제@후보@베를리날레 스페셜 (에이슬링 월쉬)@제 18회 전주국제영화제@후보@야외상영 (에이슬링 월쉬)@2016@제 41회 토론토국제영화제@후보@특별한 발표 부문 (에이슬링 월쉬)@제 35회 벤쿠버국제영화제@수상@슈퍼 채널 관객상 (에이슬링 월쉬)@접기","-","-","337669","https://www.youtube.com/watch?v=j4CKzkAuBXE"
"140","2017","2017 .10.24 개봉","영화","드라마, 멜로/로맨스","내 사랑 왕가흔","베니 라우","https://movie-phinf.pstatic.net/20171011_269/1507684556289xAAN5_JPEG/movie_image.jpg","때는 1992년, 알아주는 사람 없어도 기타를 치며 노래하곤 하던 천인(황우남)은@ 어느 날 밤 우연히 극장에서 아름다운 매표원 왕가흔을 만나 사랑에 빠진다.@ 그녀의 이름 석자와 기타만을 가지고 놓쳐버린 그녀를 찾아 나서는 천인.@ 수많은 왕가흔을 만나는 동안 점차 뮤지션으로 성장하는 그의 앞에@ 정작 그가 애타게 찾는 그 왕가흔은 도무지 나타나질 않는다.@ 그러던 중, 그의 앞에 나타난 57번째 왕가흔(우첸위)은 그의 첫사랑 찾기를 돕겠다고 나서고@ 아무리 찾아도 나타나지 않는 '왕가흔’의 존재에 점점 지쳐가는 와중에@ 생각지도 못한 비밀이 밝혀지는데…!","해외","홍콩","https://www.youtube.com/watch?v=Tvygjvgy1js","(주)영화사 빅","(주)영화사 빅","12세 관람가","97분","-","류메이쥔 황우남 우첸위 ","  베니 라우 Benny Lau (각본) 오건웅 (제작) 황바이밍 Bak-Ming Wong (제작) 오건웅 (기획) 황자환 Edmond Wong (기획) 이동전 (편집)","배우/제작진 수상 이력@수상정보 테이블표@2016@제 11회 오사카 아시안 필름 페스티벌@후보@경쟁부문 (베니 라우)@후보@스페셜포커스 (베니 라우)@제 35회 홍콩금상장영화제@후보@주제가상 (For Wong Ka Yan)@2015@제 19회 부천국제판타스틱영화제@후보@비전 익스프레스 (베니 라우)","-","-","  ","https://www.youtube.com/watch?v=_CsinrVIs9E"
"141","2017","2017 .07.10 개봉","영화","멜로/로맨스","내 삼촌의 아내: 내 여자가 되던 날","이진","https://movie-phinf.pstatic.net/20170710_153/1499671996667kwjg0_JPEG/movie_image.jpg","삼촌이라 부를 정도로 가깝게 지내던 아빠의 후배 신타로 집에 얹혀 살게 된 토오루. 그런데 알고 보니 삼촌의 아내가 자신의 고등학교 동창생 미히로였다! 설상가상으로 미히로는 고등학생 때에 토오루를 좋아했었다고 고백하고, 토오루 역시 미히로를 보며 설레는 마음을 감출 수 없다. 삼촌 몰래 한 집안에서 벌어지는 스릴만점 섹스 라이프.","국내","한국","https://www.youtube.com/watch?v=opXfcslrXDM","-","-","청소년 관람불가","62분","-","스즈키 미사토시 하나시마 미즈에 ","-","-","-","-","   ","https://www.youtube.com/watch?v=leFpugENNr0"
"142","2017","2017 .05.18 개봉","영화","멜로/로맨스, 드라마","내 아내와 결혼해 주세요","미야케 요시시게","https://movie-phinf.pstatic.net/20170504_163/1493858314029rEVQU_JPEG/movie_image.jpg","어떤 상황이라도 즐거운 일로 바꾸자는 신념으로 살아온 경력 20년 차 베테랑 방송작가 ‘슈지’는 어느 날, 청천벽력 같은 췌장암 말기 6개월 시한부 선고를 받게 된다.@ 자신이 세상을 떠난 뒤 남겨질 사랑하는 가족 걱정에 상심에 빠져 있던 ‘슈지’는 우연히 웨딩업체의 광고를 접하게 되고, 한 가지 기상천외한 아이디어를 떠올린다.@ 그것은 바로 자신을 대신할 새로운 남편을 아내에게 선물하는 것!@ 과연, ‘슈지’의 인생 마지막 예능은 성공적으로 실행될 수 있을까…?","해외","일본","https://www.youtube.com/watch?v=8H437cLX6_c","(주)미디어캐슬","(주)스마일이엔티","전체 관람가","114분","-","오스기 렌 오오츠카 치히로 마에카와 야스유키 사토 아리사 마시마 히데카즈 모리 칸나 다카시마 레이코 하라다 타이조 요시다 요 오다 유지 ","  카네코 아리사 Kaneko Arisa (각본)","배우/제작진 수상 이력@수상정보 테이블표@2017@제 6회 마리끌레르 영화제@후보@상영작 (미야케 요시시게)","-","-","2676","https://www.youtube.com/watch?v=XzUplhHB-dM"
"143","2017","2017 .10.30 개봉","영화","멜로/로맨스","내 아내의 초대남들 : 네토라레","노현진","https://movie-phinf.pstatic.net/20171026_77/1508984088455YJomz_JPEG/movie_image.jpg","상기는 아내인 은아를 여자로 느끼지 않는다. 어느 날 은아와 상기는 동창인 동수와 함께 만나게 된다. 세 사람은 2차로 노래방에 가게 된다. 은아는 노래방에서 만취하게 되고, 상기는 피곤함에 다른 빈방을 잡고 쉰다. 은아는 동수를 민규로 착각하고 정사를 하게 된다. 상기는 술을 깬 후에 다시 은아와 동수가 있는 방으로 가게 되고, 두 사람의 정사를 목격하게 된다. 그로 인해 상기는 자신의 특이한 성향을 깨닫게 되는데...","국내","한국","https://www.youtube.com/watch?v=2R4Swuy72FA","-","-","청소년 관람불가","84분","-","윤상두 아리 강민우 ","-","-","-","-","  ","https://www.youtube.com/watch?v=2R4Swuy72FA"
"144","2017","2017 .06.23 개봉","영화","멜로/로맨스","내 아들의 여자","최강호","https://movie-phinf.pstatic.net/20171208_143/1512693596151IMqt3_JPEG/movie_image.jpg","능력있는 여의사 유즈키에게는 대학생 아들을 둔 마사토라는 애인이 있다.@ 술과 도박을 즐기며 정해진 직장도 없이 근근이 살아가는 애인을 구제하기 위하여, 유즈키는 그에게 자신이 일하는 병원에서 청소일을 할 것을 제안한다.@ 얼마 후, 아들 치아키와 함께 유즈키의 병원으로 찾아온 애인.@ 아들과의 첫 만남에서 그녀는 병원의 젊은 간호사를 소개해주고 그들은 금세 사랑헤 빠진다.@ 애인과 병원에서 일하기 시작한 날, 유즈키는 조용히 탈의실로 그를 데려가, 일하게 한 건 구제 목적이 아닌 욕정을 풀기 위함이었음을 밝히며 섹스를 시작한다.","국내","한국","https://www.youtube.com/watch?v=EBBejDq5dgo","-","-","-","73분","-","-","-","-","-","-","-","https://www.youtube.com/watch?v=qWEnyruYeZU"
"145","2017","2017 .01.04 개봉","영화","드라마","내 어깨 위 고양이, 밥","로저 스포티스우드","https://movie-phinf.pstatic.net/20161221_130/1482309164295fbt3H_JPEG/movie_image.jpg","아무런 희망도 미래도 없는 버스킹 뮤지션 ‘제임스’는 길거리에서 상처 입은 고양이 ‘밥’을 우연히 발견한다.@ 자신과 같은 처지인 고양이 ‘밥’을 위해 생활비를 모두 쏟아 치료해준 후,@ 여느 날처럼 거리 버스킹 공연을 시작한 ‘제임스’는 평소와 다른 분위기를 눈치채게 된다.@ @ 어느샌가 고양이 ‘밥’이 ‘제임스’ 옆자리를 지키고 있었던 것.@ 평생 한번도 받아보지 못했던 사람들의 따뜻한 환호 속에 ‘제임스’는 고양이 ‘밥’과 함께 버스킹 공연을 이어나간다.@ @ 우연한 만남을 통해 인생의 두번째 기회를 맞이하게 된 ‘제임스’와 ‘밥’의 버스킹 프로젝트가 계속 되던 중,@ 이들을 시기한 사람들의 방해로 인해 둘은 인생의 또 다른 시련에 맞닥뜨리게 되는데…","해외","영국","https://www.youtube.com/watch?v=aaMyiCOl_EA","(주)누리픽쳐스","(주)누리픽쳐스","12세 관람가","103분","-","토니 제이야워드너 베스 고다드 대런 에반스 안소니 헤드 조앤 프로갯 루타 게드민타스 루크 트레더웨이 ","  마리아 네이션 Maria Nation (각본) 아담 롤스톤 Adam Rolston (제작) Howard Ball (기획) 폴 브렛 Paul Brett (기획) Laura Davison (기획) Alice de Sousa (기획) Anders Erden (기획) 다미안 존스 Damian Jones (기획) 피터 운스토프 Peter Wunstorf (촬영) 데이비드 허슈펠더 David Hirschfelder (음악) 안토니아 로우 Antonia Lowe (미술) 조 톰슨 Jo Thompson (의상) 폴 토틸 Paul Tothill (편집)","배우/제작진 수상 이력@수상정보 테이블표@2017@제 40회 예테보리국제영화제@후보@갈라 (로저 스포티스우드)@2016@제 53회 금마장@후보@파노라마 (로저 스포티스우드)","-","-","26963","https://www.youtube.com/watch?v=SwUg9T6nv7c"
"146","2017","2017 .03.09 개봉","영화","애니메이션, 가족","내 이름은 꾸제트","클로드 바라스","https://movie-phinf.pstatic.net/20170206_100/1486365075820LbqjC_JPEG/movie_image.jpg","우연한 사고로 엄마와 헤어지고 퐁텐 보육원으로 보금자리를 옮기게 된 ‘꾸제트’.@ 각각의 비밀스러운 사연을 가진 친구들과 함께 살아가게 된 ‘꾸제트’,@ 티격태격 싸우기도 하지만 그래도 항상 함께 있어주는 친구들로 인해 마음의 위로를 받게 된다.@ 그리고 퐁텐 교육원에 새로 온 ‘까미유’를 보고 첫 눈에 반하게 되는데…@ 사랑 받지 못했던 ‘꾸제트’, 엄마, 아빠와는 함께 할 수 없지만 ‘레이몽’ 경찰관 아저씨,@ 퐁텐 보육원의 자칭 대장 ‘시몽’, 신참 ‘까미유’, 그리고 다른 친구들과 추억과 우정을 쌓아가며, 하루하루 사랑을 배워나가게 된다.","해외","프랑스 / 스위스","https://www.youtube.com/watch?v=l7JxvWP6ygE","(주)에이앤비픽쳐스","(주)스마일이엔티","전체 관람가","66분","-","에이미 세다리스 엘렌 페이지 닉 오퍼맨 윌 포트 루 위크 엘리엇 산체스 에스테 에나드 라울 리베라 미셸 빌레모 폴린 자쿠우드 시스틴 무하 가스파 츨라테르 ","  셀린 시아마 Celine Sciamma (각색) 클로드 바라스 Claude Barras (각색) 질 파리 Gilles Paris (원작자) 마크 보니 Marc Bonny (프로듀서) 미셸 메르크 Michel Merkt (프로듀서) 다비드 투트부아 David Toutevoix (촬영) 소피 헝거 Sophie Hunger (음악) 발렌틴 로텔리 Valentin Rotelli (편집)","배우/제작진 수상 이력@수상정보 테이블표@2019@제 10회 부산평화영화제@후보@어린이 상영작 (클로드 바라스)@2018@제 42회 안시 국제애니메이션 페스티벌@후보@오픈 에어 스크리닝 (클로드 바라스)@제 31회 도쿄국제영화제@후보@유스 (클로드 바라스)@제 71회 영국 아카데미 시상식@후보@장편애니메이션작품상 (클로드 바라스)@2017@제 44회 애니어워드@후보@장편 애니메이션: 각본상 (셀린 시아마)@후보@장편 애니메이션: 감독상 (윌 포트 외 2명)@후보@최우수 독립 장편 애니메이션 (윌 포트 외 2명)@제 4회 가톨릭영화제@후보@CaFF 초이스 장편 (클로드 바라스)@제 16회 애니 필름@수상@최고의 장편 애니메이션상 - 어린이 (클로드 바라스)@제 27회 자그레브 국제 애니메이션 영화제@수상@Mr. M상 (클로드 바라스)@후보@그랜드 경쟁 장편 (클로드 바라스)@제 28회 팜스프링스 국제영화제@후보@버즈어워드: 최우수 국제영화 (클로드 바라스)@제 64회 시드니 영화제@후보@가족영화 (클로드 바라스)@후보@애니메이션 (클로드 바라스)@제 32회 산타바바라 국제영화제@후보@특별 헌정작 (클로드 바라스)@제 21회 판타지아 영화제@후보@장편 영화 (클로드 바라스)@제 19회 부천국제애니메이션페스티벌@후보@애니 투게더 (클로드 바라스)@제 12회 로마 국제영화제@후보@앨리스 인 더 시티 (클로드 바라스)@제 12회 부산국제어린이청소년영화제@후보@큰나래 모음 (클로드 바라스)@제 33회 선댄스영화제@후보@선댄스 키즈 (클로드 바라스)@제 42회 세자르영화제@수상@각색상 (셀린 시아마)@수상@애니메이션상 - 단편 (클로드 바라스)@후보@음악상 (소피 헝거)@제 89회 미국 아카데미 시상식@후보@장편애니메이션상 (클로드 바라스)@제 74회 골든 글로브 시상식@후보@장편애니메이션상 (클로드 바라스)@2016@제 12회 취리히 영화제@후보@ZFF 포 키즈 (클로드 바라스)@수상@심사위원상 (어린이영화) (클로드 바라스)@후보@특별 상영작 (클로드 바라스)@제 54회 히혼국제영화제@후보@Gran Angular (클로드 바라스)@제 30회 씨네키드 영화제@후보@최우수 어린이 영화 (클로드 바라스)@제 57회 데살로니키 국제 영화제@후보@LUX 프라이즈 (클로드 바라스)@후보@오픈 호라이즌스 (클로드 바라스)@후보@유스 스크린 (클로드 바라스)@제 32회 바르샤바 국제영화제@후보@특별 상영 (클로드 바라스)@제 27회 스톡홀름영화제@후보@파트너쉽 스크리닝 (클로드 바라스)@제 18회 부천국제애니메이션페스티벌@후보@장편경쟁부문 (클로드 바라스)@제 60회 런던 국제 영화제@후보@데뷔작 경쟁 (클로드 바라스)@제 43회 겐트 영화제@후보@갈라 프리미어 및 특별 행사 (클로드 바라스)@제 29회 유럽영화상@수상@유러피안 애니메이션상 (클로드 바라스)@제 27회 싱가포르 국제 영화제@후보@시네마 투데이 (클로드 바라스)@제 65회 멜버른 국제 영화제@수상@관객상 - 장편 (클로드 바라스)@후보@애니메이션 장편 (클로드 바라스)@제 40회 안시 국제애니메이션 페스티벌@후보@장편경쟁 (클로드 바라스)@수상@관객상 - 장편부문 (클로드 바라스)@수상@안시 크리스탈상 - 장편부문 (클로드 바라스)@제 64회 산세바스티안국제영화제@후보@Pearls (클로드 바라스)@제 41회 토론토국제영화제@후보@TIFF KIDS 부문 (클로드 바라스)@2015@제 39회 안시 국제애니메이션 페스티벌@수상@Gan Foundation Support for Distribution상 (클로드 바라스)@접기","-","-","       ...","https://www.youtube.com/watch?v=gqbE8nRw5e0"
"147","2017","2017 .08.09 개봉","영화","멜로/로맨스","내 이웃의 아내 2: 이웃 부부와 교환하던 날","이진","https://movie-phinf.pstatic.net/20170810_21/1502353050569i5fCU_JPEG/movie_image.jpg","섹시한 여비서를 오피스 와이프로 삼아 사무실에서 은밀한 정사를 즐겨온 변호사 에라타.@ 그는 우연히 여비서가 옆집에 살고 있고, 여비서의 남편과 자신의 진짜 아내가 외도 중이란 사실을 알게 된다.@ 이웃의 아내를 탐하는 두 남자의 뜨거운 욕망! 끝내 두 남자는 파격의 아내 교환을 결심한다.","국내","한국","https://www.youtube.com/watch?v=a0w151ej5C4","-","-","청소년 관람불가","64분","-","미즈미 사키 나루사와 히나미 ","-","-","-","-","   ","-"
